MAG010_2_137	0f2170821725ac4abdb7c501f34a660d	263	Pfam	PF03819	MazG nucleotide pyrophosphohydrolase domain	173	232	3.2E-5	T	21-03-2019	IPR004518	NTP pyrophosphohydrolase MazG, putative catalytic core
MAG010_2_137	0f2170821725ac4abdb7c501f34a660d	263	Pfam	PF03819	MazG nucleotide pyrophosphohydrolase domain	34	107	1.4E-26	T	21-03-2019	IPR004518	NTP pyrophosphohydrolase MazG, putative catalytic core
MAG010_2_137	0f2170821725ac4abdb7c501f34a660d	263	TIGRFAM	TIGR00444	mazG: MazG family protein	18	261	2.5E-88	T	21-03-2019	IPR011551	NTP pyrophosphohydrolase MazG
MAG010_47_12	d476f9170f3c6d0f9a3b57633bd08ab5	372	Pfam	PF06050	2-hydroxyglutaryl-CoA dehydratase, D-component	37	371	7.8E-51	T	21-03-2019	IPR010327	FldB/FldC dehydratase alpha/beta subunit
MAG010_9_18	407e384f90ce234d01308daa0bf431cb	169	Pfam	PF00440	Bacterial regulatory proteins, tetR family	3	33	2.2E-4	T	21-03-2019	IPR001647	DNA-binding HTH domain, TetR-type
MAG010_6_21	92d094a107e122d289b3d3cf64a1c0eb	268	Pfam	PF02361	Cobalt transport protein	15	235	7.1E-53	T	21-03-2019	IPR003339	ABC/ECF transporter, transmembrane component
MAG010_6_40	44a70326e28a50519c761f6f84d08db0	346	TIGRFAM	TIGR00878	purM: phosphoribosylformylglycinamidine cyclo-ligase	8	338	1.0E-135	T	21-03-2019	IPR004733	Phosphoribosylformylglycinamidine cyclo-ligase
MAG010_6_40	44a70326e28a50519c761f6f84d08db0	346	Pfam	PF02769	AIR synthase related protein, C-terminal domain	177	341	1.4E-34	T	21-03-2019	IPR010918	PurM-like, C-terminal domain
MAG010_6_40	44a70326e28a50519c761f6f84d08db0	346	Pfam	PF00586	AIR synthase related protein, N-terminal domain	66	165	5.3E-17	T	21-03-2019	IPR016188	PurM-like, N-terminal domain
MAG010_32_9	0599dba82f77561fade99491212dbdf7	438	Pfam	PF13407	Periplasmic binding protein domain	83	292	6.9E-20	T	21-03-2019	IPR025997	Periplasmic binding protein
MAG010_20_3	7f5b428405f2f57daed7cf1fb0f87977	410	Pfam	PF00557	Metallopeptidase family M24	180	393	5.4E-34	T	21-03-2019	IPR000994	Peptidase M24
MAG010_20_3	7f5b428405f2f57daed7cf1fb0f87977	410	Pfam	PF01321	Creatinase/Prolidase N-terminal domain	23	172	3.8E-12	T	21-03-2019	IPR000587	Creatinase, N-terminal
MAG010_8_42	44f93a0095b8fc6011c392a592364f9c	298	Pfam	PF03418	Germination protease	9	238	8.7E-63	T	21-03-2019	IPR005080	Peptidase A25, germination protease
MAG010_2_82	4b0f3f72ed8f67f97009de510b8fe2f0	243	Pfam	PF13561	Enoyl-(Acyl carrier protein) reductase	10	241	3.7E-66	T	21-03-2019
MAG010_4_129	3657ae7de56d4d31ce8a4622e8a0251b	315	Pfam	PF02866	lactate/malate dehydrogenase, alpha/beta C-terminal domain	146	309	4.5E-34	T	21-03-2019	IPR022383	Lactate/malate dehydrogenase, C-terminal
MAG010_4_129	3657ae7de56d4d31ce8a4622e8a0251b	315	Pfam	PF00056	lactate/malate dehydrogenase, NAD binding domain	6	143	1.1E-38	T	21-03-2019	IPR001236	Lactate/malate dehydrogenase, N-terminal
MAG010_4_129	3657ae7de56d4d31ce8a4622e8a0251b	315	TIGRFAM	TIGR01771	L-LDH-NAD: L-lactate dehydrogenase	9	306	4.8E-121	T	21-03-2019	IPR011304	L-lactate dehydrogenase
MAG010_4_94	c71bf81233afa11d77a896c752f6e113	263	Pfam	PF02195	ParB-like nuclease domain	15	101	1.6E-22	T	21-03-2019	IPR003115	ParB/Sulfiredoxin
MAG010_4_94	c71bf81233afa11d77a896c752f6e113	263	TIGRFAM	TIGR00180	parB_part: ParB/RepB/Spo0J family partition protein	12	184	4.1E-49	T	21-03-2019	IPR004437	ParB/RepB/Spo0J partition protein family
MAG010_36_18	f8eb5ef287e24359cf7ad2dea53cd831	188	TIGRFAM	TIGR00277	HDIG: HDIG domain	26	85	9.0E-8	T	21-03-2019	IPR006675	HDIG domain
MAG010_36_18	f8eb5ef287e24359cf7ad2dea53cd831	188	Pfam	PF01966	HD domain	28	129	6.1E-13	T	21-03-2019	IPR006674	HD domain
MAG010_2_134	2c034db3a2a8bc53ec53795ac13bdac9	615	Pfam	PF08757	CotH kinase protein	92	476	2.9E-50	T	21-03-2019	IPR014867	Spore coat protein CotH
MAG010_15_40	3182b61ee2da14f90b1344fbc2f06ebb	581	Pfam	PF00005	ABC transporter	358	507	6.2E-33	T	21-03-2019	IPR003439	ABC transporter-like
MAG010_15_40	3182b61ee2da14f90b1344fbc2f06ebb	581	Pfam	PF00664	ABC transporter transmembrane region	27	296	1.5E-50	T	21-03-2019	IPR011527	ABC transporter type 1, transmembrane domain
MAG010_17_16	f1a4b281748a4038d276131fdb4650bf	202	Pfam	PF01025	GrpE	64	201	1.0E-44	T	21-03-2019	IPR000740	GrpE nucleotide exchange factor
MAG010_35_17	c285f107d5ea36addc1f0b983f1af2ba	455	Pfam	PF00535	Glycosyl transferase family 2	8	154	3.0E-30	T	21-03-2019	IPR001173	Glycosyltransferase 2-like
MAG010_120_2	a133a9582917a38a08c2c851ec28b66f	103	Pfam	PF12957	Domain of unknown function (DUF3846)	3	92	6.1E-30	T	21-03-2019	IPR024559	Protein of unknown function DUF3846
MAG010_62_1	abb793a041d21fd9233627d99161126c	311	TIGRFAM	TIGR01001	metA: homoserine O-succinyltransferase	1	301	5.9E-139	T	21-03-2019	IPR005697	Homoserine O-succinyltransferase MetA
MAG010_62_1	abb793a041d21fd9233627d99161126c	311	Pfam	PF04204	Homoserine O-succinyltransferase	2	299	1.2E-136	T	21-03-2019	IPR033752	MetA family
MAG010_15_38	de0c67a83d26bb5616df13caea949302	484	Pfam	PF13180	PDZ domain	338	426	5.8E-16	T	21-03-2019	IPR001478	PDZ domain
MAG010_15_38	de0c67a83d26bb5616df13caea949302	484	Pfam	PF13365	Trypsin-like peptidase domain	156	293	6.7E-33	T	21-03-2019
MAG010_9_2	df1e5b513f2c19e99b979d42452f3d9e	204	TIGRFAM	TIGR03953	rplD_bact: 50S ribosomal protein uL4	17	201	7.6E-74	T	21-03-2019	IPR013005	50S ribosomal protein uL4
MAG010_9_2	df1e5b513f2c19e99b979d42452f3d9e	204	Pfam	PF00573	Ribosomal protein L4/L1 family	17	201	1.3E-65	T	21-03-2019	IPR002136	Ribosomal protein L4/L1e
MAG010_6_32	f46faba7f94b40a9939256b51fe3cd56	520	Pfam	PF02782	FGGY family of carbohydrate kinases, C-terminal domain	292	457	4.7E-25	T	21-03-2019	IPR018485	Carbohydrate kinase, FGGY, C-terminal
MAG010_6_32	f46faba7f94b40a9939256b51fe3cd56	520	Pfam	PF00370	FGGY family of carbohydrate kinases, N-terminal domain	4	250	5.5E-42	T	21-03-2019	IPR018484	Carbohydrate kinase, FGGY, N-terminal
MAG010_14_51	8f543e1d783527123b4c087827854099	87	Pfam	PF07875	Coat F domain	3	64	8.8E-21	T	21-03-2019	IPR012851	Spore coat protein CotF-like
MAG010_27_27	adb818373263269c228df8b35c66435d	140	Pfam	PF08281	Sigma-70, region 4	83	133	4.1E-13	T	21-03-2019	IPR013249	RNA polymerase sigma factor 70, region 4 type 2
MAG010_27_27	adb818373263269c228df8b35c66435d	140	TIGRFAM	TIGR02937	sigma70-ECF: RNA polymerase sigma factor, sigma-70 family	2	137	5.0E-16	T	21-03-2019	IPR014284	RNA polymerase sigma-70 like domain
MAG010_27_27	adb818373263269c228df8b35c66435d	140	Pfam	PF04542	Sigma-70 region 2	3	61	1.0E-7	T	21-03-2019	IPR007627	RNA polymerase sigma-70 region 2
MAG010_52_27	48b59c6e3d4a95bb792abb6ec01ad12a	316	Pfam	PF01193	RNA polymerase Rpb3/Rpb11 dimerisation domain	26	221	1.1E-24	T	21-03-2019	IPR011263	DNA-directed RNA polymerase, RpoA/D/Rpb3-type
MAG010_52_27	48b59c6e3d4a95bb792abb6ec01ad12a	316	Pfam	PF03118	Bacterial RNA polymerase, alpha chain C terminal domain	242	304	2.4E-27	T	21-03-2019	IPR011260	RNA polymerase, alpha subunit, C-terminal
MAG010_52_27	48b59c6e3d4a95bb792abb6ec01ad12a	316	TIGRFAM	TIGR02027	rpoA: DNA-directed RNA polymerase, alpha subunit	20	312	4.0E-119	T	21-03-2019	IPR011773	DNA-directed RNA polymerase, alpha subunit
MAG010_52_27	48b59c6e3d4a95bb792abb6ec01ad12a	316	Pfam	PF01000	RNA polymerase Rpb3/RpoA insert domain	61	151	4.0E-23	T	21-03-2019	IPR011262	DNA-directed RNA polymerase, insert domain
MAG010_20_37	acb2bf0f8d3afd0c66462c8ce52056e4	719	Pfam	PF09371	Tex-like protein N-terminal domain	8	193	2.9E-68	T	21-03-2019	IPR018974	Tex-like protein, N-terminal
MAG010_20_37	acb2bf0f8d3afd0c66462c8ce52056e4	719	Pfam	PF16921	Tex protein YqgF-like domain	316	440	2.8E-53	T	21-03-2019	IPR032639	Tex protein, YqgF-like domain
MAG010_20_37	acb2bf0f8d3afd0c66462c8ce52056e4	719	Pfam	PF12836	Helix-hairpin-helix motif	480	544	1.3E-27	T	21-03-2019
MAG010_20_37	acb2bf0f8d3afd0c66462c8ce52056e4	719	Pfam	PF00575	S1 RNA binding domain	644	715	3.5E-17	T	21-03-2019	IPR003029	S1 domain
MAG010_1_101	171b6be99ce4ea918745cb55f3fc9f3f	260	Pfam	PF02535	ZIP Zinc transporter	91	254	3.5E-22	T	21-03-2019	IPR003689	Zinc/iron permease
MAG010_9_71	5b9f837b0559d83ea8334f27e6f3c1c5	1244	Pfam	PF02769	AIR synthase related protein, C-terminal domain	446	597	4.2E-23	T	21-03-2019	IPR010918	PurM-like, C-terminal domain
MAG010_9_71	5b9f837b0559d83ea8334f27e6f3c1c5	1244	Pfam	PF13507	CobB/CobQ-like glutamine amidotransferase domain	980	1243	4.2E-85	T	21-03-2019
MAG010_9_71	5b9f837b0559d83ea8334f27e6f3c1c5	1244	TIGRFAM	TIGR01857	FGAM-synthase: phosphoribosylformylglycinamidine synthase	10	1243	0.0	T	21-03-2019	IPR010141	Phosphoribosylformylglycinamidine synthase, FGAM
MAG010_32_17	31e6586da9c39ae4db56864321b3678a	479	Pfam	PF01546	Peptidase family M20/M25/M40	72	477	6.4E-15	T	21-03-2019	IPR002933	Peptidase M20
MAG010_32_17	31e6586da9c39ae4db56864321b3678a	479	Pfam	PF07687	Peptidase dimerisation domain	211	285	2.5E-4	T	21-03-2019	IPR011650	Peptidase M20, dimerisation domain
MAG010_7_2	ad1438300ed89c85caf5b51ad679bb0d	350	Pfam	PF14279	HNH endonuclease	4	56	2.1E-10	T	21-03-2019	IPR029471	HNH endonuclease 5
MAG010_4_8	083cbeff9dab60a368f879c11c35386f	524	Pfam	PF00079	Serpin (serine protease inhibitor)	158	522	1.1E-61	T	21-03-2019	IPR023796	Serpin domain
MAG010_72_4	4c67b1ea1b27622a79634efc6df44e7b	165	TIGRFAM	TIGR00830	PTBA: PTS system, glucose subfamily, IIA component	23	138	5.8E-33	T	21-03-2019	IPR001127	Phosphotransferase system, sugar-specific permease EIIA type 1
MAG010_72_4	4c67b1ea1b27622a79634efc6df44e7b	165	Pfam	PF00358	phosphoenolpyruvate-dependent sugar phosphotransferase system, EIIA 1	19	141	6.6E-42	T	21-03-2019	IPR001127	Phosphotransferase system, sugar-specific permease EIIA type 1
MAG010_33_27	24b4c8abb231536840a8200847c28c01	265	Pfam	PF01061	ABC-2 type transporter	21	225	3.8E-26	T	21-03-2019	IPR013525	ABC-2 type transporter
MAG010_15_11	17beaf0ba39b800b29b56d7f9da019af	436	TIGRFAM	TIGR01026	fliI_yscN: ATPase, FliI/YscN family	5	435	7.4E-182	T	21-03-2019	IPR005714	ATPase, type III secretion system, FliI/YscN
MAG010_15_11	17beaf0ba39b800b29b56d7f9da019af	436	Pfam	PF02874	ATP synthase alpha/beta family, beta-barrel domain	26	89	2.6E-6	T	21-03-2019	IPR004100	ATPase, F1/V1/A1 complex, alpha/beta subunit, N-terminal domain
MAG010_15_11	17beaf0ba39b800b29b56d7f9da019af	436	TIGRFAM	TIGR03497	FliI_clade2: flagellar protein export ATPase FliI	22	435	2.3E-191	T	21-03-2019	IPR022425	Flagellar export ATPase FliI, clade 2
MAG010_15_11	17beaf0ba39b800b29b56d7f9da019af	436	Pfam	PF00006	ATP synthase alpha/beta family, nucleotide-binding domain	146	355	6.8E-77	T	21-03-2019	IPR000194	ATPase, F1/V1/A1 complex, alpha/beta subunit, nucleotide-binding domain
MAG010_44_16	df8e1c22918bc2b6492fa8403150d461	444	Pfam	PF01554	MatE	22	182	3.8E-23	T	21-03-2019	IPR002528	Multi antimicrobial extrusion protein
MAG010_44_16	df8e1c22918bc2b6492fa8403150d461	444	Pfam	PF01554	MatE	247	400	2.7E-14	T	21-03-2019	IPR002528	Multi antimicrobial extrusion protein
MAG010_44_16	df8e1c22918bc2b6492fa8403150d461	444	TIGRFAM	TIGR00797	matE: MATE efflux family protein	22	413	3.8E-46	T	21-03-2019	IPR002528	Multi antimicrobial extrusion protein
MAG010_2_100	bb8dfb24bec84182027eb6cc09472d6e	507	Pfam	PF01676	Metalloenzyme superfamily	5	494	6.3E-73	T	21-03-2019	IPR006124	Metalloenzyme
MAG010_2_100	bb8dfb24bec84182027eb6cc09472d6e	507	TIGRFAM	TIGR01307	pgm_bpd_ind: phosphoglycerate mutase (2,3-diphosphoglycerate-independent)	4	505	8.2E-204	T	21-03-2019	IPR005995	Phosphoglycerate mutase, 2,3-bisphosphoglycerate-independent
MAG010_2_100	bb8dfb24bec84182027eb6cc09472d6e	507	Pfam	PF06415	BPG-independent PGAM N-terminus (iPGM_N)	83	296	5.2E-80	T	21-03-2019	IPR011258	BPG-independent PGAM, N-terminal
MAG010_89_6	69903bfd61a921da0e7ddebb318354c4	124	Pfam	PF01880	Desulfoferrodoxin	40	123	5.7E-19	T	21-03-2019	IPR002742	Desulfoferrodoxin, ferrous iron-binding domain
MAG010_89_6	69903bfd61a921da0e7ddebb318354c4	124	Pfam	PF06397	Desulfoferrodoxin, N-terminal domain	4	34	1.2E-6	T	21-03-2019	IPR004462	Desulforodoxin domain
MAG010_13_71	1e4fd0c64aa942066e19c7476863e6de	452	Pfam	PF05167	Uncharacterised ACR (DUF711)	13	416	1.2E-182	T	21-03-2019	IPR007841	Uncharacterised protein family UPF0210
MAG010_52_13	04fec6ca9580720a8941cb303ad77afe	181	Pfam	PF00347	Ribosomal protein L6	92	165	9.2E-19	T	21-03-2019	IPR020040	Ribosomal protein L6, alpha-beta domain
MAG010_52_13	04fec6ca9580720a8941cb303ad77afe	181	Pfam	PF00347	Ribosomal protein L6	11	83	9.1E-21	T	21-03-2019	IPR020040	Ribosomal protein L6, alpha-beta domain
MAG010_52_13	04fec6ca9580720a8941cb303ad77afe	181	TIGRFAM	TIGR03654	L6_bact: ribosomal protein uL6	2	177	2.0E-75	T	21-03-2019	IPR019906	Ribosomal protein L6, bacterial-type
MAG010_43_26	87485243d4a0992d3cb24e3ad2ef18f4	1013	Pfam	PF00176	SNF2 family N-terminal domain	497	774	8.8E-6	T	21-03-2019	IPR000330	SNF2-related, N-terminal domain
MAG010_43_26	87485243d4a0992d3cb24e3ad2ef18f4	1013	Pfam	PF02384	N-6 DNA Methylase	69	174	3.1E-6	T	21-03-2019	IPR003356	DNA methylase, adenine-specific
MAG010_89_1	f5e9da6b9da891833d0fdefc873cc221	70	Pfam	PF00037	4Fe-4S binding domain	42	64	2.7E-6	T	21-03-2019	IPR017896	4Fe-4S ferredoxin-type, iron-sulphur binding domain
MAG010_89_1	f5e9da6b9da891833d0fdefc873cc221	70	Pfam	PF00037	4Fe-4S binding domain	12	34	1.3E-5	T	21-03-2019	IPR017896	4Fe-4S ferredoxin-type, iron-sulphur binding domain
MAG010_47_17	202e8f14b639bd7df9ef66c7e734db35	136	Pfam	PF00512	His Kinase A (phospho-acceptor) domain	58	121	1.0E-12	T	21-03-2019	IPR003661	Signal transduction histidine kinase, dimerisation/phosphoacceptor domain
MAG010_6_42	ce8c32fb90d8de5983f0f9f9619c9900	236	TIGRFAM	TIGR00081	purC: phosphoribosylaminoimidazolesuccinocarboxamide synthase	3	233	6.2E-74	T	21-03-2019	IPR001636	Phosphoribosylaminoimidazole-succinocarboxamide synthase
MAG010_6_42	ce8c32fb90d8de5983f0f9f9619c9900	236	Pfam	PF01259	SAICAR synthetase	7	231	4.4E-68	T	21-03-2019	IPR028923	SAICAR synthetase/ADE2, N-terminal
MAG010_10_41	c33d0b3439fef8b1a1f0757f9103f31d	86	Pfam	PF00381	PTS HPr component phosphorylation site	3	83	1.2E-23	T	21-03-2019	IPR000032	Phosphocarrier protein HPr-like
MAG010_10_41	c33d0b3439fef8b1a1f0757f9103f31d	86	TIGRFAM	TIGR01003	PTS_HPr_family: phosphocarrier, HPr family	1	82	3.0E-22	T	21-03-2019	IPR000032	Phosphocarrier protein HPr-like
MAG010_7_21	98c157b422949d665610d00b59d34fed	110	Pfam	PF05521	Phage head-tail joining protein	8	105	7.5E-13	T	21-03-2019	IPR008767	Bacteriophage SPP1, head-tail adaptor
MAG010_7_21	98c157b422949d665610d00b59d34fed	110	TIGRFAM	TIGR01563	gp16_SPP1: putative phage head-tail adaptor	6	107	1.2E-14	T	21-03-2019	IPR008767	Bacteriophage SPP1, head-tail adaptor
MAG010_1_15	72a850c2dab0b308fef5ea169ace3104	130	Pfam	PF00239	Resolvase, N terminal domain	7	119	7.2E-19	T	21-03-2019	IPR006119	Resolvase, N-terminal catalytic domain
MAG010_5_31	123921d14de51ee48ede9deea52558e9	701	Pfam	PF02922	Carbohydrate-binding module 48 (Isoamylase N-terminal domain)	43	132	4.9E-10	T	21-03-2019	IPR004193	Glycoside hydrolase, family 13, N-terminal
MAG010_5_31	123921d14de51ee48ede9deea52558e9	701	TIGRFAM	TIGR02100	glgX_debranch: glycogen debranching enzyme GlgX	42	699	1.2E-199	T	21-03-2019	IPR011837	Glycogen debranching enzyme, GlgX type
MAG010_5_31	123921d14de51ee48ede9deea52558e9	701	Pfam	PF00128	Alpha amylase, catalytic domain	197	299	8.7E-16	T	21-03-2019	IPR006047	Glycosyl hydrolase, family 13, catalytic domain
MAG010_28_2	8acb1cbc28c6dd70c4159415c93e0355	388	Pfam	PF00389	D-isomer specific 2-hydroxyacid dehydrogenase, catalytic domain	49	307	7.4E-17	T	21-03-2019	IPR006139	D-isomer specific 2-hydroxyacid dehydrogenase, catalytic domain
MAG010_28_2	8acb1cbc28c6dd70c4159415c93e0355	388	Pfam	PF02826	D-isomer specific 2-hydroxyacid dehydrogenase, NAD binding domain	94	275	5.4E-41	T	21-03-2019	IPR006140	D-isomer specific 2-hydroxyacid dehydrogenase, NAD-binding domain
MAG010_22_30	505e4591e8364cc89d1dffbad571b46d	72	TIGRFAM	TIGR01764	excise: DNA binding domain, excisionase family	19	63	9.0E-8	T	21-03-2019	IPR010093	SinI-like, DNA-binding domain
MAG010_22_30	505e4591e8364cc89d1dffbad571b46d	72	Pfam	PF12728	Helix-turn-helix domain	17	63	9.5E-10	T	21-03-2019
MAG010_7_20	4d00190c7ccf92a782746a7d4045eeb3	127	Pfam	PF04883	Bacteriophage HK97-gp10, putative tail-component	16	91	3.3E-14	T	21-03-2019	IPR010064	Bacteriophage HK97-gp10, putative tail-component
MAG010_18_62	995fb1b073ede3030c45f13b0b1dc77c	331	Pfam	PF05598	Transposase domain (DUF772)	50	125	5.4E-20	T	21-03-2019	IPR008490	Transposase InsH, N-terminal
MAG010_18_62	995fb1b073ede3030c45f13b0b1dc77c	331	Pfam	PF01609	Transposase DDE domain	142	318	3.2E-24	T	21-03-2019	IPR002559	Transposase, IS4-like
MAG010_26_8	d99f90fd1a03cd53955f0ed4356ca191	701	TIGRFAM	TIGR01398	FlhA: flagellar biosynthesis protein FlhA	9	686	2.7E-237	T	21-03-2019	IPR006301	Flagellar biosynthesis protein FlhA
MAG010_26_8	d99f90fd1a03cd53955f0ed4356ca191	701	Pfam	PF00771	FHIPEP family	17	678	3.6E-246	T	21-03-2019	IPR001712	Type III secretion system FHIPEP
MAG010_1_147	46614c88dc69728edcdd2631592fcfb3	328	Pfam	PF08352	Oligopeptide/dipeptide transporter, C-terminal region	236	303	7.5E-16	T	21-03-2019	IPR013563	Oligopeptide/dipeptide ABC transporter, C-terminal
MAG010_1_147	46614c88dc69728edcdd2631592fcfb3	328	TIGRFAM	TIGR01727	oligo_HPY: oligopeptide/dipeptide ABC transporter, ATP-binding protein, C-terminal domain	234	322	1.2E-26	T	21-03-2019	IPR013563	Oligopeptide/dipeptide ABC transporter, C-terminal
MAG010_1_147	46614c88dc69728edcdd2631592fcfb3	328	Pfam	PF00005	ABC transporter	35	184	2.1E-34	T	21-03-2019	IPR003439	ABC transporter-like
MAG010_36_17	1361de0120fb8a9bb2f9af574aa4849d	257	TIGRFAM	TIGR00671	baf: pantothenate kinase, type III	3	251	5.4E-46	T	21-03-2019	IPR004619	Type III pantothenate kinase
MAG010_36_17	1361de0120fb8a9bb2f9af574aa4849d	257	Pfam	PF03309	Type III pantothenate kinase	2	205	2.1E-44	T	21-03-2019	IPR004619	Type III pantothenate kinase
MAG010_30_12	5cd91f7e3657a2b285249b77fa4029c5	333	Pfam	PF02615	Malate/L-lactate dehydrogenase	3	330	4.1E-103	T	21-03-2019	IPR003767	Malate/L-lactate dehydrogenase-like
MAG010_22_35	0fafaf6801e817aba572eeaf8534a5f0	555	Pfam	PF13408	Recombinase zinc beta ribbon domain	319	374	4.6E-13	T	21-03-2019	IPR025827	Recombinase zinc beta ribbon domain
MAG010_22_35	0fafaf6801e817aba572eeaf8534a5f0	555	Pfam	PF00239	Resolvase, N terminal domain	8	159	1.7E-20	T	21-03-2019	IPR006119	Resolvase, N-terminal catalytic domain
MAG010_22_35	0fafaf6801e817aba572eeaf8534a5f0	555	Pfam	PF07508	Recombinase	183	304	2.6E-18	T	21-03-2019	IPR011109	DNA-binding recombinase domain
MAG010_28_38	43c30da07d2e38da7a32a3cbbba59aa9	479	Pfam	PF10112	5-bromo-4-chloroindolyl phosphate hydrolysis protein	346	459	3.0E-16	T	21-03-2019	IPR018770	5-bromo-4-chloroindolyl phosphate hydrolysis protein
MAG010_30_40	dda3c6d80fcb794a9ab5be7f6719dbfa	126	Pfam	PF08281	Sigma-70, region 4	71	122	6.6E-7	T	21-03-2019	IPR013249	RNA polymerase sigma factor 70, region 4 type 2
MAG010_3_117	d21118aa8980554d1e31a229705da6ab	259	Pfam	PF08478	POTRA domain, FtsQ-type	41	110	3.0E-16	T	21-03-2019	IPR013685	POTRA domain, FtsQ-type
MAG010_3_36	ba1b516bb24368439a3ff6285db1b220	127	Pfam	PF06486	Protein of unknown function (DUF1093)	34	112	2.3E-17	T	21-03-2019	IPR006542	Protein of unknown function DUF1093
MAG010_3_36	ba1b516bb24368439a3ff6285db1b220	127	TIGRFAM	TIGR01655	yxeA_fam: conserved hypothetical protein	1	120	1.4E-13	T	21-03-2019	IPR006542	Protein of unknown function DUF1093
MAG010_72_2	6a57509d965eea050a3f1371ed9cf712	279	Pfam	PF00924	Mechanosensitive ion channel	71	266	1.1E-51	T	21-03-2019	IPR006685	Mechanosensitive ion channel MscS
MAG010_65_5	23abe1bea96634e84f0d223773818593	163	Pfam	PF00005	ABC transporter	2	90	2.1E-11	T	21-03-2019	IPR003439	ABC transporter-like
MAG010_4_136	2c393310dac2bc97cf9ae6b52a20fd9b	314	Pfam	PF00725	3-hydroxyacyl-CoA dehydrogenase, C-terminal domain	213	313	2.0E-18	T	21-03-2019	IPR006108	3-hydroxyacyl-CoA dehydrogenase, C-terminal
MAG010_4_136	2c393310dac2bc97cf9ae6b52a20fd9b	314	Pfam	PF02737	3-hydroxyacyl-CoA dehydrogenase, NAD binding domain	5	209	3.2E-30	T	21-03-2019	IPR006176	3-hydroxyacyl-CoA dehydrogenase, NAD binding
MAG010_53_13	138fd44823a03bdd1e586604cdd85119	239	Pfam	PF07729	FCD domain	79	201	9.4E-20	T	21-03-2019	IPR011711	GntR, C-terminal
MAG010_53_13	138fd44823a03bdd1e586604cdd85119	239	Pfam	PF00392	Bacterial regulatory proteins, gntR family	9	63	6.5E-11	T	21-03-2019	IPR000524	Transcription regulator HTH, GntR
MAG010_5_107	c1828b9e5daebb4f608eb0514f19a551	549	Pfam	PF00515	Tetratricopeptide repeat	454	485	8.0E-10	T	21-03-2019	IPR001440	Tetratricopeptide repeat 1
MAG010_5_107	c1828b9e5daebb4f608eb0514f19a551	549	Pfam	PF00515	Tetratricopeptide repeat	487	519	4.8E-8	T	21-03-2019	IPR001440	Tetratricopeptide repeat 1
MAG010_5_107	c1828b9e5daebb4f608eb0514f19a551	549	Pfam	PF13289	SIR2-like domain	151	283	2.1E-5	T	21-03-2019	IPR039444	SIR2-like domain
MAG010_5_107	c1828b9e5daebb4f608eb0514f19a551	549	Pfam	PF13181	Tetratricopeptide repeat	420	451	0.0012	T	21-03-2019	IPR019734	Tetratricopeptide repeat
MAG010_1_88	66ff2f9d6a2f0cf3387c4b6d4b1fb572	498	Pfam	PF02074	Carboxypeptidase Taq (M32) metallopeptidase	10	492	3.7E-123	T	21-03-2019	IPR001333	Peptidase M32, carboxypeptidase Taq
MAG010_55_9	4a0f627462a93da8b7bb2fb0527e8c19	743	TIGRFAM	TIGR01448	recD_rel: helicase, RecD/TraA family	14	732	2.5E-180	T	21-03-2019	IPR006345	DNA helicase, RecD-like
MAG010_55_9	4a0f627462a93da8b7bb2fb0527e8c19	743	Pfam	PF13604	AAA domain	330	512	2.5E-44	T	21-03-2019
MAG010_55_9	4a0f627462a93da8b7bb2fb0527e8c19	743	Pfam	PF13538	UvrD-like helicase C-terminal domain	662	709	2.9E-14	T	21-03-2019	IPR027785	UvrD-like helicase C-terminal domain
MAG010_55_9	4a0f627462a93da8b7bb2fb0527e8c19	743	Pfam	PF14490	Helix-hairpin-helix containing domain	150	239	1.1E-21	T	21-03-2019	IPR029493	RecD helicase-like helix-hairpin-helix domain
MAG010_58_13	80410c0f03cda598de96c502a9094fbe	186	Pfam	PF10369	Small subunit of acetolactate synthase	89	163	5.2E-26	T	21-03-2019	IPR019455	Acetolactate synthase, small subunit, C-terminal
MAG010_58_13	80410c0f03cda598de96c502a9094fbe	186	Pfam	PF01842	ACT domain	8	72	2.2E-12	T	21-03-2019	IPR002912	ACT domain
MAG010_58_13	80410c0f03cda598de96c502a9094fbe	186	TIGRFAM	TIGR00119	acolac_sm: acetolactate synthase, small subunit	6	164	7.4E-51	T	21-03-2019	IPR004789	Acetolactate synthase, small subunit
MAG010_17_46	a4f1065d83cfe60e0399eb27c60156f6	1183	Pfam	PF00395	S-layer homology domain	99	137	3.2E-7	T	21-03-2019	IPR001119	S-layer homology domain
MAG010_17_46	a4f1065d83cfe60e0399eb27c60156f6	1183	Pfam	PF00395	S-layer homology domain	33	75	2.4E-4	T	21-03-2019	IPR001119	S-layer homology domain
MAG010_37_1	43dc8afaf495ca4e8951e4b413a04cbf	65	Pfam	PF08984	Domain of unknown function (DUF1858)	4	57	8.2E-26	T	21-03-2019	IPR015077	Domain of unknown function DUF1858
MAG010_37_1	43dc8afaf495ca4e8951e4b413a04cbf	65	TIGRFAM	TIGR03980	prismane_assoc: hybrid cluster protein-associated redox disulfide domain	4	61	7.2E-30	T	21-03-2019	IPR023883	Conserved hypothetical protein CHP03980,  redox-disulphide
MAG010_4_38	bd35b68846ac4d702b9b85b88076bcfb	314	Pfam	PF06325	Ribosomal protein L11 methyltransferase (PrmA)	5	313	8.7E-77	T	21-03-2019
MAG010_4_38	bd35b68846ac4d702b9b85b88076bcfb	314	TIGRFAM	TIGR00406	prmA: ribosomal protein L11 methyltransferase	5	306	1.3E-61	T	21-03-2019	IPR004498	Ribosomal protein L11 methyltransferase
MAG010_1_122	007a74fbab91441b5c5786d4430d2441	553	Pfam	PF02286	Dehydratase large subunit	1	552	0.0	T	21-03-2019	IPR003206	Diol/glycerol dehydratase, large subunit
MAG010_97_3	4198c98016ee4ac2797ca5848fc4db42	440	Pfam	PF03432	Relaxase/Mobilisation nuclease domain	15	256	3.5E-40	T	21-03-2019	IPR005094	Endonuclease relaxase, MobA/VirD2
MAG010_5_102	5938051c465d7074868ec09a5f5d40e2	593	TIGRFAM	TIGR02397	dnaX_nterm: DNA polymerase III, subunit gamma and tau	2	357	8.5E-124	T	21-03-2019	IPR012763	DNA polymerase III, subunit gamma/ tau
MAG010_5_102	5938051c465d7074868ec09a5f5d40e2	593	Pfam	PF13177	DNA polymerase III, delta subunit	19	177	1.6E-45	T	21-03-2019
MAG010_5_102	5938051c465d7074868ec09a5f5d40e2	593	Pfam	PF12169	DNA polymerase III subunits gamma and tau domain III	230	358	4.6E-12	T	21-03-2019	IPR022754	DNA polymerase III, gamma subunit, domain III
MAG010_25_4	65d403f7f5e7dfbd7d8f17ca74128fae	264	Pfam	PF01678	Diaminopimelate epimerase	143	256	4.7E-28	T	21-03-2019	IPR001653	Diaminopimelate epimerase, DapF
MAG010_25_4	65d403f7f5e7dfbd7d8f17ca74128fae	264	Pfam	PF01678	Diaminopimelate epimerase	3	124	5.9E-33	T	21-03-2019	IPR001653	Diaminopimelate epimerase, DapF
MAG010_25_4	65d403f7f5e7dfbd7d8f17ca74128fae	264	TIGRFAM	TIGR00652	DapF: diaminopimelate epimerase	1	262	1.9E-87	T	21-03-2019	IPR001653	Diaminopimelate epimerase, DapF
MAG010_1_107	06da72425c7d25fd425c489cd0534edd	313	Pfam	PF00528	Binding-protein-dependent transport system inner membrane component	114	310	5.6E-36	T	21-03-2019	IPR000515	ABC transporter type 1, transmembrane domain MetI-like
MAG010_15_58	af255106a123a7c0b4ddd948d70e528a	228	Pfam	PF01991	ATP synthase (E/31 kDa) subunit	11	227	2.2E-13	T	21-03-2019	IPR002842	V-type ATPase subunit E
MAG010_4_120	56153b926dd433fb1949f217a5aa15cb	280	Pfam	PF10418	Iron-sulfur cluster binding domain of dihydroorotate dehydrogenase B	213	249	1.6E-12	T	21-03-2019	IPR019480	Dihydroorotate dehydrogenase, electron transfer subunit, iron-sulphur cluster binding domain
MAG010_17_18	43da2026001ad2fce1e6793e232b62c8	754	Pfam	PF16192	C-terminal four TMM region of protein-O-mannosyltransferase	578	752	9.2E-17	T	21-03-2019	IPR032421	Protein O-mannosyl-transferase, C-terminal four TM domain
MAG010_17_18	43da2026001ad2fce1e6793e232b62c8	754	Pfam	PF13231	Dolichyl-phosphate-mannose-protein mannosyltransferase	303	441	8.3E-17	T	21-03-2019	IPR038731	Glycosyltransferase RgtA/B/C/D-like
MAG010_47_15	ad0106a61e325615d468f2eb422f6243	247	Pfam	PF07729	FCD domain	112	240	1.9E-20	T	21-03-2019	IPR011711	GntR, C-terminal
MAG010_47_15	ad0106a61e325615d468f2eb422f6243	247	Pfam	PF00392	Bacterial regulatory proteins, gntR family	24	82	1.0E-18	T	21-03-2019	IPR000524	Transcription regulator HTH, GntR
