MAG086_112_3	34a7a73133ab24f963c89414a7c7f2ae	425	TIGRFAM	TIGR00838	argH: argininosuccinate lyase	11	390	2.6E-98	T	21-03-2019	IPR009049	Argininosuccinate lyase
MAG086_74_5	41775f2e2bef3791a9a18312118f4344	787	TIGRFAM	TIGR01180	aman2_put: putative alpha-1,2-mannosidase	10	763	4.1E-261	T	21-03-2019	IPR005887	Alpha-1,2-mannosidase, putative
MAG086_74_5	41775f2e2bef3791a9a18312118f4344	787	Pfam	PF07971	Glycosyl hydrolase family 92	261	759	4.7E-172	T	21-03-2019	IPR012939	Glycosyl hydrolase family 92
MAG086_121_3	af3fd773e1a643884144e41b2bce1429	825	Pfam	PF01640	Peptidase C10 family	152	347	2.9E-66	T	21-03-2019	IPR000200	Peptidase C10, streptopain
MAG086_121_3	af3fd773e1a643884144e41b2bce1429	825	Pfam	PF13734	Spi protease inhibitor	18	116	3.9E-23	T	21-03-2019	IPR025896	Spi protease inhibitor
MAG086_121_3	af3fd773e1a643884144e41b2bce1429	825	TIGRFAM	TIGR04183	Por_Secre_tail: Por secretion system C-terminal sorting domain	762	824	8.5E-9	T	21-03-2019	IPR026444	Secretion system C-terminal sorting domain
MAG086_37_5	e855cb9684e1013a13d6064685c0ad8f	595	TIGRFAM	TIGR00231	small_GTP: small GTP-binding protein domain	5	174	7.1E-19	T	21-03-2019	IPR005225	Small GTP-binding protein domain
MAG086_37_5	e855cb9684e1013a13d6064685c0ad8f	595	TIGRFAM	TIGR01393	lepA: elongation factor 4	2	595	2.8E-301	T	21-03-2019	IPR006297	Elongation factor 4
MAG086_37_5	e855cb9684e1013a13d6064685c0ad8f	595	Pfam	PF06421	GTP-binding protein LepA C-terminus	487	593	8.2E-51	T	21-03-2019	IPR013842	GTP-binding protein LepA, C-terminal
MAG086_37_5	e855cb9684e1013a13d6064685c0ad8f	595	Pfam	PF00009	Elongation factor Tu GTP binding domain	2	181	4.0E-54	T	21-03-2019	IPR000795	Transcription factor, GTP-binding domain
MAG086_37_5	e855cb9684e1013a13d6064685c0ad8f	595	Pfam	PF03144	Elongation factor Tu domain 2	205	274	5.7E-10	T	21-03-2019	IPR004161	Translation elongation factor EFTu-like, domain 2
MAG086_37_5	e855cb9684e1013a13d6064685c0ad8f	595	Pfam	PF00679	Elongation factor G C-terminus	398	485	2.0E-19	T	21-03-2019	IPR000640	Elongation factor EFG, domain V-like
MAG086_7_2	9e659c3c518901f0baca7e242b8a5df5	221	Pfam	PF01168	Alanine racemase, N-terminal domain	8	219	1.1E-13	T	21-03-2019	IPR001608	Alanine racemase, N-terminal
MAG086_7_2	9e659c3c518901f0baca7e242b8a5df5	221	TIGRFAM	TIGR00044	TIGR00044: pyridoxal phosphate enzyme, YggS family	11	219	2.8E-53	T	21-03-2019	IPR011078	Pyridoxal phosphate homeostasis protein
MAG086_139_1	01d28c5b3cfb64448727d80a8cfc3af2	380	Pfam	PF08676	MutL C terminal dimerisation domain	200	339	1.1E-26	T	21-03-2019	IPR014790	MutL, C-terminal, dimerisation
MAG086_139_1	01d28c5b3cfb64448727d80a8cfc3af2	380	Pfam	PF01119	DNA mismatch repair protein, C-terminal domain	3	65	7.1E-18	T	21-03-2019	IPR013507	DNA mismatch repair protein,  S5 domain 2-like
MAG086_5_13	0f238ccde1c0e24f0fedeec810b81807	115	Pfam	PF10825	Protein of unknown function (DUF2752)	28	75	3.0E-20	T	21-03-2019	IPR021215	Protein of unknown function DUF2752
MAG086_145_6	1a152b8ad5a190e96166c3fb01b3be94	129	Pfam	PF00411	Ribosomal protein S11	19	128	1.3E-41	T	21-03-2019	IPR001971	Ribosomal protein S11
MAG086_145_6	1a152b8ad5a190e96166c3fb01b3be94	129	TIGRFAM	TIGR03632	uS11_bact: ribosomal protein uS11	10	126	8.1E-53	T	21-03-2019	IPR019981	Ribosomal protein S11, bacterial-type
MAG086_42_9	03b2987042eb6aa004df774a9a8e4732	357	Pfam	PF03739	Predicted permease YjgP/YjgQ family	7	353	2.4E-58	T	21-03-2019	IPR005495	Permease LptG/LptF-related
MAG086_233_1	ae3e940b03f0a86998a077819477b22a	448	Pfam	PF01384	Phosphate transporter family	26	447	5.6E-27	T	21-03-2019	IPR001204	Phosphate transporter
MAG086_89_8	b21953fb73c7b9f88813606afb49b8b8	599	Pfam	PF00884	Sulfatase	400	539	5.0E-10	T	21-03-2019	IPR000917	Sulfatase, N-terminal
MAG086_19_14	cf38e9455c9193500234c5a3cd3a8964	243	Pfam	PF00877	NlpC/P60 family	72	176	7.7E-30	T	21-03-2019	IPR000064	Endopeptidase, NLPC/P60 domain
MAG086_57_5	cf621725bd94b2c31bc3ff9771da1879	468	Pfam	PF00657	GDSL-like Lipase/Acylhydrolase	98	432	5.7E-19	T	21-03-2019	IPR001087	GDSL lipase/esterase
MAG086_49_3	b92eac892f712f80bf387117ad66479b	302	Pfam	PF00932	Lamin Tail Domain	21	137	5.8E-8	T	21-03-2019	IPR001322	Lamin tail domain
MAG086_49_3	b92eac892f712f80bf387117ad66479b	302	Pfam	PF04277	Oxaloacetate decarboxylase, gamma chain	194	266	5.6E-14	T	21-03-2019	IPR005899	Sodium ion-translocating decarboxylase
MAG086_63_10	7a491f31661156c22a8bef497836aec1	673	Pfam	PF07715	TonB-dependent Receptor Plug Domain	3	76	2.4E-10	T	21-03-2019	IPR012910	TonB-dependent receptor, plug domain
MAG086_102_2	f3526294d0bd7485b17c74eb103e31f7	197	Pfam	PF00625	Guanylate kinase	11	191	9.1E-43	T	21-03-2019	IPR008145	Guanylate kinase/L-type calcium channel beta subunit
MAG086_102_2	f3526294d0bd7485b17c74eb103e31f7	197	TIGRFAM	TIGR03263	guanyl_kin: guanylate kinase	11	191	6.2E-63	T	21-03-2019	IPR017665	Guanylate kinase
MAG086_144_1	b48961119899a828c74f307e6a48bba6	642	Pfam	PF01043	SecA preprotein cross-linking domain	400	540	1.2E-36	T	21-03-2019	IPR011130	SecA, preprotein cross-linking domain
MAG086_144_1	b48961119899a828c74f307e6a48bba6	642	Pfam	PF07517	SecA DEAD-like domain	8	584	7.4E-119	T	21-03-2019	IPR011115	SecA DEAD-like, N-terminal
MAG086_75_4	29d4f0127957d117bcce5011a19fe93f	325	Pfam	PF13732	Domain of unknown function (DUF4162)	215	308	2.4E-11	T	21-03-2019	IPR025302	Domain of unknown function DUF4162
MAG086_75_4	29d4f0127957d117bcce5011a19fe93f	325	Pfam	PF00005	ABC transporter	21	161	1.4E-27	T	21-03-2019	IPR003439	ABC transporter-like
MAG086_176_1	065716a29d1205fa8b4c8e2da19fa6e3	217	Pfam	PF01520	N-acetylmuramoyl-L-alanine amidase	11	95	2.3E-15	T	21-03-2019	IPR002508	N-acetylmuramoyl-L-alanine amidase, catalytic domain
MAG086_24_7	6b366b6141eeff8f3927ef647b9c8ea0	334	Pfam	PF01131	DNA topoisomerase	128	296	1.9E-58	T	21-03-2019	IPR013497	DNA topoisomerase, type IA, central
MAG086_24_7	6b366b6141eeff8f3927ef647b9c8ea0	334	Pfam	PF01751	Toprim domain	5	113	3.0E-29	T	21-03-2019	IPR006171	TOPRIM  domain
MAG086_48_5	055dd98923224be20529e56d34778166	339	Pfam	PF16141	Putative glycoside hydrolase Family 18, chitinase_18	27	332	3.3E-72	T	21-03-2019	IPR032320	Protein of unknown function DUF4849, putative glycoside hydrolase family 18
MAG086_134_3	08f48c29966332035d19c7ebd7526f77	328	TIGRFAM	TIGR02226	two_anch: N-terminal double-transmembrane domain	1	78	4.0E-6	T	21-03-2019	IPR011933	Double transmembrane domain
MAG086_134_3	08f48c29966332035d19c7ebd7526f77	328	Pfam	PF07584	Aerotolerance regulator N-terminal	1	74	2.1E-11	T	21-03-2019	IPR024163	Aerotolerance regulator, N-terminal
MAG086_134_3	08f48c29966332035d19c7ebd7526f77	328	Pfam	PF00092	von Willebrand factor type A domain	89	280	1.4E-27	T	21-03-2019	IPR002035	von Willebrand factor, type A
MAG086_108_1	a8cde7c965826c1d3fd0a14713c432f9	357	Pfam	PF00144	Beta-lactamase	11	333	5.3E-31	T	21-03-2019	IPR001466	Beta-lactamase-related
MAG086_103_7	95109993c22a554cc527ee7a0dcaf435	234	Pfam	PF16270	Domain of unknown function (DUF4923)	34	201	1.1E-44	T	21-03-2019	IPR032575	Protein of unknown function DUF4923
MAG086_72_7	4c0c03a2319886f7288e56aab9cdea85	506	Pfam	PF16499	Alpha galactosidase A	124	414	4.1E-55	T	21-03-2019	IPR002241	Glycoside hydrolase, family 27
MAG086_63_6	6e76302a53d4e6c0e6ed2506424540e6	258	Pfam	PF00329	Respiratory-chain NADH dehydrogenase, 30 Kd subunit	26	141	5.4E-33	T	21-03-2019	IPR001268	NADH:ubiquinone oxidoreductase, 30kDa subunit
MAG086_19_9	bc6018d42963e93d50ad0cbb802214e6	342	Pfam	PF00766	Electron transfer flavoprotein FAD-binding domain	217	300	4.1E-36	T	21-03-2019	IPR014731	Electron transfer flavoprotein, alpha subunit, C-terminal
MAG086_19_9	bc6018d42963e93d50ad0cbb802214e6	342	Pfam	PF01012	Electron transfer flavoprotein domain	9	190	1.9E-37	T	21-03-2019	IPR014730	Electron transfer flavoprotein, alpha/beta-subunit, N-terminal
MAG086_24_11	f1517fbd44744e11ee1e4466458b50df	314	Pfam	PF13444	Acetyltransferase (GNAT) domain	52	156	8.2E-10	T	21-03-2019
MAG086_1_33	e9f250f5d50b4a48aed2c15c8051803a	285	TIGRFAM	TIGR03534	RF_mod_PrmC: protein-(glutamine-N5) methyltransferase, release factor-specific	32	274	7.5E-61	T	21-03-2019	IPR019874	Protein-(glutamine-N5) methyltransferase, release factor-specific
MAG086_1_33	e9f250f5d50b4a48aed2c15c8051803a	285	Pfam	PF05175	Methyltransferase small domain	111	189	5.8E-15	T	21-03-2019	IPR007848	Methyltransferase small domain
MAG086_1_33	e9f250f5d50b4a48aed2c15c8051803a	285	TIGRFAM	TIGR00536	hemK_fam: methyltransferase, HemK family	58	278	1.1E-45	T	21-03-2019	IPR004556	Modification methylase HemK
MAG086_138_3	2008ee94d0f0369d025b8044f2c6e761	400	Pfam	PF00155	Aminotransferase class I and II	38	386	6.3E-39	T	21-03-2019	IPR004839	Aminotransferase, class I/classII
MAG086_138_3	2008ee94d0f0369d025b8044f2c6e761	400	TIGRFAM	TIGR04350	C_S_lyase_PatB: putative C-S lyase	7	390	4.7E-132	T	21-03-2019	IPR027619	Putative C-S lyase
MAG086_43_3	8ceec6fa40496728c531d5f0af1df9cb	329	Pfam	PF12437	Glutamine synthetase type III N terminal	30	186	2.9E-75	T	21-03-2019	IPR022147	Glutamine synthetase type III N-terminal
MAG086_43_3	8ceec6fa40496728c531d5f0af1df9cb	329	Pfam	PF00120	Glutamine synthetase, catalytic domain	208	324	1.9E-8	T	21-03-2019	IPR008146	Glutamine synthetase, catalytic domain
MAG086_2_25	f977051d39970b33e44e93cec98c50e4	120	TIGRFAM	TIGR00810	secG: preprotein translocase, SecG subunit	2	69	1.5E-20	T	21-03-2019	IPR004692	Preprotein translocase SecG subunit
MAG086_2_25	f977051d39970b33e44e93cec98c50e4	120	Pfam	PF03840	Preprotein translocase SecG subunit	5	69	1.5E-18	T	21-03-2019	IPR004692	Preprotein translocase SecG subunit
MAG086_47_11	a98baebaca9662d3d5dfd78a496bdf91	391	Pfam	PF06968	Biotin and Thiamin Synthesis associated domain	279	379	3.6E-20	T	21-03-2019	IPR010722	Biotin and thiamin synthesis-associated domain
MAG086_47_11	a98baebaca9662d3d5dfd78a496bdf91	391	Pfam	PF04055	Radical SAM superfamily	101	247	6.7E-8	T	21-03-2019	IPR007197	Radical SAM
MAG086_47_11	a98baebaca9662d3d5dfd78a496bdf91	391	TIGRFAM	TIGR02351	thiH: thiazole biosynthesis protein ThiH	20	388	2.8E-146	T	21-03-2019	IPR012726	Thiazole biosynthesis ThiH
MAG086_171_2	24eefa93e037d1b2060d2be3c21b58ab	86	Pfam	PF04608	Phosphatidylglycerophosphatase A	18	83	7.6E-10	T	21-03-2019	IPR007686	YutG/PgpA domain
MAG086_15_15	cae5f001d0f20985ca0956278be54539	386	Pfam	PF00684	DnaJ central domain	157	221	2.7E-14	T	21-03-2019	IPR001305	Heat shock protein DnaJ, cysteine-rich domain
MAG086_15_15	cae5f001d0f20985ca0956278be54539	386	TIGRFAM	TIGR02349	DnaJ_bact: chaperone protein DnaJ	5	363	5.8E-130	T	21-03-2019	IPR012724	Chaperone DnaJ
MAG086_15_15	cae5f001d0f20985ca0956278be54539	386	Pfam	PF01556	DnaJ C terminal domain	131	347	1.1E-36	T	21-03-2019	IPR002939	Chaperone DnaJ, C-terminal
MAG086_15_15	cae5f001d0f20985ca0956278be54539	386	Pfam	PF00226	DnaJ domain	5	67	5.5E-28	T	21-03-2019	IPR001623	DnaJ domain
MAG086_215_2	fa78b9d115ae4430028c4b9b4f8ed7b8	548	Pfam	PF13287	Fn3 associated	261	315	6.8E-17	T	21-03-2019	IPR026876	Fn3 associated repeat
MAG086_7_11	2f98bd4342a9774d8b7bfa4585f7b68a	206	Pfam	PF04301	Protein of unknown function (DUF452)	14	197	1.0E-28	T	21-03-2019	IPR007398	Protein of unknown function DUF452
MAG086_45_7	0f3081ff4b053108cf2ce92058780218	1078	Pfam	PF14684	Tricorn protease C1 domain	709	775	2.7E-24	T	21-03-2019	IPR028204	Tricorn protease C1 domain
MAG086_45_7	0f3081ff4b053108cf2ce92058780218	1078	Pfam	PF13180	PDZ domain	787	868	7.4E-9	T	21-03-2019	IPR001478	PDZ domain
MAG086_45_7	0f3081ff4b053108cf2ce92058780218	1078	Pfam	PF07676	WD40-like Beta Propeller Repeat	62	96	9.5E-13	T	21-03-2019	IPR011659	WD40-like Beta Propeller
MAG086_45_7	0f3081ff4b053108cf2ce92058780218	1078	Pfam	PF07676	WD40-like Beta Propeller Repeat	349	383	1.8E-4	T	21-03-2019	IPR011659	WD40-like Beta Propeller
MAG086_45_7	0f3081ff4b053108cf2ce92058780218	1078	Pfam	PF07676	WD40-like Beta Propeller Repeat	33	45	0.2	T	21-03-2019	IPR011659	WD40-like Beta Propeller
MAG086_45_7	0f3081ff4b053108cf2ce92058780218	1078	Pfam	PF07676	WD40-like Beta Propeller Repeat	404	432	6.1E-5	T	21-03-2019	IPR011659	WD40-like Beta Propeller
MAG086_45_7	0f3081ff4b053108cf2ce92058780218	1078	Pfam	PF03572	Peptidase family S41	898	1052	1.6E-16	T	21-03-2019	IPR005151	Tail specific protease
MAG086_36_9	694dbc7562b23192cfdfa51cf81a710f	226	Pfam	PF00486	Transcriptional regulatory protein, C terminal	150	223	1.7E-12	T	21-03-2019	IPR001867	OmpR/PhoB-type DNA-binding domain
MAG086_36_9	694dbc7562b23192cfdfa51cf81a710f	226	Pfam	PF00072	Response regulator receiver domain	5	114	4.5E-27	T	21-03-2019	IPR001789	Signal transduction response regulator, receiver domain
MAG086_83_2	c630121a15d626dbadd2ca1c222fdaed	369	Pfam	PF00480	ROK family	10	289	1.3E-17	T	21-03-2019	IPR000600	ROK family
MAG086_15_8	1c3291aee59cabfcf1b2fcfd2a4b7558	204	TIGRFAM	TIGR02937	sigma70-ECF: RNA polymerase sigma factor, sigma-70 family	51	203	2.5E-24	T	21-03-2019	IPR014284	RNA polymerase sigma-70 like domain
MAG086_15_8	1c3291aee59cabfcf1b2fcfd2a4b7558	204	Pfam	PF04542	Sigma-70 region 2	55	121	4.2E-12	T	21-03-2019	IPR007627	RNA polymerase sigma-70 region 2
MAG086_15_8	1c3291aee59cabfcf1b2fcfd2a4b7558	204	Pfam	PF08281	Sigma-70, region 4	149	200	4.4E-9	T	21-03-2019	IPR013249	RNA polymerase sigma factor 70, region 4 type 2
MAG086_15_2	fef52144954e969297370a89067d3258	356	Pfam	PF00117	Glutamine amidotransferase class-I	180	354	1.9E-48	T	21-03-2019	IPR017926	Glutamine amidotransferase
MAG086_15_2	fef52144954e969297370a89067d3258	356	Pfam	PF00988	Carbamoyl-phosphate synthase small chain, CPSase domain	8	142	8.7E-52	T	21-03-2019	IPR002474	Carbamoyl-phosphate synthase small subunit, N-terminal domain
MAG086_15_2	fef52144954e969297370a89067d3258	356	TIGRFAM	TIGR01368	CPSaseIIsmall: carbamoyl-phosphate synthase, small subunit	8	355	5.0E-135	T	21-03-2019	IPR006274	Carbamoyl-phosphate synthase, small subunit
MAG086_47_13	0fa5faa45bca55356ceee5b1b29b5e89	168	Pfam	PF03852	DNA mismatch endonuclease Vsr	2	72	1.8E-33	T	21-03-2019	IPR004603	DNA mismatch endonuclease vsr
MAG086_47_13	0fa5faa45bca55356ceee5b1b29b5e89	168	TIGRFAM	TIGR00632	vsr: DNA mismatch endonuclease Vsr	1	119	7.0E-47	T	21-03-2019	IPR004603	DNA mismatch endonuclease vsr
MAG086_115_12	7ae3363d7e7e78b081370967d0a7bd16	185	Pfam	PF00347	Ribosomal protein L6	11	83	1.8E-22	T	21-03-2019	IPR020040	Ribosomal protein L6, alpha-beta domain
MAG086_115_12	7ae3363d7e7e78b081370967d0a7bd16	185	Pfam	PF00347	Ribosomal protein L6	91	168	1.2E-16	T	21-03-2019	IPR020040	Ribosomal protein L6, alpha-beta domain
MAG086_115_12	7ae3363d7e7e78b081370967d0a7bd16	185	TIGRFAM	TIGR03654	L6_bact: ribosomal protein uL6	2	181	5.5E-71	T	21-03-2019	IPR019906	Ribosomal protein L6, bacterial-type
MAG086_190_3	342dc890450561a261abfcc846aa3ef2	167	Pfam	PF01642	Methylmalonyl-CoA mutase	30	167	1.1E-53	T	21-03-2019	IPR006099	Methylmalonyl-CoA mutase, alpha/beta chain, catalytic
MAG086_6_12	16570e72ef641ef844a5ff7edf5a8aff	254	TIGRFAM	TIGR00696	wecG_tagA_cpsF: glycosyltransferase, WecB/TagA/CpsF family	49	226	6.7E-32	T	21-03-2019	IPR004629	Glycosyl transferase WecB/TagA/CpsF
MAG086_6_12	16570e72ef641ef844a5ff7edf5a8aff	254	Pfam	PF03808	Glycosyl transferase WecB/TagA/CpsF family	53	226	8.3E-49	T	21-03-2019	IPR004629	Glycosyl transferase WecB/TagA/CpsF
MAG086_105_3	ee375bcdb81ab96bb81ac794f5010fad	463	Pfam	PF13727	CoA-binding domain	77	211	1.4E-10	T	21-03-2019
MAG086_105_3	ee375bcdb81ab96bb81ac794f5010fad	463	TIGRFAM	TIGR03025	EPS_sugtrans: exopolysaccharide biosynthesis polyprenyl glycosylphosphotransferase	21	459	1.9E-121	T	21-03-2019	IPR017475	Exopolysaccharide biosynthesis polyprenyl glycosylphosphotransferase
MAG086_105_3	ee375bcdb81ab96bb81ac794f5010fad	463	TIGRFAM	TIGR03023	WcaJ_sugtrans: undecaprenyl-phosphate glucose phosphotransferase	25	463	2.3E-131	T	21-03-2019	IPR017473	Undecaprenyl-phosphate glucose phosphotransferase, WcaJ
MAG086_105_3	ee375bcdb81ab96bb81ac794f5010fad	463	Pfam	PF02397	Bacterial sugar transferase	273	455	3.8E-62	T	21-03-2019	IPR003362	Bacterial sugar transferase
MAG086_46_11	675428c276e39bb03ffc1847fac0ed28	200	TIGRFAM	TIGR00042	TIGR00042: non-canonical purine NTP pyrophosphatase, RdgB/HAM1 family	10	195	7.1E-52	T	21-03-2019	IPR002637	Ham1-like protein
MAG086_46_11	675428c276e39bb03ffc1847fac0ed28	200	Pfam	PF01725	Ham1 family	10	192	2.8E-54	T	21-03-2019	IPR002637	Ham1-like protein
MAG086_53_6	292274ca94bac4aea9cd05b2af85be96	428	Pfam	PF05193	Peptidase M16 inactive domain	217	358	1.2E-13	T	21-03-2019	IPR007863	Peptidase M16, C-terminal
MAG086_11_15	f77cf6367396b0a0a8e670046db38149	299	Pfam	PF05552	Conserved TM helix	31	76	5.6E-8	T	21-03-2019	IPR008910	Conserved TM helix
MAG086_11_15	f77cf6367396b0a0a8e670046db38149	299	Pfam	PF00924	Mechanosensitive ion channel	84	285	1.6E-46	T	21-03-2019	IPR006685	Mechanosensitive ion channel MscS
MAG086_3_4	1a3e3e1f4eb913ca9e27bcd083456e8f	444	Pfam	PF08486	Stage II sporulation protein	100	221	5.8E-32	T	21-03-2019	IPR013693	Sporulation stage II protein D, amidase enhancer LytB N-terminal
MAG086_3_4	1a3e3e1f4eb913ca9e27bcd083456e8f	444	TIGRFAM	TIGR02669	SpoIID_LytB: SpoIID/LytB domain	104	441	9.4E-47	T	21-03-2019	IPR013486	Sporulation stage II protein D, amidase enhancer LytB
MAG086_158_3	8ebb41edadc601d883c4605591204df5	243	Pfam	PF12838	4Fe-4S dicluster domain	66	124	9.9E-11	T	21-03-2019	IPR017896	4Fe-4S ferredoxin-type, iron-sulphur binding domain
MAG086_1_24	bb4fc9e8b6567618d0496ef6c5ac3255	576	Pfam	PF01740	STAS domain	453	555	5.8E-14	T	21-03-2019	IPR002645	STAS domain
MAG086_1_24	bb4fc9e8b6567618d0496ef6c5ac3255	576	TIGRFAM	TIGR00815	sulP: sulfate permease	15	555	1.4E-114	T	21-03-2019	IPR001902	SLC26A/SulP transporter
MAG086_1_24	bb4fc9e8b6567618d0496ef6c5ac3255	576	Pfam	PF00916	Sulfate permease family	25	395	2.7E-80	T	21-03-2019	IPR011547	SLC26A/SulP transporter domain
MAG086_22_15	0e4547fdbeb4db683f4f0c7f36513576	311	Pfam	PF00056	lactate/malate dehydrogenase, NAD binding domain	3	143	4.6E-42	T	21-03-2019	IPR001236	Lactate/malate dehydrogenase, N-terminal
MAG086_22_15	0e4547fdbeb4db683f4f0c7f36513576	311	Pfam	PF02866	lactate/malate dehydrogenase, alpha/beta C-terminal domain	148	302	3.4E-22	T	21-03-2019	IPR022383	Lactate/malate dehydrogenase, C-terminal
MAG086_12_14	f18e172ee1b1a046cdc5e49f70744ebf	47	Pfam	PF02595	Glycerate kinase family	9	37	6.4E-7	T	21-03-2019	IPR004381	Glycerate kinase
MAG086_186_3	b6eee7c890b1659cfd108d402c9d5ea5	120	Pfam	PF00588	SpoU rRNA Methylase family	3	108	4.9E-15	T	21-03-2019	IPR001537	tRNA/rRNA methyltransferase, SpoU type
MAG086_66_10	542094cb3bac5e9dc16124db2624a4d5	236	TIGRFAM	TIGR01938	nqrC: NADH:ubiquinone oxidoreductase, Na(+)-translocating, C subunit	6	231	1.8E-60	T	21-03-2019	IPR010204	Na(+)-translocating NADH-quinone reductase subunit C
MAG086_66_10	542094cb3bac5e9dc16124db2624a4d5	236	Pfam	PF04205	FMN-binding domain	127	223	5.4E-17	T	21-03-2019	IPR007329	FMN-binding
MAG086_7_21	6ef4cd9334a3be2d5403da18cf058d8e	367	Pfam	PF01926	50S ribosome-binding GTPase	5	123	7.8E-24	T	21-03-2019	IPR006073	GTP binding domain
MAG086_7_21	6ef4cd9334a3be2d5403da18cf058d8e	367	TIGRFAM	TIGR00092	TIGR00092: GTP-binding protein YchF	1	367	4.7E-147	T	21-03-2019	IPR004396	Ribosome-binding ATPase YchF/Obg-like ATPase 1
MAG086_7_21	6ef4cd9334a3be2d5403da18cf058d8e	367	Pfam	PF06071	Protein of unknown function (DUF933)	283	366	3.5E-39	T	21-03-2019	IPR013029	YchF, C-terminal domain
MAG086_12_1	d1b7088c7dac8a1cedfcd50950dfc142	266	TIGRFAM	TIGR00755	ksgA: ribosomal RNA small subunit methyltransferase A	4	256	7.9E-75	T	21-03-2019	IPR011530	Ribosomal RNA adenine dimethylase
MAG086_12_1	d1b7088c7dac8a1cedfcd50950dfc142	266	Pfam	PF00398	Ribosomal RNA adenine dimethylase	7	257	2.0E-51	T	21-03-2019	IPR001737	Ribosomal RNA adenine methyltransferase KsgA/Erm
MAG086_10_7	54ef11d1c2c73248d3acf9f80112c299	544	TIGRFAM	TIGR03801	asp_4_decarbox: aspartate 4-decarboxylase	15	539	5.6E-227	T	21-03-2019	IPR022518	Aspartate 4-decarboxylase
MAG086_10_7	54ef11d1c2c73248d3acf9f80112c299	544	Pfam	PF00155	Aminotransferase class I and II	193	354	1.1E-16	T	21-03-2019	IPR004839	Aminotransferase, class I/classII
MAG086_122_5	3426f30c56662c8d0d26e2bc4b15d563	378	Pfam	PF03721	UDP-glucose/GDP-mannose dehydrogenase family, NAD binding domain	1	167	2.5E-31	T	21-03-2019	IPR001732	UDP-glucose/GDP-mannose dehydrogenase, N-terminal
MAG086_122_5	3426f30c56662c8d0d26e2bc4b15d563	378	Pfam	PF00984	UDP-glucose/GDP-mannose dehydrogenase family, central domain	220	310	1.6E-26	T	21-03-2019	IPR014026	UDP-glucose/GDP-mannose dehydrogenase, dimerisation
MAG086_19_6	277c86f39fd4268b60750c51f222f173	235	Pfam	PF00072	Response regulator receiver domain	7	116	3.1E-27	T	21-03-2019	IPR001789	Signal transduction response regulator, receiver domain
MAG086_19_6	277c86f39fd4268b60750c51f222f173	235	Pfam	PF00486	Transcriptional regulatory protein, C terminal	154	226	3.9E-17	T	21-03-2019	IPR001867	OmpR/PhoB-type DNA-binding domain
MAG086_199_3	d4ca97565f67cfc4a959e8e8e7754598	280	Pfam	PF00535	Glycosyl transferase family 2	4	96	2.3E-26	T	21-03-2019	IPR001173	Glycosyltransferase 2-like
MAG086_57_7	d64c35334c2ff637274b06a96815c0ff	346	Pfam	PF02275	Linear amide C-N hydrolases, choloylglycine hydrolase family	23	311	1.1E-36	T	21-03-2019	IPR029132	Choloylglycine hydrolase/NAAA C-terminal
MAG086_106_2	ef78bd57e9992e01fb581d32cfcbc63a	311	TIGRFAM	TIGR01251	ribP_PPkin: ribose-phosphate diphosphokinase	5	306	1.6E-108	T	21-03-2019	IPR005946	Ribose-phosphate pyrophosphokinase
MAG086_106_2	ef78bd57e9992e01fb581d32cfcbc63a	311	Pfam	PF14572	Phosphoribosyl synthetase-associated domain	201	306	2.0E-23	T	21-03-2019	IPR005946	Ribose-phosphate pyrophosphokinase
MAG086_106_2	ef78bd57e9992e01fb581d32cfcbc63a	311	Pfam	PF13793	N-terminal domain of ribose phosphate pyrophosphokinase	5	120	4.9E-45	T	21-03-2019	IPR029099	Ribose-phosphate pyrophosphokinase, N-terminal domain
MAG086_8_14	65cc8039ad8712f2c0df8ed15a35359f	599	TIGRFAM	TIGR01394	TypA_BipA: GTP-binding protein TypA/BipA	4	595	1.5E-274	T	21-03-2019	IPR006298	GTP-binding protein TypA
MAG086_8_14	65cc8039ad8712f2c0df8ed15a35359f	599	TIGRFAM	TIGR00231	small_GTP: small GTP-binding protein domain	3	140	3.0E-22	T	21-03-2019	IPR005225	Small GTP-binding protein domain
MAG086_8_14	65cc8039ad8712f2c0df8ed15a35359f	599	Pfam	PF03144	Elongation factor Tu domain 2	217	286	5.1E-11	T	21-03-2019	IPR004161	Translation elongation factor EFTu-like, domain 2
MAG086_8_14	65cc8039ad8712f2c0df8ed15a35359f	599	Pfam	PF00009	Elongation factor Tu GTP binding domain	3	194	2.6E-55	T	21-03-2019	IPR000795	Transcription factor, GTP-binding domain
MAG086_8_14	65cc8039ad8712f2c0df8ed15a35359f	599	Pfam	PF00679	Elongation factor G C-terminus	394	478	1.2E-20	T	21-03-2019	IPR000640	Elongation factor EFG, domain V-like
MAG086_40_3	6a5e6f0f49b5d0b25170864831df6505	491	Pfam	PF01938	TRAM domain	37	86	1.6E-9	T	21-03-2019	IPR002792	TRAM domain
MAG086_40_3	6a5e6f0f49b5d0b25170864831df6505	491	Pfam	PF05958	tRNA (Uracil-5-)-methyltransferase	301	488	6.4E-19	T	21-03-2019	IPR010280	(Uracil-5)-methyltransferase family
MAG086_40_3	6a5e6f0f49b5d0b25170864831df6505	491	TIGRFAM	TIGR00479	rumA: 23S rRNA (uracil-5-)-methyltransferase RumA	45	483	2.8E-105	T	21-03-2019
MAG086_81_7	378807b7f0d1025e58b10ef0e20e2475	453	Pfam	PF08245	Mur ligase middle domain	112	289	3.3E-32	T	21-03-2019	IPR013221	Mur ligase, central
MAG086_81_7	378807b7f0d1025e58b10ef0e20e2475	453	TIGRFAM	TIGR01087	murD: UDP-N-acetylmuramoylalanine--D-glutamate ligase	10	450	1.8E-116	T	21-03-2019	IPR005762	UDP-N-acetylmuramoylalanine-D-glutamate ligase
MAG086_81_7	378807b7f0d1025e58b10ef0e20e2475	453	Pfam	PF02875	Mur ligase family, glutamate ligase domain	312	376	3.6E-7	T	21-03-2019	IPR004101	Mur ligase, C-terminal
MAG086_175_2	21390bd4cb986d4fe8a9fbd36429e435	264	Pfam	PF02633	Creatinine amidohydrolase	20	240	2.8E-47	T	21-03-2019	IPR003785	Creatininase/formamide hydrolase
MAG086_51_11	36e7b2229d479c7b268f9d200b9bfb3b	57	Pfam	PF07432	Histone H1-like protein Hc1	2	57	2.6E-9	T	21-03-2019	IPR010886	Histone H1-like Hc1
MAG086_91_2	032c1c2a223fef153e945508e3358d1f	179	Pfam	PF00132	Bacterial transferase hexapeptide (six repeats)	11	46	2.0E-7	T	21-03-2019	IPR001451	Hexapeptide repeat
MAG086_91_2	032c1c2a223fef153e945508e3358d1f	179	Pfam	PF00132	Bacterial transferase hexapeptide (six repeats)	90	123	3.4E-7	T	21-03-2019	IPR001451	Hexapeptide repeat
MAG086_184_3	df91f8f93ec4d101a74618e973f9910e	174	Pfam	PF08545	3-Oxoacyl-[acyl-carrier-protein (ACP)] synthase III	107	167	1.9E-11	T	21-03-2019	IPR013751	3-Oxoacyl-[acyl-carrier-protein (ACP)] synthase III
MAG086_52_3	95fc3a8e4d4faa95828dcb51e575c8c0	250	Pfam	PF03372	Endonuclease/Exonuclease/phosphatase family	5	242	1.9E-24	T	21-03-2019	IPR005135	Endonuclease/exonuclease/phosphatase
MAG086_52_3	95fc3a8e4d4faa95828dcb51e575c8c0	250	TIGRFAM	TIGR00195	exoDNase_III: exodeoxyribonuclease III	1	249	1.0E-91	T	21-03-2019
MAG086_52_3	95fc3a8e4d4faa95828dcb51e575c8c0	250	TIGRFAM	TIGR00633	xth: exodeoxyribonuclease III (xth)	1	249	2.1E-98	T	21-03-2019	IPR004808	AP endonuclease 1
MAG086_26_7	2074330c85073451a0a10aad68d2f5e4	214	TIGRFAM	TIGR01509	HAD-SF-IA-v3: HAD hydrolase, family IA, variant 3	131	188	2.2E-11	T	21-03-2019	IPR006439	HAD hydrolase, subfamily IA
MAG086_26_7	2074330c85073451a0a10aad68d2f5e4	214	Pfam	PF00702	haloacid dehalogenase-like hydrolase	93	185	1.8E-7	T	21-03-2019
MAG086_116_3	03c85da1511287e1241e19c8cf5445ea	266	Pfam	PF00588	SpoU rRNA Methylase family	122	259	2.1E-31	T	21-03-2019	IPR001537	tRNA/rRNA methyltransferase, SpoU type
MAG086_115_3	58029aeadbf7e23ed26a86de0fc01052	246	Pfam	PF00189	Ribosomal protein S3, C-terminal domain	119	201	4.4E-37	T	21-03-2019	IPR001351	Ribosomal protein S3, C-terminal
MAG086_115_3	58029aeadbf7e23ed26a86de0fc01052	246	Pfam	PF07650	KH domain	37	110	5.3E-20	T	21-03-2019	IPR004044	K Homology domain, type 2
MAG086_115_3	58029aeadbf7e23ed26a86de0fc01052	246	TIGRFAM	TIGR01009	rpsC_bact: ribosomal protein uS3	1	209	1.1E-84	T	21-03-2019	IPR005704	Ribosomal protein S3, bacterial
MAG086_148_2	762c9ff27c4a5f8a84f529a90086b6f3	724	TIGRFAM	TIGR01180	aman2_put: putative alpha-1,2-mannosidase	5	723	1.1E-185	T	21-03-2019	IPR005887	Alpha-1,2-mannosidase, putative
