MAG004_28_10	6c91d379a60cb8e4a8c7a72412499850	252	Pfam	PF12399	Branched-chain amino acid ATP-binding cassette transporter	229	251	2.4E-9	T	21-03-2019	IPR032823	Branched-chain amino acid ATP-binding cassette transporter, C-terminal
MAG004_28_10	6c91d379a60cb8e4a8c7a72412499850	252	Pfam	PF00005	ABC transporter	20	179	3.5E-29	T	21-03-2019	IPR003439	ABC transporter-like
MAG004_7_42	543350117b384bbb9a47725f8b9ceec6	570	Pfam	PF13524	Glycosyl transferases group 1	465	558	2.7E-18	T	21-03-2019
MAG004_1_42	bdee5ae5a2c1d6ba94b11292350bf4f7	254	Pfam	PF04545	Sigma-70, region 4	195	243	3.2E-17	T	21-03-2019	IPR007630	RNA polymerase sigma-70 region 4
MAG004_1_42	bdee5ae5a2c1d6ba94b11292350bf4f7	254	TIGRFAM	TIGR02479	FliA_WhiG: RNA polymerase sigma factor, FliA/WhiG family	26	245	1.3E-78	T	21-03-2019	IPR012845	RNA polymerase sigma factor, FliA/WhiG
MAG004_1_42	bdee5ae5a2c1d6ba94b11292350bf4f7	254	TIGRFAM	TIGR02937	sigma70-ECF: RNA polymerase sigma factor, sigma-70 family	21	245	3.7E-37	T	21-03-2019	IPR014284	RNA polymerase sigma-70 like domain
MAG004_1_42	bdee5ae5a2c1d6ba94b11292350bf4f7	254	Pfam	PF04542	Sigma-70 region 2	27	97	2.3E-13	T	21-03-2019	IPR007627	RNA polymerase sigma-70 region 2
MAG004_36_22	8c731d2dae05ef1ef8087070d77379c4	511	TIGRFAM	TIGR04265	bac_cardiolipin: cardiolipin synthase	42	511	5.6E-114	T	21-03-2019	IPR022924	Cardiolipin synthase
MAG004_36_22	8c731d2dae05ef1ef8087070d77379c4	511	Pfam	PF13091	PLD-like domain	164	274	1.8E-9	T	21-03-2019	IPR025202	Phospholipase D-like domain
MAG004_36_22	8c731d2dae05ef1ef8087070d77379c4	511	Pfam	PF13091	PLD-like domain	352	473	2.5E-22	T	21-03-2019	IPR025202	Phospholipase D-like domain
MAG004_36_22	8c731d2dae05ef1ef8087070d77379c4	511	Pfam	PF13396	Phospholipase_D-nuclease N-terminal	46	88	2.8E-11	T	21-03-2019	IPR027379	Cardiolipin synthase N-terminal
MAG004_36_2	1d788d55092bf7d469a7589c1f7f0d1c	359	Pfam	PF00005	ABC transporter	129	276	1.5E-32	T	21-03-2019	IPR003439	ABC transporter-like
MAG004_36_2	1d788d55092bf7d469a7589c1f7f0d1c	359	Pfam	PF01381	Helix-turn-helix	12	64	5.2E-12	T	21-03-2019	IPR001387	Cro/C1-type helix-turn-helix domain
MAG004_42_9	131ee3ccb372a771f068148629f3d5f9	445	Pfam	PF01189	16S rRNA methyltransferase RsmB/F	82	286	1.3E-46	T	21-03-2019	IPR001678	SAM-dependent methyltransferase RsmB/NOP2-type
MAG004_42_9	131ee3ccb372a771f068148629f3d5f9	445	Pfam	PF17126	RsmF rRNA methyltransferase first C-terminal domain	315	375	8.0E-24	T	21-03-2019	IPR031340	Ribosomal RNA small subunit methyltransferase F, first C-terminal domain
MAG004_42_9	131ee3ccb372a771f068148629f3d5f9	445	Pfam	PF13636	RNA-binding PUA-like domain of methyltransferase RsmF	394	440	4.3E-18	T	21-03-2019	IPR027391	rRNA small subunit methyltransferase F, RNA-binding PUA-like domain
MAG004_42_9	131ee3ccb372a771f068148629f3d5f9	445	Pfam	PF17125	N-terminal domain of 16S rRNA methyltransferase RsmF	1	77	1.5E-24	T	21-03-2019	IPR031341	Ribosomal RNA small subunit methyltransferase F, N-terminal
MAG004_41_19	ad106401c0e352713250e2def54d7351	705	Pfam	PF00679	Elongation factor G C-terminus	612	698	7.9E-32	T	21-03-2019	IPR000640	Elongation factor EFG, domain V-like
MAG004_41_19	ad106401c0e352713250e2def54d7351	705	Pfam	PF03764	Elongation factor G, domain IV	489	610	2.2E-44	T	21-03-2019	IPR005517	Translation elongation factor EFG/EF2, domain IV
MAG004_41_19	ad106401c0e352713250e2def54d7351	705	Pfam	PF14492	Elongation Factor G, domain II	414	487	1.1E-33	T	21-03-2019
MAG004_41_19	ad106401c0e352713250e2def54d7351	705	Pfam	PF03144	Elongation factor Tu domain 2	334	401	1.5E-13	T	21-03-2019	IPR004161	Translation elongation factor EFTu-like, domain 2
MAG004_41_19	ad106401c0e352713250e2def54d7351	705	Pfam	PF00009	Elongation factor Tu GTP binding domain	10	292	1.5E-63	T	21-03-2019	IPR000795	Transcription factor, GTP-binding domain
MAG004_41_19	ad106401c0e352713250e2def54d7351	705	TIGRFAM	TIGR00231	small_GTP: small GTP-binding protein domain	10	193	9.4E-34	T	21-03-2019	IPR005225	Small GTP-binding protein domain
MAG004_41_19	ad106401c0e352713250e2def54d7351	705	TIGRFAM	TIGR00484	EF-G: translation elongation factor G	4	704	0.0	T	21-03-2019	IPR004540	Translation elongation factor EFG/EF2
MAG004_35_23	1960a509339f98c4cfc9252354c4fd72	408	TIGRFAM	TIGR00234	tyrS: tyrosine--tRNA ligase	4	405	1.2E-128	T	21-03-2019	IPR002307	Tyrosine-tRNA ligase
MAG004_35_23	1960a509339f98c4cfc9252354c4fd72	408	Pfam	PF00579	tRNA synthetases class I (W and Y)	29	318	2.9E-79	T	21-03-2019	IPR002305	Aminoacyl-tRNA synthetase, class Ic
MAG004_35_23	1960a509339f98c4cfc9252354c4fd72	408	Pfam	PF01479	S4 domain	347	386	2.4E-8	T	21-03-2019	IPR002942	RNA-binding S4 domain
MAG004_91_2	07eedbf9f39242efd3ced2e6bba938f3	538	TIGRFAM	TIGR00337	PyrG: CTP synthase	3	529	8.0E-245	T	21-03-2019	IPR004468	CTP synthase
MAG004_91_2	07eedbf9f39242efd3ced2e6bba938f3	538	Pfam	PF00117	Glutamine amidotransferase class-I	304	528	1.5E-55	T	21-03-2019	IPR017926	Glutamine amidotransferase
MAG004_91_2	07eedbf9f39242efd3ced2e6bba938f3	538	Pfam	PF06418	CTP synthase N-terminus	5	269	5.5E-125	T	21-03-2019	IPR017456	CTP synthase, N-terminal
MAG004_20_9	c11542c4379ba8c87f5845d8193e806d	635	TIGRFAM	TIGR02034	CysN: sulfate adenylyltransferase, large subunit	95	497	1.9E-101	T	21-03-2019	IPR011779	Sulphate adenylyltransferase, large subunit
MAG004_20_9	c11542c4379ba8c87f5845d8193e806d	635	Pfam	PF00009	Elongation factor Tu GTP binding domain	93	299	2.5E-36	T	21-03-2019	IPR000795	Transcription factor, GTP-binding domain
MAG004_79_9	c850cc008aac495dd5733a790018e08d	63	Pfam	PF06107	Bacterial protein of unknown function (DUF951)	3	56	2.4E-27	T	21-03-2019	IPR009296	Protein of unknown function DUF951
MAG004_1_2	8bdf59fb96dcc867d1f2c7821706a987	618	Pfam	PF00128	Alpha amylase, catalytic domain	156	218	2.0E-4	T	21-03-2019	IPR006047	Glycosyl hydrolase, family 13, catalytic domain
MAG004_6_105	92cd7172d18ffa81287078ee0cb27d62	483	TIGRFAM	TIGR02095	glgA: glycogen/starch synthase, ADP-glucose type	3	479	5.5E-161	T	21-03-2019	IPR011835	Bacterial/plant glycogen synthase
MAG004_6_105	92cd7172d18ffa81287078ee0cb27d62	483	Pfam	PF00534	Glycosyl transferases group 1	293	435	1.6E-10	T	21-03-2019	IPR001296	Glycosyl transferase, family 1
MAG004_6_105	92cd7172d18ffa81287078ee0cb27d62	483	Pfam	PF08323	Starch synthase catalytic domain	3	240	3.3E-76	T	21-03-2019	IPR013534	Starch synthase, catalytic domain
MAG004_32_1	2c3f7059d7b6ab447a119e707c61097e	66	Pfam	PF12728	Helix-turn-helix domain	10	59	1.7E-9	T	21-03-2019
MAG004_3_84	32a416edca43a7e245f2b5e7fbafcf5d	1419	Pfam	PF01869	BadF/BadG/BcrA/BcrD ATPase family	9	222	6.9E-20	T	21-03-2019	IPR002731	ATPase, BadF/BadG/BcrA/BcrD type
MAG004_3_84	32a416edca43a7e245f2b5e7fbafcf5d	1419	Pfam	PF01869	BadF/BadG/BcrA/BcrD ATPase family	324	578	6.5E-34	T	21-03-2019	IPR002731	ATPase, BadF/BadG/BcrA/BcrD type
MAG004_3_84	32a416edca43a7e245f2b5e7fbafcf5d	1419	Pfam	PF06050	2-hydroxyglutaryl-CoA dehydratase, D-component	908	1231	1.2E-58	T	21-03-2019	IPR010327	FldB/FldC dehydratase alpha/beta subunit
MAG004_3_84	32a416edca43a7e245f2b5e7fbafcf5d	1419	Pfam	PF09989	CoA enzyme activase uncharacterised domain (DUF2229)	673	893	1.1E-78	T	21-03-2019	IPR018709	CoA enzyme activase, domain of unknown function DUF2229
MAG004_5_90	6df61425c9792cadad26ea6a636d83f8	763	Pfam	PF00112	Papain family cysteine protease	180	319	8.1E-9	T	21-03-2019	IPR000668	Peptidase C1A, papain C-terminal
MAG004_5_90	6df61425c9792cadad26ea6a636d83f8	763	Pfam	PF02368	Bacterial Ig-like domain (group 2)	553	601	3.7E-7	T	21-03-2019	IPR003343	Bacterial Ig-like, group 2
MAG004_5_90	6df61425c9792cadad26ea6a636d83f8	763	Pfam	PF02368	Bacterial Ig-like domain (group 2)	620	686	5.5E-8	T	21-03-2019	IPR003343	Bacterial Ig-like, group 2
MAG004_20_31	aa17c1bd527407477ee73deff4445715	335	TIGRFAM	TIGR01245	trpD: anthranilate phosphoribosyltransferase	6	332	4.7E-127	T	21-03-2019	IPR005940	Anthranilate phosphoribosyl transferase
MAG004_20_31	aa17c1bd527407477ee73deff4445715	335	Pfam	PF02885	Glycosyl transferase family, helical bundle domain	5	64	3.7E-17	T	21-03-2019	IPR017459	Glycosyl transferase family 3, N-terminal domain
MAG004_20_31	aa17c1bd527407477ee73deff4445715	335	Pfam	PF00591	Glycosyl transferase family, a/b domain	74	323	7.0E-97	T	21-03-2019	IPR000312	Glycosyl transferase, family 3
MAG004_2_104	218340da4b04ad7fd923908dda93aadd	219	Pfam	PF00625	Guanylate kinase	13	84	1.2E-10	T	21-03-2019	IPR008145	Guanylate kinase/L-type calcium channel beta subunit
MAG004_24_16	ce32d3c9f1e9d6c72c882d46a6f37b53	44	Pfam	PF00468	Ribosomal protein L34	1	44	3.0E-22	T	21-03-2019	IPR000271	Ribosomal protein L34
MAG004_24_16	ce32d3c9f1e9d6c72c882d46a6f37b53	44	TIGRFAM	TIGR01030	rpmH_bact: ribosomal protein bL34	1	44	2.2E-19	T	21-03-2019	IPR000271	Ribosomal protein L34
MAG004_24_39	9aeeae5e2183e4a2c01658cb034e3cdf	385	Pfam	PF05569	BlaR1 peptidase M56	88	287	1.1E-22	T	21-03-2019	IPR008756	Peptidase M56
MAG004_8_60	ae87dc69ca0e8f97e73f7c6a8f9ac37c	69	Pfam	PF13443	Cro/C1-type HTH DNA-binding domain	7	67	3.0E-14	T	21-03-2019	IPR001387	Cro/C1-type helix-turn-helix domain
MAG004_2_71	5d37bf9aad2776e685946ad302c294d6	284	Pfam	PF00231	ATP synthase	3	282	1.3E-89	T	21-03-2019	IPR000131	ATP synthase, F1 complex, gamma subunit
MAG004_2_71	5d37bf9aad2776e685946ad302c294d6	284	TIGRFAM	TIGR01146	ATPsyn_F1gamma: ATP synthase F1, gamma subunit	1	283	1.1E-90	T	21-03-2019	IPR000131	ATP synthase, F1 complex, gamma subunit
MAG004_28_27	2e08e0d96d79f84d99d565b6a5946516	968	Pfam	PF00041	Fibronectin type III domain	869	948	7.8E-7	T	21-03-2019	IPR003961	Fibronectin type III
MAG004_3_60	0124fcdeb33eb128dab5d8e3af35a4c3	553	TIGRFAM	TIGR02477	PFKA_PPi: diphosphate--fructose-6-phosphate 1-phosphotransferase	6	551	2.1E-247	T	21-03-2019	IPR011183	Pyrophosphate-dependent phosphofructokinase PfpB
MAG004_3_60	0124fcdeb33eb128dab5d8e3af35a4c3	553	Pfam	PF00365	Phosphofructokinase	74	315	7.2E-40	T	21-03-2019	IPR000023	Phosphofructokinase domain
MAG004_38_19	93f0cad3d9592863da1314929f5b3464	764	Pfam	PF13884	Chaperone of endosialidase	595	682	5.8E-9	T	21-03-2019	IPR030392	Intramolecular chaperone auto-processing domain
MAG004_38_19	93f0cad3d9592863da1314929f5b3464	764	Pfam	PF05658	Head domain of trimeric autotransporter adhesin	514	537	7.9E-5	T	21-03-2019	IPR008640	Head domain of trimeric autotransporter adhesin
MAG004_11_18	ca0ab46315e778c3dcb54e3b24d540b4	433	Pfam	PF05673	Protein of unknown function (DUF815)	183	429	7.9E-93	T	21-03-2019	IPR008533	Domain of unknown function DUF815
MAG004_52_11	fd331647e862187e7b67854f7034ae14	212	Pfam	PF08006	Protein of unknown function (DUF1700)	1	195	7.2E-17	T	21-03-2019	IPR012963	Protein of unknown function DUF1700
MAG004_1_11	9bc8289d0d81addb5fa4161866c22c7b	148	TIGRFAM	TIGR01395	FlgC: flagellar basal-body rod protein FlgC	4	147	3.0E-47	T	21-03-2019	IPR006299	Flagellar basal-body rod protein FlgC
MAG004_1_11	9bc8289d0d81addb5fa4161866c22c7b	148	Pfam	PF00460	Flagella basal body rod protein	7	34	2.2E-7	T	21-03-2019	IPR001444	Flagellar basal body rod protein, N-terminal
MAG004_1_11	9bc8289d0d81addb5fa4161866c22c7b	148	Pfam	PF06429	Flagellar basal body rod FlgEFG protein C-terminal	97	144	5.0E-13	T	21-03-2019	IPR010930	Flagellar basal-body/hook protein, C-terminal domain
MAG004_66_4	88f484fd3d807193f2502e265cf1824c	443	Pfam	PF00004	ATPase family associated with various cellular activities (AAA)	53	162	3.9E-16	T	21-03-2019	IPR003959	ATPase, AAA-type, core
MAG004_66_4	88f484fd3d807193f2502e265cf1824c	443	Pfam	PF12002	MgsA AAA+ ATPase C terminal	267	432	5.7E-67	T	21-03-2019	IPR021886	MgsA AAA+ ATPase C-terminal
MAG004_66_4	88f484fd3d807193f2502e265cf1824c	443	Pfam	PF16193	AAA C-terminal domain	187	266	7.1E-26	T	21-03-2019	IPR032423	AAA C-terminal domain
MAG004_14_59	ce173f98e21a1ea2bd2b8117e44ceae1	64	Pfam	PF02597	ThiS family	8	64	7.3E-11	T	21-03-2019	IPR003749	Sulfur carrier ThiS/MoaD-like
MAG004_14_59	ce173f98e21a1ea2bd2b8117e44ceae1	64	TIGRFAM	TIGR01683	thiS: thiamine biosynthesis protein ThiS	2	64	2.7E-19	T	21-03-2019	IPR010035	ThiS, thiamine-biosynthesis
MAG004_38_2	6fb1a9a9c8f0cf8ebbdc7e4fb256b154	490	TIGRFAM	TIGR01085	murE: UDP-N-acetylmuramyl-tripeptide synthetase	22	483	7.0E-135	T	21-03-2019	IPR005761	UDP-N-acetylmuramoylalanyl-D-glutamate-2,6-diaminopimelate ligase
MAG004_38_2	6fb1a9a9c8f0cf8ebbdc7e4fb256b154	490	Pfam	PF08245	Mur ligase middle domain	109	310	3.1E-44	T	21-03-2019	IPR013221	Mur ligase, central
MAG004_38_2	6fb1a9a9c8f0cf8ebbdc7e4fb256b154	490	Pfam	PF01225	Mur ligase family, catalytic domain	24	96	9.1E-10	T	21-03-2019	IPR000713	Mur ligase, N-terminal catalytic domain
MAG004_38_2	6fb1a9a9c8f0cf8ebbdc7e4fb256b154	490	Pfam	PF02875	Mur ligase family, glutamate ligase domain	330	416	2.9E-19	T	21-03-2019	IPR004101	Mur ligase, C-terminal
MAG004_6_80	1e1bf14b5a9c45260908c79e9b6f7d9f	647	Pfam	PF13589	Histidine kinase-, DNA gyrase B-, and HSP90-like ATPase	25	135	8.0E-12	T	21-03-2019
MAG004_6_80	1e1bf14b5a9c45260908c79e9b6f7d9f	647	Pfam	PF01119	DNA mismatch repair protein, C-terminal domain	209	326	2.8E-33	T	21-03-2019	IPR013507	DNA mismatch repair protein,  S5 domain 2-like
MAG004_6_80	1e1bf14b5a9c45260908c79e9b6f7d9f	647	Pfam	PF08676	MutL C terminal dimerisation domain	460	603	6.6E-34	T	21-03-2019	IPR014790	MutL, C-terminal, dimerisation
MAG004_6_80	1e1bf14b5a9c45260908c79e9b6f7d9f	647	TIGRFAM	TIGR00585	mutl: DNA mismatch repair protein MutL	3	306	7.1E-94	T	21-03-2019	IPR002099	DNA mismatch repair protein family, N-terminal
MAG004_9_58	de325f1d50e30474bb4379153d48d83d	283	Pfam	PF02588	Uncharacterised 5xTM membrane BCR, YitT family COG1284	2	213	4.1E-64	T	21-03-2019	IPR003740	Uncharacterised membrane protein YitT
MAG004_9_58	de325f1d50e30474bb4379153d48d83d	283	Pfam	PF10035	Uncharacterized protein conserved in bacteria (DUF2179)	218	272	6.1E-21	T	21-03-2019	IPR019264	Domain of unknown function DUF2179
MAG004_8_5	686526765bbe0e14ded1b7754d94a8b9	356	Pfam	PF00117	Glutamine amidotransferase class-I	173	350	7.7E-44	T	21-03-2019	IPR017926	Glutamine amidotransferase
MAG004_8_5	686526765bbe0e14ded1b7754d94a8b9	356	TIGRFAM	TIGR01368	CPSaseIIsmall: carbamoyl-phosphate synthase, small subunit	4	352	3.4E-139	T	21-03-2019	IPR006274	Carbamoyl-phosphate synthase, small subunit
MAG004_8_5	686526765bbe0e14ded1b7754d94a8b9	356	Pfam	PF00988	Carbamoyl-phosphate synthase small chain, CPSase domain	2	129	1.4E-50	T	21-03-2019	IPR002474	Carbamoyl-phosphate synthase small subunit, N-terminal domain
MAG004_3_58	e4790b09a1f0085d9ccf44fecf3c14d0	246	TIGRFAM	TIGR00071	hisT_truA: tRNA pseudouridine(38-40) synthase	2	237	3.3E-69	T	21-03-2019	IPR001406	Pseudouridine synthase I, TruA
MAG004_3_58	e4790b09a1f0085d9ccf44fecf3c14d0	246	Pfam	PF01416	tRNA pseudouridine synthase	143	237	1.3E-29	T	21-03-2019	IPR020097	Pseudouridine synthase I, TruA, alpha/beta domain
MAG004_3_58	e4790b09a1f0085d9ccf44fecf3c14d0	246	Pfam	PF01416	tRNA pseudouridine synthase	7	96	4.1E-9	T	21-03-2019	IPR020097	Pseudouridine synthase I, TruA, alpha/beta domain
MAG004_7_95	02a58833f0ef383642c53070cfa9e11b	321	Pfam	PF01041	DegT/DnrJ/EryC1/StrS aminotransferase family	14	320	7.6E-84	T	21-03-2019	IPR000653	DegT/DnrJ/EryC1/StrS aminotransferase
MAG004_7_95	02a58833f0ef383642c53070cfa9e11b	321	TIGRFAM	TIGR02379	ECA_wecE: TDP-4-keto-6-deoxy-D-glucose transaminase	1	321	2.0E-160	T	21-03-2019	IPR012749	dTDP-4-amino-4,6-dideoxygalactose transaminase WecE-like
MAG004_1_7	83607a8178f8f6120107d74a72c28d39	362	Pfam	PF02481	DNA recombination-mediator protein A	74	279	2.9E-74	T	21-03-2019	IPR003488	DNA recombination-mediator protein A
MAG004_1_7	83607a8178f8f6120107d74a72c28d39	362	TIGRFAM	TIGR00732	dprA: DNA protecting protein DprA	71	286	5.5E-70	T	21-03-2019	IPR003488	DNA recombination-mediator protein A
MAG004_13_23	5d0ef395994e3adaef8588b9338c6481	298	Pfam	PF00892	EamA-like transporter family	149	287	3.0E-22	T	21-03-2019	IPR000620	EamA domain
MAG004_13_23	5d0ef395994e3adaef8588b9338c6481	298	Pfam	PF00892	EamA-like transporter family	4	137	1.1E-21	T	21-03-2019	IPR000620	EamA domain
MAG004_130_2	d746ba7b53eb9cbdc06ce2a9c8566b2d	396	Pfam	PF03235	Protein of unknown function DUF262	48	192	7.4E-22	T	21-03-2019	IPR004919	Domain of unknown function DUF262
MAG004_54_7	4579b30ecaa96fc0d6f6c549e73bb6a8	546	Pfam	PF12848	ABC transporter	224	307	5.8E-20	T	21-03-2019	IPR032781	ABC-transporter extension domain
MAG004_54_7	4579b30ecaa96fc0d6f6c549e73bb6a8	546	Pfam	PF00005	ABC transporter	18	184	9.2E-22	T	21-03-2019	IPR003439	ABC transporter-like
MAG004_54_7	4579b30ecaa96fc0d6f6c549e73bb6a8	546	Pfam	PF00005	ABC transporter	335	465	2.5E-14	T	21-03-2019	IPR003439	ABC transporter-like
MAG004_18_4	49044dbe61b037b9c3ff3266e1753c62	707	TIGRFAM	TIGR02063	RNase_R: ribonuclease R	9	706	1.2E-253	T	21-03-2019	IPR011805	Ribonuclease R
MAG004_18_4	49044dbe61b037b9c3ff3266e1753c62	707	Pfam	PF08206	Ribonuclease B OB domain	148	201	2.1E-9	T	21-03-2019	IPR013223	Ribonuclease B, N-terminal OB domain
MAG004_18_4	49044dbe61b037b9c3ff3266e1753c62	707	Pfam	PF08206	Ribonuclease B OB domain	75	132	6.6E-17	T	21-03-2019	IPR013223	Ribonuclease B, N-terminal OB domain
MAG004_18_4	49044dbe61b037b9c3ff3266e1753c62	707	TIGRFAM	TIGR00358	3_prime_RNase: VacB and RNase II family 3'-5' exoribonucleases	72	705	3.7E-195	T	21-03-2019	IPR004476	Ribonuclease II/ribonuclease R
MAG004_18_4	49044dbe61b037b9c3ff3266e1753c62	707	Pfam	PF00575	S1 RNA binding domain	624	695	2.1E-11	T	21-03-2019	IPR003029	S1 domain
MAG004_18_4	49044dbe61b037b9c3ff3266e1753c62	707	Pfam	PF00773	RNB domain	248	576	9.0E-110	T	21-03-2019	IPR001900	Ribonuclease II/R
MAG004_12_46	df4680edc6cf784bc253d653d6c66202	419	TIGRFAM	TIGR02086	IPMI_arch: 3-isopropylmalate dehydratase, large subunit	3	417	1.3E-158	T	21-03-2019	IPR011826	Homoaconitase/3-isopropylmalate dehydratase, large subunit, prokaryotic
MAG004_12_46	df4680edc6cf784bc253d653d6c66202	419	TIGRFAM	TIGR02083	LEU2: 3-isopropylmalate dehydratase, large subunit	3	418	4.7E-222	T	21-03-2019	IPR011823	3-isopropylmalate dehydratase, large subunit, bacteria
MAG004_12_46	df4680edc6cf784bc253d653d6c66202	419	TIGRFAM	TIGR01343	hacA_fam: homoaconitate hydratase family protein	4	416	1.2E-174	T	21-03-2019	IPR006251	Homoaconitase/3-isopropylmalate dehydratase, large subunit
MAG004_12_46	df4680edc6cf784bc253d653d6c66202	419	Pfam	PF00330	Aconitase family (aconitate hydratase)	8	411	2.9E-97	T	21-03-2019	IPR001030	Aconitase/3-isopropylmalate dehydratase large subunit, alpha/beta/alpha domain
MAG004_1_72	888059acd81d332b391186d7e8daa3cc	275	Pfam	PF00950	ABC 3 transport family	4	257	4.2E-50	T	21-03-2019	IPR001626	ABC transporter, TroCD-like
MAG004_29_22	d72f1a97ba7988ac895613a45afa3c7a	171	Pfam	PF14277	Domain of unknown function (DUF4364)	8	169	1.9E-54	T	21-03-2019	IPR025374	Protein of unknown function DUF4364
MAG004_39_15	eacbba90fd381ebd71c92d59a68aa146	621	Pfam	PF06048	Domain of unknown function (DUF927)	104	367	1.5E-42	T	21-03-2019	IPR009270	Domain of unknown function DUF927
MAG004_30_17	6b09d86f1f17c4c5631de9884da3f452	211	Pfam	PF00005	ABC transporter	21	159	1.9E-25	T	21-03-2019	IPR003439	ABC transporter-like
MAG004_7_55	1c1ece3a816d6061bac2e46bdb7200fc	782	Pfam	PF01326	Pyruvate phosphate dikinase, PEP/pyruvate binding domain	49	136	2.7E-10	T	21-03-2019	IPR002192	Pyruvate phosphate dikinase, PEP/pyruvate-binding
MAG004_7_55	1c1ece3a816d6061bac2e46bdb7200fc	782	Pfam	PF00391	PEP-utilising enzyme, mobile domain	701	769	6.2E-12	T	21-03-2019	IPR008279	PEP-utilising enzyme, mobile domain
MAG004_135_1	a51ada3c5cb8afb06f6d0c87508971f3	538	Pfam	PF13007	Transposase C of IS166 homeodomain	48	117	1.3E-8	T	21-03-2019	IPR024463	Transposase TnpC, homeodomain
MAG004_135_1	a51ada3c5cb8afb06f6d0c87508971f3	538	Pfam	PF13817	IS66 C-terminal element	488	527	1.9E-9	T	21-03-2019	IPR039552	Transposase IS66, C-terminal
MAG004_135_1	a51ada3c5cb8afb06f6d0c87508971f3	538	Pfam	PF03050	Transposase IS66 family	196	481	4.8E-88	T	21-03-2019	IPR004291	Transposase, IS66
MAG004_135_1	a51ada3c5cb8afb06f6d0c87508971f3	538	Pfam	PF13005	zinc-finger binding domain of transposase IS66	127	172	8.3E-14	T	21-03-2019	IPR024474	Zinc-finger binding domain of transposase IS66
MAG004_2_75	c5c1a1078e0cc1d9c30c30e1eba1d256	85	Pfam	PF00137	ATP synthase subunit C	15	77	1.3E-17	T	21-03-2019	IPR002379	V-ATPase proteolipid subunit C-like domain
MAG004_2_75	c5c1a1078e0cc1d9c30c30e1eba1d256	85	TIGRFAM	TIGR01260	ATP_synt_c: ATP synthase F0, C subunit	23	79	5.7E-14	T	21-03-2019	IPR005953	ATP synthase, F0 complex, subunit C, bacterial/chloroplast
MAG004_19_3	d52cf02eae4428f47235c5a8bd2eef5a	532	Pfam	PF00270	DEAD/DEAH box helicase	28	192	1.4E-50	T	21-03-2019	IPR011545	DEAD/DEAH box helicase domain
MAG004_19_3	d52cf02eae4428f47235c5a8bd2eef5a	532	Pfam	PF00271	Helicase conserved C-terminal domain	229	338	1.6E-29	T	21-03-2019	IPR001650	Helicase, C-terminal
MAG004_19_3	d52cf02eae4428f47235c5a8bd2eef5a	532	Pfam	PF03880	DbpA RNA binding domain	457	527	1.2E-27	T	21-03-2019	IPR005580	DEAD box helicase DbpA/CsdA, RNA-binding domain
MAG004_49_20	86b9d241ecf0254e9f5a223b16b83e34	122	Pfam	PF00238	Ribosomal protein L14p/L23e	1	122	1.4E-55	T	21-03-2019	IPR000218	Ribosomal protein L14P
MAG004_49_20	86b9d241ecf0254e9f5a223b16b83e34	122	TIGRFAM	TIGR01067	rplN_bact: ribosomal protein uL14	1	122	1.8E-58	T	21-03-2019	IPR005745	Ribosomal protein L14P, bacterial-type
MAG004_133_2	ba7bd65b3fa1dab5b45df945131d9b26	251	Pfam	PF14268	YoaP-like	202	244	1.5E-18	T	21-03-2019	IPR025685	YoaP-like domain
MAG004_26_10	ed4e1dffe3b769f19aade625e0847c8f	408	Pfam	PF01136	Peptidase family U32	75	310	7.6E-99	T	21-03-2019	IPR001539	Peptidase U32
MAG004_26_10	ed4e1dffe3b769f19aade625e0847c8f	408	Pfam	PF16325	Peptidase family U32 C-terminal domain	324	404	2.3E-26	T	21-03-2019	IPR032525	Peptidase family U32, C-terminal
MAG004_139_1	f93757522a35f1f93d13acebee00bb85	531	Pfam	PF01514	Secretory protein of YscJ/FliF family	2	164	8.9E-30	T	21-03-2019	IPR006182	Secretory protein YscJ/FliF
MAG004_139_1	f93757522a35f1f93d13acebee00bb85	531	Pfam	PF08345	Flagellar M-ring protein C-terminal	203	351	1.2E-6	T	21-03-2019	IPR013556	Flagellar M-ring C-terminal
MAG004_40_7	06d29f35084f892900116458bace3cda	1198	Pfam	PF06964	Alpha-L-arabinofuranosidase C-terminal domain	805	937	1.3E-8	T	21-03-2019	IPR010720	Alpha-L-arabinofuranosidase, C-terminal
MAG004_40_7	06d29f35084f892900116458bace3cda	1198	Pfam	PF13385	Concanavalin A-like lectin/glucanases superfamily	97	251	3.4E-21	T	21-03-2019
MAG004_3_73	2a9f3a81775d5e7f8a6b2a77c7d29fcf	189	TIGRFAM	TIGR00277	HDIG: HDIG domain	19	105	1.8E-7	T	21-03-2019	IPR006675	HDIG domain
MAG004_3_73	2a9f3a81775d5e7f8a6b2a77c7d29fcf	189	Pfam	PF01966	HD domain	20	133	2.2E-15	T	21-03-2019	IPR006674	HD domain
MAG004_3_73	2a9f3a81775d5e7f8a6b2a77c7d29fcf	189	TIGRFAM	TIGR00488	TIGR00488: putative HD superfamily hydrolase	12	183	3.8E-46	T	21-03-2019	IPR005249	Conserved hypothetical protein CHP00488
MAG004_16_2	ac279216f3f503cdec331f1c0d4d1976	67	Pfam	PF09035	Excisionase from transposon Tn916	3	63	8.7E-19	T	21-03-2019	IPR015122	Excisionase from transposon Tn916
MAG004_52_7	31ac1ab6b4f39d6575d021389301038e	357	Pfam	PF00365	Phosphofructokinase	3	307	3.6E-102	T	21-03-2019	IPR000023	Phosphofructokinase domain
MAG004_18_14	44bf64ae0df15bf910d57d3af19a8c90	327	Pfam	PF00490	Delta-aminolevulinic acid dehydratase	5	318	2.8E-148	T	21-03-2019	IPR001731	Delta-aminolevulinic acid dehydratase
MAG004_129_1	21a32617736999f6595412f8880eee5c	520	Pfam	PF13408	Recombinase zinc beta ribbon domain	291	364	2.8E-12	T	21-03-2019	IPR025827	Recombinase zinc beta ribbon domain
MAG004_129_1	21a32617736999f6595412f8880eee5c	520	Pfam	PF14287	Domain of unknown function (DUF4368)	456	519	3.6E-19	T	21-03-2019	IPR025378	Domain of unknown function DUF4368
MAG004_129_1	21a32617736999f6595412f8880eee5c	520	Pfam	PF00239	Resolvase, N terminal domain	3	136	2.0E-18	T	21-03-2019	IPR006119	Resolvase, N-terminal catalytic domain
MAG004_129_1	21a32617736999f6595412f8880eee5c	520	Pfam	PF07508	Recombinase	161	276	1.3E-21	T	21-03-2019	IPR011109	DNA-binding recombinase domain
MAG004_2_95	ad64606bf60c40227fe83348e58c1ad0	532	Pfam	PF08011	PD-(D/E)XK nuclease superfamily	442	523	1.6E-7	T	21-03-2019	IPR012547	PD-(D/E)XK nuclease superfamily 9
MAG004_2_95	ad64606bf60c40227fe83348e58c1ad0	532	Pfam	PF09820	Predicted AAA-ATPase	18	285	9.4E-40	T	21-03-2019	IPR018631	AAA-ATPase-like domain
MAG004_31_19	d3d288c12e86f136ac569040d8f70540	142	Pfam	PF03610	PTS system fructose IIA component	4	120	2.8E-23	T	21-03-2019	IPR004701	Phosphotransferase system, mannose-type IIA component
MAG004_41_1	cdd760f38fd2cde11e776331e0d7b94b	286	Pfam	PF00293	NUDIX domain	154	263	5.5E-17	T	21-03-2019	IPR000086	NUDIX hydrolase domain
MAG004_41_1	cdd760f38fd2cde11e776331e0d7b94b	286	Pfam	PF09297	NADH pyrophosphatase zinc ribbon domain	119	148	3.0E-9	T	21-03-2019	IPR015376	Zinc ribbon, NADH pyrophosphatase
MAG004_16_42	f5963071a451ece9e96a50a6feb46082	515	Pfam	PF12072	Domain of unknown function (DUF3552)	8	200	8.6E-59	T	21-03-2019	IPR022711	Ribonuclease Y, N-terminal
MAG004_16_42	f5963071a451ece9e96a50a6feb46082	515	Pfam	PF00013	KH domain	208	265	2.1E-7	T	21-03-2019	IPR004088	K Homology domain, type 1
MAG004_16_42	f5963071a451ece9e96a50a6feb46082	515	TIGRFAM	TIGR00277	HDIG: HDIG domain	327	404	3.0E-23	T	21-03-2019	IPR006675	HDIG domain
MAG004_16_42	f5963071a451ece9e96a50a6feb46082	515	TIGRFAM	TIGR03319	RNase_Y: ribonuclease Y	10	515	7.3E-227	T	21-03-2019	IPR017705	Ribonuclease Y
MAG004_16_42	f5963071a451ece9e96a50a6feb46082	515	Pfam	PF01966	HD domain	333	423	1.9E-19	T	21-03-2019	IPR006674	HD domain
MAG004_21_48	f3518e4c2074eb11d1b294d365dc9ab7	105	Pfam	PF05067	Manganese containing catalase	1	70	2.1E-15	T	21-03-2019	IPR007760	Manganese catalase
MAG004_12_19	811acd58dd7a1855f70455b8567c41fd	617	Pfam	PF00128	Alpha amylase, catalytic domain	87	374	3.4E-46	T	21-03-2019	IPR006047	Glycosyl hydrolase, family 13, catalytic domain
MAG004_12_37	c8268db2beaa3a937de6e56cef01c7ad	135	Pfam	PF00383	Cytidine and deoxycytidylate deaminase zinc-binding region	5	97	1.1E-15	T	21-03-2019	IPR002125	Cytidine and deoxycytidylate deaminase domain
