MAG010_58_15	e866c27bff2591a5ec92f25ddec88989	339	Pfam	PF07991	Acetohydroxy acid isomeroreductase, NADPH-binding domain	15	178	3.3E-74	T	21-03-2019	IPR013116	Ketol-acid reductoisomerase, N-terminal
MAG010_58_15	e866c27bff2591a5ec92f25ddec88989	339	TIGRFAM	TIGR00465	ilvC: ketol-acid reductoisomerase	15	327	1.2E-128	T	21-03-2019	IPR013023	Ketol-acid reductoisomerase
MAG010_58_15	e866c27bff2591a5ec92f25ddec88989	339	Pfam	PF01450	Acetohydroxy acid isomeroreductase, catalytic domain	184	328	8.8E-57	T	21-03-2019	IPR000506	Ketol-acid reductoisomerase, C-terminal
MAG010_1_12	13e8b1f8d67cce69625247962532ff87	546	Pfam	PF13408	Recombinase zinc beta ribbon domain	324	383	2.6E-18	T	21-03-2019	IPR025827	Recombinase zinc beta ribbon domain
MAG010_1_12	13e8b1f8d67cce69625247962532ff87	546	Pfam	PF07508	Recombinase	190	310	3.0E-24	T	21-03-2019	IPR011109	DNA-binding recombinase domain
MAG010_1_12	13e8b1f8d67cce69625247962532ff87	546	Pfam	PF00239	Resolvase, N terminal domain	13	164	1.9E-17	T	21-03-2019	IPR006119	Resolvase, N-terminal catalytic domain
MAG010_3_93	2350324bc36d687252a973e348ed7dae	419	Pfam	PF06898	Putative stage IV sporulation protein YqfD	6	393	1.0E-95	T	21-03-2019	IPR010690	Putative stage IV sporulation YqfD
MAG010_12_21	f3eb20480fba612b6e72a6f7aef31478	386	Pfam	PF02534	Type IV secretory system Conjugative DNA transfer	21	331	1.1E-34	T	21-03-2019	IPR003688	Type IV secretion system protein TraG/VirD4
MAG010_9_35	026592452a51edf7b43cbdf1fca3d6ae	668	TIGRFAM	TIGR00585	mutl: DNA mismatch repair protein MutL	4	306	3.8E-90	T	21-03-2019	IPR002099	DNA mismatch repair protein family, N-terminal
MAG010_9_35	026592452a51edf7b43cbdf1fca3d6ae	668	Pfam	PF08676	MutL C terminal dimerisation domain	488	623	2.7E-31	T	21-03-2019	IPR014790	MutL, C-terminal, dimerisation
MAG010_9_35	026592452a51edf7b43cbdf1fca3d6ae	668	Pfam	PF01119	DNA mismatch repair protein, C-terminal domain	210	326	2.4E-33	T	21-03-2019	IPR013507	DNA mismatch repair protein,  S5 domain 2-like
MAG010_9_35	026592452a51edf7b43cbdf1fca3d6ae	668	Pfam	PF13589	Histidine kinase-, DNA gyrase B-, and HSP90-like ATPase	25	126	2.0E-11	T	21-03-2019
MAG010_23_27	b2fcb6f6d48e49650debe0cd5a1db5e1	368	Pfam	PF14659	Phage integrase, N-terminal SAM-like domain	38	95	1.5E-6	T	21-03-2019	IPR004107	Integrase, SAM-like, N-terminal
MAG010_23_27	b2fcb6f6d48e49650debe0cd5a1db5e1	368	Pfam	PF00589	Phage integrase family	145	348	2.3E-26	T	21-03-2019	IPR002104	Integrase, catalytic domain
MAG010_6_71	2013c5e351e47fffde32c291828f3384	288	TIGRFAM	TIGR00064	ftsY: signal recognition particle-docking protein FtsY	19	288	1.0E-106	T	21-03-2019	IPR004390	Signal-recognition particle receptor FtsY
MAG010_6_71	2013c5e351e47fffde32c291828f3384	288	Pfam	PF00448	SRP54-type protein, GTPase domain	89	288	3.0E-77	T	21-03-2019	IPR000897	Signal recognition particle, SRP54 subunit, GTPase domain
MAG010_6_71	2013c5e351e47fffde32c291828f3384	288	Pfam	PF02881	SRP54-type protein, helical bundle domain	13	70	9.2E-9	T	21-03-2019	IPR013822	Signal recognition particle, SRP54 subunit, helical bundle
MAG010_7_83	40b15d7db26649cfc38f28111c5b4155	147	TIGRFAM	TIGR00576	dut: dUTP diphosphatase	7	146	4.8E-49	T	21-03-2019	IPR008181	Deoxyuridine triphosphate nucleotidohydrolase
MAG010_7_83	40b15d7db26649cfc38f28111c5b4155	147	Pfam	PF00692	dUTPase	15	145	1.0E-32	T	21-03-2019	IPR029054	dUTPase-like
MAG010_27_8	741dc1eab26994075af9b24ff0bf21bd	446	Pfam	PF02978	Signal peptide binding domain	326	421	3.8E-31	T	21-03-2019	IPR004125	Signal recognition particle, SRP54 subunit, M-domain
MAG010_27_8	741dc1eab26994075af9b24ff0bf21bd	446	Pfam	PF02881	SRP54-type protein, helical bundle domain	6	83	1.4E-23	T	21-03-2019	IPR013822	Signal recognition particle, SRP54 subunit, helical bundle
MAG010_27_8	741dc1eab26994075af9b24ff0bf21bd	446	Pfam	PF00448	SRP54-type protein, GTPase domain	101	295	6.8E-74	T	21-03-2019	IPR000897	Signal recognition particle, SRP54 subunit, GTPase domain
MAG010_27_8	741dc1eab26994075af9b24ff0bf21bd	446	TIGRFAM	TIGR00959	ffh: signal recognition particle protein	3	424	1.5E-177	T	21-03-2019	IPR004780	Signal recognition particle protein Ffh
MAG010_9_34	ea3c6c3971fd58908b3b862c71e4f5d7	153	Pfam	PF01381	Helix-turn-helix	11	62	2.4E-16	T	21-03-2019	IPR001387	Cro/C1-type helix-turn-helix domain
MAG010_18_16	3c00c1c9b8f472c17e3586003362d611	294	TIGRFAM	TIGR00431	TruB: tRNA pseudouridine(55) synthase	3	211	3.1E-75	T	21-03-2019	IPR014780	tRNA pseudouridine synthase II, TruB
MAG010_18_16	3c00c1c9b8f472c17e3586003362d611	294	Pfam	PF16198	tRNA pseudouridylate synthase B C-terminal domain	174	232	1.2E-18	T	21-03-2019	IPR032819	tRNA pseudouridylate synthase B, C-terminal
MAG010_18_16	3c00c1c9b8f472c17e3586003362d611	294	Pfam	PF01509	TruB family pseudouridylate synthase (N terminal domain)	24	173	4.8E-57	T	21-03-2019	IPR002501	Pseudouridine synthase II, N-terminal
MAG010_16_50	83bcd26d5f84ceced3310e36cbacb8af	117	Pfam	PF01230	HIT domain	16	111	1.4E-26	T	21-03-2019	IPR001310	Histidine triad (HIT) protein
MAG010_7_120	85086b6f55a978d9984fd507f9e49e2f	369	Pfam	PF02371	Transposase IS116/IS110/IS902 family	229	299	1.2E-19	T	21-03-2019	IPR003346	Transposase, IS116/IS110/IS902
MAG010_7_120	85086b6f55a978d9984fd507f9e49e2f	369	Pfam	PF01548	Transposase	7	155	9.9E-13	T	21-03-2019	IPR002525	Transposase, IS111A/IS1328/IS1533, N-terminal
MAG010_9_45	bca37f8935e2dfa7e36f278d817375e5	218	Pfam	PF00486	Transcriptional regulatory protein, C terminal	146	216	1.2E-19	T	21-03-2019	IPR001867	OmpR/PhoB-type DNA-binding domain
MAG010_9_45	bca37f8935e2dfa7e36f278d817375e5	218	Pfam	PF00072	Response regulator receiver domain	4	112	3.0E-27	T	21-03-2019	IPR001789	Signal transduction response regulator, receiver domain
MAG010_13_44	7469f0d2c8a2b0a6879aa14735dc7f38	318	Pfam	PF12146	Serine aminopeptidase, S33	96	183	5.9E-9	T	21-03-2019	IPR022742	Serine aminopeptidase, S33
MAG010_45_20	5cb1cedf0a2ba1fe689db247afe832cb	245	Pfam	PF02775	Thiamine pyrophosphate enzyme, C-terminal TPP binding domain	51	210	2.2E-23	T	21-03-2019	IPR011766	Thiamine pyrophosphate enzyme, C-terminal TPP-binding
MAG010_6_78	69008f89ab7375675a82291eff674167	267	Pfam	PF07833	Copper amine oxidase N-terminal domain	44	131	1.7E-14	T	21-03-2019	IPR012854	Copper amine oxidase-like, N-terminal
MAG010_6_78	69008f89ab7375675a82291eff674167	267	Pfam	PF07486	Cell Wall Hydrolase	164	266	1.6E-22	T	21-03-2019	IPR011105	Cell wall hydrolase, SleB
MAG010_5_77	8b89a4aee973c4e2727d04b2a7016c1d	240	TIGRFAM	TIGR00696	wecG_tagA_cpsF: glycosyltransferase, WecB/TagA/CpsF family	53	226	1.5E-52	T	21-03-2019	IPR004629	Glycosyl transferase WecB/TagA/CpsF
MAG010_5_77	8b89a4aee973c4e2727d04b2a7016c1d	240	Pfam	PF03808	Glycosyl transferase WecB/TagA/CpsF family	58	222	1.5E-59	T	21-03-2019	IPR004629	Glycosyl transferase WecB/TagA/CpsF
MAG010_7_66	6e2ea416470fa1ce74fe9f300a72da66	154	Pfam	PF12681	Glyoxalase-like domain	4	120	1.1E-39	T	21-03-2019	IPR025870	Glyoxalase-like domain
MAG010_63_6	bce6f96462617e1bc998703f92ab1bb3	94	Pfam	PF12958	Protein of unknown function (DUF3847)	6	78	5.5E-13	T	21-03-2019	IPR024215	Protein of unknown function DUF3847
MAG010_42_5	c7ae48e0600f91bb8bd603f51d5e9c0b	193	Pfam	PF00574	Clp protease	12	191	9.5E-82	T	21-03-2019	IPR023562	Clp protease proteolytic subunit /Translocation-enhancing protein TepA
MAG010_33_17	64a59f33811fe5bb275a9bbef131726a	294	Pfam	PF04321	RmlD substrate binding domain	3	287	3.7E-26	T	21-03-2019	IPR029903	RmlD-like substrate binding domain
MAG010_21_47	5c021161f2cdbdcdea0c8cf1b392a435	863	Pfam	PF00679	Elongation factor G C-terminus	519	601	7.0E-16	T	21-03-2019	IPR000640	Elongation factor EFG, domain V-like
MAG010_21_47	5c021161f2cdbdcdea0c8cf1b392a435	863	TIGRFAM	TIGR00231	small_GTP: small GTP-binding protein domain	13	156	5.7E-20	T	21-03-2019	IPR005225	Small GTP-binding protein domain
MAG010_21_47	5c021161f2cdbdcdea0c8cf1b392a435	863	Pfam	PF14492	Elongation Factor G, domain II	330	400	1.3E-8	T	21-03-2019
MAG010_21_47	5c021161f2cdbdcdea0c8cf1b392a435	863	Pfam	PF00009	Elongation factor Tu GTP binding domain	14	230	2.5E-51	T	21-03-2019	IPR000795	Transcription factor, GTP-binding domain
MAG010_21_47	5c021161f2cdbdcdea0c8cf1b392a435	863	Pfam	PF05991	YacP-like NYN domain	723	858	5.0E-45	T	21-03-2019	IPR010298	Protein of unknown function DUF901
MAG010_21_47	5c021161f2cdbdcdea0c8cf1b392a435	863	Pfam	PF03764	Elongation factor G, domain IV	403	516	5.9E-16	T	21-03-2019	IPR005517	Translation elongation factor EFG/EF2, domain IV
MAG010_21_38	db258e59eee3e037cc9e2cf703a59e41	392	Pfam	PF01551	Peptidase family M23	284	375	2.0E-30	T	21-03-2019	IPR016047	Peptidase M23
MAG010_30_9	58a35fb024adc7844dd86d99eb2039a7	435	TIGRFAM	TIGR00786	dctM: TRAP transporter, DctM subunit	24	428	8.5E-123	T	21-03-2019	IPR004681	TRAP transporter large membrane protein DctM
MAG010_30_9	58a35fb024adc7844dd86d99eb2039a7	435	Pfam	PF06808	Tripartite ATP-independent periplasmic transporter, DctM component	12	423	1.6E-101	T	21-03-2019	IPR010656	TRAP C4-dicarboxylate transport system permease DctM subunit
MAG010_9_24	7b3f69c1595ddaffd5cbf30a3dccc414	329	TIGRFAM	TIGR02363	dhaK1: dihydroxyacetone kinase, DhaK subunit	1	326	6.5E-149	T	21-03-2019	IPR012736	Dihydroxyacetone kinase DhaK, subunit 1
MAG010_9_24	7b3f69c1595ddaffd5cbf30a3dccc414	329	Pfam	PF02733	Dak1 domain	17	325	8.0E-132	T	21-03-2019	IPR004006	DhaK domain
MAG010_48_9	348b6f24aaaf663ccf8bcf2e8a40d523	130	Pfam	PF03061	Thioesterase superfamily	35	104	3.7E-4	T	21-03-2019	IPR006683	Thioesterase domain
MAG010_14_36	ab5c7fded826f0b2067065b6c87c2e89	391	Pfam	PF00202	Aminotransferase class-III	20	390	1.2E-98	T	21-03-2019	IPR005814	Aminotransferase class-III
MAG010_8_8	3f06daa4310ffc90be86e456b5bb9bb9	113	Pfam	PF14287	Domain of unknown function (DUF4368)	45	112	4.1E-22	T	21-03-2019	IPR025378	Domain of unknown function DUF4368
MAG010_6_18	809eebd401032ef31b02a5b1cacad68c	226	Pfam	PF02674	Colicin V production protein	6	56	7.2E-9	T	21-03-2019	IPR003825	Colicin V production, CvpA
MAG010_25_12	de2e24473d5d6e97f3c450a0d9d4d05f	367	Pfam	PF09546	Stage III sporulation protein AE (spore_III_AE)	63	363	1.1E-51	T	21-03-2019	IPR014194	Sporulation stage III, protein AE
MAG010_5_79	91b9956b44a6a45e27b2e34534cebe4f	175	Pfam	PF01812	5-formyltetrahydrofolate cyclo-ligase family	8	174	2.7E-30	T	21-03-2019	IPR002698	5-formyltetrahydrofolate cyclo-ligase
MAG010_5_79	91b9956b44a6a45e27b2e34534cebe4f	175	TIGRFAM	TIGR02727	MTHFS_bact: 5-formyltetrahydrofolate cyclo-ligase	20	174	6.7E-40	T	21-03-2019	IPR002698	5-formyltetrahydrofolate cyclo-ligase
MAG010_9_6	972b89b9bedb3ada00de66d664aee06d	352	Pfam	PF13102	Phage integrase SAM-like domain	74	132	1.2E-9	T	21-03-2019	IPR025269	Phage integrase SAM-like domain
MAG010_9_6	972b89b9bedb3ada00de66d664aee06d	352	Pfam	PF00589	Phage integrase family	174	329	3.1E-20	T	21-03-2019	IPR002104	Integrase, catalytic domain
MAG010_6_28	1fe2a91151615e19fe37ed153fe259e7	314	Pfam	PF00528	Binding-protein-dependent transport system inner membrane component	77	301	7.3E-16	T	21-03-2019	IPR000515	ABC transporter type 1, transmembrane domain MetI-like
MAG010_71_9	730238b81a4959b488af85f4b09b86db	546	Pfam	PF01764	Lipase (class 3)	131	221	6.9E-9	T	21-03-2019	IPR002921	Fungal lipase-like domain
MAG010_4_138	e71e590dc0827682ca5ab77f89e3921e	240	Pfam	PF00005	ABC transporter	17	165	1.1E-37	T	21-03-2019	IPR003439	ABC transporter-like
MAG010_3_87	1074be9ef0d4c69e88e42462c675651c	209	Pfam	PF09186	Domain of unknown function (DUF1949)	137	191	6.9E-13	T	21-03-2019	IPR015269	Uncharacterised domain UPF0029, Impact, C-terminal
MAG010_3_87	1074be9ef0d4c69e88e42462c675651c	209	Pfam	PF01205	Uncharacterized protein family UPF0029	18	121	3.9E-32	T	21-03-2019	IPR001498	Impact, N-terminal
MAG010_3_87	1074be9ef0d4c69e88e42462c675651c	209	TIGRFAM	TIGR00257	IMPACT_YIGZ: uncharacterized protein, YigZ family	1	192	4.9E-52	T	21-03-2019	IPR015796	Impact family, bacterial/archaeal
MAG010_8_22	8da3a8492a661703f87bb743d6ea3950	639	Pfam	PF02836	Glycosyl hydrolases family 2, TIM barrel domain	252	541	6.7E-34	T	21-03-2019	IPR006103	Glycoside hydrolase family 2, catalytic domain
MAG010_8_22	8da3a8492a661703f87bb743d6ea3950	639	Pfam	PF00703	Glycosyl hydrolases family 2	156	244	5.7E-10	T	21-03-2019	IPR006102	Glycoside hydrolase, family 2, immunoglobulin-like beta-sandwich
MAG010_8_22	8da3a8492a661703f87bb743d6ea3950	639	Pfam	PF02837	Glycosyl hydrolases family 2, sugar binding domain	19	139	4.1E-12	T	21-03-2019	IPR006104	Glycosyl hydrolases family 2, sugar binding domain
MAG010_49_10	d6c216040a803ffece4b1167189eb176	463	TIGRFAM	TIGR01143	murF: UDP-N-acetylmuramoyl-tripeptide--D-alanyl-D-alanine ligase	33	457	6.2E-131	T	21-03-2019	IPR005863	UDP-N-acetylmuramoyl-tripeptide--D-alanyl-D-alanine ligase
MAG010_49_10	d6c216040a803ffece4b1167189eb176	463	Pfam	PF01225	Mur ligase family, catalytic domain	28	101	7.1E-10	T	21-03-2019	IPR000713	Mur ligase, N-terminal catalytic domain
MAG010_49_10	d6c216040a803ffece4b1167189eb176	463	Pfam	PF02875	Mur ligase family, glutamate ligase domain	319	402	4.8E-14	T	21-03-2019	IPR004101	Mur ligase, C-terminal
MAG010_49_10	d6c216040a803ffece4b1167189eb176	463	Pfam	PF08245	Mur ligase middle domain	112	298	1.7E-43	T	21-03-2019	IPR013221	Mur ligase, central
MAG010_3_144	d07fe0a47364376ce0e64beeb6f21ba8	227	Pfam	PF00486	Transcriptional regulatory protein, C terminal	146	220	7.0E-21	T	21-03-2019	IPR001867	OmpR/PhoB-type DNA-binding domain
MAG010_3_144	d07fe0a47364376ce0e64beeb6f21ba8	227	Pfam	PF00072	Response regulator receiver domain	4	112	1.2E-26	T	21-03-2019	IPR001789	Signal transduction response regulator, receiver domain
MAG010_52_15	d90b26daaf4962b1c6ad1f529633cb28	166	TIGRFAM	TIGR01021	rpsE_bact: ribosomal protein uS5	9	163	2.9E-64	T	21-03-2019	IPR005712	Ribosomal protein S5, bacterial-type
MAG010_52_15	d90b26daaf4962b1c6ad1f529633cb28	166	Pfam	PF03719	Ribosomal protein S5, C-terminal domain	87	157	2.4E-30	T	21-03-2019	IPR005324	Ribosomal protein S5, C-terminal
MAG010_52_15	d90b26daaf4962b1c6ad1f529633cb28	166	Pfam	PF00333	Ribosomal protein S5, N-terminal domain	12	74	1.2E-26	T	21-03-2019	IPR013810	Ribosomal protein S5, N-terminal
MAG010_31_7	1ce17a45d4e29582b088f9cb788779ae	379	Pfam	PF07943	Penicillin-binding protein 5, C-terminal domain	281	360	7.9E-14	T	21-03-2019	IPR012907	Peptidase S11, D-Ala-D-Ala carboxypeptidase A, C-terminal
MAG010_31_7	1ce17a45d4e29582b088f9cb788779ae	379	Pfam	PF00768	D-alanyl-D-alanine carboxypeptidase	24	251	5.1E-72	T	21-03-2019	IPR001967	Peptidase S11, D-alanyl-D-alanine carboxypeptidase A, N-terminal
MAG010_21_42	89ffe6ad0b022c11253eafef0cfcfea6	233	Pfam	PF01479	S4 domain	2	45	1.9E-11	T	21-03-2019	IPR002942	RNA-binding S4 domain
MAG010_21_42	89ffe6ad0b022c11253eafef0cfcfea6	233	Pfam	PF00849	RNA pseudouridylate synthase	62	191	7.7E-15	T	21-03-2019	IPR006145	Pseudouridine synthase, RsuA/RluB/C/D/E/F
MAG010_21_42	89ffe6ad0b022c11253eafef0cfcfea6	233	TIGRFAM	TIGR00093	TIGR00093: pseudouridine synthase	66	224	2.7E-45	T	21-03-2019	IPR000748	Pseudouridine synthase, RsuA/RluB/E/F
MAG010_19_24	e6e56ca0fc556e032519ceac512ab1dd	361	Pfam	PF00365	Phosphofructokinase	3	309	1.1E-95	T	21-03-2019	IPR000023	Phosphofructokinase domain
MAG010_37_11	5eca2468493c305d267279681b8e6e04	478	Pfam	PF00206	Lyase	98	304	1.1E-20	T	21-03-2019	IPR022761	Fumarate lyase, N-terminal
MAG010_37_11	5eca2468493c305d267279681b8e6e04	478	TIGRFAM	TIGR00928	purB: adenylosuccinate lyase	10	453	3.3E-113	T	21-03-2019	IPR004769	Adenylosuccinate lyase
MAG010_37_11	5eca2468493c305d267279681b8e6e04	478	Pfam	PF10397	Adenylosuccinate lyase C-terminus	371	452	1.1E-15	T	21-03-2019	IPR019468	Adenylosuccinate lyase C-terminal
MAG010_20_49	fa552ff27187c16b5bb34c8fccc44137	343	Pfam	PF10974	Protein of unknown function (DUF2804)	15	342	4.0E-122	T	21-03-2019	IPR021243	Protein of unknown function DUF2804
MAG010_6_49	ccfac6f43b777e0ac25af3c732d1859c	245	Pfam	PF00899	ThiF family	10	229	2.1E-34	T	21-03-2019	IPR000594	THIF-type NAD/FAD binding fold
MAG010_63_4	a8b215dc5b321911105ea534cbf3eabb	135	Pfam	PF08281	Sigma-70, region 4	74	118	1.6E-7	T	21-03-2019	IPR013249	RNA polymerase sigma factor 70, region 4 type 2
MAG010_13_57	983bf3998a10358138a9d6fa27b0d020	611	Pfam	PF00570	HRDC domain	542	607	7.7E-22	T	21-03-2019	IPR002121	HRDC domain
MAG010_13_57	983bf3998a10358138a9d6fa27b0d020	611	Pfam	PF00270	DEAD/DEAH box helicase	18	180	6.1E-16	T	21-03-2019	IPR011545	DEAD/DEAH box helicase domain
MAG010_13_57	983bf3998a10358138a9d6fa27b0d020	611	Pfam	PF09382	RQC domain	408	518	6.6E-24	T	21-03-2019	IPR018982	RQC domain
MAG010_13_57	983bf3998a10358138a9d6fa27b0d020	611	Pfam	PF16124	RecQ zinc-binding	334	404	8.7E-14	T	21-03-2019	IPR032284	ATP-dependent DNA helicase RecQ, zinc-binding domain
MAG010_13_57	983bf3998a10358138a9d6fa27b0d020	611	TIGRFAM	TIGR00614	recQ_fam: ATP-dependent DNA helicase, RecQ family	6	466	2.1E-139	T	21-03-2019	IPR004589	DNA helicase, ATP-dependent, RecQ type
MAG010_13_57	983bf3998a10358138a9d6fa27b0d020	611	TIGRFAM	TIGR01389	recQ: ATP-dependent DNA helicase RecQ	6	608	1.3E-213	T	21-03-2019	IPR006293	DNA helicase, ATP-dependent, RecQ type, bacterial
MAG010_13_57	983bf3998a10358138a9d6fa27b0d020	611	Pfam	PF00271	Helicase conserved C-terminal domain	214	321	1.7E-20	T	21-03-2019	IPR001650	Helicase, C-terminal
MAG010_67_8	bcd427dac1412c0a474eff7ff3905379	86	Pfam	PF02604	Antitoxin Phd_YefM, type II toxin-antitoxin system	4	65	6.0E-9	T	21-03-2019	IPR006442	Type II toxin-antitoxin system, antitoxin Phd/YefM
MAG010_67_8	bcd427dac1412c0a474eff7ff3905379	86	TIGRFAM	TIGR01552	phd_fam: prevent-host-death family protein	7	53	1.8E-7	T	21-03-2019
MAG010_27_33	7bd10db29239b5f27421ffb8ce6b5640	248	TIGRFAM	TIGR00055	uppS: di-trans,poly-cis-decaprenylcistransferase	19	246	5.8E-82	T	21-03-2019	IPR001441	Decaprenyl diphosphate synthase-like
MAG010_27_33	7bd10db29239b5f27421ffb8ce6b5640	248	Pfam	PF01255	Putative undecaprenyl diphosphate synthase	26	246	1.0E-76	T	21-03-2019	IPR001441	Decaprenyl diphosphate synthase-like
MAG010_2_20	b87f699f43fccfb6d86e055eb9fa5538	470	Pfam	PF00285	Citrate synthase, C-terminal domain	61	453	2.5E-114	T	21-03-2019	IPR002020	Citrate synthase
MAG010_16_8	af8a331a2f23f96b8bf9c737d8249cad	174	Pfam	PF14277	Domain of unknown function (DUF4364)	12	166	5.5E-33	T	21-03-2019	IPR025374	Protein of unknown function DUF4364
MAG010_48_11	8dfc5346397a4d1d4954b5458efc4c08	844	TIGRFAM	TIGR01511	ATPase-IB1_Cu: copper-translocating P-type ATPase	202	750	7.8E-176	T	21-03-2019
MAG010_48_11	8dfc5346397a4d1d4954b5458efc4c08	844	Pfam	PF00702	haloacid dehalogenase-like hydrolase	437	654	1.7E-41	T	21-03-2019
MAG010_48_11	8dfc5346397a4d1d4954b5458efc4c08	844	TIGRFAM	TIGR00003	TIGR00003: copper ion binding protein	2	64	5.1E-13	T	21-03-2019	IPR006122	Heavy metal-associated domain, copper ion-binding
MAG010_48_11	8dfc5346397a4d1d4954b5458efc4c08	844	TIGRFAM	TIGR00003	TIGR00003: copper ion binding protein	782	841	2.2E-9	T	21-03-2019	IPR006122	Heavy metal-associated domain, copper ion-binding
MAG010_48_11	8dfc5346397a4d1d4954b5458efc4c08	844	TIGRFAM	TIGR01494	ATPase_P-type: HAD ATPase, P-type, family IC	213	720	4.0E-95	T	21-03-2019	IPR001757	P-type ATPase
MAG010_48_11	8dfc5346397a4d1d4954b5458efc4c08	844	Pfam	PF00403	Heavy-metal-associated domain	5	63	1.5E-14	T	21-03-2019	IPR006121	Heavy metal-associated domain, HMA
MAG010_48_11	8dfc5346397a4d1d4954b5458efc4c08	844	Pfam	PF00403	Heavy-metal-associated domain	785	839	5.9E-15	T	21-03-2019	IPR006121	Heavy metal-associated domain, HMA
MAG010_48_11	8dfc5346397a4d1d4954b5458efc4c08	844	Pfam	PF00122	E1-E2 ATPase	242	421	7.8E-59	T	21-03-2019
MAG010_48_11	8dfc5346397a4d1d4954b5458efc4c08	844	TIGRFAM	TIGR01525	ATPase-IB_hvy: heavy metal translocating P-type ATPase	165	749	5.7E-194	T	21-03-2019	IPR027256	P-type ATPase, subfamily IB
MAG010_2_26	4337f4f57c84dc9d5f6b31adaad40bd4	228	Pfam	PF00132	Bacterial transferase hexapeptide (six repeats)	116	149	2.3E-8	T	21-03-2019	IPR001451	Hexapeptide repeat
MAG010_2_26	4337f4f57c84dc9d5f6b31adaad40bd4	228	Pfam	PF00132	Bacterial transferase hexapeptide (six repeats)	71	107	0.0013	T	21-03-2019	IPR001451	Hexapeptide repeat
MAG010_2_26	4337f4f57c84dc9d5f6b31adaad40bd4	228	TIGRFAM	TIGR01172	cysE: serine O-acetyltransferase	6	165	5.4E-73	T	21-03-2019	IPR005881	Serine O-acetyltransferase
MAG010_7_89	f0598888dff0a0f939c9b3431d5a2bde	210	TIGRFAM	TIGR01091	upp: uracil phosphoribosyltransferase	4	210	2.5E-87	T	21-03-2019	IPR005765	Uracil phosphoribosyl transferase
MAG010_7_89	f0598888dff0a0f939c9b3431d5a2bde	210	Pfam	PF14681	Uracil phosphoribosyltransferase	7	209	1.3E-73	T	21-03-2019
MAG010_23_7	a6e4a70df7e449fbaa2190ecd31a988b	199	Pfam	PF12710	haloacid dehalogenase-like hydrolase	61	160	3.1E-8	T	21-03-2019
MAG010_23_7	a6e4a70df7e449fbaa2190ecd31a988b	199	TIGRFAM	TIGR01488	HAD-SF-IB: HAD phosphoserine phosphatase-like hydrolase, family IB	48	162	9.1E-15	T	21-03-2019
MAG010_23_7	a6e4a70df7e449fbaa2190ecd31a988b	199	TIGRFAM	TIGR02137	HSK-PSP: phosphoserine phosphatase/homoserine phosphotransferase bifunctional protein	1	195	4.4E-68	T	21-03-2019	IPR011863	Phosphoserine phosphatase/homoserine phosphotransferase bifunctional protein
MAG010_92_1	bb556b37b4f239049e69b38de83de6ec	116	Pfam	PF00528	Binding-protein-dependent transport system inner membrane component	1	110	5.6E-10	T	21-03-2019	IPR000515	ABC transporter type 1, transmembrane domain MetI-like
MAG010_78_1	8f7bdc13163a2976bcbb4ef74a39244c	305	Pfam	PF12784	PD-(D/E)XK nuclease family transposase	15	252	8.1E-29	T	21-03-2019
MAG010_78_1	8f7bdc13163a2976bcbb4ef74a39244c	305	TIGRFAM	TIGR01784	T_den_put_tspse: conserved hypothetical protein	15	299	3.6E-26	T	21-03-2019	IPR010106	Recombination-promoting nuclease RpnA
MAG010_120_1	47882130e37a9792546ec03a1393774d	248	Pfam	PF00395	S-layer homology domain	202	235	0.0049	T	21-03-2019	IPR001119	S-layer homology domain
MAG010_120_1	47882130e37a9792546ec03a1393774d	248	Pfam	PF00395	S-layer homology domain	139	180	1.2E-6	T	21-03-2019	IPR001119	S-layer homology domain
MAG010_11_22	d7cbd7664669b955b749d765e7711469	637	Pfam	PF13537	Glutamine amidotransferase domain	47	166	2.0E-44	T	21-03-2019	IPR017932	Glutamine amidotransferase type 2 domain
MAG010_11_22	d7cbd7664669b955b749d765e7711469	637	Pfam	PF00733	Asparagine synthase	246	628	1.8E-60	T	21-03-2019	IPR001962	Asparagine synthase
MAG010_11_22	d7cbd7664669b955b749d765e7711469	637	TIGRFAM	TIGR01536	asn_synth_AEB: asparagine synthase (glutamine-hydrolyzing)	2	564	3.3E-120	T	21-03-2019	IPR006426	Asparagine synthase, glutamine-hydrolyzing
MAG010_1_13	b57429c7cbee2d050610ba85fafcde69	567	Pfam	PF13408	Recombinase zinc beta ribbon domain	345	407	2.5E-12	T	21-03-2019	IPR025827	Recombinase zinc beta ribbon domain
MAG010_1_13	b57429c7cbee2d050610ba85fafcde69	567	Pfam	PF07508	Recombinase	205	324	3.3E-26	T	21-03-2019	IPR011109	DNA-binding recombinase domain
MAG010_1_13	b57429c7cbee2d050610ba85fafcde69	567	Pfam	PF00239	Resolvase, N terminal domain	28	180	2.1E-20	T	21-03-2019	IPR006119	Resolvase, N-terminal catalytic domain
MAG010_6_65	9ab12fc16994c62bc7b4017fd75feba7	122	TIGRFAM	TIGR00090	rsfS_iojap_ybeB: ribosome silencing factor	9	105	9.1E-35	T	21-03-2019	IPR004394	Protein Iojap/ribosomal silencing factor RsfS
MAG010_6_65	9ab12fc16994c62bc7b4017fd75feba7	122	Pfam	PF02410	Ribosomal silencing factor during starvation	11	105	4.7E-27	T	21-03-2019
MAG010_49_9	45be382a17e43716df5dd63e18326796	348	Pfam	PF07478	D-ala D-ala ligase C-terminus	167	338	6.6E-49	T	21-03-2019	IPR011095	D-alanine--D-alanine ligase, C-terminal
MAG010_49_9	45be382a17e43716df5dd63e18326796	348	TIGRFAM	TIGR01205	D_ala_D_alaTIGR: D-alanine--D-alanine ligase	2	339	4.1E-89	T	21-03-2019	IPR005905	D-alanine--D-alanine ligase
MAG010_49_9	45be382a17e43716df5dd63e18326796	348	Pfam	PF01820	D-ala D-ala ligase N-terminus	2	126	8.6E-23	T	21-03-2019	IPR011127	D-alanine--D-alanine ligase, N-terminal domain
MAG010_54_13	57d0e8630e3c3dd01f1af574bb6de110	459	TIGRFAM	TIGR01087	murD: UDP-N-acetylmuramoylalanine--D-glutamate ligase	16	456	7.5E-111	T	21-03-2019	IPR005762	UDP-N-acetylmuramoylalanine-D-glutamate ligase
MAG010_54_13	57d0e8630e3c3dd01f1af574bb6de110	459	Pfam	PF08245	Mur ligase middle domain	122	295	7.3E-32	T	21-03-2019	IPR013221	Mur ligase, central
MAG010_8_28	262a4b36ccc50d3038885153e13eae23	983	Pfam	PF00933	Glycosyl hydrolase family 3 N terminal domain	711	925	4.3E-39	T	21-03-2019	IPR001764	Glycoside hydrolase, family 3, N-terminal
MAG010_8_28	262a4b36ccc50d3038885153e13eae23	983	Pfam	PF01915	Glycosyl hydrolase family 3 C-terminal domain	105	432	4.5E-22	T	21-03-2019	IPR002772	Glycoside hydrolase family 3 C-terminal domain
MAG010_8_28	262a4b36ccc50d3038885153e13eae23	983	Pfam	PF14310	Fibronectin type III-like domain	465	539	3.2E-14	T	21-03-2019	IPR026891	Fibronectin type III-like domain
MAG010_25_29	eddfad5517947cc517f2cc9f3f778c19	408	Pfam	PF00579	tRNA synthetases class I (W and Y)	28	318	5.4E-74	T	21-03-2019	IPR002305	Aminoacyl-tRNA synthetase, class Ic
MAG010_25_29	eddfad5517947cc517f2cc9f3f778c19	408	TIGRFAM	TIGR00234	tyrS: tyrosine--tRNA ligase	4	404	5.7E-115	T	21-03-2019	IPR002307	Tyrosine-tRNA ligase
MAG010_1_180	1993637c78c0811d68b7576e26220f8a	1184	Pfam	PF12705	PD-(D/E)XK nuclease superfamily	1011	1163	4.6E-8	T	21-03-2019	IPR038726	PD-(D/E)XK endonuclease-like domain, AddAB-type
MAG010_1_180	1993637c78c0811d68b7576e26220f8a	1184	Pfam	PF13361	UvrD-like helicase C-terminal domain	669	854	1.5E-12	T	21-03-2019	IPR014017	UvrD-like DNA helicase, C-terminal
MAG010_1_180	1993637c78c0811d68b7576e26220f8a	1184	TIGRFAM	TIGR02785	addA_Gpos: helicase-exonuclease AddAB, AddA subunit	5	1183	4.0E-260	T	21-03-2019	IPR014152	DNA helicase subunit AddA
MAG010_1_180	1993637c78c0811d68b7576e26220f8a	1184	Pfam	PF13361	UvrD-like helicase C-terminal domain	459	643	6.5E-8	T	21-03-2019	IPR014017	UvrD-like DNA helicase, C-terminal
MAG010_1_180	1993637c78c0811d68b7576e26220f8a	1184	Pfam	PF00580	UvrD/REP helicase N-terminal domain	5	445	2.2E-69	T	21-03-2019	IPR034739	UvrD/AddA helicase, N-terminal
MAG010_5_23	990decf5688eb953c6fea16ace4e5b87	895	Pfam	PF00476	DNA polymerase family A	521	893	3.8E-150	T	21-03-2019	IPR001098	DNA-directed DNA polymerase, family A, palm domain
