MAG076_11_21	8583a31bbeb23f7b8686944a3ed17c5d	297	Pfam	PF01261	Xylose isomerase-like TIM barrel	21	216	2.0E-25	T	21-03-2019	IPR013022	Xylose isomerase-like, TIM barrel domain
MAG076_2_22	cd558a1d9560e620d0e296d0186fe490	220	Pfam	PF02588	Uncharacterised 5xTM membrane BCR, YitT family COG1284	60	177	3.5E-7	T	21-03-2019	IPR003740	Uncharacterised membrane protein YitT
MAG076_7_29	9699f460524ec391a56695d4a51ae37c	72	Pfam	PF13443	Cro/C1-type HTH DNA-binding domain	6	68	4.1E-24	T	21-03-2019	IPR001387	Cro/C1-type helix-turn-helix domain
MAG076_1_63	e599d2ed30675c194302e3ec8fd6cb87	346	Pfam	PF10282	Lactonase, 7-bladed beta-propeller	4	343	5.3E-73	T	21-03-2019	IPR019405	Lactonase, 7-bladed beta propeller
MAG076_44_20	ea5ad3e27dc721d952e29119321fff42	185	Pfam	PF01226	Formate/nitrite transporter	8	183	1.4E-43	T	21-03-2019	IPR000292	Formate/nitrite transporter
MAG076_63_14	84e5a99efed007c02be5c624259a56ac	387	Pfam	PF00589	Phage integrase family	182	361	7.4E-23	T	21-03-2019	IPR002104	Integrase, catalytic domain
MAG076_63_14	84e5a99efed007c02be5c624259a56ac	387	Pfam	PF13102	Phage integrase SAM-like domain	86	163	7.6E-8	T	21-03-2019	IPR025269	Phage integrase SAM-like domain
MAG076_53_19	99efcb00e0dda51c8148ae0b547b6345	304	Pfam	PF04204	Homoserine O-succinyltransferase	2	299	1.4E-136	T	21-03-2019	IPR033752	MetA family
MAG076_53_19	99efcb00e0dda51c8148ae0b547b6345	304	TIGRFAM	TIGR01001	metA: homoserine O-succinyltransferase	1	301	3.7E-134	T	21-03-2019	IPR005697	Homoserine O-succinyltransferase MetA
MAG076_43_11	3f6f3d25469ed68c02f176d06fb40cd1	352	TIGRFAM	TIGR00787	dctP: TRAP transporter solute receptor, DctP family	45	288	9.5E-56	T	21-03-2019	IPR004682	TRAP transporter solute receptor, DctP family
MAG076_43_11	3f6f3d25469ed68c02f176d06fb40cd1	352	Pfam	PF03480	Bacterial extracellular solute-binding protein, family 7	44	327	7.6E-70	T	21-03-2019	IPR018389	TRAP transporter solute receptor DctP/TeaA
MAG076_1_77	12f14fd31317f6bbc4439460cf11a669	688	Pfam	PF00005	ABC transporter	465	614	2.7E-27	T	21-03-2019	IPR003439	ABC transporter-like
MAG076_1_77	12f14fd31317f6bbc4439460cf11a669	688	Pfam	PF00664	ABC transporter transmembrane region	36	308	1.7E-50	T	21-03-2019	IPR011527	ABC transporter type 1, transmembrane domain
MAG076_56_13	2114f5322ac658c54c3bed179d711652	223	Pfam	PF02774	Semialdehyde dehydrogenase, dimerisation domain	167	221	1.1E-5	T	21-03-2019	IPR012280	Semialdehyde dehydrogenase, dimerisation domain
MAG076_56_13	2114f5322ac658c54c3bed179d711652	223	Pfam	PF01118	Semialdehyde dehydrogenase, NAD binding domain	5	136	1.4E-31	T	21-03-2019	IPR000534	Semialdehyde dehydrogenase, NAD-binding
MAG076_46_3	eb84183e196e03b382765e7fe9c0c2b2	328	Pfam	PF13280	WYL domain	142	323	3.8E-34	T	21-03-2019	IPR026881	WYL domain
MAG076_4_34	8677f76d6578308a9df6950a078315b4	284	Pfam	PF08478	POTRA domain, FtsQ-type	41	109	8.6E-16	T	21-03-2019	IPR013685	POTRA domain, FtsQ-type
MAG076_22_29	5ffecf35c165df56cc9244692609a151	315	Pfam	PF01497	Periplasmic binding protein	61	290	3.5E-23	T	21-03-2019	IPR002491	ABC transporter periplasmic binding domain
MAG076_18_37	7d8c259fdb8037cc2709ac3319a981af	229	Pfam	PF02308	MgtC family	21	145	4.0E-34	T	21-03-2019	IPR003416	MgtC/SapB/SrpB/YhiD family
MAG076_3_23	2ba8ca6a509e099ff938e0cb90edd2dd	408	Pfam	PF11193	Protein of unknown function (DUF2812)	15	120	2.7E-17	T	21-03-2019	IPR021359	Protein of unknown function DUF2812
MAG076_25_1	48f2ba671d824aa9648822217771ad61	694	Pfam	PF07228	Stage II sporulation protein E (SpoIIE)	511	690	3.9E-20	T	21-03-2019	IPR001932	PPM-type phosphatase domain
MAG076_2_53	2ebc057da8c49f7337bba7f61b2589ea	188	Pfam	PF03729	Short repeat of unknown function (DUF308)	13	83	2.8E-6	T	21-03-2019	IPR005325	Protein of unknown function DUF308, membrane
MAG076_41_6	7a061c43ff5b3dab7703fd1b24d9a3d2	302	Pfam	PF12833	Helix-turn-helix domain	219	297	1.4E-21	T	21-03-2019	IPR018060	DNA binding HTH domain, AraC-type
MAG076_41_6	7a061c43ff5b3dab7703fd1b24d9a3d2	302	Pfam	PF02311	AraC-like ligand binding domain	53	179	1.0E-11	T	21-03-2019	IPR003313	AraC-type arabinose-binding/dimerisation domain
MAG076_6_40	464c310e33799d29ca9eba8773efbd84	324	Pfam	PF01515	Phosphate acetyl/butaryl transferase	5	321	3.1E-112	T	21-03-2019	IPR002505	Phosphate acetyl/butaryl transferase
MAG076_6_40	464c310e33799d29ca9eba8773efbd84	324	TIGRFAM	TIGR00651	pta: phosphate acetyltransferase	16	321	3.6E-102	T	21-03-2019	IPR004614	Phosphate acetyltransferase
MAG076_53_6	3dfb84a27b478e547493f46ca626e978	317	Pfam	PF13529	Peptidase_C39 like family	144	280	2.0E-14	T	21-03-2019	IPR039564	Peptidase C39-like
MAG076_113_5	ec1f83dfbcb125777c341f34d07d2fe2	367	Pfam	PF00005	ABC transporter	84	287	6.5E-12	T	21-03-2019	IPR003439	ABC transporter-like
MAG076_18_29	0dca27ddaca5cb9a749bcebeecd2d292	346	Pfam	PF01933	Uncharacterised protein family UPF0052	17	305	8.5E-105	T	21-03-2019	IPR002882	LPPG:FO 2-phospho-L-lactate transferase CofD/UPF0052
MAG076_18_29	0dca27ddaca5cb9a749bcebeecd2d292	346	TIGRFAM	TIGR01826	CofD_related: conserved hypothetical protein	17	328	7.8E-112	T	21-03-2019	IPR010119	Gluconeogenesis factor
MAG076_54_4	64e8ad3f973fffe023021a6bde2df43a	397	Pfam	PF13635	Domain of unknown function (DUF4143)	197	345	7.8E-9	T	21-03-2019	IPR025420	Domain of unknown function DUF4143
MAG076_54_4	64e8ad3f973fffe023021a6bde2df43a	397	Pfam	PF13173	AAA domain	21	149	1.3E-33	T	21-03-2019
MAG076_35_14	84b727b0853947f7ea399a502ee321e4	422	Pfam	PF16325	Peptidase family U32 C-terminal domain	334	415	9.1E-19	T	21-03-2019	IPR032525	Peptidase family U32, C-terminal
MAG076_35_14	84b727b0853947f7ea399a502ee321e4	422	Pfam	PF01136	Peptidase family U32	95	324	1.7E-95	T	21-03-2019	IPR001539	Peptidase U32
MAG076_28_33	de14f55ce56ea5d8bbe69ed88d969d2a	384	Pfam	PF01588	Putative tRNA binding domain	45	128	5.6E-19	T	21-03-2019	IPR002547	tRNA-binding domain
MAG076_28_33	de14f55ce56ea5d8bbe69ed88d969d2a	384	Pfam	PF03483	B3/4 domain	328	383	4.2E-26	T	21-03-2019	IPR005146	B3/B4 tRNA-binding domain
MAG076_107_1	6e56fc659139323c2b91fef26764f2c0	71	Pfam	PF07878	CopG-like RHH_1 or ribbon-helix-helix domain, RHH_5	33	69	6.0E-7	T	21-03-2019	IPR012869	CopG-like ribbon-helix-helix domain
MAG076_35_27	aa204c6d1fde2311ec69833c89c8b8b8	455	TIGRFAM	TIGR00797	matE: MATE efflux family protein	23	418	7.9E-54	T	21-03-2019	IPR002528	Multi antimicrobial extrusion protein
MAG076_35_27	aa204c6d1fde2311ec69833c89c8b8b8	455	Pfam	PF01554	MatE	23	186	1.1E-22	T	21-03-2019	IPR002528	Multi antimicrobial extrusion protein
MAG076_35_27	aa204c6d1fde2311ec69833c89c8b8b8	455	Pfam	PF01554	MatE	249	409	1.6E-21	T	21-03-2019	IPR002528	Multi antimicrobial extrusion protein
MAG076_19_34	d5c6e37c255fe2a362ac454611f9ef20	445	Pfam	PF13336	Acetyl-CoA hydrolase/transferase C-terminal domain	278	434	6.8E-60	T	21-03-2019	IPR026888	Acetyl-CoA hydrolase/transferase C-terminal domain
MAG076_19_34	d5c6e37c255fe2a362ac454611f9ef20	445	Pfam	PF02550	Acetyl-CoA hydrolase/transferase N-terminal domain	3	187	2.9E-22	T	21-03-2019	IPR003702	Acetyl-CoA hydrolase/transferase
MAG076_19_34	d5c6e37c255fe2a362ac454611f9ef20	445	TIGRFAM	TIGR03948	butyr_acet_CoA: butyryl-CoA:acetate CoA-transferase	2	445	1.8E-233	T	21-03-2019	IPR023990	Butyryl-CoA:acetate CoA-transferase
MAG076_66_8	4a86f45e1a60dff9478b315bac120dda	213	Pfam	PF13472	GDSL-like Lipase/Acylhydrolase family	7	198	1.2E-19	T	21-03-2019	IPR013830	SGNH hydrolase-type esterase domain
MAG076_99_9	0429a8e47c2315e63fb9df8e10cc49a1	437	Pfam	PF13408	Recombinase zinc beta ribbon domain	195	258	3.8E-15	T	21-03-2019	IPR025827	Recombinase zinc beta ribbon domain
MAG076_99_9	0429a8e47c2315e63fb9df8e10cc49a1	437	Pfam	PF14287	Domain of unknown function (DUF4368)	349	413	1.2E-18	T	21-03-2019	IPR025378	Domain of unknown function DUF4368
MAG076_99_9	0429a8e47c2315e63fb9df8e10cc49a1	437	Pfam	PF07508	Recombinase	59	184	8.6E-20	T	21-03-2019	IPR011109	DNA-binding recombinase domain
MAG076_47_11	07da569fe503636976116a28b4423f90	192	TIGRFAM	TIGR01462	greA: transcription elongation factor GreA	43	191	1.7E-50	T	21-03-2019	IPR006359	Transcription elongation factor GreA
MAG076_47_11	07da569fe503636976116a28b4423f90	192	Pfam	PF03449	Transcription elongation factor, N-terminal	42	110	7.2E-24	T	21-03-2019	IPR022691	Transcription elongation factor, GreA/GreB, N-terminal
MAG076_47_11	07da569fe503636976116a28b4423f90	192	Pfam	PF01272	Transcription elongation factor, GreA/GreB, C-term	118	191	1.5E-24	T	21-03-2019	IPR001437	Transcription elongation factor, GreA/GreB, C-terminal
MAG076_46_7	92655e8a545d14c9366f1efe9096ba0f	336	TIGRFAM	TIGR01534	GAPDH-I: glyceraldehyde-3-phosphate dehydrogenase, type I	4	324	6.6E-134	T	21-03-2019	IPR006424	Glyceraldehyde-3-phosphate dehydrogenase, type I
MAG076_46_7	92655e8a545d14c9366f1efe9096ba0f	336	Pfam	PF00044	Glyceraldehyde 3-phosphate dehydrogenase, NAD binding domain	3	102	5.1E-38	T	21-03-2019	IPR020828	Glyceraldehyde 3-phosphate dehydrogenase, NAD(P) binding domain
MAG076_46_7	92655e8a545d14c9366f1efe9096ba0f	336	Pfam	PF02800	Glyceraldehyde 3-phosphate dehydrogenase, C-terminal domain	156	313	1.8E-70	T	21-03-2019	IPR020829	Glyceraldehyde 3-phosphate dehydrogenase, catalytic domain
MAG076_66_2	55e0146d18fe4eed9d060f8ad6ed1ed4	435	Pfam	PF10509	Galactokinase galactose-binding signature	59	97	3.0E-10	T	21-03-2019	IPR019539	Galactokinase galactose-binding domain
MAG076_66_2	55e0146d18fe4eed9d060f8ad6ed1ed4	435	Pfam	PF00288	GHMP kinases N terminal domain	155	221	7.7E-8	T	21-03-2019	IPR006204	GHMP kinase N-terminal domain
MAG076_96_5	2f1aa956af3073712e9b9c731bd48847	328	Pfam	PF00528	Binding-protein-dependent transport system inner membrane component	120	323	7.4E-38	T	21-03-2019	IPR000515	ABC transporter type 1, transmembrane domain MetI-like
MAG076_62_6	b54e364bd0e69c8d187fbdcb30ade82e	232	Pfam	PF00596	Class II Aldolase and Adducin N-terminal domain	7	197	6.8E-49	T	21-03-2019	IPR001303	Class II aldolase/adducin N-terminal
MAG076_4_28	687688c7807182a6d9a11f71b31de782	419	Pfam	PF00278	Pyridoxal-dependent decarboxylase, C-terminal sheet domain	285	373	4.0E-20	T	21-03-2019	IPR022643	Orn/DAP/Arg decarboxylase 2, C-terminal
MAG076_4_28	687688c7807182a6d9a11f71b31de782	419	Pfam	PF02784	Pyridoxal-dependent decarboxylase, pyridoxal binding domain	30	283	2.3E-24	T	21-03-2019	IPR022644	Orn/DAP/Arg decarboxylase 2, N-terminal
MAG076_22_33	78fa5c72d031ae44401756bda5fb6685	497	Pfam	PF02602	Uroporphyrinogen-III synthase HemD	265	484	5.3E-36	T	21-03-2019	IPR003754	Tetrapyrrole biosynthesis, uroporphyrinogen III synthase
MAG076_22_33	78fa5c72d031ae44401756bda5fb6685	497	Pfam	PF00590	Tetrapyrrole (Corrin/Porphyrin) Methylases	5	216	8.6E-45	T	21-03-2019	IPR000878	Tetrapyrrole methylase
MAG076_22_33	78fa5c72d031ae44401756bda5fb6685	497	TIGRFAM	TIGR01469	cobA_cysG_Cterm: uroporphyrinogen-III C-methyltransferase	3	239	3.4E-83	T	21-03-2019	IPR006366	Uroporphyrin-III C-methyltransferase
MAG076_60_19	e77b133999ee446b8799619c8ce47a57	505	TIGRFAM	TIGR00835	agcS: amino acid carrier protein	43	478	1.4E-137	T	21-03-2019	IPR001463	Sodium:alanine symporter
MAG076_60_19	e77b133999ee446b8799619c8ce47a57	505	Pfam	PF01235	Sodium:alanine symporter family	76	490	2.0E-149	T	21-03-2019	IPR001463	Sodium:alanine symporter
MAG076_29_19	686d945df5c35051e5171dc1ecea2c80	390	Pfam	PF00389	D-isomer specific 2-hydroxyacid dehydrogenase, catalytic domain	49	307	1.3E-16	T	21-03-2019	IPR006139	D-isomer specific 2-hydroxyacid dehydrogenase, catalytic domain
MAG076_29_19	686d945df5c35051e5171dc1ecea2c80	390	Pfam	PF02826	D-isomer specific 2-hydroxyacid dehydrogenase, NAD binding domain	93	275	2.7E-37	T	21-03-2019	IPR006140	D-isomer specific 2-hydroxyacid dehydrogenase, NAD-binding domain
MAG076_36_15	4d089e6d65eea2497a19ed5cca6c5ff1	549	Pfam	PF08345	Flagellar M-ring protein C-terminal	258	419	8.9E-14	T	21-03-2019	IPR013556	Flagellar M-ring C-terminal
MAG076_36_15	4d089e6d65eea2497a19ed5cca6c5ff1	549	TIGRFAM	TIGR00206	fliF: flagellar M-ring protein FliF	2	543	5.6E-41	T	21-03-2019	IPR000067	Flagellar M-ring protein FliF
MAG076_36_15	4d089e6d65eea2497a19ed5cca6c5ff1	549	Pfam	PF01514	Secretory protein of YscJ/FliF family	32	220	4.6E-34	T	21-03-2019	IPR006182	Secretory protein YscJ/FliF
MAG076_43_8	2f4734183e5d9f4d68f2dfdf51a63d4f	394	Pfam	PF07905	Purine catabolism regulatory protein-like family	7	130	5.6E-17	T	21-03-2019	IPR012914	Purine catabolism PurC-like domain
MAG076_43_8	2f4734183e5d9f4d68f2dfdf51a63d4f	394	Pfam	PF13556	PucR C-terminal helix-turn-helix domain	330	387	3.7E-13	T	21-03-2019	IPR025736	PucR C-terminal helix-turn-helix domain
MAG076_23_15	e98d10b347cb43893d7f49384a97ab91	306	TIGRFAM	TIGR01037	pyrD_sub1_fam: dihydroorotate dehydrogenase family protein	7	301	7.3E-108	T	21-03-2019	IPR005720	Dihydroorotate dehydrogenase domain
MAG076_23_15	e98d10b347cb43893d7f49384a97ab91	306	Pfam	PF01180	Dihydroorotate dehydrogenase	6	286	2.7E-75	T	21-03-2019	IPR005720	Dihydroorotate dehydrogenase domain
MAG076_5_48	be713d5aa0d26d501206b8749b38007f	151	TIGRFAM	TIGR01575	rimI: ribosomal-protein-alanine acetyltransferase	13	143	2.6E-34	T	21-03-2019	IPR006464	N-acetyltransferase RimI/Ard1
MAG076_5_48	be713d5aa0d26d501206b8749b38007f	151	Pfam	PF00583	Acetyltransferase (GNAT) family	15	123	1.7E-15	T	21-03-2019	IPR000182	GNAT domain
MAG076_17_9	9a6df3993cc1a77483912b44f3e8bd77	244	Pfam	PF13561	Enoyl-(Acyl carrier protein) reductase	8	242	7.6E-73	T	21-03-2019
MAG076_2_54	60b98ed8f3c5504a29543d051f8a150c	304	Pfam	PF02311	AraC-like ligand binding domain	28	121	1.1E-15	T	21-03-2019	IPR003313	AraC-type arabinose-binding/dimerisation domain
MAG076_2_54	60b98ed8f3c5504a29543d051f8a150c	304	Pfam	PF12833	Helix-turn-helix domain	217	295	5.4E-21	T	21-03-2019	IPR018060	DNA binding HTH domain, AraC-type
MAG076_29_30	b44eeff1c3c12d4446ccf6ea072652d0	374	Pfam	PF01339	CheB methylesterase	189	366	3.9E-51	T	21-03-2019	IPR000673	Signal transduction response regulator, chemotaxis, protein-glutamate methylesterase
MAG076_29_30	b44eeff1c3c12d4446ccf6ea072652d0	374	Pfam	PF00072	Response regulator receiver domain	10	109	4.4E-20	T	21-03-2019	IPR001789	Signal transduction response regulator, receiver domain
MAG076_62_17	cda303cf9e076b454c720944e9b636af	147	Pfam	PF06541	Putative ABC-transporter type IV	43	130	6.5E-11	T	21-03-2019	IPR010540	Putative ABC-transporter type IV CmpB/TMEM229
MAG076_59_2	557123106b213fbaf6c77815f5a23e49	403	Pfam	PF03447	Homoserine dehydrogenase, NAD binding domain	8	124	1.2E-12	T	21-03-2019	IPR005106	Aspartate/homoserine dehydrogenase, NAD-binding
MAG076_59_2	557123106b213fbaf6c77815f5a23e49	403	Pfam	PF00742	Homoserine dehydrogenase	132	311	1.6E-62	T	21-03-2019	IPR001342	Homoserine dehydrogenase, catalytic
MAG076_17_15	6086471018cfe6f2fe827790a7d29bf3	403	TIGRFAM	TIGR00125	cyt_tran_rel: cytidyltransferase-like domain	3	62	1.4E-7	T	21-03-2019	IPR004821	Cytidyltransferase-like domain
MAG076_17_15	6086471018cfe6f2fe827790a7d29bf3	403	Pfam	PF01467	Cytidylyltransferase-like	5	179	6.9E-20	T	21-03-2019	IPR004821	Cytidyltransferase-like domain
MAG076_17_15	6086471018cfe6f2fe827790a7d29bf3	403	Pfam	PF01966	HD domain	230	342	1.4E-13	T	21-03-2019	IPR006674	HD domain
MAG076_17_15	6086471018cfe6f2fe827790a7d29bf3	403	TIGRFAM	TIGR00277	HDIG: HDIG domain	228	321	9.6E-8	T	21-03-2019	IPR006675	HDIG domain
MAG076_17_15	6086471018cfe6f2fe827790a7d29bf3	403	TIGRFAM	TIGR00488	TIGR00488: putative HD superfamily hydrolase	225	393	1.6E-36	T	21-03-2019	IPR005249	Conserved hypothetical protein CHP00488
MAG076_17_15	6086471018cfe6f2fe827790a7d29bf3	403	TIGRFAM	TIGR00482	TIGR00482: nicotinate (nicotinamide) nucleotide adenylyltransferase	5	204	6.3E-39	T	21-03-2019	IPR005248	Nicotinate/nicotinamide nucleotide adenylyltransferase
MAG076_3_62	3b1d60c927faa512e6326bd22b3e690a	416	Pfam	PF08279	HTH domain	5	56	1.8E-16	T	21-03-2019	IPR013196	Helix-turn-helix, type 11
MAG076_3_62	3b1d60c927faa512e6326bd22b3e690a	416	Pfam	PF13280	WYL domain	128	292	1.5E-38	T	21-03-2019	IPR026881	WYL domain
MAG076_3_62	3b1d60c927faa512e6326bd22b3e690a	416	Pfam	PF12674	Putative zinc ribbon domain	332	414	1.0E-27	T	21-03-2019	IPR025868	Putative zinc ribbon domain
MAG076_58_1	05307bb8a7af5b12c232d2bd7c0a4fcc	103	Pfam	PF00528	Binding-protein-dependent transport system inner membrane component	2	93	1.5E-7	T	21-03-2019	IPR000515	ABC transporter type 1, transmembrane domain MetI-like
MAG076_11_45	84e68a0f468443197ba89c5404f9b05a	347	Pfam	PF00633	Helix-hairpin-helix motif	100	128	8.6E-7	T	21-03-2019	IPR000445	Helix-hairpin-helix motif
MAG076_11_45	84e68a0f468443197ba89c5404f9b05a	347	Pfam	PF14815	NUDIX domain	236	336	1.6E-21	T	21-03-2019	IPR029119	MutY, C-terminal
MAG076_11_45	84e68a0f468443197ba89c5404f9b05a	347	TIGRFAM	TIGR01084	mutY: A/G-specific adenine glycosylase	11	265	4.5E-92	T	21-03-2019	IPR005760	A/G-specific adenine glycosylase MutY
MAG076_11_45	84e68a0f468443197ba89c5404f9b05a	347	Pfam	PF00730	HhH-GPD superfamily base excision DNA repair protein	35	163	5.6E-18	T	21-03-2019	IPR003265	HhH-GPD domain
MAG076_1_65	e3131bcc2be2a1fc9f529c438b7de5c1	343	Pfam	PF16868	NMT1-like family	61	341	4.7E-50	T	21-03-2019	IPR011852	TRAP transporter solute receptor, TAXI family
MAG076_1_65	e3131bcc2be2a1fc9f529c438b7de5c1	343	TIGRFAM	TIGR02122	TRAP_TAXI: TRAP transporter solute receptor, TAXI family	1	341	3.3E-53	T	21-03-2019	IPR011852	TRAP transporter solute receptor, TAXI family
MAG076_36_19	c2c797165483a6dde9105c03ea4f7f75	716	Pfam	PF09371	Tex-like protein N-terminal domain	8	192	3.0E-66	T	21-03-2019	IPR018974	Tex-like protein, N-terminal
MAG076_36_19	c2c797165483a6dde9105c03ea4f7f75	716	Pfam	PF00575	S1 RNA binding domain	643	713	5.1E-16	T	21-03-2019	IPR003029	S1 domain
MAG076_36_19	c2c797165483a6dde9105c03ea4f7f75	716	Pfam	PF12836	Helix-hairpin-helix motif	479	543	1.4E-27	T	21-03-2019
MAG076_36_19	c2c797165483a6dde9105c03ea4f7f75	716	Pfam	PF16921	Tex protein YqgF-like domain	315	439	3.5E-53	T	21-03-2019	IPR032639	Tex protein, YqgF-like domain
MAG076_13_30	2d5d60dcd14bff591e45df069f83e123	685	Pfam	PF04879	Molybdopterin oxidoreductase Fe4S4 domain	5	56	1.0E-15	T	21-03-2019	IPR006963	Molybdopterin oxidoreductase, 4Fe-4S domain
MAG076_13_30	2d5d60dcd14bff591e45df069f83e123	685	Pfam	PF01568	Molydopterin dinucleotide binding domain	573	676	1.8E-20	T	21-03-2019	IPR006657	Molybdopterin dinucleotide-binding domain
MAG076_13_30	2d5d60dcd14bff591e45df069f83e123	685	Pfam	PF00384	Molybdopterin oxidoreductase	61	474	1.8E-52	T	21-03-2019	IPR006656	Molybdopterin oxidoreductase
MAG076_24_25	49f4caa35e60fc972ccb2b84a5af4079	313	Pfam	PF02779	Transketolase, pyrimidine binding domain	11	173	8.8E-33	T	21-03-2019	IPR005475	Transketolase-like, pyrimidine-binding domain
MAG076_24_25	49f4caa35e60fc972ccb2b84a5af4079	313	Pfam	PF02780	Transketolase, C-terminal domain	185	305	4.4E-33	T	21-03-2019	IPR033248	Transketolase, C-terminal domain
MAG076_26_18	3b776ada320f4b8ad9bd544bcd5121dc	280	TIGRFAM	TIGR00219	mreC: rod shape-determining protein MreC	54	275	2.2E-28	T	21-03-2019	IPR007221	Rod shape-determining protein MreC
MAG076_26_18	3b776ada320f4b8ad9bd544bcd5121dc	280	Pfam	PF04085	rod shape-determining protein MreC	123	274	1.4E-35	T	21-03-2019	IPR007221	Rod shape-determining protein MreC
MAG076_11_9	b69fc79f4a0760a09e88b748c4df0dcc	72	Pfam	PF01381	Helix-turn-helix	16	70	1.7E-5	T	21-03-2019	IPR001387	Cro/C1-type helix-turn-helix domain
MAG076_3_24	cf789a31a744f637a3bcd17b27ff78c6	197	Pfam	PF13331	Domain of unknown function (DUF4093)	103	194	1.1E-16	T	21-03-2019	IPR025156	Ribonuclease M5, C-terminal domain
MAG076_18_24	f4563461b31c145a68f42bbec735b721	62	TIGRFAM	TIGR00009	L28: ribosomal protein bL28	1	55	1.3E-18	T	21-03-2019	IPR001383	Ribosomal protein L28
MAG076_18_24	f4563461b31c145a68f42bbec735b721	62	Pfam	PF00830	Ribosomal L28 family	3	57	4.8E-21	T	21-03-2019	IPR026569	Ribosomal protein L28/L24
MAG076_87_4	716cfb1d08a4345fa233879ae7b91bc7	67	Pfam	PF04070	Domain of unknown function (DUF378)	2	59	2.6E-24	T	21-03-2019	IPR007211	Protein of unknown function DUF378
MAG076_24_9	29bdbf7d461b5b86a2ca795746c36f09	480	Pfam	PF00512	His Kinase A (phospho-acceptor) domain	257	321	7.9E-19	T	21-03-2019	IPR003661	Signal transduction histidine kinase, dimerisation/phosphoacceptor domain
MAG076_24_9	29bdbf7d461b5b86a2ca795746c36f09	480	Pfam	PF02518	Histidine kinase-, DNA gyrase B-, and HSP90-like ATPase	370	479	8.4E-19	T	21-03-2019	IPR003594	Histidine kinase/HSP90-like ATPase
MAG076_24_9	29bdbf7d461b5b86a2ca795746c36f09	480	Pfam	PF00672	HAMP domain	204	251	1.7E-10	T	21-03-2019	IPR003660	HAMP domain
MAG076_128_1	78c4125f1d6076cef73721ae1c3b75f3	401	Pfam	PF00665	Integrase core domain	107	238	4.6E-26	T	21-03-2019	IPR001584	Integrase, catalytic core
MAG076_6_77	183368abb105af832e789cb9f974c0ad	110	TIGRFAM	TIGR01044	rplV_bact: ribosomal protein uL22	5	107	2.7E-40	T	21-03-2019	IPR005727	Ribosomal protein L22, bacterial/chloroplast-type
MAG076_6_77	183368abb105af832e789cb9f974c0ad	110	Pfam	PF00237	Ribosomal protein L22p/L17e	5	107	3.2E-36	T	21-03-2019	IPR001063	Ribosomal protein L22/L17
MAG076_122_1	bf34d9ee71433e166425267d16e7b2aa	78	Pfam	PF12645	Helix-turn-helix domain	18	75	4.5E-22	T	21-03-2019	IPR024760	Helix-turn-helix, conjugative transposon-like
MAG076_23_22	63485777ef45f94bdc9b01c24fb31d78	415	Pfam	PF02321	Outer membrane efflux protein	302	405	3.4E-8	T	21-03-2019	IPR003423	Outer membrane efflux protein
MAG076_6_58	be190c00f54381076e53a5faa27bb289	72	TIGRFAM	TIGR00008	infA: translation initiation factor IF-1	3	71	7.4E-34	T	21-03-2019	IPR004368	Translation initiation factor IF-1
MAG076_6_58	be190c00f54381076e53a5faa27bb289	72	Pfam	PF01176	Translation initiation factor 1A / IF-1	7	70	8.5E-25	T	21-03-2019	IPR006196	RNA-binding domain, S1, IF1 type
MAG076_7_20	a70933bb3ef0cfcb7306eb8092b78dca	429	Pfam	PF00128	Alpha amylase, catalytic domain	26	113	4.2E-23	T	21-03-2019	IPR006047	Glycosyl hydrolase, family 13, catalytic domain
MAG076_7_20	a70933bb3ef0cfcb7306eb8092b78dca	429	Pfam	PF00128	Alpha amylase, catalytic domain	136	316	1.5E-7	T	21-03-2019	IPR006047	Glycosyl hydrolase, family 13, catalytic domain
MAG076_8_9	58b46ca2a8de4a83eabf8a9db2d3c862	397	TIGRFAM	TIGR00016	ackA: acetate kinase	1	396	3.4E-158	T	21-03-2019	IPR004372	Acetate/propionate kinase
MAG076_8_9	58b46ca2a8de4a83eabf8a9db2d3c862	397	Pfam	PF00871	Acetokinase family	3	389	2.3E-160	T	21-03-2019	IPR000890	Aliphatic acid kinase, short-chain
MAG076_22_38	d2123c995f697410ab5bee7137097fb5	102	Pfam	PF05713	Bacterial mobilisation protein (MobC)	56	100	6.6E-9	T	21-03-2019	IPR008687	Bacterial mobilisation
MAG076_13_3	1701a43b3914f7ba2c8398ea0b3f9248	553	Pfam	PF13426	PAS domain	100	198	6.5E-6	T	21-03-2019	IPR000014	PAS domain
MAG076_13_3	1701a43b3914f7ba2c8398ea0b3f9248	553	Pfam	PF02954	Bacterial regulatory protein, Fis family	514	550	7.0E-5	T	21-03-2019	IPR002197	DNA binding HTH domain,  Fis-type
MAG076_13_3	1701a43b3914f7ba2c8398ea0b3f9248	553	Pfam	PF00158	Sigma-54 interaction domain	235	399	1.7E-59	T	21-03-2019	IPR002078	RNA polymerase sigma factor 54 interaction domain
MAG076_18_13	ce0e834c7942c375eaa226170a2d4ef5	231	Pfam	PF04545	Sigma-70, region 4	174	223	4.4E-15	T	21-03-2019	IPR007630	RNA polymerase sigma-70 region 4
MAG076_18_13	ce0e834c7942c375eaa226170a2d4ef5	231	TIGRFAM	TIGR02937	sigma70-ECF: RNA polymerase sigma factor, sigma-70 family	48	223	8.3E-29	T	21-03-2019	IPR014284	RNA polymerase sigma-70 like domain
MAG076_18_13	ce0e834c7942c375eaa226170a2d4ef5	231	Pfam	PF04542	Sigma-70 region 2	53	122	5.6E-16	T	21-03-2019	IPR007627	RNA polymerase sigma-70 region 2
MAG076_130_1	ac71e0adc0b32a491a80d97f4aa57503	407	Pfam	PF02371	Transposase IS116/IS110/IS902 family	275	360	2.1E-21	T	21-03-2019	IPR003346	Transposase, IS116/IS110/IS902
MAG076_130_1	ac71e0adc0b32a491a80d97f4aa57503	407	Pfam	PF01548	Transposase	4	160	1.4E-30	T	21-03-2019	IPR002525	Transposase, IS111A/IS1328/IS1533, N-terminal
MAG076_87_2	b345b15e5125ec39b28f36ac56fd4f96	510	Pfam	PF00117	Glutamine amidotransferase class-I	7	188	1.9E-39	T	21-03-2019	IPR017926	Glutamine amidotransferase
MAG076_87_2	b345b15e5125ec39b28f36ac56fd4f96	510	TIGRFAM	TIGR00888	guaA_Nterm: GMP synthase (glutamine-hydrolyzing), N-terminal domain	6	192	2.5E-73	T	21-03-2019	IPR004739	GMP synthase, glutamine amidotransferase
MAG076_87_2	b345b15e5125ec39b28f36ac56fd4f96	510	TIGRFAM	TIGR00884	guaA_Cterm: GMP synthase (glutamine-hydrolyzing), C-terminal domain	203	510	1.4E-143	T	21-03-2019	IPR001674	GMP synthase, C-terminal
MAG076_87_2	b345b15e5125ec39b28f36ac56fd4f96	510	Pfam	PF00958	GMP synthase C terminal domain	418	509	6.2E-44	T	21-03-2019	IPR001674	GMP synthase, C-terminal
MAG076_87_2	b345b15e5125ec39b28f36ac56fd4f96	510	Pfam	PF03054	tRNA methyl transferase	217	250	8.8E-5	T	21-03-2019
MAG076_1_81	0a2fe1df8874d8426088928b9e0b3153	124	Pfam	PF01381	Helix-turn-helix	7	62	5.4E-11	T	21-03-2019	IPR001387	Cro/C1-type helix-turn-helix domain
MAG076_5_27	05d2d5eac5d0866c6cbd586f4b792fea	315	Pfam	PF02492	CobW/HypB/UreG, nucleotide-binding domain	8	150	1.8E-11	T	21-03-2019	IPR003495	CobW/HypB/UreG, nucleotide-binding domain
MAG076_53_18	54f1fb2b0c3b280245e3c05953423f6d	118	Pfam	PF01925	Sulfite exporter TauE/SafE	3	112	4.7E-15	T	21-03-2019	IPR002781	Transmembrane protein TauE-like
MAG076_18_2	865b38fcb5dd35ae4a696668a6bda1ce	433	Pfam	PF00355	Rieske [2Fe-2S] domain	388	428	2.3E-8	T	21-03-2019	IPR017941	Rieske [2Fe-2S] iron-sulphur domain
MAG076_18_2	865b38fcb5dd35ae4a696668a6bda1ce	433	Pfam	PF01266	FAD dependent oxidoreductase	24	348	5.9E-40	T	21-03-2019	IPR006076	FAD dependent oxidoreductase
MAG076_2_40	b25b1168cec26f09283375da0c478f8c	664	Pfam	PF00158	Sigma-54 interaction domain	341	507	3.2E-66	T	21-03-2019	IPR002078	RNA polymerase sigma factor 54 interaction domain
MAG076_5_7	b8561dd8d52eceaa1d618760089b6b94	494	Pfam	PF02906	Iron only hydrogenase large subunit, C-terminal domain	211	438	2.4E-57	T	21-03-2019	IPR004108	Iron hydrogenase, large subunit, C-terminal
MAG076_5_7	b8561dd8d52eceaa1d618760089b6b94	494	Pfam	PF12838	4Fe-4S dicluster domain	150	188	1.0E-6	T	21-03-2019	IPR017896	4Fe-4S ferredoxin-type, iron-sulphur binding domain
