MAG004_6_110	cfdbb4a00a23b0cc335438d890a5937b	389	Pfam	PF01168	Alanine racemase, N-terminal domain	11	233	9.5E-60	T	21-03-2019	IPR001608	Alanine racemase, N-terminal
MAG004_6_110	cfdbb4a00a23b0cc335438d890a5937b	389	TIGRFAM	TIGR00492	alr: alanine racemase	7	374	9.4E-112	T	21-03-2019	IPR000821	Alanine racemase
MAG004_13_34	5dd73465e7c7ef176ee9d63cb5823500	809	Pfam	PF00809	Pterin binding enzyme	323	544	1.1E-27	T	21-03-2019	IPR000489	Pterin-binding domain
MAG004_13_34	5dd73465e7c7ef176ee9d63cb5823500	809	Pfam	PF02310	B12 binding domain	692	799	1.4E-22	T	21-03-2019	IPR006158	Cobalamin (vitamin B12)-binding domain
MAG004_13_34	5dd73465e7c7ef176ee9d63cb5823500	809	Pfam	PF02607	B12 binding domain	607	677	9.2E-18	T	21-03-2019	IPR003759	Cobalamin (vitamin B12)-binding module, cap domain
MAG004_13_34	5dd73465e7c7ef176ee9d63cb5823500	809	Pfam	PF02574	Homocysteine S-methyltransferase	15	286	2.6E-58	T	21-03-2019	IPR003726	Homocysteine-binding domain
MAG004_6_53	43c87a7d87bd7235f2b3d92910047a56	238	Pfam	PF01553	Acyltransferase	60	183	5.3E-15	T	21-03-2019	IPR002123	Phospholipid/glycerol acyltransferase
MAG004_23_16	f0e60d13732c86b4de2c97ff676970ae	659	Pfam	PF07728	AAA domain (dynein-related subfamily)	313	485	2.3E-15	T	21-03-2019	IPR011704	ATPase, dynein-related, AAA domain
MAG004_49_11	8221795d27c67a4fc32a71a495d60bb1	146	Pfam	PF00828	Ribosomal proteins 50S-L15, 50S-L18e, 60S-L27A	29	144	3.0E-37	T	21-03-2019	IPR021131	Ribosomal protein L18e/L15P
MAG004_49_11	8221795d27c67a4fc32a71a495d60bb1	146	TIGRFAM	TIGR01071	rplO_bact: ribosomal protein uL15	3	143	1.1E-48	T	21-03-2019	IPR005749	Ribosomal protein L15, bacterial-type
MAG004_13_8	71dca6532797d37a1e8bc1206af92ede	145	Pfam	PF02367	Threonylcarbamoyl adenosine biosynthesis protein TsaE	9	128	5.4E-37	T	21-03-2019	IPR003442	tRNA threonylcarbamoyl adenosine modification protein TsaE
MAG004_13_8	71dca6532797d37a1e8bc1206af92ede	145	TIGRFAM	TIGR00150	T6A_YjeE: tRNA threonylcarbamoyl adenosine modification protein YjeE	12	127	4.2E-36	T	21-03-2019	IPR003442	tRNA threonylcarbamoyl adenosine modification protein TsaE
MAG004_2_113	9f130e49b689dfba3ef9b831ec12edf0	350	Pfam	PF13145	PPIC-type PPIASE domain	171	309	1.5E-8	T	21-03-2019	IPR000297	Peptidyl-prolyl cis-trans isomerase, PpiC-type
MAG004_14_58	fa95da723cac011ebca195401e086c2b	213	Pfam	PF00899	ThiF family	20	134	5.5E-30	T	21-03-2019	IPR000594	THIF-type NAD/FAD binding fold
MAG004_14_58	fa95da723cac011ebca195401e086c2b	213	TIGRFAM	TIGR02354	thiF_fam2: thiamine biosynthesis protein ThiF	8	207	1.3E-80	T	21-03-2019	IPR012729	Thiamine biosynthesis protein ThiF
MAG004_14_5	4ec681c4feab82b77e698d0a7a270c03	147	Pfam	PF10934	Protein of unknown function (DUF2634)	30	127	4.1E-32	T	21-03-2019	IPR020288	Protein of unknown function DUF2634
MAG004_1_117	2869c90d4aef25b1d8cbc00f56a955e8	329	Pfam	PF16138	Domain of unknown function (4846)	88	325	2.1E-103	T	21-03-2019	IPR032315	Protein of unknown function DUF4846
MAG004_103_5	85180a836e52a45a524e373d881717b5	91	Pfam	PF01554	MatE	18	79	3.0E-12	T	21-03-2019	IPR002528	Multi antimicrobial extrusion protein
MAG004_45_18	bd3646b35ad2396b8025fb58dfe1b692	65	Pfam	PF14205	Cysteine-rich KTR	4	56	1.5E-32	T	21-03-2019	IPR025957	Cysteine-rich KTR
MAG004_15_22	5227b49e393bd6c3fe74c336f9131233	96	Pfam	PF04977	Septum formation initiator	18	94	1.7E-10	T	21-03-2019	IPR007060	Septum formation initiator FtsL/DivIC
MAG004_5_52	5c4abdadba7e9c39cd9f21166ddfd4c8	438	Pfam	PF03721	UDP-glucose/GDP-mannose dehydrogenase family, NAD binding domain	16	193	8.8E-42	T	21-03-2019	IPR001732	UDP-glucose/GDP-mannose dehydrogenase, N-terminal
MAG004_5_52	5c4abdadba7e9c39cd9f21166ddfd4c8	438	Pfam	PF00984	UDP-glucose/GDP-mannose dehydrogenase family, central domain	216	305	4.1E-28	T	21-03-2019	IPR014026	UDP-glucose/GDP-mannose dehydrogenase, dimerisation
MAG004_5_52	5c4abdadba7e9c39cd9f21166ddfd4c8	438	Pfam	PF03720	UDP-glucose/GDP-mannose dehydrogenase family, UDP binding domain	332	427	3.9E-21	T	21-03-2019	IPR014027	UDP-glucose/GDP-mannose dehydrogenase, C-terminal
MAG004_5_52	5c4abdadba7e9c39cd9f21166ddfd4c8	438	TIGRFAM	TIGR03026	NDP-sugDHase: nucleotide sugar dehydrogenase	16	424	2.0E-128	T	21-03-2019	IPR017476	UDP-glucose/GDP-mannose dehydrogenase
MAG004_23_31	711b9ee0b637b93003810b62accac0fd	492	Pfam	PF13181	Tetratricopeptide repeat	160	190	1.4E-4	T	21-03-2019	IPR019734	Tetratricopeptide repeat
MAG004_23_31	711b9ee0b637b93003810b62accac0fd	492	Pfam	PF13414	TPR repeat	49	81	1.7E-6	T	21-03-2019
MAG004_23_31	711b9ee0b637b93003810b62accac0fd	492	Pfam	PF13432	Tetratricopeptide repeat	375	439	1.3E-5	T	21-03-2019
MAG004_15_42	4dc9143073b142e576be30a6b7cb1aad	1650	Pfam	PF13306	Leucine rich repeats (6 copies)	1534	1630	2.4E-17	T	21-03-2019	IPR026906	Leucine rich repeat 5
MAG004_61_6	ad15fb0180418ca9bf9a6e5fb32b48ff	378	Pfam	PF05711	Macrocin-O-methyltransferase (TylF)	173	361	3.4E-20	T	21-03-2019	IPR008884	Macrocin-O-methyltransferase
MAG004_110_2	bcc7e43ba63a62455c0686d08697fd6a	187	Pfam	PF01226	Formate/nitrite transporter	3	179	1.9E-16	T	21-03-2019	IPR000292	Formate/nitrite transporter
MAG004_65_5	23f7ce678f32d778dafa07d9d9902fc5	122	Pfam	PF03788	LrgA family	15	107	5.7E-32	T	21-03-2019	IPR005538	LrgA/CidA family
MAG004_12_14	c83786a8843833da152cdc3ac07b3878	312	Pfam	PF00041	Fibronectin type III domain	34	110	6.0E-9	T	21-03-2019	IPR003961	Fibronectin type III
MAG004_20_7	b642b8aa2d90ae69dc5759317f8f645f	251	TIGRFAM	TIGR03064	sortase_srtB: sortase, SrtB family	25	237	1.1E-52	T	21-03-2019	IPR009835	Sortase B family
MAG004_20_7	b642b8aa2d90ae69dc5759317f8f645f	251	Pfam	PF04203	Sortase family	86	247	1.1E-19	T	21-03-2019	IPR005754	Sortase family
MAG004_15_16	84f8c39efaa418ef64390e06e7af0c75	702	Pfam	PF02903	Alpha amylase, N-terminal ig-like domain	44	123	9.3E-9	T	21-03-2019	IPR004185	Glycoside hydrolase, family 13, N-terminal Ig-like domain
MAG004_15_16	84f8c39efaa418ef64390e06e7af0c75	702	Pfam	PF00128	Alpha amylase, catalytic domain	195	242	9.9E-17	T	21-03-2019	IPR006047	Glycosyl hydrolase, family 13, catalytic domain
MAG004_15_16	84f8c39efaa418ef64390e06e7af0c75	702	Pfam	PF00128	Alpha amylase, catalytic domain	282	576	1.1E-38	T	21-03-2019	IPR006047	Glycosyl hydrolase, family 13, catalytic domain
MAG004_45_5	43ea611a69a049669be12db0af3f68ed	313	TIGRFAM	TIGR01946	rnfD: electron transport complex, RnfABCDGE type, D subunit	10	305	1.1E-83	T	21-03-2019	IPR011303	Ion-translocating oxidoreductase complex Rnf, subunit D
MAG004_45_5	43ea611a69a049669be12db0af3f68ed	313	Pfam	PF03116	NQR2, RnfD, RnfE family	7	304	2.0E-114	T	21-03-2019	IPR004338	Ion-translocating oxidoreductase NqrB/RnfD
MAG004_90_3	f9dd9a66212d225d38809700fd296a45	214	Pfam	PF00440	Bacterial regulatory proteins, tetR family	14	61	1.6E-15	T	21-03-2019	IPR001647	DNA-binding HTH domain, TetR-type
MAG004_16_44	96e6f42594f8b05287895066860b1de9	368	Pfam	PF00154	recA bacterial DNA recombination protein	20	282	1.3E-143	T	21-03-2019	IPR013765	DNA recombination and repair protein RecA
MAG004_16_44	96e6f42594f8b05287895066860b1de9	368	TIGRFAM	TIGR02012	tigrfam_recA: protein RecA	17	337	2.1E-172	T	21-03-2019	IPR013765	DNA recombination and repair protein RecA
MAG004_9_60	c77411d6ae3509de667259025002d9ea	751	Pfam	PF00343	Carbohydrate phosphorylase	77	751	6.1E-266	T	21-03-2019	IPR000811	Glycosyl transferase, family 35
MAG004_9_60	c77411d6ae3509de667259025002d9ea	751	TIGRFAM	TIGR02093	P_ylase: glycogen/starch/alpha-glucan phosphorylases	3	751	8.1E-277	T	21-03-2019	IPR011833	Glycogen/starch/alpha-glucan phosphorylase
MAG004_33_10	ba7b246bd1ee61f3b3ba393a55cdb6a6	1425	Pfam	PF13476	AAA domain	5	303	3.3E-27	T	21-03-2019	IPR038729	Rad50/SbcC-type AAA domain
MAG004_33_10	ba7b246bd1ee61f3b3ba393a55cdb6a6	1425	Pfam	PF13558	Putative exonuclease SbcCD, C subunit	1317	1379	2.5E-12	T	21-03-2019
MAG004_40_15	486ee3d9cb86facfaabc11b4570f7f10	317	Pfam	PF01501	Glycosyl transferase family 8	2	250	1.6E-39	T	21-03-2019	IPR002495	Glycosyl transferase, family 8
MAG004_83_2	1bd05df838ea27d66a9b4513bfee4595	119	Pfam	PF01381	Helix-turn-helix	60	114	2.6E-16	T	21-03-2019	IPR001387	Cro/C1-type helix-turn-helix domain
MAG004_82_3	17835d242d6af12a8a93aa027b773044	163	Pfam	PF01047	MarR family	44	101	2.3E-9	T	21-03-2019	IPR000835	MarR-type HTH domain
MAG004_108_4	f210788ef436f2ebd704360b968b2bbc	384	Pfam	PF05569	BlaR1 peptidase M56	93	285	1.2E-34	T	21-03-2019	IPR008756	Peptidase M56
MAG004_33_6	2b708fc5623594b4a43095a9e9a5106a	1061	Pfam	PF00271	Helicase conserved C-terminal domain	694	812	8.4E-13	T	21-03-2019	IPR001650	Helicase, C-terminal
MAG004_33_6	2b708fc5623594b4a43095a9e9a5106a	1061	Pfam	PF00176	SNF2 family N-terminal domain	238	414	3.0E-8	T	21-03-2019	IPR000330	SNF2-related, N-terminal domain
MAG004_42_4	e275edcca5b9e070f9ad9044d42e9f03	190	Pfam	PF01558	Pyruvate ferredoxin/flavodoxin oxidoreductase	11	187	6.8E-39	T	21-03-2019	IPR019752	Pyruvate/ketoisovalerate oxidoreductase, catalytic domain
MAG004_2_99	40911a2a9d5e1d1c2516323150600134	281	Pfam	PF00590	Tetrapyrrole (Corrin/Porphyrin) Methylases	4	203	2.5E-30	T	21-03-2019	IPR000878	Tetrapyrrole methylase
MAG004_2_99	40911a2a9d5e1d1c2516323150600134	281	TIGRFAM	TIGR00096	TIGR00096: 16S rRNA (cytidine(1402)-2'-O)-methyltransferase	5	281	3.2E-80	T	21-03-2019	IPR008189	rRNA small subunit methyltransferase I
MAG004_152_1	1b1f8d95db782bfa0b238c658588149d	441	Pfam	PF13701	Transposase DDE domain group 1	9	437	4.1E-151	T	21-03-2019	IPR025668	Transposase DDE domain
MAG004_3_74	96c4de58cd0198c35e8c601db3a62f99	115	TIGRFAM	TIGR00090	rsfS_iojap_ybeB: ribosome silencing factor	8	104	1.0E-33	T	21-03-2019	IPR004394	Protein Iojap/ribosomal silencing factor RsfS
MAG004_3_74	96c4de58cd0198c35e8c601db3a62f99	115	Pfam	PF02410	Ribosomal silencing factor during starvation	11	104	8.2E-27	T	21-03-2019
MAG004_6_111	de487136e001859f0a0d6c0229237b2a	509	Pfam	PF01256	Carbohydrate kinase	244	496	3.7E-58	T	21-03-2019	IPR000631	ATP-dependent (S)-NAD(P)H-hydrate dehydratase
MAG004_6_111	de487136e001859f0a0d6c0229237b2a	509	TIGRFAM	TIGR00197	yjeF_nterm: YjeF family N-terminal domain	4	205	7.1E-49	T	21-03-2019	IPR004443	YjeF N-terminal domain
MAG004_6_111	de487136e001859f0a0d6c0229237b2a	509	TIGRFAM	TIGR00196	yjeF_cterm: YjeF family C-terminal domain	219	499	3.6E-67	T	21-03-2019	IPR000631	ATP-dependent (S)-NAD(P)H-hydrate dehydratase
MAG004_6_111	de487136e001859f0a0d6c0229237b2a	509	Pfam	PF03853	YjeF-related protein N-terminus	26	184	6.6E-43	T	21-03-2019	IPR004443	YjeF N-terminal domain
MAG004_32_30	72e2ed4ea4e86379ebd5cbaf034bc187	641	Pfam	PF05569	BlaR1 peptidase M56	2	307	1.6E-46	T	21-03-2019	IPR008756	Peptidase M56
MAG004_104_3	fe10891081d3dd59ae8874bfe123ef44	378	Pfam	PF06970	Replication initiator protein A (RepA) N-terminus	18	92	2.4E-33	T	21-03-2019	IPR010724	Replication initiator A, N-terminal
MAG004_3_12	b1704f68289d52756a46d81dee052ec7	141	Pfam	PF00293	NUDIX domain	15	108	9.6E-11	T	21-03-2019	IPR000086	NUDIX hydrolase domain
MAG004_55_9	b87b7ca6e8d067e5ad8f83a9ea052408	444	Pfam	PF02812	Glu/Leu/Phe/Val dehydrogenase, dimerisation domain	55	183	1.2E-50	T	21-03-2019	IPR006097	Glutamate/phenylalanine/leucine/valine dehydrogenase, dimerisation domain
MAG004_55_9	b87b7ca6e8d067e5ad8f83a9ea052408	444	Pfam	PF00208	Glutamate/Leucine/Phenylalanine/Valine dehydrogenase	200	442	1.7E-89	T	21-03-2019	IPR006096	Glutamate/phenylalanine/leucine/valine dehydrogenase, C-terminal
MAG004_12_23	898d03f49c6f2df352cec1ab9da68bbf	452	Pfam	PF09479	Listeria-Bacteroides repeat domain (List_Bact_rpt)	83	136	1.0E-8	T	21-03-2019	IPR013378	Listeria/Bacterioides repeat
MAG004_12_23	898d03f49c6f2df352cec1ab9da68bbf	452	TIGRFAM	TIGR02543	List_Bact_rpt: repeat, TIGR02543 family	100	139	1.6E-8	T	21-03-2019	IPR013378	Listeria/Bacterioides repeat
MAG004_26_11	b47400ce1241ba35a931b995285b447d	213	Pfam	PF01596	O-methyltransferase	15	212	7.2E-34	T	21-03-2019	IPR002935	O-methyltransferase, family 3
MAG004_15_13	06cf97fbd9ea15867c302b6ee1448023	436	Pfam	PF00933	Glycosyl hydrolase family 3 N terminal domain	96	428	2.7E-82	T	21-03-2019	IPR001764	Glycoside hydrolase, family 3, N-terminal
MAG004_8_16	7b2f8def47ff858e8eabf0afa930fa23	102	Pfam	PF02686	Glu-tRNAGln amidotransferase C subunit	21	84	1.8E-18	T	21-03-2019	IPR003837	Glu-tRNAGln amidotransferase C subunit
MAG004_8_16	7b2f8def47ff858e8eabf0afa930fa23	102	TIGRFAM	TIGR00135	gatC: aspartyl/glutamyl-tRNA(Asn/Gln) amidotransferase, C subunit	5	96	2.1E-22	T	21-03-2019	IPR003837	Glu-tRNAGln amidotransferase C subunit
MAG004_43_23	9ce2b403a95f45e74c1b72be1f639262	316	Pfam	PF13280	WYL domain	148	315	3.5E-20	T	21-03-2019	IPR026881	WYL domain
MAG004_5_7	39b45924d78b755c4e4e760074d78340	271	TIGRFAM	TIGR02488	flgG_G_neg: flagellar basal-body rod protein FlgG	4	269	4.3E-77	T	21-03-2019	IPR012834	Flagellar basal-body rod FlgG
MAG004_5_7	39b45924d78b755c4e4e760074d78340	271	Pfam	PF00460	Flagella basal body rod protein	5	35	2.6E-11	T	21-03-2019	IPR001444	Flagellar basal body rod protein, N-terminal
MAG004_5_7	39b45924d78b755c4e4e760074d78340	271	Pfam	PF06429	Flagellar basal body rod FlgEFG protein C-terminal	190	269	1.1E-20	T	21-03-2019	IPR010930	Flagellar basal-body/hook protein, C-terminal domain
MAG004_5_7	39b45924d78b755c4e4e760074d78340	271	TIGRFAM	TIGR03506	FlgEFG_subfam: flagellar hook-basal body protein	3	138	1.1E-40	T	21-03-2019	IPR020013	Flagellar hook-basal body protein, FlgE/F/G
MAG004_38_6	bebfe8ac55cb7a0a821a82b946de3aef	237	Pfam	PF04298	Putative neutral zinc metallopeptidase	12	230	2.0E-97	T	21-03-2019	IPR007395	Putative neutral zinc metallopeptidase
MAG004_40_5	2f67049b99c2576204c4c21fbbeac22b	357	Pfam	PF01636	Phosphotransferase enzyme family	19	258	4.9E-21	T	21-03-2019	IPR002575	Aminoglycoside phosphotransferase
MAG004_60_6	bab279ec838be83f4c14d6f7dd909e5f	129	Pfam	PF01475	Ferric uptake regulator family	2	103	5.8E-25	T	21-03-2019	IPR002481	Ferric-uptake regulator
MAG004_71_2	f12a3952b344c7e7685c4d1c57070050	250	Pfam	PF14358	Domain of unknown function (DUF4405)	97	154	8.7E-12	T	21-03-2019	IPR025517	Domain of unknown function DUF4405
MAG004_19_5	69fdeca51554100204437fcf6ef02b40	288	Pfam	PF01551	Peptidase family M23	188	283	6.0E-14	T	21-03-2019	IPR016047	Peptidase M23
MAG004_26_12	7b0e7f80af15c269e8e339ee7a1b290c	130	Pfam	PF02618	YceG-like family	58	121	6.3E-9	T	21-03-2019	IPR003770	Endolytic murein transglycosylase
MAG004_40_14	ea494de582f8e6c9571999336514dfe7	367	Pfam	PF01872	RibD C-terminal domain	147	355	2.2E-48	T	21-03-2019	IPR002734	Bacterial bifunctional deaminase-reductase, C-terminal
MAG004_40_14	ea494de582f8e6c9571999336514dfe7	367	TIGRFAM	TIGR00326	eubact_ribD: riboflavin biosynthesis protein RibD	7	355	1.3E-105	T	21-03-2019	IPR004794	Riboflavin biosynthesis protein RibD
MAG004_40_14	ea494de582f8e6c9571999336514dfe7	367	TIGRFAM	TIGR00227	ribD_Cterm: riboflavin-specific deaminase C-terminal domain	146	357	1.1E-59	T	21-03-2019	IPR011549	Riboflavin-specific deaminase, C-terminal
MAG004_40_14	ea494de582f8e6c9571999336514dfe7	367	Pfam	PF00383	Cytidine and deoxycytidylate deaminase zinc-binding region	3	99	2.5E-21	T	21-03-2019	IPR002125	Cytidine and deoxycytidylate deaminase domain
MAG004_22_30	1e366e24c4e268082bcc6bc62848edfe	120	Pfam	PF01022	Bacterial regulatory protein, arsR family	44	89	8.9E-16	T	21-03-2019	IPR001845	HTH ArsR-type DNA-binding domain
MAG004_6_22	c225fc8946c615f3f95394a17b0d1774	86	Pfam	PF04025	Domain of unknown function (DUF370)	4	76	2.2E-33	T	21-03-2019	IPR007169	Extracellular matrix regulatory protein A
MAG004_16_31	a55ec04bf65bb4a41178e66ae29306da	308	Pfam	PF10646	Sporulation and spore germination	35	144	4.0E-8	T	21-03-2019	IPR019606	GerMN domain
MAG004_16_31	a55ec04bf65bb4a41178e66ae29306da	308	Pfam	PF10646	Sporulation and spore germination	178	284	8.3E-22	T	21-03-2019	IPR019606	GerMN domain
MAG004_78_1	ae75446fe4cf0462ab1156672722a4ad	310	TIGRFAM	TIGR01139	cysK: cysteine synthase A	11	308	1.5E-138	T	21-03-2019	IPR005859	Cysteine synthase CysK
MAG004_78_1	ae75446fe4cf0462ab1156672722a4ad	310	Pfam	PF00291	Pyridoxal-phosphate dependent enzyme	10	297	1.4E-73	T	21-03-2019	IPR001926	Pyridoxal-phosphate dependent enzyme
MAG004_78_1	ae75446fe4cf0462ab1156672722a4ad	310	TIGRFAM	TIGR01136	cysKM: cysteine synthase	11	308	5.2E-133	T	21-03-2019	IPR005856	Cysteine synthase
MAG004_4_54	eda4221d6b53e423f3fe3ceaddfcdbd8	454	TIGRFAM	TIGR00797	matE: MATE efflux family protein	24	421	7.8E-65	T	21-03-2019	IPR002528	Multi antimicrobial extrusion protein
MAG004_4_54	eda4221d6b53e423f3fe3ceaddfcdbd8	454	Pfam	PF01554	MatE	24	184	2.0E-28	T	21-03-2019	IPR002528	Multi antimicrobial extrusion protein
MAG004_4_54	eda4221d6b53e423f3fe3ceaddfcdbd8	454	Pfam	PF01554	MatE	249	410	2.9E-21	T	21-03-2019	IPR002528	Multi antimicrobial extrusion protein
MAG004_49_13	ffbb780785a13dcb03beaa9d7ea0bba9	169	Pfam	PF00333	Ribosomal protein S5, N-terminal domain	13	76	1.3E-28	T	21-03-2019	IPR013810	Ribosomal protein S5, N-terminal
MAG004_49_13	ffbb780785a13dcb03beaa9d7ea0bba9	169	Pfam	PF03719	Ribosomal protein S5, C-terminal domain	89	160	3.5E-30	T	21-03-2019	IPR005324	Ribosomal protein S5, C-terminal
MAG004_49_13	ffbb780785a13dcb03beaa9d7ea0bba9	169	TIGRFAM	TIGR01021	rpsE_bact: ribosomal protein uS5	12	166	1.6E-63	T	21-03-2019	IPR005712	Ribosomal protein S5, bacterial-type
MAG004_20_30	4a1f6d2924702257a5e6a4e47c649f75	262	TIGRFAM	TIGR00262	trpA: tryptophan synthase, alpha subunit	10	251	7.6E-76	T	21-03-2019	IPR002028	Tryptophan synthase, alpha chain
MAG004_20_30	4a1f6d2924702257a5e6a4e47c649f75	262	Pfam	PF00290	Tryptophan synthase alpha chain	9	246	3.2E-81	T	21-03-2019	IPR002028	Tryptophan synthase, alpha chain
MAG004_10_74	ee2c92bb3b4f285c3ad9272afc26bf88	124	Pfam	PF05402	Coenzyme PQQ synthesis protein D (PqqD)	53	109	6.3E-12	T	21-03-2019	IPR008792	Coenzyme PQQ synthesis D
MAG004_28_7	6856b30054cbde32071b059543cdd5d3	393	Pfam	PF13458	Periplasmic binding protein	43	387	4.2E-62	T	21-03-2019	IPR028081	Leucine-binding protein domain
MAG004_52_1	fa37e7da5f487f1207d79c6e489a4004	236	Pfam	PF02674	Colicin V production protein	109	221	4.9E-12	T	21-03-2019	IPR003825	Colicin V production, CvpA
MAG004_16_4	b84f0b3a01dc48fb3b09ba792fd8e10e	194	Pfam	PF01381	Helix-turn-helix	10	63	8.5E-14	T	21-03-2019	IPR001387	Cro/C1-type helix-turn-helix domain
MAG004_6_77	e12db46d3a9ee3c72ce2184d26147cbc	230	Pfam	PF04002	RadC-like JAB domain	109	227	7.6E-42	T	21-03-2019	IPR025657	RadC-like JAB domain
MAG004_6_77	e12db46d3a9ee3c72ce2184d26147cbc	230	TIGRFAM	TIGR00608	radc: DNA repair protein RadC	15	229	3.5E-64	T	21-03-2019	IPR001405	Uncharacterised protein family UPF0758
MAG004_3_88	7154137eecac64b80e0f4a123b9adb50	155	Pfam	PF01047	MarR family	28	91	1.7E-8	T	21-03-2019	IPR000835	MarR-type HTH domain
MAG004_21_47	06169e47738b1723bfbf9c9bd07dca3e	88	Pfam	PF12652	CotJB protein	10	84	1.0E-29	T	21-03-2019	IPR024207	Spore coat assembly protein CotJB, domain
MAG004_8_26	47a6d3b29c27789e999bd951c66b0053	185	Pfam	PF08207	Elongation factor P (EF-P) KOW-like domain	3	59	8.2E-27	T	21-03-2019	IPR013185	Translation elongation factor, KOW-like
MAG004_8_26	47a6d3b29c27789e999bd951c66b0053	185	TIGRFAM	TIGR00038	efp: translation elongation factor P	2	185	3.2E-77	T	21-03-2019	IPR011768	Translation elongation factor P
MAG004_8_26	47a6d3b29c27789e999bd951c66b0053	185	Pfam	PF09285	Elongation factor P, C-terminal	129	184	2.1E-27	T	21-03-2019	IPR015365	Elongation factor P, C-terminal
MAG004_8_26	47a6d3b29c27789e999bd951c66b0053	185	Pfam	PF01132	Elongation factor P (EF-P) OB domain	68	120	5.7E-23	T	21-03-2019	IPR001059	Translation elongation factor P/YeiP, central
MAG004_14_42	9619324271a2ab9230089771644099a0	486	TIGRFAM	TIGR01302	IMP_dehydrog: inosine-5'-monophosphate dehydrogenase	8	452	9.9E-197	T	21-03-2019	IPR005990	Inosine-5'-monophosphate dehydrogenase
MAG004_14_42	9619324271a2ab9230089771644099a0	486	Pfam	PF00571	CBS domain	95	140	2.6E-9	T	21-03-2019	IPR000644	CBS domain
MAG004_14_42	9619324271a2ab9230089771644099a0	486	Pfam	PF00571	CBS domain	155	201	5.0E-5	T	21-03-2019	IPR000644	CBS domain
MAG004_14_42	9619324271a2ab9230089771644099a0	486	Pfam	PF00478	IMP dehydrogenase / GMP reductase domain	8	471	5.4E-167	T	21-03-2019	IPR001093	IMP dehydrogenase/GMP reductase
MAG004_16_33	c473977cc51da0900763ed53b292c9a3	229	Pfam	PF00486	Transcriptional regulatory protein, C terminal	151	226	3.3E-28	T	21-03-2019	IPR001867	OmpR/PhoB-type DNA-binding domain
MAG004_16_33	c473977cc51da0900763ed53b292c9a3	229	Pfam	PF00072	Response regulator receiver domain	5	113	5.2E-32	T	21-03-2019	IPR001789	Signal transduction response regulator, receiver domain
MAG004_44_15	2b2060ff975240496dcd131bcaf2b525	248	Pfam	PF13561	Enoyl-(Acyl carrier protein) reductase	7	232	1.3E-43	T	21-03-2019
MAG004_2_48	13db4dea711a7876267ba46a91a0d879	512	Pfam	PF14264	Glucosyl transferase GtrII	33	336	1.6E-34	T	21-03-2019	IPR025686	Glucosyl transferase II
MAG004_9_61	892b32a35fe20e1cf11664e9bef94ad5	421	Pfam	PF01595	Domain of unknown function DUF21	11	189	1.4E-51	T	21-03-2019	IPR002550	CNNM, transmembrane domain
MAG004_9_61	892b32a35fe20e1cf11664e9bef94ad5	421	Pfam	PF00571	CBS domain	205	258	6.7E-7	T	21-03-2019	IPR000644	CBS domain
MAG004_9_61	892b32a35fe20e1cf11664e9bef94ad5	421	Pfam	PF00571	CBS domain	268	322	1.2E-4	T	21-03-2019	IPR000644	CBS domain
MAG004_9_61	892b32a35fe20e1cf11664e9bef94ad5	421	Pfam	PF03471	Transporter associated domain	339	414	4.1E-18	T	21-03-2019	IPR005170	Transporter-associated domain
MAG004_24_34	472cc7616a9969983f38f2151ab9dac2	259	Pfam	PF05389	Negative regulator of genetic competence (MecA)	1	255	2.0E-74	T	21-03-2019	IPR008681	Negative regulator of genetic competence, MecA
MAG004_31_8	6034b3f7caff0de722b16e823d45da68	541	Pfam	PF00118	TCP-1/cpn60 chaperonin family	22	521	3.9E-104	T	21-03-2019	IPR002423	Chaperonin Cpn60/TCP-1 family
MAG004_31_8	6034b3f7caff0de722b16e823d45da68	541	TIGRFAM	TIGR02348	GroEL: chaperonin GroL	2	526	4.7E-250	T	21-03-2019	IPR001844	Chaperonin Cpn60
MAG004_8_53	45a4c4c8ed3718a95a9dbf7a7ccdeb35	1714	Pfam	PF13569	Domain of unknown function (DUF4132)	1347	1522	1.1E-47	T	21-03-2019	IPR025406	Domain of unknown function DUF4132
MAG004_4_17	9151142a9e766c93d7ee2ae1aeaf6778	690	Pfam	PF00884	Sulfatase	254	493	1.8E-28	T	21-03-2019	IPR000917	Sulfatase, N-terminal
MAG004_73_2	6cdb94ff7ba507d555eaee4c4fdb9ad4	391	Pfam	PF02661	Fic/DOC family	163	234	1.6E-7	T	21-03-2019	IPR003812	Fido domain
MAG004_13_48	63c585dc95235470e1a00a270aa17517	1735	Pfam	PF00754	F5/8 type C domain	68	190	6.3E-13	T	21-03-2019	IPR000421	Coagulation factor 5/8 C-terminal domain
MAG004_13_48	63c585dc95235470e1a00a270aa17517	1735	Pfam	PF13306	Leucine rich repeats (6 copies)	1621	1704	5.2E-15	T	21-03-2019	IPR026906	Leucine rich repeat 5
MAG004_49_3	521ffc8eb1308b0fd1fe3dd0843ae8fe	197	Pfam	PF00163	Ribosomal protein S4/S9 N-terminal domain	7	86	1.6E-20	T	21-03-2019	IPR001912	Ribosomal protein S4/S9, N-terminal
MAG004_49_3	521ffc8eb1308b0fd1fe3dd0843ae8fe	197	TIGRFAM	TIGR01017	rpsD_bact: ribosomal protein uS4	7	197	1.5E-66	T	21-03-2019	IPR005709	Ribosomal protein S4, bacterial-type
MAG004_49_3	521ffc8eb1308b0fd1fe3dd0843ae8fe	197	Pfam	PF01479	S4 domain	87	134	2.2E-19	T	21-03-2019	IPR002942	RNA-binding S4 domain
MAG004_7_19	c026641824aa1b3f545f99c56c20e1f7	382	Pfam	PF05816	Toxic anion resistance protein (TelA)	48	372	1.4E-102	T	21-03-2019	IPR008863	Toxic anion resistance
MAG004_70_4	7942b24dd38911a3de47af6856fd4f56	1030	Pfam	PF04851	Type III restriction enzyme, res subunit	14	251	2.1E-19	T	21-03-2019	IPR006935	Helicase/UvrB, N-terminal
MAG004_56_1	b5ccc30d5b81021cd52472aa00ef16a9	533	Pfam	PF00041	Fibronectin type III domain	449	516	1.2E-6	T	21-03-2019	IPR003961	Fibronectin type III
MAG004_6_51	2888e056131fee4e5a4e94e31aa11e18	85	Pfam	PF00381	PTS HPr component phosphorylation site	3	82	3.6E-29	T	21-03-2019	IPR000032	Phosphocarrier protein HPr-like
MAG004_6_51	2888e056131fee4e5a4e94e31aa11e18	85	TIGRFAM	TIGR01003	PTS_HPr_family: phosphocarrier, HPr family	1	81	6.5E-30	T	21-03-2019	IPR000032	Phosphocarrier protein HPr-like
MAG004_1_24	f929626f73a2e3fcddf6f28581980b5d	270	Pfam	PF00691	OmpA family	156	256	1.9E-18	T	21-03-2019	IPR006665	OmpA-like domain
MAG004_1_24	f929626f73a2e3fcddf6f28581980b5d	270	Pfam	PF13677	Membrane MotB of proton-channel complex MotA/MotB	4	56	6.5E-22	T	21-03-2019	IPR025713	Motility protein B, N-terminal domain
MAG004_1_107	18149469b0629c975dd9e3d884944a7c	418	TIGRFAM	TIGR02543	List_Bact_rpt: repeat, TIGR02543 family	68	113	3.9E-8	T	21-03-2019	IPR013378	Listeria/Bacterioides repeat
MAG004_1_107	18149469b0629c975dd9e3d884944a7c	418	Pfam	PF09479	Listeria-Bacteroides repeat domain (List_Bact_rpt)	39	111	6.0E-14	T	21-03-2019	IPR013378	Listeria/Bacterioides repeat
MAG004_45_16	a27e28cbfd01fd831f40a1609e36f5ad	109	Pfam	PF13151	Protein of unknown function (DUF3990)	4	62	4.6E-12	T	21-03-2019	IPR025051	Protein of unknown function DUF3990
MAG004_28_9	45fa0e588a2a1259966a0309b6c4bc83	354	Pfam	PF02653	Branched-chain amino acid transport system / permease component	42	327	9.5E-43	T	21-03-2019	IPR001851	ABC transporter, permease
MAG004_8_24	5e3f80ad171212c57629bace8343b23c	286	Pfam	PF12833	Helix-turn-helix domain	200	277	3.6E-21	T	21-03-2019	IPR018060	DNA binding HTH domain, AraC-type
MAG004_8_24	5e3f80ad171212c57629bace8343b23c	286	Pfam	PF02311	AraC-like ligand binding domain	19	128	1.9E-16	T	21-03-2019	IPR003313	AraC-type arabinose-binding/dimerisation domain
MAG004_67_3	d5edf2b009da17094f57d72e4003b138	509	Pfam	PF01087	Galactose-1-phosphate uridyl transferase, N-terminal domain	40	241	2.2E-36	T	21-03-2019	IPR005849	Galactose-1-phosphate uridyl transferase, N-terminal
MAG004_67_3	d5edf2b009da17094f57d72e4003b138	509	TIGRFAM	TIGR01239	galT_2: galactose-1-phosphate uridylyltransferase	8	508	7.3E-204	T	21-03-2019	IPR000766	Galactose-1-phosphate uridyl transferase, class II
MAG004_67_3	d5edf2b009da17094f57d72e4003b138	509	Pfam	PF02744	Galactose-1-phosphate uridyl transferase, C-terminal domain	257	453	9.3E-33	T	21-03-2019	IPR005850	Galactose-1-phosphate uridyl transferase, C-terminal
MAG004_110_1	8e6306712dabe279084837eb92ea4ff1	530	Pfam	PF16658	Class II release factor RF3, C-terminal domain	387	514	2.3E-46	T	21-03-2019	IPR032090	Peptide chain release factor 3, C-terminal
