MAG076_47_17	6a6cfa4d5d6edf032820e3d48516732c	427	Pfam	PF06245	Protein of unknown function (DUF1015)	22	421	7.0E-70	T	21-03-2019	IPR008323	Uncharacterised conserved protein UCP033563
MAG076_32_3	8837469b79755d936d13b4dcdf5490b5	365	Pfam	PF01144	Coenzyme A transferase	6	239	4.9E-40	T	21-03-2019	IPR004165	Coenzyme A transferase family I
MAG076_37_21	2c8468b1265447125e668e910205fa86	547	Pfam	PF13408	Recombinase zinc beta ribbon domain	315	388	2.7E-12	T	21-03-2019	IPR025827	Recombinase zinc beta ribbon domain
MAG076_37_21	2c8468b1265447125e668e910205fa86	547	Pfam	PF14287	Domain of unknown function (DUF4368)	480	545	2.6E-19	T	21-03-2019	IPR025378	Domain of unknown function DUF4368
MAG076_37_21	2c8468b1265447125e668e910205fa86	547	Pfam	PF00239	Resolvase, N terminal domain	13	161	1.4E-21	T	21-03-2019	IPR006119	Resolvase, N-terminal catalytic domain
MAG076_37_21	2c8468b1265447125e668e910205fa86	547	Pfam	PF07508	Recombinase	185	301	1.5E-21	T	21-03-2019	IPR011109	DNA-binding recombinase domain
MAG076_24_6	a32ebd13e1d4e7b412d3a228c469594f	393	TIGRFAM	TIGR00350	lytR_cpsA_psr: cell envelope-related function transcriptional attenuator common domain	143	293	1.3E-30	T	21-03-2019	IPR004474	Cell envelope-related transcriptional attenuator domain
MAG076_24_6	a32ebd13e1d4e7b412d3a228c469594f	393	Pfam	PF03816	Cell envelope-related transcriptional attenuator domain	144	293	3.4E-32	T	21-03-2019	IPR004474	Cell envelope-related transcriptional attenuator domain
MAG076_3_39	7e955ce06d6b6888f64b71c39f47d7ec	333	Pfam	PF00710	Asparaginase, N-terminal	3	181	2.8E-58	T	21-03-2019	IPR027474	L-asparaginase, N-terminal
MAG076_3_39	7e955ce06d6b6888f64b71c39f47d7ec	333	TIGRFAM	TIGR00519	asnASE_I: L-asparaginase, type I	1	330	3.1E-87	T	21-03-2019	IPR006033	L-asparaginase, type I
MAG076_6_34	6ba1acabcc0a23a6dccad2f2370bc4e1	486	Pfam	PF10396	GTP-binding protein TrmE N-terminus	7	127	1.5E-35	T	21-03-2019	IPR018948	GTP-binding protein TrmE, N-terminal
MAG076_6_34	6ba1acabcc0a23a6dccad2f2370bc4e1	486	TIGRFAM	TIGR00231	small_GTP: small GTP-binding protein domain	226	346	7.8E-21	T	21-03-2019	IPR005225	Small GTP-binding protein domain
MAG076_6_34	6ba1acabcc0a23a6dccad2f2370bc4e1	486	TIGRFAM	TIGR00450	mnmE_trmE_thdF: tRNA modification GTPase TrmE	13	343	5.5E-93	T	21-03-2019	IPR004520	tRNA modification GTPase MnmE
MAG076_6_34	6ba1acabcc0a23a6dccad2f2370bc4e1	486	Pfam	PF12631	MnmE helical domain	130	483	3.6E-50	T	21-03-2019	IPR025867	MnmE, helical domain
MAG076_6_34	6ba1acabcc0a23a6dccad2f2370bc4e1	486	Pfam	PF01926	50S ribosome-binding GTPase	226	339	8.0E-24	T	21-03-2019	IPR006073	GTP binding domain
MAG076_15_3	aa61c5ebe9972120aec03ffea162b361	640	TIGRFAM	TIGR00829	FRU: PTS system, Fru family, IIB component	173	254	4.9E-31	T	21-03-2019	IPR003353	Phosphotransferase system, fructose-specific IIB subunit
MAG076_15_3	aa61c5ebe9972120aec03ffea162b361	640	TIGRFAM	TIGR01427	PTS_IIC_fructo: PTS system, Fru family, IIC component	290	636	2.4E-109	T	21-03-2019	IPR006327	Phosphotransferase system, fructose IIC component
MAG076_15_3	aa61c5ebe9972120aec03ffea162b361	640	Pfam	PF00359	Phosphoenolpyruvate-dependent sugar phosphotransferase system, EIIA 2	6	147	2.6E-33	T	21-03-2019	IPR002178	PTS EIIA type-2 domain
MAG076_15_3	aa61c5ebe9972120aec03ffea162b361	640	Pfam	PF02302	PTS system, Lactose/Cellobiose specific IIB subunit	173	263	1.1E-16	T	21-03-2019	IPR003501	Phosphotransferase system, EIIB component, type 2/3
MAG076_15_3	aa61c5ebe9972120aec03ffea162b361	640	Pfam	PF02378	Phosphotransferase system, EIIC	298	583	4.4E-17	T	21-03-2019	IPR003352	Phosphotransferase system, EIIC
MAG076_15_3	aa61c5ebe9972120aec03ffea162b361	640	TIGRFAM	TIGR00848	fruA: PTS system, fructose subfamily, IIA component	8	133	5.2E-31	T	21-03-2019	IPR004715	Phosphotransferase system, IIA component fructose subfamily
MAG076_7_47	5e88eb8c0f584b36c4c61bf64918e10b	421	Pfam	PF05496	Holliday junction DNA helicase ruvB N-terminus	8	128	6.8E-12	T	21-03-2019	IPR008824	Holliday junction DNA helicase ruvB, N-terminal
MAG076_7_47	5e88eb8c0f584b36c4c61bf64918e10b	421	Pfam	PF16193	AAA C-terminal domain	177	254	1.8E-23	T	21-03-2019	IPR032423	AAA C-terminal domain
MAG076_7_47	5e88eb8c0f584b36c4c61bf64918e10b	421	Pfam	PF12002	MgsA AAA+ ATPase C terminal	255	419	2.1E-59	T	21-03-2019	IPR021886	MgsA AAA+ ATPase C-terminal
MAG076_18_3	68c2cf2de2d7d08fcf48c076211d77bf	277	Pfam	PF12837	4Fe-4S binding domain	223	243	1.5E-6	T	21-03-2019	IPR017896	4Fe-4S ferredoxin-type, iron-sulphur binding domain
MAG076_18_3	68c2cf2de2d7d08fcf48c076211d77bf	277	Pfam	PF12801	4Fe-4S binding domain	128	160	6.6	T	21-03-2019	IPR017896	4Fe-4S ferredoxin-type, iron-sulphur binding domain
MAG076_18_3	68c2cf2de2d7d08fcf48c076211d77bf	277	Pfam	PF12801	4Fe-4S binding domain	53	64	7.3	T	21-03-2019	IPR017896	4Fe-4S ferredoxin-type, iron-sulphur binding domain
MAG076_18_3	68c2cf2de2d7d08fcf48c076211d77bf	277	Pfam	PF12801	4Fe-4S binding domain	185	218	5.4E-5	T	21-03-2019	IPR017896	4Fe-4S ferredoxin-type, iron-sulphur binding domain
MAG076_18_3	68c2cf2de2d7d08fcf48c076211d77bf	277	Pfam	PF12801	4Fe-4S binding domain	72	112	5.7E-12	T	21-03-2019	IPR017896	4Fe-4S ferredoxin-type, iron-sulphur binding domain
MAG076_113_4	af51f560079099611d847f3119843b55	132	Pfam	PF07638	ECF sigma factor	41	127	1.3E-4	T	21-03-2019	IPR011517	RNA polymerase sigma-70 ECF-like
MAG076_38_15	9357bc6fb6e8231a7a74d1e51d5d4f4c	162	Pfam	PF04542	Sigma-70 region 2	13	77	1.1E-9	T	21-03-2019	IPR007627	RNA polymerase sigma-70 region 2
MAG076_38_15	9357bc6fb6e8231a7a74d1e51d5d4f4c	162	Pfam	PF08281	Sigma-70, region 4	101	152	9.9E-16	T	21-03-2019	IPR013249	RNA polymerase sigma factor 70, region 4 type 2
MAG076_38_15	9357bc6fb6e8231a7a74d1e51d5d4f4c	162	TIGRFAM	TIGR02937	sigma70-ECF: RNA polymerase sigma factor, sigma-70 family	10	155	3.7E-23	T	21-03-2019	IPR014284	RNA polymerase sigma-70 like domain
MAG076_28_17	bd214ddf93d7baf9c0c96a6302655cd6	337	TIGRFAM	TIGR02845	spore_V_AD: stage V sporulation protein AD	9	333	1.3E-126	T	21-03-2019	IPR010894	Stage V sporulation AD
MAG076_28_17	bd214ddf93d7baf9c0c96a6302655cd6	337	Pfam	PF07451	Stage V sporulation protein AD (SpoVAD)	7	333	1.7E-140	T	21-03-2019	IPR010894	Stage V sporulation AD
MAG076_85_5	c6c04d9fcb23e1dcf84d6ef5f07f9e6b	89	Pfam	PF05239	PRC-barrel domain	4	75	2.4E-13	T	21-03-2019	IPR027275	PRC-barrel domain
MAG076_85_5	c6c04d9fcb23e1dcf84d6ef5f07f9e6b	89	TIGRFAM	TIGR02888	spore_YlmC_YmxH: sporulation protein, YlmC/YmxH family	4	75	3.5E-24	T	21-03-2019	IPR014238	Sporulation protein YlmC/YmxH
MAG076_126_3	8a16b0ff0e6da2db40f6f9616155b692	269	TIGRFAM	TIGR01076	sortase_fam: sortase	148	254	8.8E-18	T	21-03-2019	IPR005754	Sortase family
MAG076_126_3	8a16b0ff0e6da2db40f6f9616155b692	269	Pfam	PF04203	Sortase family	150	267	4.0E-22	T	21-03-2019	IPR005754	Sortase family
MAG076_39_29	8db92e983e58cd8c73bd0a7b1861aaee	73	Pfam	PF01381	Helix-turn-helix	12	66	4.1E-11	T	21-03-2019	IPR001387	Cro/C1-type helix-turn-helix domain
MAG076_1_74	5949d0577c85a4149323bbca3ab722dd	155	Pfam	PF04397	LytTr DNA-binding domain	57	144	2.0E-18	T	21-03-2019	IPR007492	LytTR DNA-binding domain
MAG076_4_70	4d2d5de98a2e05ae4b47469693cc0d32	690	TIGRFAM	TIGR00231	small_GTP: small GTP-binding protein domain	8	150	4.8E-15	T	21-03-2019	IPR005225	Small GTP-binding protein domain
MAG076_4_70	4d2d5de98a2e05ae4b47469693cc0d32	690	Pfam	PF00009	Elongation factor Tu GTP binding domain	7	275	2.0E-38	T	21-03-2019	IPR000795	Transcription factor, GTP-binding domain
MAG076_4_70	4d2d5de98a2e05ae4b47469693cc0d32	690	Pfam	PF00679	Elongation factor G C-terminus	592	679	1.2E-25	T	21-03-2019	IPR000640	Elongation factor EFG, domain V-like
MAG076_4_70	4d2d5de98a2e05ae4b47469693cc0d32	690	Pfam	PF03144	Elongation factor Tu domain 2	316	383	2.2E-8	T	21-03-2019	IPR004161	Translation elongation factor EFTu-like, domain 2
MAG076_4_70	4d2d5de98a2e05ae4b47469693cc0d32	690	Pfam	PF14492	Elongation Factor G, domain II	396	469	3.7E-22	T	21-03-2019
MAG076_4_70	4d2d5de98a2e05ae4b47469693cc0d32	690	Pfam	PF03764	Elongation factor G, domain IV	472	590	2.8E-40	T	21-03-2019	IPR005517	Translation elongation factor EFG/EF2, domain IV
MAG076_3_26	ec0672fa0d152839fcebf217ed119239	764	Pfam	PF03772	Competence protein	215	493	2.2E-49	T	21-03-2019	IPR004477	ComEC/Rec2-related protein
MAG076_3_26	ec0672fa0d152839fcebf217ed119239	764	TIGRFAM	TIGR00360	ComEC_N-term: ComEC/Rec2-related protein	237	425	3.6E-20	T	21-03-2019	IPR004477	ComEC/Rec2-related protein
MAG076_3_26	ec0672fa0d152839fcebf217ed119239	764	Pfam	PF00753	Metallo-beta-lactamase superfamily	533	726	2.6E-13	T	21-03-2019	IPR001279	Metallo-beta-lactamase
MAG076_3_26	ec0672fa0d152839fcebf217ed119239	764	TIGRFAM	TIGR00361	ComEC_Rec2: DNA internalization-related competence protein ComEC/Rec2	205	756	1.9E-61	T	21-03-2019	IPR004797	Competence protein ComEC/Rec2
MAG076_6_81	102560be6b8ab3274f9e44d15a1bed5e	206	Pfam	PF00573	Ribosomal protein L4/L1 family	17	203	2.9E-65	T	21-03-2019	IPR002136	Ribosomal protein L4/L1e
MAG076_6_81	102560be6b8ab3274f9e44d15a1bed5e	206	TIGRFAM	TIGR03953	rplD_bact: 50S ribosomal protein uL4	17	203	1.2E-73	T	21-03-2019	IPR013005	50S ribosomal protein uL4
MAG076_7_49	ae5980d62ca851c84fbd7124296bd62d	344	Pfam	PF10974	Protein of unknown function (DUF2804)	16	343	1.6E-116	T	21-03-2019	IPR021243	Protein of unknown function DUF2804
MAG076_16_9	045c516550ff3aae9dc65093fcf0f2ed	215	TIGRFAM	TIGR01549	HAD-SF-IA-v1: HAD hydrolase, family IA, variant 1	69	178	3.1E-10	T	21-03-2019	IPR006439	HAD hydrolase, subfamily IA
MAG076_16_9	045c516550ff3aae9dc65093fcf0f2ed	215	Pfam	PF13419	Haloacid dehalogenase-like hydrolase	6	184	1.5E-35	T	21-03-2019
MAG076_20_7	7edbd23fa366fdeb499756bdea78cb1b	212	Pfam	PF14520	Helix-hairpin-helix domain	81	139	7.1E-17	T	21-03-2019
MAG076_20_7	7edbd23fa366fdeb499756bdea78cb1b	212	Pfam	PF01330	RuvA N terminal domain	13	71	6.2E-18	T	21-03-2019	IPR013849	DNA helicase, Holliday junction RuvA type, domain I, bacterial
MAG076_20_7	7edbd23fa366fdeb499756bdea78cb1b	212	Pfam	PF07499	RuvA, C-terminal domain	166	209	2.6E-10	T	21-03-2019	IPR011114	Holliday junction DNA helicase RuvA, C-terminal
MAG076_20_7	7edbd23fa366fdeb499756bdea78cb1b	212	TIGRFAM	TIGR00084	ruvA: Holliday junction DNA helicase RuvA	15	210	5.6E-46	T	21-03-2019	IPR000085	Bacterial DNA recombination protein RuvA
MAG076_17_38	12427722d3e3f943c91130752f180d78	809	Pfam	PF00004	ATPase family associated with various cellular activities (AAA)	212	326	4.1E-13	T	21-03-2019	IPR003959	ATPase, AAA-type, core
MAG076_17_38	12427722d3e3f943c91130752f180d78	809	Pfam	PF10431	C-terminal, D2-small domain, of ClpB protein	717	795	8.5E-17	T	21-03-2019	IPR019489	Clp ATPase, C-terminal
MAG076_17_38	12427722d3e3f943c91130752f180d78	809	Pfam	PF07724	AAA domain (Cdc48 subfamily)	540	710	2.6E-46	T	21-03-2019	IPR003959	ATPase, AAA-type, core
MAG076_17_38	12427722d3e3f943c91130752f180d78	809	Pfam	PF02861	Clp amino terminal domain, pathogenicity island component	92	144	7.5E-9	T	21-03-2019	IPR004176	Clp, N-terminal
MAG076_17_38	12427722d3e3f943c91130752f180d78	809	Pfam	PF02861	Clp amino terminal domain, pathogenicity island component	17	68	1.2E-11	T	21-03-2019	IPR004176	Clp, N-terminal
MAG076_81_11	3756803cc5ccecb92dae8a13c766bdd7	87	TIGRFAM	TIGR01402	fliQ: flagellar biosynthetic protein FliQ	1	84	7.2E-28	T	21-03-2019	IPR006305	Flagellar biosynthesis protein FliQ
MAG076_81_11	3756803cc5ccecb92dae8a13c766bdd7	87	Pfam	PF01313	Bacterial export proteins, family 3	6	78	1.9E-27	T	21-03-2019	IPR002191	Bacterial export protein family 3
MAG076_7_60	cb0d0d47759ac5a7277f01dcb2cf00d5	614	TIGRFAM	TIGR03960	rSAM_fuse_unch: radical SAM family uncharacterized protein	8	608	5.0E-271	T	21-03-2019	IPR023862	Conserved hypothetical protein CHP03960, radical SAM
MAG076_7_60	cb0d0d47759ac5a7277f01dcb2cf00d5	614	Pfam	PF04055	Radical SAM superfamily	264	426	1.5E-14	T	21-03-2019	IPR007197	Radical SAM
MAG076_14_53	2fc9dd47c6255bb8061635ae7d3d3fe8	182	Pfam	PF01648	4'-phosphopantetheinyl transferase superfamily	71	145	1.9E-10	T	21-03-2019	IPR008278	4'-phosphopantetheinyl transferase domain
MAG076_1_103	763ada2d4a3270095d8a9e53b79f5d24	278	Pfam	PF02153	Prephenate dehydrogenase	16	267	4.4E-49	T	21-03-2019	IPR003099	Prephenate dehydrogenase
MAG076_45_15	a3aa4c1247e872e816b415f7b874c66a	299	Pfam	PF03471	Transporter associated domain	210	291	2.2E-19	T	21-03-2019	IPR005170	Transporter-associated domain
MAG076_45_15	a3aa4c1247e872e816b415f7b874c66a	299	Pfam	PF00571	CBS domain	75	127	4.5E-4	T	21-03-2019	IPR000644	CBS domain
MAG076_45_15	a3aa4c1247e872e816b415f7b874c66a	299	Pfam	PF00571	CBS domain	155	193	5.4E-4	T	21-03-2019	IPR000644	CBS domain
MAG076_29_10	016b646d4a622316f414123ce02c1591	261	TIGRFAM	TIGR03915	SAM_7_link_chp: probable DNA metabolism protein	9	247	2.8E-58	T	21-03-2019	IPR023875	DNA metabolism protein, putative
MAG076_29_10	016b646d4a622316f414123ce02c1591	261	Pfam	PF13566	Domain of unknown function (DUF4130	84	246	9.7E-42	T	21-03-2019	IPR025404	Domain of unknown function DUF4130
MAG076_10_43	f6d0352b8fb8b21da3468b3a5f25855b	596	Pfam	PF01336	OB-fold nucleic acid binding domain	25	106	2.4E-11	T	21-03-2019	IPR004365	OB-fold nucleic acid binding domain, AA-tRNA synthetase-type
MAG076_10_43	f6d0352b8fb8b21da3468b3a5f25855b	596	TIGRFAM	TIGR00459	aspS_bact: aspartate--tRNA ligase	7	592	1.8E-172	T	21-03-2019	IPR004524	Aspartate-tRNA ligase, type 1
MAG076_10_43	f6d0352b8fb8b21da3468b3a5f25855b	596	Pfam	PF00152	tRNA synthetases class II (D, K and N)	126	564	1.9E-92	T	21-03-2019	IPR004364	Aminoacyl-tRNA synthetase, class II (D/K/N)
MAG076_6_43	6b2590b93f8e1499f2c20bbcd948b158	225	TIGRFAM	TIGR00266	TIGR00266: TIGR00266 family protein	1	224	7.9E-34	T	21-03-2019	IPR002838	Mitochondrial biogenesis protein AIM24
MAG076_6_43	6b2590b93f8e1499f2c20bbcd948b158	225	Pfam	PF01987	Mitochondrial biogenesis AIM24	3	208	1.4E-66	T	21-03-2019	IPR002838	Mitochondrial biogenesis protein AIM24
MAG076_3_40	39e613fcb8f9430b55658c74ba9ed7c7	285	TIGRFAM	TIGR01207	rmlA: glucose-1-phosphate thymidylyltransferase	2	283	1.1E-117	T	21-03-2019	IPR005907	Glucose-1-phosphate thymidylyltransferase, short form
MAG076_3_40	39e613fcb8f9430b55658c74ba9ed7c7	285	Pfam	PF00483	Nucleotidyl transferase	2	237	4.6E-58	T	21-03-2019	IPR005835	Nucleotidyl transferase domain
MAG076_6_26	1650324830ac13263f2aa312fbf513f0	1598	Pfam	PF01467	Cytidylyltransferase-like	915	1072	1.1E-4	T	21-03-2019	IPR004821	Cytidyltransferase-like domain
MAG076_53_13	8200a2a094dc23141b94f34795b198a1	721	TIGRFAM	TIGR00003	TIGR00003: copper ion binding protein	655	718	2.1E-13	T	21-03-2019	IPR006122	Heavy metal-associated domain, copper ion-binding
MAG076_53_13	8200a2a094dc23141b94f34795b198a1	721	TIGRFAM	TIGR00003	TIGR00003: copper ion binding protein	3	66	1.0E-14	T	21-03-2019	IPR006122	Heavy metal-associated domain, copper ion-binding
MAG076_53_13	8200a2a094dc23141b94f34795b198a1	721	TIGRFAM	TIGR01494	ATPase_P-type: HAD ATPase, P-type, family IC	197	598	9.4E-73	T	21-03-2019	IPR001757	P-type ATPase
MAG076_53_13	8200a2a094dc23141b94f34795b198a1	721	Pfam	PF00403	Heavy-metal-associated domain	6	65	7.1E-13	T	21-03-2019	IPR006121	Heavy metal-associated domain, HMA
MAG076_53_13	8200a2a094dc23141b94f34795b198a1	721	Pfam	PF00403	Heavy-metal-associated domain	657	716	8.5E-11	T	21-03-2019	IPR006121	Heavy metal-associated domain, HMA
MAG076_53_13	8200a2a094dc23141b94f34795b198a1	721	Pfam	PF00122	E1-E2 ATPase	175	283	6.0E-27	T	21-03-2019
MAG076_53_13	8200a2a094dc23141b94f34795b198a1	721	Pfam	PF00702	haloacid dehalogenase-like hydrolase	300	521	8.0E-44	T	21-03-2019
MAG076_53_13	8200a2a094dc23141b94f34795b198a1	721	TIGRFAM	TIGR01525	ATPase-IB_hvy: heavy metal translocating P-type ATPase	175	616	4.4E-151	T	21-03-2019	IPR027256	P-type ATPase, subfamily IB
MAG076_53_13	8200a2a094dc23141b94f34795b198a1	721	TIGRFAM	TIGR01511	ATPase-IB1_Cu: copper-translocating P-type ATPase	175	617	9.5E-137	T	21-03-2019
MAG076_44_4	84243ee6e65d766fc8688c5e557da60c	100	TIGRFAM	TIGR02531	yecD_yerC: TrpR homolog YerC/YecD	8	95	1.2E-33	T	21-03-2019	IPR013368	TrpR homologue YerC/YecD
MAG076_44_4	84243ee6e65d766fc8688c5e557da60c	100	Pfam	PF01371	Trp repressor protein	12	95	9.9E-25	T	21-03-2019	IPR000831	Trp repressor
MAG076_2_60	ab53b4c3f6a83df888a8b263a349d7f7	329	Pfam	PF00356	Bacterial regulatory proteins, lacI family	9	53	8.1E-11	T	21-03-2019	IPR000843	LacI-type HTH domain
MAG076_2_60	ab53b4c3f6a83df888a8b263a349d7f7	329	Pfam	PF13377	Periplasmic binding protein-like domain	168	327	6.7E-18	T	21-03-2019
MAG076_17_35	81e167d8df3bbb71ef98e690f8cbbec4	384	Pfam	PF01527	Transposase	3	68	9.7E-9	T	21-03-2019	IPR002514	Transposase IS3/IS911family
MAG076_17_35	81e167d8df3bbb71ef98e690f8cbbec4	384	Pfam	PF13276	HTH-like domain	140	191	2.9E-11	T	21-03-2019	IPR025948	HTH-like domain
MAG076_17_35	81e167d8df3bbb71ef98e690f8cbbec4	384	Pfam	PF00665	Integrase core domain	216	330	3.0E-30	T	21-03-2019	IPR001584	Integrase, catalytic core
MAG076_104_4	dbbe7c7a3b8da2892f2eeb445b20eb86	383	Pfam	PF14659	Phage integrase, N-terminal SAM-like domain	71	129	5.6E-15	T	21-03-2019	IPR004107	Integrase, SAM-like, N-terminal
MAG076_104_4	dbbe7c7a3b8da2892f2eeb445b20eb86	383	Pfam	PF00589	Phage integrase family	212	365	3.9E-30	T	21-03-2019	IPR002104	Integrase, catalytic domain
MAG076_1_41	d7350d6f025c44b0f3bc7440a6a92b12	206	Pfam	PF02631	RecX family	83	199	1.5E-23	T	21-03-2019	IPR003783	Regulatory protein RecX
MAG076_59_6	3e52dc74812b01230ef0f1c64d6d92b4	504	Pfam	PF13624	SurA N-terminal domain	34	142	9.3E-8	T	21-03-2019
MAG076_59_6	3e52dc74812b01230ef0f1c64d6d92b4	504	Pfam	PF00639	PPIC-type PPIASE domain	358	459	1.5E-10	T	21-03-2019	IPR000297	Peptidyl-prolyl cis-trans isomerase, PpiC-type
MAG076_2_69	8f400e6f42452d8aa7a852bb60b9be43	279	Pfam	PF02311	AraC-like ligand binding domain	32	112	2.1E-6	T	21-03-2019	IPR003313	AraC-type arabinose-binding/dimerisation domain
MAG076_2_69	8f400e6f42452d8aa7a852bb60b9be43	279	Pfam	PF12833	Helix-turn-helix domain	195	274	4.7E-22	T	21-03-2019	IPR018060	DNA binding HTH domain, AraC-type
MAG076_39_16	07db44aba95db783a7a6ed01bca99dc7	145	Pfam	PF13581	Histidine kinase-like ATPase domain	12	135	3.7E-23	T	21-03-2019	IPR003594	Histidine kinase/HSP90-like ATPase
MAG076_39_16	07db44aba95db783a7a6ed01bca99dc7	145	TIGRFAM	TIGR01925	spIIAB: anti-sigma F factor	3	138	9.5E-51	T	21-03-2019	IPR010194	Anti-sigma F factor
MAG076_21_7	6b93a3ccfc69ae52a1e507ac7bbb8b74	72	Pfam	PF01381	Helix-turn-helix	14	70	2.9E-5	T	21-03-2019	IPR001387	Cro/C1-type helix-turn-helix domain
MAG076_18_35	741274341366f1893f4054f682e0406c	1156	Pfam	PF01336	OB-fold nucleic acid binding domain	1000	1078	2.7E-7	T	21-03-2019	IPR004365	OB-fold nucleic acid binding domain, AA-tRNA synthetase-type
MAG076_18_35	741274341366f1893f4054f682e0406c	1156	Pfam	PF07733	Bacterial DNA polymerase III alpha subunit	299	717	8.8E-166	T	21-03-2019	IPR011708	Bacterial DNA polymerase III, alpha subunit
MAG076_18_35	741274341366f1893f4054f682e0406c	1156	Pfam	PF02811	PHP domain	5	179	3.1E-54	T	21-03-2019	IPR004013	PHP domain
MAG076_18_35	741274341366f1893f4054f682e0406c	1156	Pfam	PF14579	Helix-hairpin-helix motif	803	892	1.9E-26	T	21-03-2019	IPR029460	DNA polymerase, helix-hairpin-helix motif
MAG076_18_35	741274341366f1893f4054f682e0406c	1156	TIGRFAM	TIGR00594	polc: DNA polymerase III, alpha subunit	3	1037	0.0	T	21-03-2019	IPR004805	DNA polymerase III, alpha subunit
MAG076_34_4	b8bc3df2a32b0a607d7be68d2ee4689a	87	Pfam	PF00381	PTS HPr component phosphorylation site	3	84	4.2E-24	T	21-03-2019	IPR000032	Phosphocarrier protein HPr-like
MAG076_34_4	b8bc3df2a32b0a607d7be68d2ee4689a	87	TIGRFAM	TIGR01003	PTS_HPr_family: phosphocarrier, HPr family	1	83	1.4E-22	T	21-03-2019	IPR000032	Phosphocarrier protein HPr-like
MAG076_51_11	749f19402ee69395d5fb5aeedac284b8	339	TIGRFAM	TIGR00465	ilvC: ketol-acid reductoisomerase	15	328	1.1E-129	T	21-03-2019	IPR013023	Ketol-acid reductoisomerase
MAG076_51_11	749f19402ee69395d5fb5aeedac284b8	339	Pfam	PF07991	Acetohydroxy acid isomeroreductase, NADPH-binding domain	15	178	4.0E-76	T	21-03-2019	IPR013116	Ketol-acid reductoisomerase, N-terminal
MAG076_51_11	749f19402ee69395d5fb5aeedac284b8	339	Pfam	PF01450	Acetohydroxy acid isomeroreductase, catalytic domain	184	328	1.5E-58	T	21-03-2019	IPR000506	Ketol-acid reductoisomerase, C-terminal
MAG076_36_16	81cbcaec8bf539e6917a40dd7eac4b19	101	Pfam	PF02049	Flagellar hook-basal body complex protein FliE	19	100	3.2E-18	T	21-03-2019	IPR001624	Flagellar hook-basal body complex protein FliE
MAG076_36_16	81cbcaec8bf539e6917a40dd7eac4b19	101	TIGRFAM	TIGR00205	fliE: flagellar hook-basal body complex protein FliE	21	99	1.2E-13	T	21-03-2019	IPR001624	Flagellar hook-basal body complex protein FliE
MAG076_10_62	998d725430ef6140eba7b54e73f6f138	651	TIGRFAM	TIGR01059	gyrB: DNA gyrase, B subunit	20	650	5.5E-286	T	21-03-2019	IPR011557	DNA gyrase, subunit B
MAG076_10_62	998d725430ef6140eba7b54e73f6f138	651	Pfam	PF01751	Toprim domain	433	538	5.4E-16	T	21-03-2019	IPR006171	TOPRIM  domain
MAG076_10_62	998d725430ef6140eba7b54e73f6f138	651	Pfam	PF00204	DNA gyrase B	236	404	4.4E-60	T	21-03-2019	IPR013506	DNA topoisomerase, type IIA, subunit B, domain 2
MAG076_10_62	998d725430ef6140eba7b54e73f6f138	651	Pfam	PF00986	DNA gyrase B subunit, carboxyl terminus	579	640	7.9E-29	T	21-03-2019	IPR002288	DNA gyrase B subunit, C-terminal
MAG076_10_62	998d725430ef6140eba7b54e73f6f138	651	Pfam	PF02518	Histidine kinase-, DNA gyrase B-, and HSP90-like ATPase	46	188	4.0E-23	T	21-03-2019	IPR003594	Histidine kinase/HSP90-like ATPase
MAG076_57_8	26b8b3fe77616488ea5c09119fa58187	435	TIGRFAM	TIGR00089	TIGR00089: radical SAM methylthiotransferase, MiaB/RimO family	2	427	1.6E-119	T	21-03-2019	IPR005839	Methylthiotransferase
MAG076_57_8	26b8b3fe77616488ea5c09119fa58187	435	TIGRFAM	TIGR01579	MiaB-like-C: MiaB-like tRNA modifying enzyme	5	417	8.2E-125	T	21-03-2019	IPR006467	MiaB-like tRNA modifying enzyme
MAG076_57_8	26b8b3fe77616488ea5c09119fa58187	435	Pfam	PF00919	Uncharacterized protein family UPF0004	2	87	2.3E-21	T	21-03-2019	IPR013848	Methylthiotransferase, N-terminal
MAG076_57_8	26b8b3fe77616488ea5c09119fa58187	435	Pfam	PF04055	Radical SAM superfamily	151	317	9.7E-23	T	21-03-2019	IPR007197	Radical SAM
MAG076_20_23	21e3fa9364a1c4d2b872afe7a848b717	258	TIGRFAM	TIGR00486	YbgI_SA1388: dinuclear metal center protein, YbgI/SA1388 family	4	250	2.1E-53	T	21-03-2019	IPR002678	GTP cyclohydrolase 1 type 2/Nif3
MAG076_20_23	21e3fa9364a1c4d2b872afe7a848b717	258	Pfam	PF01784	NIF3 (NGG1p interacting factor 3)	7	242	4.8E-67	T	21-03-2019	IPR002678	GTP cyclohydrolase 1 type 2/Nif3
MAG076_16_44	6c3b81557e61166680ef15ef87c3dc58	400	Pfam	PF10112	5-bromo-4-chloroindolyl phosphate hydrolysis protein	275	381	2.8E-15	T	21-03-2019	IPR018770	5-bromo-4-chloroindolyl phosphate hydrolysis protein
MAG076_24_31	468afe2af5253aa856025faf9c808261	242	Pfam	PF07729	FCD domain	107	228	5.9E-23	T	21-03-2019	IPR011711	GntR, C-terminal
MAG076_24_31	468afe2af5253aa856025faf9c808261	242	Pfam	PF00392	Bacterial regulatory proteins, gntR family	21	82	8.2E-19	T	21-03-2019	IPR000524	Transcription regulator HTH, GntR
MAG076_5_26	731b3ec14f3d27a6730a83283b0ee736	360	Pfam	PF07683	Cobalamin synthesis protein cobW C-terminal domain	272	357	8.6E-7	T	21-03-2019	IPR011629	Cobalamin (vitamin B12) biosynthesis CobW-like, C-terminal
MAG076_5_26	731b3ec14f3d27a6730a83283b0ee736	360	Pfam	PF02492	CobW/HypB/UreG, nucleotide-binding domain	6	179	1.2E-34	T	21-03-2019	IPR003495	CobW/HypB/UreG, nucleotide-binding domain
MAG076_117_3	9e1df2f4934e61b68ad76861eb723f1d	336	Pfam	PF02534	Type IV secretory system Conjugative DNA transfer	134	335	2.2E-23	T	21-03-2019	IPR003688	Type IV secretion system protein TraG/VirD4
MAG076_2_30	b67edf802bcb8f7d4786d2e397fedd19	396	Pfam	PF12704	MacB-like periplasmic core domain	21	233	1.5E-36	T	21-03-2019	IPR025857	MacB-like periplasmic core domain
MAG076_2_30	b67edf802bcb8f7d4786d2e397fedd19	396	Pfam	PF02687	FtsX-like permease family	296	389	3.6E-15	T	21-03-2019	IPR003838	ABC transporter permease protein domain
MAG076_31_6	08ff9dc41502a58f0a6ffa4f7bfaa163	393	Pfam	PF00155	Aminotransferase class I and II	34	382	1.3E-47	T	21-03-2019	IPR004839	Aminotransferase, class I/classII
MAG076_12_53	a229ff9e36b15453d183d5fa9d9972b6	228	Pfam	PF00006	ATP synthase alpha/beta family, nucleotide-binding domain	1	105	5.9E-31	T	21-03-2019	IPR000194	ATPase, F1/V1/A1 complex, alpha/beta subunit, nucleotide-binding domain
MAG076_12_22	48fa1bfa721b19ab3f594e1962fdfc18	126	Pfam	PF03965	Penicillinase repressor	6	119	2.9E-29	T	21-03-2019	IPR005650	BlaI transcriptional regulatory family
MAG076_9_46	66d4ac858a2727429cd363a67fcf4f9a	274	TIGRFAM	TIGR01697	PNPH-PUNA-XAPA: inosine/guanosine/xanthosine phosphorylase family	25	269	4.4E-94	T	21-03-2019	IPR011268	Purine nucleoside phosphorylase
MAG076_9_46	66d4ac858a2727429cd363a67fcf4f9a	274	Pfam	PF01048	Phosphorylase superfamily	26	272	2.3E-47	T	21-03-2019	IPR000845	Nucleoside phosphorylase domain
MAG076_9_46	66d4ac858a2727429cd363a67fcf4f9a	274	TIGRFAM	TIGR01700	PNPH: purine nucleoside phosphorylase I, inosine and guanosine-specific	25	269	8.9E-96	T	21-03-2019	IPR011270	Purine nucleoside phosphorylase I, inosine/guanosine-specific
MAG076_7_17	263e21f0c16dee038aa5a97de1e44b7f	349	TIGRFAM	TIGR01205	D_ala_D_alaTIGR: D-alanine--D-alanine ligase	2	341	4.5E-85	T	21-03-2019	IPR005905	D-alanine--D-alanine ligase
MAG076_7_17	263e21f0c16dee038aa5a97de1e44b7f	349	Pfam	PF07478	D-ala D-ala ligase C-terminus	161	339	1.3E-49	T	21-03-2019	IPR011095	D-alanine--D-alanine ligase, C-terminal
MAG076_7_17	263e21f0c16dee038aa5a97de1e44b7f	349	Pfam	PF01820	D-ala D-ala ligase N-terminus	2	129	3.9E-22	T	21-03-2019	IPR011127	D-alanine--D-alanine ligase, N-terminal domain
MAG076_18_9	767641b868cffe80ed36939164d55aaa	219	Pfam	PF00027	Cyclic nucleotide-binding domain	28	116	9.5E-9	T	21-03-2019	IPR000595	Cyclic nucleotide-binding domain
MAG076_18_9	767641b868cffe80ed36939164d55aaa	219	Pfam	PF13545	Crp-like helix-turn-helix domain	150	216	4.5E-16	T	21-03-2019	IPR012318	Crp-type HTH domain
MAG076_11_43	819075b5f337e47b9d6b5bbfc358403f	696	Pfam	PF17191	RecG wedge domain	14	169	7.8E-27	T	21-03-2019	IPR033454	RecG, wedge domain
