MAG092_75_6	dba0d78eb4deba7e2f35223159756180	342	Pfam	PF00793	DAHP synthetase I family	37	333	9.7E-48	T	21-03-2019	IPR006218	DAHP synthetase I/KDSA
MAG092_65_9	71ff593705497c67283363059c9e6e5c	240	Pfam	PF00005	ABC transporter	19	159	2.4E-30	T	21-03-2019	IPR003439	ABC transporter-like
MAG092_79_3	9af82e4f745f060a16fee43bc4584e7c	286	Pfam	PF12822	ECF transporter, substrate-specific component	8	259	7.3E-32	T	21-03-2019	IPR024529	ECF transporter, substrate-specific component
MAG092_137_4	4e50f7cbcbb032f352d36b4535e0a88d	309	Pfam	PF08546	Ketopantoate reductase PanE/ApbA C terminal	183	301	6.4E-21	T	21-03-2019	IPR013752	Ketopantoate reductase, C-terminal domain
MAG092_137_4	4e50f7cbcbb032f352d36b4535e0a88d	309	Pfam	PF02558	Ketopantoate reductase PanE/ApbA	7	153	2.1E-26	T	21-03-2019	IPR013332	Ketopantoate reductase, N-terminal domain
MAG092_137_4	4e50f7cbcbb032f352d36b4535e0a88d	309	TIGRFAM	TIGR00745	apbA_panE: 2-dehydropantoate 2-reductase	5	304	4.8E-53	T	21-03-2019	IPR003710	Ketopantoate reductase ApbA/PanE
MAG092_163_3	ba605f6e6f6666d11e370a9ea30534df	480	Pfam	PF14501	GHKL domain	365	471	8.1E-20	T	21-03-2019	IPR032834	Sensor histidine kinase NatK, C-terminal domain
MAG092_143_3	c18b1f105b8957ca7051e5817017bd30	347	TIGRFAM	TIGR03723	T6A_TsaD_YgjD: tRNA threonylcarbamoyl adenosine modification protein TsaD	14	326	2.3E-135	T	21-03-2019	IPR022450	tRNA N6-adenosine threonylcarbamoyltransferase, TsaD
MAG092_143_3	c18b1f105b8957ca7051e5817017bd30	347	TIGRFAM	TIGR00329	gcp_kae1: metallohydrolase, glycoprotease/Kae1 family	15	319	4.2E-110	T	21-03-2019	IPR017861	Kae1/TsaD family
MAG092_143_3	c18b1f105b8957ca7051e5817017bd30	347	Pfam	PF00814	Glycoprotease family	34	319	3.1E-102	T	21-03-2019	IPR000905	Gcp-like domain
MAG092_27_11	27dc8dd00be552719f38e61bfe4f2238	118	Pfam	PF00453	Ribosomal protein L20	3	109	8.0E-46	T	21-03-2019	IPR005813	Ribosomal protein L20
MAG092_27_11	27dc8dd00be552719f38e61bfe4f2238	118	TIGRFAM	TIGR01032	rplT_bact: ribosomal protein bL20	1	114	6.2E-46	T	21-03-2019	IPR005813	Ribosomal protein L20
MAG092_76_6	ec400b523b281d4c6c654773c31db048	449	Pfam	PF01609	Transposase DDE domain	152	392	8.4E-15	T	21-03-2019	IPR002559	Transposase, IS4-like
MAG092_76_6	ec400b523b281d4c6c654773c31db048	449	Pfam	PF13808	DDE_Tnp_1-associated	43	123	7.3E-23	T	21-03-2019	IPR032806	H repeat-associated protein, N-terminal
MAG092_27_23	1c17df6b97627ee8ada28d38947d66c3	1393	Pfam	PF00271	Helicase conserved C-terminal domain	262	358	8.6E-14	T	21-03-2019	IPR001650	Helicase, C-terminal
MAG092_27_23	1c17df6b97627ee8ada28d38947d66c3	1393	Pfam	PF08494	DEAD/H associated	617	803	3.2E-46	T	21-03-2019	IPR013701	DEAD/H associated
MAG092_27_23	1c17df6b97627ee8ada28d38947d66c3	1393	Pfam	PF00270	DEAD/DEAH box helicase	29	205	5.2E-27	T	21-03-2019	IPR011545	DEAD/DEAH box helicase domain
MAG092_69_16	ab3f3c7ecdfd10fee2340504cb4f363b	246	Pfam	PF04452	RNA methyltransferase	17	242	9.5E-69	T	21-03-2019	IPR006700	Ribosomal RNA small subunit methyltransferase E
MAG092_69_16	ab3f3c7ecdfd10fee2340504cb4f363b	246	TIGRFAM	TIGR00046	TIGR00046: RNA methyltransferase, RsmE family	2	245	4.5E-61	T	21-03-2019	IPR006700	Ribosomal RNA small subunit methyltransferase E
MAG092_7_5	3cc42b396f31d2c6dec9086c9db4d8ef	97	TIGRFAM	TIGR00135	gatC: aspartyl/glutamyl-tRNA(Asn/Gln) amidotransferase, C subunit	5	95	1.4E-23	T	21-03-2019	IPR003837	Glu-tRNAGln amidotransferase C subunit
MAG092_7_5	3cc42b396f31d2c6dec9086c9db4d8ef	97	Pfam	PF02686	Glu-tRNAGln amidotransferase C subunit	22	91	7.9E-20	T	21-03-2019	IPR003837	Glu-tRNAGln amidotransferase C subunit
MAG092_110_4	7c242968893dc8d0fd48e1549bb7c0df	312	Pfam	PF02780	Transketolase, C-terminal domain	184	304	7.5E-38	T	21-03-2019	IPR033248	Transketolase, C-terminal domain
MAG092_110_4	7c242968893dc8d0fd48e1549bb7c0df	312	Pfam	PF02779	Transketolase, pyrimidine binding domain	5	170	1.8E-39	T	21-03-2019	IPR005475	Transketolase-like, pyrimidine-binding domain
MAG092_114_9	41c58580b459f37da19b31dabab779e9	232	TIGRFAM	TIGR02585	cas_Cst2_DevR: CRISPR-associated protein Cas7/Cst2/DevR, subtype I-B/TNEAP	8	226	6.8E-56	T	21-03-2019	IPR013414	CRISPR-associated protein Cas7,  subtype I-B/Tneap
MAG092_114_9	41c58580b459f37da19b31dabab779e9	232	Pfam	PF01905	CRISPR-associated negative auto-regulator DevR/Csa2	86	216	4.2E-12	T	21-03-2019	IPR010154	CRISPR-associated protein Cas7/Cst2/DevR
MAG092_114_9	41c58580b459f37da19b31dabab779e9	232	TIGRFAM	TIGR01875	cas_MJ0381: CRISPR-associated autoregulator DevR family	6	226	4.9E-46	T	21-03-2019	IPR010154	CRISPR-associated protein Cas7/Cst2/DevR
MAG092_83_11	df4ac1cf399403ce02a3f34a67a7ee46	505	Pfam	PF06964	Alpha-L-arabinofuranosidase C-terminal domain	307	498	2.6E-42	T	21-03-2019	IPR010720	Alpha-L-arabinofuranosidase, C-terminal
MAG092_263_2	60f2798b5495829aa8c1779b541a2d24	258	Pfam	PF02518	Histidine kinase-, DNA gyrase B-, and HSP90-like ATPase	194	253	1.8E-7	T	21-03-2019	IPR003594	Histidine kinase/HSP90-like ATPase
MAG092_263_2	60f2798b5495829aa8c1779b541a2d24	258	Pfam	PF00512	His Kinase A (phospho-acceptor) domain	82	139	1.7E-7	T	21-03-2019	IPR003661	Signal transduction histidine kinase, dimerisation/phosphoacceptor domain
MAG092_86_5	d093953a6c8908f96eae86cedf83dfa6	298	Pfam	PF00924	Mechanosensitive ion channel	83	280	2.7E-50	T	21-03-2019	IPR006685	Mechanosensitive ion channel MscS
MAG092_161_12	16b272d2c793361f90a1b084aad89e50	54	Pfam	PF14501	GHKL domain	2	35	5.8E-6	T	21-03-2019	IPR032834	Sensor histidine kinase NatK, C-terminal domain
MAG092_46_20	5900e54e473f9a161cb83a3c261c9a8e	140	Pfam	PF06271	RDD family	6	115	7.9E-11	T	21-03-2019	IPR010432	RDD
MAG092_126_9	4c8acb762780563338f5d36268461d50	973	Pfam	PF08367	Peptidase M16C associated	463	712	2.2E-70	T	21-03-2019	IPR013578	Peptidase M16C associated
MAG092_126_9	4c8acb762780563338f5d36268461d50	973	Pfam	PF05193	Peptidase M16 inactive domain	204	387	2.1E-10	T	21-03-2019	IPR007863	Peptidase M16, C-terminal
MAG092_126_9	4c8acb762780563338f5d36268461d50	973	Pfam	PF00675	Insulinase (Peptidase family M16)	51	153	6.7E-10	T	21-03-2019	IPR011765	Peptidase M16, N-terminal
MAG092_12_31	95974b1a8539fdd376d6bda6927a8654	484	Pfam	PF16173	Domain of unknown function (DUF4874)	51	214	1.2E-44	T	21-03-2019	IPR032379	Domain of unknown function DUF4874
MAG092_12_31	95974b1a8539fdd376d6bda6927a8654	484	Pfam	PF16116	Domain of unknown function (DUF4832)	237	457	3.6E-52	T	21-03-2019	IPR032267	Domain of unknown function DUF4832
MAG092_190_3	4384f38854018554b9d6a50e140ba1ba	256	Pfam	PF06182	ABC-2 family transporter protein	58	255	4.2E-18	T	21-03-2019	IPR010390	Protein of unknown function DUF990
MAG092_100_5	9442906682f949d0358b69f807c6a532	85	Pfam	PF12116	Stage III sporulation protein D	2	82	5.8E-42	T	21-03-2019	IPR014208	Sporulation stage III, transcriptional regulator SpoIIID
MAG092_100_5	9442906682f949d0358b69f807c6a532	85	TIGRFAM	TIGR02844	spore_III_D: sporulation transcriptional regulator SpoIIID	2	80	3.7E-39	T	21-03-2019	IPR014208	Sporulation stage III, transcriptional regulator SpoIIID
MAG092_71_14	bbe285b8894b650282dfb1ec4ede337f	473	Pfam	PF12631	MnmE helical domain	134	470	5.0E-53	T	21-03-2019	IPR025867	MnmE, helical domain
MAG092_71_14	bbe285b8894b650282dfb1ec4ede337f	473	TIGRFAM	TIGR00450	mnmE_trmE_thdF: tRNA modification GTPase TrmE	10	473	5.0E-117	T	21-03-2019	IPR004520	tRNA modification GTPase MnmE
MAG092_71_14	bbe285b8894b650282dfb1ec4ede337f	473	Pfam	PF10396	GTP-binding protein TrmE N-terminus	5	131	2.5E-39	T	21-03-2019	IPR018948	GTP-binding protein TrmE, N-terminal
MAG092_71_14	bbe285b8894b650282dfb1ec4ede337f	473	TIGRFAM	TIGR00231	small_GTP: small GTP-binding protein domain	228	390	3.9E-24	T	21-03-2019	IPR005225	Small GTP-binding protein domain
MAG092_71_14	bbe285b8894b650282dfb1ec4ede337f	473	Pfam	PF01926	50S ribosome-binding GTPase	230	342	1.3E-23	T	21-03-2019	IPR006073	GTP binding domain
MAG092_5_37	ae5ccaf0634a8a3cb4f29c7b3511d7ef	469	Pfam	PF02397	Bacterial sugar transferase	282	461	2.4E-70	T	21-03-2019	IPR003362	Bacterial sugar transferase
MAG092_5_37	ae5ccaf0634a8a3cb4f29c7b3511d7ef	469	Pfam	PF13727	CoA-binding domain	69	245	2.4E-28	T	21-03-2019
MAG092_5_37	ae5ccaf0634a8a3cb4f29c7b3511d7ef	469	TIGRFAM	TIGR03023	WcaJ_sugtrans: undecaprenyl-phosphate glucose phosphotransferase	16	469	4.5E-152	T	21-03-2019	IPR017473	Undecaprenyl-phosphate glucose phosphotransferase, WcaJ
MAG092_5_37	ae5ccaf0634a8a3cb4f29c7b3511d7ef	469	TIGRFAM	TIGR03025	EPS_sugtrans: exopolysaccharide biosynthesis polyprenyl glycosylphosphotransferase	16	469	2.2E-137	T	21-03-2019	IPR017475	Exopolysaccharide biosynthesis polyprenyl glycosylphosphotransferase
MAG092_175_4	c2898e4120aa5cc37b5bff472c8f6a01	103	Pfam	PF01906	Putative heavy-metal-binding	1	101	4.8E-36	T	21-03-2019	IPR002765	Uncharacterised protein family UPF0145
MAG092_12_13	52ba445f0a30a20a7a175db683496704	422	Pfam	PF13347	MFS/sugar transport protein	18	340	2.8E-22	T	21-03-2019
MAG092_18_20	7241438b8e7413903f6f45aeea95d993	768	Pfam	PF13802	Galactose mutarotase-like	155	213	4.9E-14	T	21-03-2019	IPR025887	Glycoside hydrolase family 31, N-terminal domain
MAG092_18_20	7241438b8e7413903f6f45aeea95d993	768	Pfam	PF01055	Glycosyl hydrolases family 31	237	664	2.0E-116	T	21-03-2019	IPR000322	Glycoside hydrolase family 31
MAG092_68_8	81742ec418ab41ba2865a9ede80ff5c8	307	Pfam	PF00528	Binding-protein-dependent transport system inner membrane component	94	297	1.0E-17	T	21-03-2019	IPR000515	ABC transporter type 1, transmembrane domain MetI-like
MAG092_132_9	4902b0f90e471d1a4d9e817cafa76d41	149	TIGRFAM	TIGR00022	TIGR00022: YhcH/YjgK/YiaL family protein	1	148	6.7E-32	T	21-03-2019	IPR004375	YhcH/YjgK/YiaL family
MAG092_132_9	4902b0f90e471d1a4d9e817cafa76d41	149	Pfam	PF04074	Domain of unknown function (DUF386)	1	148	5.3E-41	T	21-03-2019	IPR004375	YhcH/YjgK/YiaL family
MAG092_102_11	97f8eec1302a3a1f5654feba1974aa7f	803	Pfam	PF00004	ATPase family associated with various cellular activities (AAA)	374	511	2.2E-22	T	21-03-2019	IPR003959	ATPase, AAA-type, core
MAG092_102_11	97f8eec1302a3a1f5654feba1974aa7f	803	Pfam	PF05362	Lon protease (S16) C-terminal proteolytic domain	601	801	7.7E-89	T	21-03-2019	IPR008269	Peptidase S16, Lon proteolytic domain
MAG092_102_11	97f8eec1302a3a1f5654feba1974aa7f	803	TIGRFAM	TIGR00763	lon: endopeptidase La	35	801	8.1E-277	T	21-03-2019	IPR004815	Lon protease, bacterial/eukaryotic-type
MAG092_102_11	97f8eec1302a3a1f5654feba1974aa7f	803	Pfam	PF02190	ATP-dependent protease La (LON) substrate-binding domain	32	224	1.6E-23	T	21-03-2019	IPR003111	Lon, substrate-binding domain
MAG092_44_18	e7d65bec4460dd173612d89773f6dbec	398	Pfam	PF02837	Glycosyl hydrolases family 2, sugar binding domain	45	129	4.0E-13	T	21-03-2019	IPR006104	Glycosyl hydrolases family 2, sugar binding domain
MAG092_44_18	e7d65bec4460dd173612d89773f6dbec	398	Pfam	PF00703	Glycosyl hydrolases family 2	228	322	3.8E-10	T	21-03-2019	IPR006102	Glycoside hydrolase, family 2, immunoglobulin-like beta-sandwich
MAG092_35_5	846e91a9656a5e00a89d589b9831515a	209	TIGRFAM	TIGR00023	TIGR00023: acyl-phosphate glycerol 3-phosphate acyltransferase	1	200	4.5E-44	T	21-03-2019	IPR003811	Glycerol-3-phosphate acyltransferase, PlsY
MAG092_35_5	846e91a9656a5e00a89d589b9831515a	209	Pfam	PF02660	Glycerol-3-phosphate acyltransferase	2	192	5.4E-48	T	21-03-2019	IPR003811	Glycerol-3-phosphate acyltransferase, PlsY
MAG092_95_9	ca33c83e7a273bdbfc101ca6eb788820	159	Pfam	PF02590	Predicted SPOUT methyltransferase	1	158	3.5E-58	T	21-03-2019	IPR003742	RNA methyltransferase RlmH
MAG092_95_9	ca33c83e7a273bdbfc101ca6eb788820	159	TIGRFAM	TIGR00246	tRNA_RlmH_YbeA: rRNA large subunit m3Psi methyltransferase RlmH	2	159	1.1E-47	T	21-03-2019	IPR003742	RNA methyltransferase RlmH
MAG092_74_7	9e3748f91b2759d0abbbf95b36a0f5eb	448	Pfam	PF02812	Glu/Leu/Phe/Val dehydrogenase, dimerisation domain	55	183	1.2E-51	T	21-03-2019	IPR006097	Glutamate/phenylalanine/leucine/valine dehydrogenase, dimerisation domain
MAG092_74_7	9e3748f91b2759d0abbbf95b36a0f5eb	448	Pfam	PF00208	Glutamate/Leucine/Phenylalanine/Valine dehydrogenase	200	446	3.2E-88	T	21-03-2019	IPR006096	Glutamate/phenylalanine/leucine/valine dehydrogenase, C-terminal
MAG092_179_4	d5b9d571745f5206d980e078963409f4	189	Pfam	PF13612	Transposase DDE domain	36	144	9.1E-16	T	21-03-2019	IPR025668	Transposase DDE domain
MAG092_238_1	f97195e6dc4ebb1bd15bd096de933325	423	Pfam	PF14501	GHKL domain	321	422	7.0E-24	T	21-03-2019	IPR032834	Sensor histidine kinase NatK, C-terminal domain
MAG092_66_2	e1b00fa063feb0fae11114a7e3c85648	334	Pfam	PF04519	Polymer-forming cytoskeletal	226	314	4.7E-17	T	21-03-2019	IPR007607	Bactofilin A/B
MAG092_155_4	b2a3e1bd6c4d7d8752a6d1393bbecd44	438	TIGRFAM	TIGR01945	rnfC: electron transport complex, RnfABCDGE type, C subunit	5	431	3.8E-152	T	21-03-2019	IPR010208	Ion-translocating oxidoreductase complex, subunit RnfC/RsxC
MAG092_155_4	b2a3e1bd6c4d7d8752a6d1393bbecd44	438	Pfam	PF13375	RnfC Barrel sandwich hybrid domain	5	103	2.5E-40	T	21-03-2019	IPR026902	RnfC Barrel sandwich hybrid domain
MAG092_155_4	b2a3e1bd6c4d7d8752a6d1393bbecd44	438	Pfam	PF01512	Respiratory-chain NADH dehydrogenase 51 Kd subunit	128	274	2.8E-48	T	21-03-2019	IPR011538	NADH-ubiquinone oxidoreductase 51kDa subunit, FMN-binding domain
MAG092_155_4	b2a3e1bd6c4d7d8752a6d1393bbecd44	438	Pfam	PF10531	SLBB domain	286	334	1.3E-12	T	21-03-2019	IPR019554	Soluble ligand binding domain
MAG092_155_4	b2a3e1bd6c4d7d8752a6d1393bbecd44	438	Pfam	PF00037	4Fe-4S binding domain	363	377	5.2E-5	T	21-03-2019	IPR017896	4Fe-4S ferredoxin-type, iron-sulphur binding domain
MAG092_87_5	f8504cf627f5c5de5a400587d441c94b	61	Pfam	PF06289	Flagellar protein (FlbD)	1	59	5.7E-23	T	21-03-2019	IPR009384	Swarming motility protein SwrD-like
MAG092_73_3	ef07257ca30152d6b1fa18bb343d37a7	172	Pfam	PF14277	Domain of unknown function (DUF4364)	10	171	7.7E-58	T	21-03-2019	IPR025374	Protein of unknown function DUF4364
MAG092_25_16	83c86e2573938d0a7b6fd5d0fda79694	265	Pfam	PF00535	Glycosyl transferase family 2	5	163	3.7E-19	T	21-03-2019	IPR001173	Glycosyltransferase 2-like
MAG092_24_20	0af5c12e0457f442c88b8cb00ac86e56	468	Pfam	PF01547	Bacterial extracellular solute-binding protein	92	365	2.6E-23	T	21-03-2019	IPR006059	Bacterial extracellular solute-binding protein
MAG092_22_10	c26673e5e00bb7a06ed69b086f3bd842	197	Pfam	PF00163	Ribosomal protein S4/S9 N-terminal domain	7	86	5.1E-21	T	21-03-2019	IPR001912	Ribosomal protein S4/S9, N-terminal
MAG092_22_10	c26673e5e00bb7a06ed69b086f3bd842	197	TIGRFAM	TIGR01017	rpsD_bact: ribosomal protein uS4	32	197	1.7E-67	T	21-03-2019	IPR005709	Ribosomal protein S4, bacterial-type
MAG092_22_10	c26673e5e00bb7a06ed69b086f3bd842	197	Pfam	PF01479	S4 domain	88	134	1.2E-18	T	21-03-2019	IPR002942	RNA-binding S4 domain
MAG092_83_5	1ca270bef1c7a4575c6aa6f822f4ce19	431	TIGRFAM	TIGR00835	agcS: amino acid carrier protein	12	430	2.7E-125	T	21-03-2019	IPR001463	Sodium:alanine symporter
MAG092_83_5	1ca270bef1c7a4575c6aa6f822f4ce19	431	Pfam	PF01235	Sodium:alanine symporter family	49	429	9.3E-116	T	21-03-2019	IPR001463	Sodium:alanine symporter
MAG092_38_3	7774a1e2e027d12ffe1631a7e28e52f7	169	TIGRFAM	TIGR01162	purE: phosphoribosylaminoimidazole carboxylase, catalytic subunit	4	158	1.1E-66	T	21-03-2019	IPR000031	PurE domain
MAG092_38_3	7774a1e2e027d12ffe1631a7e28e52f7	169	Pfam	PF00731	AIR carboxylase	3	149	4.7E-66	T	21-03-2019	IPR000031	PurE domain
MAG092_34_21	63e58a334c81781901442f12521e55e4	365	Pfam	PF00294	pfkB family carbohydrate kinase	16	346	1.5E-21	T	21-03-2019	IPR011611	Carbohydrate kinase PfkB
MAG092_22_22	d39f2428c5d0ecc5aa9b9fee67d681b3	122	Pfam	PF00861	Ribosomal L18 of archaea, bacteria, mitoch. and chloroplast	6	122	7.8E-47	T	21-03-2019	IPR005484	Ribosomal protein L18
MAG092_22_22	d39f2428c5d0ecc5aa9b9fee67d681b3	122	TIGRFAM	TIGR00060	L18_bact: ribosomal protein uL18	7	122	9.6E-41	T	21-03-2019	IPR004389	Ribosomal protein L18, bacterial-type
MAG092_54_12	344c66c64625eaf17482e7d89d7dd7b7	318	Pfam	PF13302	Acetyltransferase (GNAT) domain	147	286	5.5E-23	T	21-03-2019	IPR000182	GNAT domain
MAG092_21_22	d79d8627d50be83b747dbbbf0293ebb2	93	TIGRFAM	TIGR03824	FlgM_jcvi: flagellar biosynthesis anti-sigma factor FlgM	16	87	2.2E-14	T	21-03-2019	IPR007412	Anti-sigma-28 factor, FlgM
MAG092_21_22	d79d8627d50be83b747dbbbf0293ebb2	93	Pfam	PF04316	Anti-sigma-28 factor, FlgM	31	84	5.6E-18	T	21-03-2019	IPR031316	Anti-sigma-28 factor FlgM, C-terminal
MAG092_96_6	eb4694e98686d51296626ad77b3a5952	590	Pfam	PF00005	ABC transporter	368	516	6.2E-35	T	21-03-2019	IPR003439	ABC transporter-like
MAG092_96_6	eb4694e98686d51296626ad77b3a5952	590	Pfam	PF00664	ABC transporter transmembrane region	32	303	9.7E-38	T	21-03-2019	IPR011527	ABC transporter type 1, transmembrane domain
MAG092_22_27	7585bfed113a240e47173a3c06efb6ae	103	Pfam	PF00467	KOW motif	8	39	5.8E-9	T	21-03-2019	IPR005824	KOW
MAG092_22_27	7585bfed113a240e47173a3c06efb6ae	103	TIGRFAM	TIGR01079	rplX_bact: ribosomal protein uL24	4	102	2.1E-36	T	21-03-2019	IPR003256	Ribosomal protein L24
MAG092_22_27	7585bfed113a240e47173a3c06efb6ae	103	Pfam	PF17136	Ribosomal proteins 50S L24/mitochondrial 39S L24	41	102	3.5E-26	T	21-03-2019	IPR003256	Ribosomal protein L24
MAG092_121_7	327f765837373db6e004ff4c0d36f860	434	Pfam	PF14501	GHKL domain	328	431	1.1E-27	T	21-03-2019	IPR032834	Sensor histidine kinase NatK, C-terminal domain
MAG092_43_28	635e88cf1efa054c0985614086a3d5a5	881	Pfam	PF05592	Bacterial alpha-L-rhamnosidase concanavalin-like domain	260	355	3.1E-23	T	21-03-2019	IPR008902	Alpha-L-rhamnosidase, concanavalin-like domain
MAG092_43_28	635e88cf1efa054c0985614086a3d5a5	881	Pfam	PF17389	Bacterial alpha-L-rhamnosidase 6 hairpin glycosidase domain	361	704	3.2E-105	T	21-03-2019	IPR035396	Alpha-L-rhamnosidase, six-hairpin glycosidase domain
MAG092_43_28	635e88cf1efa054c0985614086a3d5a5	881	Pfam	PF08531	Alpha-L-rhamnosidase N-terminal domain	82	224	7.6E-34	T	21-03-2019	IPR013737	Bacterial alpha-L-rhamnosidase N-terminal
MAG092_43_28	635e88cf1efa054c0985614086a3d5a5	881	Pfam	PF17390	Bacterial alpha-L-rhamnosidase C-terminal domain	707	778	2.0E-12	T	21-03-2019	IPR035398	Alpha-L-rhamnosidase C-terminal domain
MAG092_87_4	2ee226d1365a6ec5b50e4ba1737a1d25	670	TIGRFAM	TIGR03506	FlgEFG_subfam: flagellar hook-basal body protein	4	651	2.5E-61	T	21-03-2019	IPR020013	Flagellar hook-basal body protein, FlgE/F/G
MAG092_87_4	2ee226d1365a6ec5b50e4ba1737a1d25	670	Pfam	PF06429	Flagellar basal body rod FlgEFG protein C-terminal	588	668	1.2E-21	T	21-03-2019	IPR010930	Flagellar basal-body/hook protein, C-terminal domain
MAG092_87_4	2ee226d1365a6ec5b50e4ba1737a1d25	670	Pfam	PF00460	Flagella basal body rod protein	8	35	1.4E-8	T	21-03-2019	IPR001444	Flagellar basal body rod protein, N-terminal
MAG092_112_2	7ea84a5b43ae817610646ec179d0e396	402	Pfam	PF01381	Helix-turn-helix	39	93	1.7E-13	T	21-03-2019	IPR001387	Cro/C1-type helix-turn-helix domain
MAG092_1_55	1c10efe3c66ed3504c836895a00079a1	117	Pfam	PF03965	Penicillinase repressor	6	116	1.0E-20	T	21-03-2019	IPR005650	BlaI transcriptional regulatory family
MAG092_23_8	49498b79282a853266a1f17bed8a9657	716	Pfam	PF13361	UvrD-like helicase C-terminal domain	546	615	2.7E-21	T	21-03-2019	IPR014017	UvrD-like DNA helicase, C-terminal
MAG092_23_8	49498b79282a853266a1f17bed8a9657	716	Pfam	PF00580	UvrD/REP helicase N-terminal domain	14	277	1.3E-54	T	21-03-2019	IPR034739	UvrD/AddA helicase, N-terminal
MAG092_23_8	49498b79282a853266a1f17bed8a9657	716	Pfam	PF13361	UvrD-like helicase C-terminal domain	285	427	6.8E-13	T	21-03-2019	IPR014017	UvrD-like DNA helicase, C-terminal
MAG092_203_3	0a2542c4530ef4153b50372f390feceb	593	Pfam	PF03485	Arginyl tRNA synthetase N terminal domain	4	86	1.5E-14	T	21-03-2019	IPR005148	Arginyl tRNA synthetase N-terminal domain
MAG092_203_3	0a2542c4530ef4153b50372f390feceb	593	Pfam	PF05746	DALR anticodon binding domain	475	593	1.4E-27	T	21-03-2019	IPR008909	DALR anticodon binding
MAG092_203_3	0a2542c4530ef4153b50372f390feceb	593	TIGRFAM	TIGR00456	argS: arginine--tRNA ligase	4	593	5.6E-128	T	21-03-2019	IPR001278	Arginine-tRNA ligase
MAG092_203_3	0a2542c4530ef4153b50372f390feceb	593	Pfam	PF00750	tRNA synthetases class I (R)	111	460	5.0E-86	T	21-03-2019	IPR035684	Arginyl-tRNA synthetase, catalytic core domain
MAG092_13_16	961dc9d37769d209b8d9f7aa2877cf4d	320	Pfam	PF01368	DHH family	14	155	3.5E-14	T	21-03-2019	IPR001667	DDH domain
MAG092_13_16	961dc9d37769d209b8d9f7aa2877cf4d	320	Pfam	PF02272	DHHA1 domain	234	299	8.2E-9	T	21-03-2019	IPR003156	DHHA1 domain
MAG092_148_8	d0078c6af4c76d62534680e09fb5acd5	199	TIGRFAM	TIGR00277	HDIG: HDIG domain	20	102	2.1E-8	T	21-03-2019	IPR006675	HDIG domain
MAG092_148_8	d0078c6af4c76d62534680e09fb5acd5	199	Pfam	PF01966	HD domain	21	135	3.5E-17	T	21-03-2019	IPR006674	HD domain
MAG092_148_8	d0078c6af4c76d62534680e09fb5acd5	199	TIGRFAM	TIGR00488	TIGR00488: putative HD superfamily hydrolase	14	184	4.8E-40	T	21-03-2019	IPR005249	Conserved hypothetical protein CHP00488
MAG092_30_14	39853dfb2b6e5ec074fe1572652747f3	308	Pfam	PF01531	Glycosyl transferase family 11	116	282	1.9E-27	T	21-03-2019	IPR002516	Glycosyl transferase, family 11
MAG092_27_13	3cf9a4fc7aa25502d9d3f754fe51ca12	142	TIGRFAM	TIGR00051	TIGR00051: acyl-CoA thioester hydrolase, YbgC/YbaW family	9	111	7.1E-21	T	21-03-2019	IPR006684	Acyl-CoA thioester hydrolase YbgC/YbaW family
MAG092_27_13	3cf9a4fc7aa25502d9d3f754fe51ca12	142	Pfam	PF13279	Thioesterase-like superfamily	12	124	2.4E-12	T	21-03-2019
MAG092_22_28	5b20f13d6a4de249fbfa2c92b8475790	122	Pfam	PF00238	Ribosomal protein L14p/L23e	1	122	9.8E-55	T	21-03-2019	IPR000218	Ribosomal protein L14P
MAG092_22_28	5b20f13d6a4de249fbfa2c92b8475790	122	TIGRFAM	TIGR01067	rplN_bact: ribosomal protein uL14	1	122	1.0E-57	T	21-03-2019	IPR005745	Ribosomal protein L14P, bacterial-type
MAG092_66_1	7bea0aa0f890e668b846638d01c46fad	315	Pfam	PF01522	Polysaccharide deacetylase	107	215	8.7E-28	T	21-03-2019	IPR002509	NodB homology domain
MAG092_77_14	0a7c428ce87da6014d6361d56491d12d	657	Pfam	PF02806	Alpha amylase, C-terminal all-beta domain	559	655	1.5E-17	T	21-03-2019	IPR006048	Alpha-amylase/branching enzyme, C-terminal all beta
MAG092_77_14	0a7c428ce87da6014d6361d56491d12d	657	Pfam	PF02922	Carbohydrate-binding module 48 (Isoamylase N-terminal domain)	51	134	1.9E-18	T	21-03-2019	IPR004193	Glycoside hydrolase, family 13, N-terminal
MAG092_77_14	0a7c428ce87da6014d6361d56491d12d	657	Pfam	PF00128	Alpha amylase, catalytic domain	207	278	1.2E-9	T	21-03-2019	IPR006047	Glycosyl hydrolase, family 13, catalytic domain
MAG092_77_14	0a7c428ce87da6014d6361d56491d12d	657	TIGRFAM	TIGR01515	branching_enzym: 1,4-alpha-glucan branching enzyme	36	654	3.3E-242	T	21-03-2019	IPR006407	1,4-alpha-glucan-branching enzyme, GlgB
MAG092_114_2	53afcabb5fd3a5f04f38aedbb2556382	92	TIGRFAM	TIGR01573	cas2: CRISPR-associated endonuclease Cas2	1	83	1.2E-15	T	21-03-2019	IPR021127	CRISPR-associated endonuclease Cas2
MAG092_114_2	53afcabb5fd3a5f04f38aedbb2556382	92	Pfam	PF09827	CRISPR associated protein Cas2	1	75	4.3E-22	T	21-03-2019	IPR019199	Virulence-associated protein D / CRISPR associated protein Cas2
MAG092_18_15	2f79bbbfdf00c5e240b40a23ceba3e53	494	Pfam	PF13416	Bacterial extracellular solute-binding protein	107	415	7.9E-17	T	21-03-2019	IPR006059	Bacterial extracellular solute-binding protein
MAG092_84_7	dac24c9e7ff0b6cc60141102fa0ef954	867	TIGRFAM	TIGR00125	cyt_tran_rel: cytidyltransferase-like domain	729	794	1.6E-17	T	21-03-2019	IPR004821	Cytidyltransferase-like domain
MAG092_84_7	dac24c9e7ff0b6cc60141102fa0ef954	867	Pfam	PF01467	Cytidylyltransferase-like	732	844	1.7E-14	T	21-03-2019	IPR004821	Cytidyltransferase-like domain
MAG092_161_3	8f3948f7e2243451c03ffe81239cda88	313	Pfam	PF02826	D-isomer specific 2-hydroxyacid dehydrogenase, NAD binding domain	111	282	2.6E-58	T	21-03-2019	IPR006140	D-isomer specific 2-hydroxyacid dehydrogenase, NAD-binding domain
MAG092_161_3	8f3948f7e2243451c03ffe81239cda88	313	Pfam	PF00389	D-isomer specific 2-hydroxyacid dehydrogenase, catalytic domain	20	309	3.3E-27	T	21-03-2019	IPR006139	D-isomer specific 2-hydroxyacid dehydrogenase, catalytic domain
MAG092_170_3	557ad5ff1f09029c71341b6cc6f0e330	1414	Pfam	PF06050	2-hydroxyglutaryl-CoA dehydratase, D-component	904	1225	9.4E-64	T	21-03-2019	IPR010327	FldB/FldC dehydratase alpha/beta subunit
MAG092_170_3	557ad5ff1f09029c71341b6cc6f0e330	1414	Pfam	PF09989	CoA enzyme activase uncharacterised domain (DUF2229)	672	889	4.7E-78	T	21-03-2019	IPR018709	CoA enzyme activase, domain of unknown function DUF2229
MAG092_170_3	557ad5ff1f09029c71341b6cc6f0e330	1414	Pfam	PF01869	BadF/BadG/BcrA/BcrD ATPase family	8	257	1.5E-19	T	21-03-2019	IPR002731	ATPase, BadF/BadG/BcrA/BcrD type
MAG092_170_3	557ad5ff1f09029c71341b6cc6f0e330	1414	Pfam	PF01869	BadF/BadG/BcrA/BcrD ATPase family	323	577	8.0E-33	T	21-03-2019	IPR002731	ATPase, BadF/BadG/BcrA/BcrD type
MAG092_160_4	37fa39b7614c7482399e78fb340837f3	169	Pfam	PF01381	Helix-turn-helix	6	58	5.1E-13	T	21-03-2019	IPR001387	Cro/C1-type helix-turn-helix domain
MAG092_83_9	056fd7c4752f6c4bc6db930808befe55	223	Pfam	PF07722	Peptidase C26	49	199	1.2E-34	T	21-03-2019	IPR011697	Peptidase C26
MAG092_171_7	e324b79b42b05472ab51b6966310631b	233	Pfam	PF00005	ABC transporter	13	135	2.6E-21	T	21-03-2019	IPR003439	ABC transporter-like
MAG092_20_30	69fe5e3543dd56a3d2ac1e233bf461d6	676	Pfam	PF13712	Glycosyltransferase like family	11	217	6.2E-84	T	21-03-2019
MAG092_20_30	69fe5e3543dd56a3d2ac1e233bf461d6	676	Pfam	PF00535	Glycosyl transferase family 2	233	363	4.6E-10	T	21-03-2019	IPR001173	Glycosyltransferase 2-like
MAG092_20_30	69fe5e3543dd56a3d2ac1e233bf461d6	676	Pfam	PF13489	Methyltransferase domain	483	631	4.5E-19	T	21-03-2019
MAG092_51_3	83ebc8eea236fd5864e7c8f5e2d5be47	100	TIGRFAM	TIGR02607	antidote_HigA: addiction module antidote protein, HigA family	8	82	5.6E-23	T	21-03-2019	IPR013430	Toxin-antitoxin system, antidote protein, HigA
MAG092_51_3	83ebc8eea236fd5864e7c8f5e2d5be47	100	Pfam	PF01381	Helix-turn-helix	20	69	3.0E-8	T	21-03-2019	IPR001387	Cro/C1-type helix-turn-helix domain
MAG092_8_4	2b820af412ad5471a0f933432a9867a3	335	Pfam	PF12833	Helix-turn-helix domain	208	286	6.8E-22	T	21-03-2019	IPR018060	DNA binding HTH domain, AraC-type
