MAG010_22_33	727101cbd1736d75e84938fc07d906b0	516	Pfam	PF00239	Resolvase, N terminal domain	11	164	1.7E-21	T	21-03-2019	IPR006119	Resolvase, N-terminal catalytic domain
MAG010_1_58	86cdb8c0b9d0cc8312dd3abff17c5afb	507	Pfam	PF01078	Magnesium chelatase, subunit ChlI	190	396	1.1E-95	T	21-03-2019	IPR000523	Magnesium chelatase ChlI domain
MAG010_1_58	86cdb8c0b9d0cc8312dd3abff17c5afb	507	TIGRFAM	TIGR00368	TIGR00368: Mg chelatase-like protein	10	500	3.9E-175	T	21-03-2019	IPR004482	Mg chelatase-related protein
MAG010_1_58	86cdb8c0b9d0cc8312dd3abff17c5afb	507	Pfam	PF13541	Subunit ChlI of Mg-chelatase	21	142	2.3E-45	T	21-03-2019
MAG010_1_58	86cdb8c0b9d0cc8312dd3abff17c5afb	507	Pfam	PF13335	Magnesium chelatase, subunit ChlI C-terminal	405	500	4.9E-34	T	21-03-2019	IPR025158	Mg chelatase-related protein, C-terminal domain
MAG010_30_30	d8bf660e35aa6d0d52bcb065f8f8e5af	112	Pfam	PF14198	Transposon-encoded protein TnpV	25	110	4.0E-27	T	21-03-2019	IPR026989	Transposon-encoded protein TnpV
MAG010_25_5	219a3aa4b905ce459b8b7db6709741c6	404	Pfam	PF00155	Aminotransferase class I and II	35	400	4.0E-29	T	21-03-2019	IPR004839	Aminotransferase, class I/classII
MAG010_25_5	219a3aa4b905ce459b8b7db6709741c6	404	TIGRFAM	TIGR03542	DAPAT_plant: LL-diaminopimelate aminotransferase	3	401	8.9E-167	T	21-03-2019	IPR019942	LL-diaminopimelate aminotransferase/aminotransferase ALD1
MAG010_23_33	63c0993fbb1db59e5f8e6e6558878fe6	393	Pfam	PF00438	S-adenosylmethionine synthetase, N-terminal domain	4	101	4.8E-44	T	21-03-2019	IPR022628	S-adenosylmethionine synthetase, N-terminal
MAG010_23_33	63c0993fbb1db59e5f8e6e6558878fe6	393	Pfam	PF02773	S-adenosylmethionine synthetase, C-terminal domain	243	382	1.4E-69	T	21-03-2019	IPR022630	S-adenosylmethionine synthetase, C-terminal
MAG010_23_33	63c0993fbb1db59e5f8e6e6558878fe6	393	Pfam	PF02772	S-adenosylmethionine synthetase, central domain	124	241	4.5E-49	T	21-03-2019	IPR022629	S-adenosylmethionine synthetase, central domain
MAG010_23_33	63c0993fbb1db59e5f8e6e6558878fe6	393	TIGRFAM	TIGR01034	metK: methionine adenosyltransferase	5	392	7.4E-182	T	21-03-2019	IPR002133	S-adenosylmethionine synthetase
MAG010_3_44	8dfcf238aafe32714daa4e2ec067679d	373	Pfam	PF00472	RF-1 domain	229	338	1.4E-37	T	21-03-2019	IPR000352	Peptide chain release factor class I/class II
MAG010_3_44	8dfcf238aafe32714daa4e2ec067679d	373	TIGRFAM	TIGR00020	prfB: peptide chain release factor 2	5	364	1.0E-146	T	21-03-2019	IPR004374	Peptide chain release factor 2
MAG010_3_44	8dfcf238aafe32714daa4e2ec067679d	373	Pfam	PF03462	PCRF domain	31	220	7.0E-57	T	21-03-2019	IPR005139	Peptide chain release factor
MAG010_16_58	93f09dbf5fe5ebb84e5ed3b482fc7891	459	Pfam	PF01554	MatE	30	190	3.5E-26	T	21-03-2019	IPR002528	Multi antimicrobial extrusion protein
MAG010_16_58	93f09dbf5fe5ebb84e5ed3b482fc7891	459	Pfam	PF01554	MatE	252	401	2.1E-23	T	21-03-2019	IPR002528	Multi antimicrobial extrusion protein
MAG010_16_58	93f09dbf5fe5ebb84e5ed3b482fc7891	459	TIGRFAM	TIGR00797	matE: MATE efflux family protein	30	415	2.1E-60	T	21-03-2019	IPR002528	Multi antimicrobial extrusion protein
MAG010_50_4	dcb91e2d83c481e820b5119b184782e8	238	Pfam	PF09335	SNARE associated Golgi protein	75	185	5.2E-13	T	21-03-2019	IPR032816	SNARE associated Golgi protein
MAG010_7_64	fac0cdaa27c85d3930740c1b2d90a9ae	65	Pfam	PF12663	Protein of unknown function (DUF3788)	1	60	2.8E-15	T	21-03-2019	IPR024265	Protein of unknown function DUF3788
MAG010_14_49	e2b1b74b3f93c602e59658e18ac519ac	308	Pfam	PF00005	ABC transporter	23	163	8.2E-27	T	21-03-2019	IPR003439	ABC transporter-like
MAG010_12_54	4b96bde78b81e171ca321124684301ee	184	Pfam	PF06908	Protein of unknown function (DUF1273)	6	162	4.6E-29	T	21-03-2019	IPR010697	Protein of unknown function DUF1273
MAG010_1_181	b71d5e854fddaa83eacc935ef70866e3	66	Pfam	PF01197	Ribosomal protein L31	1	64	7.6E-34	T	21-03-2019	IPR002150	Ribosomal protein L31
MAG010_1_181	b71d5e854fddaa83eacc935ef70866e3	66	TIGRFAM	TIGR00105	L31: ribosomal protein bL31	1	64	1.1E-33	T	21-03-2019	IPR002150	Ribosomal protein L31
MAG010_11_75	40101a7dc4e7adec876296db765931f5	320	Pfam	PF00202	Aminotransferase class-III	14	281	2.7E-74	T	21-03-2019	IPR005814	Aminotransferase class-III
MAG010_79_3	66afb9c9f9d1b3c9aca82f8e59f39bbe	227	Pfam	PF00486	Transcriptional regulatory protein, C terminal	152	223	5.4E-21	T	21-03-2019	IPR001867	OmpR/PhoB-type DNA-binding domain
MAG010_79_3	66afb9c9f9d1b3c9aca82f8e59f39bbe	227	Pfam	PF00072	Response regulator receiver domain	5	114	2.6E-24	T	21-03-2019	IPR001789	Signal transduction response regulator, receiver domain
MAG010_89_5	2b4af17ee5565071b70699a0216e5e77	222	Pfam	PF13545	Crp-like helix-turn-helix domain	153	218	7.2E-16	T	21-03-2019	IPR012318	Crp-type HTH domain
MAG010_89_5	2b4af17ee5565071b70699a0216e5e77	222	Pfam	PF00027	Cyclic nucleotide-binding domain	31	119	2.9E-10	T	21-03-2019	IPR000595	Cyclic nucleotide-binding domain
MAG010_93_10	d8da1f80c3f2493e0dd762daed7401ee	124	TIGRFAM	TIGR00855	L12: ribosomal protein bL12	1	124	4.6E-45	T	21-03-2019	IPR000206	Ribosomal protein L7/L12
MAG010_93_10	d8da1f80c3f2493e0dd762daed7401ee	124	Pfam	PF00542	Ribosomal protein L7/L12 C-terminal domain	57	124	1.4E-28	T	21-03-2019	IPR013823	Ribosomal protein L7/L12, C-terminal
MAG010_93_10	d8da1f80c3f2493e0dd762daed7401ee	124	Pfam	PF16320	Ribosomal protein L7/L12 dimerisation domain	5	51	1.1E-17	T	21-03-2019	IPR008932	Ribosomal protein L7/L12, oligomerisation
MAG010_7_23	76e72a9a1292f8afcd84d25364d6e1c2	403	TIGRFAM	TIGR01554	major_cap_HK97: phage major capsid protein, HK97 family	6	396	2.3E-122	T	21-03-2019	IPR024455	Phage capsid
MAG010_7_23	76e72a9a1292f8afcd84d25364d6e1c2	403	Pfam	PF05065	Phage capsid family	124	395	1.4E-89	T	21-03-2019	IPR024455	Phage capsid
MAG010_2_70	c333e45cf9c04405706b4169d0084004	929	Pfam	PF00037	4Fe-4S binding domain	318	337	9.1E-6	T	21-03-2019	IPR017896	4Fe-4S ferredoxin-type, iron-sulphur binding domain
MAG010_2_70	c333e45cf9c04405706b4169d0084004	929	Pfam	PF00037	4Fe-4S binding domain	866	887	1.4E-6	T	21-03-2019	IPR017896	4Fe-4S ferredoxin-type, iron-sulphur binding domain
MAG010_2_70	c333e45cf9c04405706b4169d0084004	929	Pfam	PF14691	Dihydroprymidine dehydrogenase domain II, 4Fe-4S cluster	386	463	6.1E-19	T	21-03-2019	IPR028261	Dihydroprymidine dehydrogenase domain II
MAG010_2_70	c333e45cf9c04405706b4169d0084004	929	Pfam	PF07992	Pyridine nucleotide-disulphide oxidoreductase	485	781	9.5E-30	T	21-03-2019	IPR023753	FAD/NAD(P)-binding domain
MAG010_15_28	b73e8f0d8d4bd0e8422f2a769b835baf	204	Pfam	PF02508	Rnf-Nqr subunit, membrane protein	5	198	7.9E-58	T	21-03-2019	IPR003667	NqrDE/RnfAE
MAG010_15_28	b73e8f0d8d4bd0e8422f2a769b835baf	204	TIGRFAM	TIGR01943	rnfA: electron transport complex, RnfABCDGE type, A subunit	3	199	2.9E-73	T	21-03-2019	IPR011293	Ion-translocating oxidoreductase complex, subunit  RnfA/RsxA
MAG010_133_3	4ceffab92cf6a357302feb909f89770a	129	Pfam	PF14287	Domain of unknown function (DUF4368)	46	99	3.5E-20	T	21-03-2019	IPR025378	Domain of unknown function DUF4368
MAG010_75_3	9dd2fead4a1b65c005a0559d141cd81a	293	Pfam	PF00795	Carbon-nitrogen hydrolase	6	204	6.5E-26	T	21-03-2019	IPR003010	Carbon-nitrogen hydrolase
MAG010_18_34	87d1687b84694ed34e94ed40c13d090f	507	Pfam	PF02446	4-alpha-glucanotransferase	8	468	1.5E-163	T	21-03-2019	IPR003385	Glycoside hydrolase, family 77
MAG010_18_34	87d1687b84694ed34e94ed40c13d090f	507	TIGRFAM	TIGR00217	malQ: 4-alpha-glucanotransferase	2	469	1.3E-102	T	21-03-2019	IPR003385	Glycoside hydrolase, family 77
MAG010_62_5	aeab9781e6fff16ab052c6e90598c5ce	350	TIGRFAM	TIGR00524	eIF-2B_rel: eIF-2B alpha/beta/delta-related uncharacterized proteins	36	339	1.7E-102	T	21-03-2019	IPR011559	Initiation factor 2B alpha/beta/delta
MAG010_62_5	aeab9781e6fff16ab052c6e90598c5ce	350	TIGRFAM	TIGR00512	salvage_mtnA: S-methyl-5-thioribose-1-phosphate isomerase	16	339	4.7E-121	T	21-03-2019	IPR005251	Methylthioribose-1-phosphate isomerase
MAG010_62_5	aeab9781e6fff16ab052c6e90598c5ce	350	Pfam	PF01008	Initiation factor 2 subunit family	50	340	2.5E-72	T	21-03-2019	IPR000649	Initiation factor 2B-related
MAG010_2_59	334b15308acee8b3b57ad27dca7af6fd	355	Pfam	PF00528	Binding-protein-dependent transport system inner membrane component	126	281	4.1E-9	T	21-03-2019	IPR000515	ABC transporter type 1, transmembrane domain MetI-like
MAG010_19_51	3bd470aec78e568b77992378cf532d7a	459	TIGRFAM	TIGR02395	rpoN_sigma: RNA polymerase sigma-54 factor	10	454	5.7E-110	T	21-03-2019	IPR000394	RNA polymerase sigma factor 54
MAG010_19_51	3bd470aec78e568b77992378cf532d7a	459	Pfam	PF04963	Sigma-54 factor, core binding domain	102	282	9.0E-40	T	21-03-2019	IPR007046	RNA polymerase sigma factor 54, core-binding domain
MAG010_19_51	3bd470aec78e568b77992378cf532d7a	459	Pfam	PF04552	Sigma-54, DNA binding domain	297	455	2.3E-44	T	21-03-2019	IPR007634	RNA polymerase sigma factor 54, DNA-binding
MAG010_19_51	3bd470aec78e568b77992378cf532d7a	459	Pfam	PF00309	Sigma-54 factor, Activator interacting domain (AID)	5	49	1.3E-11	T	21-03-2019	IPR000394	RNA polymerase sigma factor 54
MAG010_129_3	2dc2d5a8197bce27fb34f6d658a1fecd	116	Pfam	PF14194	Cysteine-rich VLP	10	63	2.7E-23	T	21-03-2019	IPR025973	Cysteine-rich VLP domain
MAG010_32_7	8953ba8afc23b87f36acaf11cc12a253	416	Pfam	PF07690	Major Facilitator Superfamily	16	370	8.7E-34	T	21-03-2019	IPR011701	Major facilitator superfamily
MAG010_10_36	1bf20d630cecae66049a281401748823	328	Pfam	PF01408	Oxidoreductase family, NAD-binding Rossmann fold	7	122	7.9E-22	T	21-03-2019	IPR000683	Oxidoreductase, N-terminal
MAG010_25_24	1dc563f2b4cfaa56be7f84c1b24b8faf	265	Pfam	PF01479	S4 domain	5	47	3.1E-6	T	21-03-2019	IPR002942	RNA-binding S4 domain
MAG010_25_24	1dc563f2b4cfaa56be7f84c1b24b8faf	265	TIGRFAM	TIGR00478	tly: TlyA family rRNA methyltransferase/putative hemolysin	5	235	5.2E-80	T	21-03-2019	IPR004538	Haemolysin A /rRNA methyltransferase TlyA
MAG010_25_24	1dc563f2b4cfaa56be7f84c1b24b8faf	265	Pfam	PF01728	FtsJ-like methyltransferase	59	237	2.5E-17	T	21-03-2019	IPR002877	Ribosomal RNA methyltransferase FtsJ domain
MAG010_1_151	326757c9f703e46f0a207a8cf44b9043	295	Pfam	PF00528	Binding-protein-dependent transport system inner membrane component	108	295	4.5E-28	T	21-03-2019	IPR000515	ABC transporter type 1, transmembrane domain MetI-like
MAG010_1_151	326757c9f703e46f0a207a8cf44b9043	295	Pfam	PF12911	N-terminal TM domain of oligopeptide transport permease C	16	67	1.1E-14	T	21-03-2019	IPR025966	Oligopeptide transport permease C-like, N-terminal domain
MAG010_107_3	613a41a298ccf5d0cf02879d00f9aefc	173	Pfam	PF00080	Copper/zinc superoxide dismutase (SODC)	36	165	2.0E-28	T	21-03-2019	IPR001424	Superoxide dismutase, copper/zinc binding domain
MAG010_4_21	32d0eca629991f18891eb4b3bca21f06	244	Pfam	PF05103	DivIVA protein	2	131	4.3E-25	T	21-03-2019	IPR007793	DivIVA family
MAG010_4_21	32d0eca629991f18891eb4b3bca21f06	244	TIGRFAM	TIGR03544	DivI1A_domain: DivIVA domain	2	36	2.1E-7	T	21-03-2019	IPR019933	DivIVA domain
MAG010_26_26	bac15bb99f231c14588676acb3930781	432	Pfam	PF07724	AAA domain (Cdc48 subfamily)	151	285	2.3E-20	T	21-03-2019	IPR003959	ATPase, AAA-type, core
MAG010_22_20	161803dc44e9afdd88f8d301f7b6849b	215	TIGRFAM	TIGR01990	bPGM: beta-phosphoglucomutase	3	189	2.2E-71	T	21-03-2019	IPR010972	Beta-phosphoglucomutase
MAG010_22_20	161803dc44e9afdd88f8d301f7b6849b	215	Pfam	PF13419	Haloacid dehalogenase-like hydrolase	6	187	2.3E-24	T	21-03-2019
MAG010_22_20	161803dc44e9afdd88f8d301f7b6849b	215	TIGRFAM	TIGR02009	PGMB-YQAB-SF: beta-phosphoglucomutase family hydrolase	3	185	5.4E-60	T	21-03-2019	IPR010976	Beta-phosphoglucomutase hydrolase
MAG010_22_20	161803dc44e9afdd88f8d301f7b6849b	215	TIGRFAM	TIGR01509	HAD-SF-IA-v3: HAD hydrolase, family IA, variant 3	63	185	4.4E-16	T	21-03-2019	IPR006439	HAD hydrolase, subfamily IA
MAG010_10_53	bde728de122d63cf6e324fb761d86a8b	592	Pfam	PF02806	Alpha amylase, C-terminal all-beta domain	506	588	2.2E-8	T	21-03-2019	IPR006048	Alpha-amylase/branching enzyme, C-terminal all beta
MAG010_10_53	bde728de122d63cf6e324fb761d86a8b	592	TIGRFAM	TIGR01515	branching_enzym: 1,4-alpha-glucan branching enzyme	2	563	6.4E-168	T	21-03-2019	IPR006407	1,4-alpha-glucan-branching enzyme, GlgB
MAG010_10_53	bde728de122d63cf6e324fb761d86a8b	592	Pfam	PF02922	Carbohydrate-binding module 48 (Isoamylase N-terminal domain)	18	94	2.7E-16	T	21-03-2019	IPR004193	Glycoside hydrolase, family 13, N-terminal
MAG010_10_53	bde728de122d63cf6e324fb761d86a8b	592	Pfam	PF00128	Alpha amylase, catalytic domain	164	235	9.6E-10	T	21-03-2019	IPR006047	Glycosyl hydrolase, family 13, catalytic domain
MAG010_12_68	8dc54f93804c39ff27937a6470d71fc8	551	Pfam	PF00239	Resolvase, N terminal domain	26	176	5.6E-22	T	21-03-2019	IPR006119	Resolvase, N-terminal catalytic domain
MAG010_12_68	8dc54f93804c39ff27937a6470d71fc8	551	Pfam	PF07508	Recombinase	201	319	9.4E-23	T	21-03-2019	IPR011109	DNA-binding recombinase domain
MAG010_12_68	8dc54f93804c39ff27937a6470d71fc8	551	Pfam	PF13408	Recombinase zinc beta ribbon domain	338	389	6.8E-10	T	21-03-2019	IPR025827	Recombinase zinc beta ribbon domain
MAG010_4_103	a25e2390641385f2b7e00b7fde685165	870	TIGRFAM	TIGR01517	ATPase-IIB_Ca: calcium-translocating P-type ATPase, PMCA-type	12	861	1.4E-159	T	21-03-2019	IPR006408	P-type ATPase, subfamily IIB
MAG010_4_103	a25e2390641385f2b7e00b7fde685165	870	Pfam	PF00702	haloacid dehalogenase-like hydrolase	326	619	4.0E-23	T	21-03-2019
MAG010_4_103	a25e2390641385f2b7e00b7fde685165	870	Pfam	PF00689	Cation transporting ATPase, C-terminus	691	866	7.5E-49	T	21-03-2019	IPR006068	Cation-transporting P-type ATPase, C-terminal
MAG010_4_103	a25e2390641385f2b7e00b7fde685165	870	TIGRFAM	TIGR01494	ATPase_P-type: HAD ATPase, P-type, family IC	87	356	1.5E-45	T	21-03-2019	IPR001757	P-type ATPase
MAG010_4_103	a25e2390641385f2b7e00b7fde685165	870	TIGRFAM	TIGR01494	ATPase_P-type: HAD ATPase, P-type, family IC	577	690	8.4E-34	T	21-03-2019	IPR001757	P-type ATPase
MAG010_4_103	a25e2390641385f2b7e00b7fde685165	870	Pfam	PF00122	E1-E2 ATPase	115	308	1.0E-52	T	21-03-2019
MAG010_4_103	a25e2390641385f2b7e00b7fde685165	870	Pfam	PF00690	Cation transporter/ATPase, N-terminus	4	72	6.0E-19	T	21-03-2019	IPR004014	Cation-transporting P-type ATPase, N-terminal
MAG010_32_15	6317fb7d2678b48d4d3a48c519347b6b	735	Pfam	PF00512	His Kinase A (phospho-acceptor) domain	360	423	1.2E-11	T	21-03-2019	IPR003661	Signal transduction histidine kinase, dimerisation/phosphoacceptor domain
MAG010_32_15	6317fb7d2678b48d4d3a48c519347b6b	735	Pfam	PF08447	PAS fold	70	151	6.9E-10	T	21-03-2019	IPR013655	PAS fold-3
MAG010_32_15	6317fb7d2678b48d4d3a48c519347b6b	735	Pfam	PF00072	Response regulator receiver domain	609	723	4.6E-19	T	21-03-2019	IPR001789	Signal transduction response regulator, receiver domain
MAG010_32_15	6317fb7d2678b48d4d3a48c519347b6b	735	Pfam	PF02518	Histidine kinase-, DNA gyrase B-, and HSP90-like ATPase	473	588	1.9E-22	T	21-03-2019	IPR003594	Histidine kinase/HSP90-like ATPase
MAG010_9_83	dae2fdaee32769f0f3d5f1ace5899190	307	Pfam	PF13407	Periplasmic binding protein domain	32	279	5.0E-41	T	21-03-2019	IPR025997	Periplasmic binding protein
MAG010_27_9	cf0c1b23cc23bbba1690cfeff9284afd	123	Pfam	PF04297	Putative helix-turn-helix protein, YlxM / p13 like	3	91	6.2E-26	T	21-03-2019	IPR007394	Putative helix-turn-helix protein, YlxM/p13-like
MAG010_18_25	d31b3f0d35a4f294d9456e3b68b9bdc5	331	TIGRFAM	TIGR00737	nifR3_yhdG: putative TIM-barrel protein, nifR3 family	3	318	1.0E-107	T	21-03-2019	IPR004652	tRNA-dihydrouridine synthase, TIM-barrel, NifR3
MAG010_18_25	d31b3f0d35a4f294d9456e3b68b9bdc5	331	Pfam	PF01207	Dihydrouridine synthase (Dus)	14	315	1.3E-91	T	21-03-2019	IPR001269	tRNA-dihydrouridine synthase
MAG010_6_10	79369e4d5a6f240644f7a5e9ebe3aa85	153	Pfam	PF13463	Winged helix DNA-binding domain	51	106	1.9E-8	T	21-03-2019	IPR000835	MarR-type HTH domain
MAG010_29_11	55ab2d3c9071872db065eb4d045c1867	861	Pfam	PF02518	Histidine kinase-, DNA gyrase B-, and HSP90-like ATPase	466	583	1.1E-26	T	21-03-2019	IPR003594	Histidine kinase/HSP90-like ATPase
MAG010_29_11	55ab2d3c9071872db065eb4d045c1867	861	Pfam	PF00072	Response regulator receiver domain	741	856	1.7E-21	T	21-03-2019	IPR001789	Signal transduction response regulator, receiver domain
MAG010_29_11	55ab2d3c9071872db065eb4d045c1867	861	Pfam	PF00072	Response regulator receiver domain	599	714	1.1E-7	T	21-03-2019	IPR001789	Signal transduction response regulator, receiver domain
MAG010_29_11	55ab2d3c9071872db065eb4d045c1867	861	Pfam	PF00512	His Kinase A (phospho-acceptor) domain	352	418	4.1E-16	T	21-03-2019	IPR003661	Signal transduction histidine kinase, dimerisation/phosphoacceptor domain
MAG010_7_90	a737de22f76db1217fa0c07ced340df7	147	Pfam	PF04397	LytTr DNA-binding domain	52	145	1.0E-19	T	21-03-2019	IPR007492	LytTR DNA-binding domain
MAG010_60_7	abafb4e567fa5add223c8ad20b939080	240	Pfam	PF04397	LytTr DNA-binding domain	139	225	2.5E-10	T	21-03-2019	IPR007492	LytTR DNA-binding domain
MAG010_60_7	abafb4e567fa5add223c8ad20b939080	240	Pfam	PF00072	Response regulator receiver domain	4	108	1.7E-16	T	21-03-2019	IPR001789	Signal transduction response regulator, receiver domain
MAG010_3_145	e22f2e4674e68d3a40c60c110679dc7b	343	Pfam	PF02518	Histidine kinase-, DNA gyrase B-, and HSP90-like ATPase	235	342	7.2E-20	T	21-03-2019	IPR003594	Histidine kinase/HSP90-like ATPase
MAG010_3_145	e22f2e4674e68d3a40c60c110679dc7b	343	Pfam	PF00512	His Kinase A (phospho-acceptor) domain	124	189	9.5E-7	T	21-03-2019	IPR003661	Signal transduction histidine kinase, dimerisation/phosphoacceptor domain
MAG010_72_1	ee6b31e81fc26ab0ad9e33290d32e881	427	TIGRFAM	TIGR00089	TIGR00089: radical SAM methylthiotransferase, MiaB/RimO family	1	420	1.5E-110	T	21-03-2019	IPR005839	Methylthiotransferase
MAG010_72_1	ee6b31e81fc26ab0ad9e33290d32e881	427	TIGRFAM	TIGR01579	MiaB-like-C: MiaB-like tRNA modifying enzyme	1	410	6.4E-115	T	21-03-2019	IPR006467	MiaB-like tRNA modifying enzyme
MAG010_72_1	ee6b31e81fc26ab0ad9e33290d32e881	427	Pfam	PF04055	Radical SAM superfamily	145	312	1.7E-25	T	21-03-2019	IPR007197	Radical SAM
MAG010_72_1	ee6b31e81fc26ab0ad9e33290d32e881	427	Pfam	PF00919	Uncharacterized protein family UPF0004	1	80	1.2E-19	T	21-03-2019	IPR013848	Methylthiotransferase, N-terminal
MAG010_37_18	ec16c49daf1bdc5e2ea3240fd5b698d0	292	Pfam	PF00589	Phage integrase family	109	276	2.6E-45	T	21-03-2019	IPR002104	Integrase, catalytic domain
MAG010_37_18	ec16c49daf1bdc5e2ea3240fd5b698d0	292	TIGRFAM	TIGR02225	recomb_XerD: tyrosine recombinase XerD	7	292	5.9E-103	T	21-03-2019	IPR011932	Tyrosine recombinase XerD
MAG010_37_18	ec16c49daf1bdc5e2ea3240fd5b698d0	292	Pfam	PF02899	Phage integrase, N-terminal SAM-like domain	7	83	2.5E-15	T	21-03-2019	IPR004107	Integrase, SAM-like, N-terminal
MAG010_108_4	7186183e3ccd8d1b1d08b1fc136f41c8	555	Pfam	PF00239	Resolvase, N terminal domain	8	159	4.1E-21	T	21-03-2019	IPR006119	Resolvase, N-terminal catalytic domain
MAG010_108_4	7186183e3ccd8d1b1d08b1fc136f41c8	555	Pfam	PF13408	Recombinase zinc beta ribbon domain	319	374	3.5E-12	T	21-03-2019	IPR025827	Recombinase zinc beta ribbon domain
MAG010_108_4	7186183e3ccd8d1b1d08b1fc136f41c8	555	Pfam	PF07508	Recombinase	182	304	1.5E-20	T	21-03-2019	IPR011109	DNA-binding recombinase domain
MAG010_7_78	bd72bbdc0fcf37442457859d3bdb5e42	308	Pfam	PF12146	Serine aminopeptidase, S33	28	291	1.5E-55	T	21-03-2019	IPR022742	Serine aminopeptidase, S33
MAG010_22_26	f020f0d25b2b146ebe492aeeb8466fdb	598	Pfam	PF06824	Metal-independent alpha-mannosidase (GH125)	392	582	3.9E-16	T	21-03-2019	IPR008313	Metal-independent alpha-mannosidase
MAG010_26_35	c5172070da204f3d7eaca6ae8f36dd09	356	Pfam	PF01339	CheB methylesterase	170	344	8.7E-51	T	21-03-2019	IPR000673	Signal transduction response regulator, chemotaxis, protein-glutamate methylesterase
MAG010_26_35	c5172070da204f3d7eaca6ae8f36dd09	356	Pfam	PF00072	Response regulator receiver domain	15	117	2.2E-14	T	21-03-2019	IPR001789	Signal transduction response regulator, receiver domain
MAG010_25_27	4b4a084c8751432a50dfb6b803cac4c9	568	TIGRFAM	TIGR00634	recN: DNA repair protein RecN	4	555	7.5E-162	T	21-03-2019	IPR004604	DNA recombination/repair protein RecN
MAG010_25_27	4b4a084c8751432a50dfb6b803cac4c9	568	Pfam	PF02463	RecF/RecN/SMC N terminal domain	7	511	1.7E-16	T	21-03-2019	IPR003395	RecF/RecN/SMC, N-terminal
MAG010_2_156	7b32ddb5327ddd84973200aeaf1d63ab	89	Pfam	PF02195	ParB-like nuclease domain	4	48	7.0E-5	T	21-03-2019	IPR003115	ParB/Sulfiredoxin
MAG010_28_5	7605c57b1e54c66abfc9624736ffac61	650	Pfam	PF00122	E1-E2 ATPase	150	326	3.3E-47	T	21-03-2019
MAG010_28_5	7605c57b1e54c66abfc9624736ffac61	650	TIGRFAM	TIGR01494	ATPase_P-type: HAD ATPase, P-type, family IC	122	620	4.6E-69	T	21-03-2019	IPR001757	P-type ATPase
MAG010_28_5	7605c57b1e54c66abfc9624736ffac61	650	Pfam	PF00702	haloacid dehalogenase-like hydrolase	346	556	5.0E-33	T	21-03-2019
MAG010_28_5	7605c57b1e54c66abfc9624736ffac61	650	TIGRFAM	TIGR01525	ATPase-IB_hvy: heavy metal translocating P-type ATPase	100	644	2.4E-162	T	21-03-2019	IPR027256	P-type ATPase, subfamily IB
MAG010_28_5	7605c57b1e54c66abfc9624736ffac61	650	TIGRFAM	TIGR01512	ATPase-IB2_Cd: cadmium-translocating P-type ATPase	100	647	7.4E-149	T	21-03-2019
MAG010_36_6	2d75f3236ec1b2be5787a352b322181b	101	TIGRFAM	TIGR02937	sigma70-ECF: RNA polymerase sigma factor, sigma-70 family	39	97	3.7E-12	T	21-03-2019	IPR014284	RNA polymerase sigma-70 like domain
MAG010_36_6	2d75f3236ec1b2be5787a352b322181b	101	Pfam	PF04545	Sigma-70, region 4	46	95	3.1E-15	T	21-03-2019	IPR007630	RNA polymerase sigma-70 region 4
MAG010_20_1	24b792b756861d5a99f72c453377bb2c	402	Pfam	PF00528	Binding-protein-dependent transport system inner membrane component	295	401	6.2E-11	T	21-03-2019	IPR000515	ABC transporter type 1, transmembrane domain MetI-like
MAG010_20_1	24b792b756861d5a99f72c453377bb2c	402	Pfam	PF01547	Bacterial extracellular solute-binding protein	70	198	1.2E-16	T	21-03-2019	IPR006059	Bacterial extracellular solute-binding protein
MAG010_7_95	8c2de44519e95dc0b707b6dcb2eb0da4	562	Pfam	PF13684	Dihydroxyacetone kinase family	232	562	6.2E-102	T	21-03-2019	IPR033470	Uncharacterised protein, DhaK domain
MAG010_7_95	8c2de44519e95dc0b707b6dcb2eb0da4	562	TIGRFAM	TIGR03599	YloV: DAK2 domain fusion protein YloV	10	562	3.2E-172	T	21-03-2019	IPR019986	DAK2 domain-containing protein YloV
MAG010_7_95	8c2de44519e95dc0b707b6dcb2eb0da4	562	Pfam	PF02734	DAK2 domain	35	199	8.8E-37	T	21-03-2019	IPR004007	DhaL domain
MAG010_2_142	1b78ad5d8675f232a3cd0ddd0cee7c3c	197	Pfam	PF02417	Chromate transporter	5	185	4.3E-40	T	21-03-2019	IPR003370	Chromate transporter
MAG010_1_148	f8ad05e2f25e04ef5410fce63a6ebbaf	630	Pfam	PF00496	Bacterial extracellular solute-binding proteins, family 5 Middle	112	523	2.2E-58	T	21-03-2019	IPR000914	Solute-binding protein family 5 domain
MAG010_33_1	8790cf70d813de4b7f71b6b872b9da47	63	Pfam	PF14198	Transposon-encoded protein TnpV	4	56	3.2E-18	T	21-03-2019	IPR026989	Transposon-encoded protein TnpV
MAG010_52_23	505f65ac24236d3a81e4ffd9c3858816	37	Pfam	PF00444	Ribosomal protein L36	1	37	5.3E-20	T	21-03-2019	IPR000473	Ribosomal protein L36
MAG010_52_23	505f65ac24236d3a81e4ffd9c3858816	37	TIGRFAM	TIGR01022	rpmJ_bact: ribosomal protein bL36	1	37	1.4E-24	T	21-03-2019	IPR000473	Ribosomal protein L36
MAG010_2_63	d3799c9e0d8974979fb915658b15efa3	493	Pfam	PF08666	SAF domain	13	82	3.1E-13	T	21-03-2019	IPR013974	SAF domain
MAG010_2_63	d3799c9e0d8974979fb915658b15efa3	493	Pfam	PF04295	D-galactarate dehydratase / Altronate hydrolase, C terminus	108	492	2.3E-161	T	21-03-2019	IPR007392	D-galactarate/Altronate dehydratase, C-terminal
MAG010_1_161	3bb8800f0b3d902e60129575a1d1c0cc	211	Pfam	PF13419	Haloacid dehalogenase-like hydrolase	56	180	1.9E-13	T	21-03-2019
MAG010_1_161	3bb8800f0b3d902e60129575a1d1c0cc	211	TIGRFAM	TIGR01509	HAD-SF-IA-v3: HAD hydrolase, family IA, variant 3	82	183	4.7E-16	T	21-03-2019	IPR006439	HAD hydrolase, subfamily IA
MAG010_1_95	5203c013f5c7f8270eab444e7bb9496e	163	TIGRFAM	TIGR00011	YbaK_EbsC: Cys-tRNA(Pro) deacylase	9	159	2.3E-50	T	21-03-2019	IPR004369	Prolyl-tRNA editing protein, YbaK/EbsC
MAG010_1_95	5203c013f5c7f8270eab444e7bb9496e	163	Pfam	PF04073	Aminoacyl-tRNA editing domain	37	150	4.9E-24	T	21-03-2019	IPR007214	YbaK/aminoacyl-tRNA synthetase-associated domain
MAG010_52_26	f73589cf1ae3729051d87a06bce9f5e5	199	TIGRFAM	TIGR01017	rpsD_bact: ribosomal protein uS4	5	199	1.1E-67	T	21-03-2019	IPR005709	Ribosomal protein S4, bacterial-type
MAG010_52_26	f73589cf1ae3729051d87a06bce9f5e5	199	Pfam	PF01479	S4 domain	88	135	2.8E-22	T	21-03-2019	IPR002942	RNA-binding S4 domain
MAG010_52_26	f73589cf1ae3729051d87a06bce9f5e5	199	Pfam	PF00163	Ribosomal protein S4/S9 N-terminal domain	5	87	1.5E-21	T	21-03-2019	IPR001912	Ribosomal protein S4/S9, N-terminal
MAG010_15_20	5a413714769854c17e92614649042505	701	Pfam	PF00990	Diguanylate cyclase, GGDEF domain	522	670	4.2E-33	T	21-03-2019	IPR000160	GGDEF domain
MAG010_15_20	5a413714769854c17e92614649042505	701	Pfam	PF00072	Response regulator receiver domain	13	118	1.4E-20	T	21-03-2019	IPR001789	Signal transduction response regulator, receiver domain
MAG010_15_20	5a413714769854c17e92614649042505	701	Pfam	PF01966	HD domain	186	305	3.1E-19	T	21-03-2019	IPR006674	HD domain
MAG010_15_20	5a413714769854c17e92614649042505	701	TIGRFAM	TIGR00254	GGDEF: diguanylate cyclase (GGDEF) domain	518	673	8.7E-36	T	21-03-2019	IPR000160	GGDEF domain
MAG010_1_51	edfe713d6f0b0f670f2ec2d83ea4f668	339	TIGRFAM	TIGR01361	DAHP_synth_Bsub: 3-deoxy-7-phosphoheptulonate synthase	72	327	1.3E-120	T	21-03-2019	IPR006268	Phospho-2-dehydro-3-deoxyheptonate aldolase, subtype 2
MAG010_1_51	edfe713d6f0b0f670f2ec2d83ea4f668	339	Pfam	PF00793	DAHP synthetase I family	87	324	2.1E-75	T	21-03-2019	IPR006218	DAHP synthetase I/KDSA
MAG010_25_22	3adda15b1742baf14eb8562de72bd0e0	147	Pfam	PF02681	Divergent PAP2 family	4	136	5.6E-48	T	21-03-2019	IPR003832	Protein of unknown function DUF212
MAG010_51_6	c027ba1ba357fb6bacf657a37e87e4d2	270	TIGRFAM	TIGR01856	hisJ_fam: histidinol phosphate phosphatase, HisJ family	5	244	3.1E-26	T	21-03-2019	IPR010140	Histidinol phosphate phosphatase, HisJ
MAG010_136_5	7a0fd133c56f51d2c27c24b1c47ab2db	69	Pfam	PF13412	Winged helix-turn-helix DNA-binding	4	37	4.9E-5	T	21-03-2019
