MAG081_9_14	adaa3a2e12b2ada74fea5a5f41897fe9	293	Pfam	PF02775	Thiamine pyrophosphate enzyme, C-terminal TPP binding domain	81	192	6.7E-12	T	21-03-2019	IPR011766	Thiamine pyrophosphate enzyme, C-terminal TPP-binding
MAG081_11_15	73eb8c1f8eaed9f8a1b3b86af0e19486	129	TIGRFAM	TIGR01354	cyt_deam_tetra: cytidine deaminase	4	127	4.1E-36	T	21-03-2019	IPR006262	Cytidine deaminase, homotetrameric
MAG081_11_15	73eb8c1f8eaed9f8a1b3b86af0e19486	129	Pfam	PF00383	Cytidine and deoxycytidylate deaminase zinc-binding region	6	102	1.9E-11	T	21-03-2019	IPR002125	Cytidine and deoxycytidylate deaminase domain
MAG081_7_12	a4a2786645aaaaef2b4e6d0ac58e6c92	112	Pfam	PF02033	Ribosome-binding factor A	6	105	6.6E-28	T	21-03-2019	IPR000238	Ribosome-binding factor A
MAG081_7_12	a4a2786645aaaaef2b4e6d0ac58e6c92	112	TIGRFAM	TIGR00082	rbfA: ribosome-binding factor A	4	110	3.8E-28	T	21-03-2019	IPR000238	Ribosome-binding factor A
MAG081_10_7	a8f67b215292df27726a086be68601ba	219	Pfam	PF00486	Transcriptional regulatory protein, C terminal	145	218	7.1E-18	T	21-03-2019	IPR001867	OmpR/PhoB-type DNA-binding domain
MAG081_10_7	a8f67b215292df27726a086be68601ba	219	Pfam	PF00072	Response regulator receiver domain	4	112	2.8E-22	T	21-03-2019	IPR001789	Signal transduction response regulator, receiver domain
MAG081_62_6	bcb7a5689257ab65e737c3a0a3611827	563	Pfam	PF00239	Resolvase, N terminal domain	15	166	6.3E-23	T	21-03-2019	IPR006119	Resolvase, N-terminal catalytic domain
MAG081_62_6	bcb7a5689257ab65e737c3a0a3611827	563	Pfam	PF07508	Recombinase	190	309	4.6E-24	T	21-03-2019	IPR011109	DNA-binding recombinase domain
MAG081_62_6	bcb7a5689257ab65e737c3a0a3611827	563	Pfam	PF13408	Recombinase zinc beta ribbon domain	323	382	1.9E-8	T	21-03-2019	IPR025827	Recombinase zinc beta ribbon domain
MAG081_25_1	7cb4c268be232e68b312b20bc9a0adff	710	TIGRFAM	TIGR01070	mutS1: DNA mismatch repair protein MutS	7	705	3.3E-238	T	21-03-2019	IPR005748	DNA mismatch repair protein MutS
MAG081_25_1	7cb4c268be232e68b312b20bc9a0adff	710	Pfam	PF05190	MutS family domain IV	282	374	4.3E-27	T	21-03-2019	IPR007861	DNA mismatch repair protein MutS, clamp
MAG081_25_1	7cb4c268be232e68b312b20bc9a0adff	710	Pfam	PF00488	MutS domain V	467	651	1.1E-82	T	21-03-2019	IPR000432	DNA mismatch repair protein MutS, C-terminal
MAG081_25_1	7cb4c268be232e68b312b20bc9a0adff	710	Pfam	PF05192	MutS domain III	128	415	2.5E-39	T	21-03-2019	IPR007696	DNA mismatch repair protein MutS, core
MAG081_87_5	42fc02ef0e0ce9dd24dd87163fb7a816	540	Pfam	PF00005	ABC transporter	17	187	5.2E-23	T	21-03-2019	IPR003439	ABC transporter-like
MAG081_87_5	42fc02ef0e0ce9dd24dd87163fb7a816	540	Pfam	PF00005	ABC transporter	346	474	3.4E-22	T	21-03-2019	IPR003439	ABC transporter-like
MAG081_37_8	6a2d689879cfd782e75a373db1641cbf	90	Pfam	PF00216	Bacterial DNA-binding protein	1	90	6.0E-31	T	21-03-2019	IPR000119	Histone-like DNA-binding protein
MAG081_3_6	8cf24856cae5e8b6d249dacb7dd74a53	458	Pfam	PF12631	MnmE helical domain	132	455	5.1E-48	T	21-03-2019	IPR025867	MnmE, helical domain
MAG081_3_6	8cf24856cae5e8b6d249dacb7dd74a53	458	TIGRFAM	TIGR00231	small_GTP: small GTP-binding protein domain	226	364	1.3E-27	T	21-03-2019	IPR005225	Small GTP-binding protein domain
MAG081_3_6	8cf24856cae5e8b6d249dacb7dd74a53	458	TIGRFAM	TIGR00450	mnmE_trmE_thdF: tRNA modification GTPase TrmE	19	458	1.2E-125	T	21-03-2019	IPR004520	tRNA modification GTPase MnmE
MAG081_3_6	8cf24856cae5e8b6d249dacb7dd74a53	458	Pfam	PF01926	50S ribosome-binding GTPase	228	341	7.6E-25	T	21-03-2019	IPR006073	GTP binding domain
MAG081_3_6	8cf24856cae5e8b6d249dacb7dd74a53	458	Pfam	PF10396	GTP-binding protein TrmE N-terminus	13	129	5.6E-39	T	21-03-2019	IPR018948	GTP-binding protein TrmE, N-terminal
MAG081_23_8	2b0e9daa24a297d81ae3366977159c66	467	TIGRFAM	TIGR00435	cysS: cysteine--tRNA ligase	1	462	4.5E-136	T	21-03-2019	IPR015803	Cysteine-tRNA ligase
MAG081_23_8	2b0e9daa24a297d81ae3366977159c66	467	Pfam	PF01406	tRNA synthetases class I (C) catalytic domain	18	326	4.9E-91	T	21-03-2019	IPR032678	tRNA synthetases class I, catalytic domain
MAG081_23_8	2b0e9daa24a297d81ae3366977159c66	467	Pfam	PF09190	DALR domain	357	407	3.3E-7	T	21-03-2019	IPR015273	Cysteinyl-tRNA synthetase, class Ia, DALR
MAG081_13_15	6902ed2e05e554c466f270e152fd917d	394	Pfam	PF13180	PDZ domain	111	186	2.3E-12	T	21-03-2019	IPR001478	PDZ domain
MAG081_13_15	6902ed2e05e554c466f270e152fd917d	394	Pfam	PF03572	Peptidase family S41	206	367	5.3E-42	T	21-03-2019	IPR005151	Tail specific protease
MAG081_13_15	6902ed2e05e554c466f270e152fd917d	394	TIGRFAM	TIGR00225	prc: C-terminal processing peptidase	67	373	4.8E-79	T	21-03-2019	IPR004447	C-terminal-processing peptidase S41A
MAG081_5_5	34ad2831ee756fad135a55078de6842f	182	Pfam	PF01327	Polypeptide deformylase	6	171	2.1E-36	T	21-03-2019	IPR023635	Peptide deformylase
MAG081_5_5	34ad2831ee756fad135a55078de6842f	182	TIGRFAM	TIGR00079	pept_deformyl: peptide deformylase	6	179	2.5E-38	T	21-03-2019	IPR023635	Peptide deformylase
MAG081_13_7	5d7870b4b05533f9c81caee901df1c44	272	Pfam	PF06831	Formamidopyrimidine-DNA glycosylase H2TH domain	132	221	5.1E-20	T	21-03-2019	IPR015886	DNA glycosylase/AP lyase, H2TH DNA-binding
MAG081_13_7	5d7870b4b05533f9c81caee901df1c44	272	Pfam	PF01149	Formamidopyrimidine-DNA glycosylase N-terminal domain	1	115	5.3E-27	T	21-03-2019	IPR012319	Formamidopyrimidine-DNA glycosylase, catalytic domain
MAG081_13_7	5d7870b4b05533f9c81caee901df1c44	272	Pfam	PF06827	Zinc finger found in FPG and IleRS	246	272	2.6E-9	T	21-03-2019	IPR010663	Zinc finger, FPG/IleRS-type
MAG081_13_7	5d7870b4b05533f9c81caee901df1c44	272	TIGRFAM	TIGR00577	fpg: DNA-formamidopyrimidine glycosylase	1	271	2.2E-79	T	21-03-2019	IPR020629	Formamidopyrimidine-DNA glycosylase
MAG081_4_11	c694a6700cd7371665c448d7f3ce4578	379	Pfam	PF12844	Helix-turn-helix domain	7	68	5.8E-14	T	21-03-2019	IPR001387	Cro/C1-type helix-turn-helix domain
MAG081_4_11	c694a6700cd7371665c448d7f3ce4578	379	Pfam	PF16107	Domain of unknown function (DUF4825)	247	330	2.1E-14	T	21-03-2019	IPR032250	Domain of unknown function DUF4825
MAG081_92_1	83f9d1b0acfb459d7a3328466ba517db	237	Pfam	PF00005	ABC transporter	17	160	4.0E-30	T	21-03-2019	IPR003439	ABC transporter-like
MAG081_47_4	f0d224e882d941a9b948bdd6fc2ad7b4	93	Pfam	PF13443	Cro/C1-type HTH DNA-binding domain	6	62	5.1E-7	T	21-03-2019	IPR001387	Cro/C1-type helix-turn-helix domain
MAG081_23_10	f1401e612d92faae6555cc8eeeee334e	124	TIGRFAM	TIGR02728	spore_gerQ: spore coat protein GerQ	41	118	3.5E-27	T	21-03-2019	IPR014099	Spore coat protein GerQ
MAG081_23_10	f1401e612d92faae6555cc8eeeee334e	124	Pfam	PF09671	Spore coat protein (Spore_GerQ)	43	117	7.2E-35	T	21-03-2019	IPR014099	Spore coat protein GerQ
MAG081_4_27	0c03a1fd93cf55dafc10fb5568d72d1b	427	Pfam	PF00675	Insulinase (Peptidase family M16)	63	154	4.4E-13	T	21-03-2019	IPR011765	Peptidase M16, N-terminal
MAG081_4_27	0c03a1fd93cf55dafc10fb5568d72d1b	427	Pfam	PF05193	Peptidase M16 inactive domain	183	359	3.1E-7	T	21-03-2019	IPR007863	Peptidase M16, C-terminal
MAG081_10_2	0bfe41187c43563da6fcf493700a5041	245	Pfam	PF13561	Enoyl-(Acyl carrier protein) reductase	13	241	1.9E-65	T	21-03-2019
MAG081_60_2	e01b398010578dd305e0e93356ae0354	180	Pfam	PF16745	RsgA N-terminal domain	4	52	7.2E-19	T	21-03-2019	IPR031944	Ribosome biogenesis GTPase RsgA, N-terminal
MAG081_60_2	e01b398010578dd305e0e93356ae0354	180	Pfam	PF03193	RsgA GTPase	57	120	5.7E-17	T	21-03-2019	IPR010914	RsgA GTPase domain
MAG081_3_14	65a1243b6bb04661013a13815e05a576	155	Pfam	PF00472	RF-1 domain	6	115	9.3E-39	T	21-03-2019	IPR000352	Peptide chain release factor class I/class II
MAG081_18_12	c3a84d4cd25e4f6f4b3fc37551a0ee68	252	Pfam	PF00005	ABC transporter	27	169	1.9E-32	T	21-03-2019	IPR003439	ABC transporter-like
MAG081_85_4	21d390124bc9ae824f40ff472388cec8	258	TIGRFAM	TIGR00755	ksgA: ribosomal RNA small subunit methyltransferase A	4	256	4.4E-73	T	21-03-2019	IPR011530	Ribosomal RNA adenine dimethylase
MAG081_85_4	21d390124bc9ae824f40ff472388cec8	258	Pfam	PF00398	Ribosomal RNA adenine dimethylase	4	256	1.3E-56	T	21-03-2019	IPR001737	Ribosomal RNA adenine methyltransferase KsgA/Erm
MAG081_4_10	86f65d426f9e7be7c48e7831f5f41a3a	134	Pfam	PF00293	NUDIX domain	4	107	1.1E-14	T	21-03-2019	IPR000086	NUDIX hydrolase domain
MAG081_15_13	37b4a04627643a1e1d1a25330fb765c1	567	Pfam	PF07963	Prokaryotic N-terminal methylation motif	4	27	1.7E-5	T	21-03-2019	IPR012902	Prokaryotic N-terminal methylation site
MAG081_15_13	37b4a04627643a1e1d1a25330fb765c1	567	TIGRFAM	TIGR02532	IV_pilin_GFxxxE: prepilin-type N-terminal cleavage/methylation domain	5	27	5.9E-5	T	21-03-2019	IPR012902	Prokaryotic N-terminal methylation site
MAG081_1_43	3faaa091d807eccf289035d68d44e836	936	Pfam	PF00005	ABC transporter	618	854	1.6E-9	T	21-03-2019	IPR003439	ABC transporter-like
MAG081_1_43	3faaa091d807eccf289035d68d44e836	936	TIGRFAM	TIGR00630	uvra: excinuclease ABC subunit A	3	919	0.0	T	21-03-2019	IPR004602	UvrABC system subunit A
MAG081_19_1	4424554833eaf4b6d098ba7131db8ff7	64	TIGRFAM	TIGR01443	intein_Cterm: intein C-terminal splicing region	39	61	5.1E-5	T	21-03-2019	IPR030934	Intein C-terminal splicing region
MAG081_94_3	0fef69995d28816dcb4b667dd93e3bf9	528	TIGRFAM	TIGR01443	intein_Cterm: intein C-terminal splicing region	503	526	2.6E-4	T	21-03-2019	IPR030934	Intein C-terminal splicing region
MAG081_94_3	0fef69995d28816dcb4b667dd93e3bf9	528	TIGRFAM	TIGR02543	List_Bact_rpt: repeat, TIGR02543 family	272	312	1.5E-5	T	21-03-2019	IPR013378	Listeria/Bacterioides repeat
MAG081_94_3	0fef69995d28816dcb4b667dd93e3bf9	528	TIGRFAM	TIGR02543	List_Bact_rpt: repeat, TIGR02543 family	54	88	7.4E-6	T	21-03-2019	IPR013378	Listeria/Bacterioides repeat
MAG081_94_3	0fef69995d28816dcb4b667dd93e3bf9	528	TIGRFAM	TIGR01445	intein_Nterm: intein N-terminal splicing region	392	463	5.3E-6	T	21-03-2019	IPR006141	Intein N-terminal splicing region
MAG081_94_3	0fef69995d28816dcb4b667dd93e3bf9	528	Pfam	PF09479	Listeria-Bacteroides repeat domain (List_Bact_rpt)	242	309	5.1E-16	T	21-03-2019	IPR013378	Listeria/Bacterioides repeat
MAG081_94_3	0fef69995d28816dcb4b667dd93e3bf9	528	Pfam	PF09479	Listeria-Bacteroides repeat domain (List_Bact_rpt)	41	86	1.3E-6	T	21-03-2019	IPR013378	Listeria/Bacterioides repeat
MAG081_94_3	0fef69995d28816dcb4b667dd93e3bf9	528	Pfam	PF09479	Listeria-Bacteroides repeat domain (List_Bact_rpt)	171	219	0.003	T	21-03-2019	IPR013378	Listeria/Bacterioides repeat
MAG081_94_3	0fef69995d28816dcb4b667dd93e3bf9	528	Pfam	PF09479	Listeria-Bacteroides repeat domain (List_Bact_rpt)	340	388	0.0036	T	21-03-2019	IPR013378	Listeria/Bacterioides repeat
MAG081_94_3	0fef69995d28816dcb4b667dd93e3bf9	528	Pfam	PF07591	Pretoxin HINT domain	398	526	2.0E-15	T	21-03-2019
MAG081_21_11	8ff41c11b0de37477662633e7984d27e	223	Pfam	PF01926	50S ribosome-binding GTPase	5	82	5.9E-7	T	21-03-2019	IPR006073	GTP binding domain
MAG081_21_11	8ff41c11b0de37477662633e7984d27e	223	TIGRFAM	TIGR03595	Obg_CgtA_exten: Obg family GTPase CgtA, C-terminal extension	154	221	1.7E-22	T	21-03-2019	IPR015349	GTP-binding protein OBG, C-terminal
MAG081_21_11	8ff41c11b0de37477662633e7984d27e	223	Pfam	PF09269	Domain of unknown function (DUF1967)	154	221	2.4E-22	T	21-03-2019	IPR015349	GTP-binding protein OBG, C-terminal
MAG081_2_25	ebc0d61d6d0a8089a33a8e3ed0ba5b1f	499	Pfam	PF01551	Peptidase family M23	383	492	1.2E-23	T	21-03-2019	IPR016047	Peptidase M23
MAG081_2_25	ebc0d61d6d0a8089a33a8e3ed0ba5b1f	499	Pfam	PF01476	LysM domain	215	259	1.0E-7	T	21-03-2019	IPR018392	LysM domain
MAG081_2_25	ebc0d61d6d0a8089a33a8e3ed0ba5b1f	499	Pfam	PF07501	G5 domain	273	345	5.7E-13	T	21-03-2019	IPR011098	G5 domain
MAG081_33_6	e632c6bb8b28c02ec32a21208d6c913c	372	Pfam	PF00684	DnaJ central domain	154	215	1.3E-10	T	21-03-2019	IPR001305	Heat shock protein DnaJ, cysteine-rich domain
MAG081_33_6	e632c6bb8b28c02ec32a21208d6c913c	372	TIGRFAM	TIGR02349	DnaJ_bact: chaperone protein DnaJ	5	356	5.4E-125	T	21-03-2019	IPR012724	Chaperone DnaJ
MAG081_33_6	e632c6bb8b28c02ec32a21208d6c913c	372	Pfam	PF01556	DnaJ C terminal domain	129	341	3.9E-40	T	21-03-2019	IPR002939	Chaperone DnaJ, C-terminal
MAG081_33_6	e632c6bb8b28c02ec32a21208d6c913c	372	Pfam	PF00226	DnaJ domain	5	66	3.4E-27	T	21-03-2019	IPR001623	DnaJ domain
MAG081_75_4	cf386953af2de72de7417c5a1636e332	471	Pfam	PF12733	Cadherin-like beta sandwich domain	264	340	5.1E-9	T	21-03-2019	IPR025883	Cadherin-like beta sandwich domain
MAG081_75_4	cf386953af2de72de7417c5a1636e332	471	Pfam	PF12733	Cadherin-like beta sandwich domain	167	248	1.1E-9	T	21-03-2019	IPR025883	Cadherin-like beta sandwich domain
MAG081_51_5	e30a5c26345b868c2680d31b6d8a8df1	494	Pfam	PF01676	Metalloenzyme superfamily	3	479	1.3E-40	T	21-03-2019	IPR006124	Metalloenzyme
MAG081_51_5	e30a5c26345b868c2680d31b6d8a8df1	494	Pfam	PF06415	BPG-independent PGAM N-terminus (iPGM_N)	81	281	6.1E-48	T	21-03-2019	IPR011258	BPG-independent PGAM, N-terminal
MAG081_51_5	e30a5c26345b868c2680d31b6d8a8df1	494	TIGRFAM	TIGR01307	pgm_bpd_ind: phosphoglycerate mutase (2,3-diphosphoglycerate-independent)	3	491	1.3E-113	T	21-03-2019	IPR005995	Phosphoglycerate mutase, 2,3-bisphosphoglycerate-independent
MAG081_8_10	bb605a45b9ab59c7a7ede29cc607f7dc	200	TIGRFAM	TIGR00615	recR: recombination protein RecR	3	197	9.4E-70	T	21-03-2019	IPR000093	DNA recombination protein RecR
MAG081_8_10	bb605a45b9ab59c7a7ede29cc607f7dc	200	Pfam	PF13662	Toprim domain	82	171	1.5E-21	T	21-03-2019	IPR006171	TOPRIM  domain
MAG081_8_10	bb605a45b9ab59c7a7ede29cc607f7dc	200	Pfam	PF02132	RecR protein	41	79	1.1E-10	T	21-03-2019	IPR023628	Recombination protein RecR, C4-type zinc finger
MAG081_11_10	2c7087c727a9b9dbca6941b5e85c23ed	277	Pfam	PF02541	Ppx/GppA phosphatase family	42	190	3.6E-7	T	21-03-2019	IPR003695	Ppx/GppA phosphatase
MAG081_36_10	2701a35ed8ccb375ed55ea5b4e6ffcd6	197	Pfam	PF03631	Virulence factor BrkB	19	192	1.3E-21	T	21-03-2019	IPR017039	Virulence factor BrkB
MAG081_2_39	ff102ae936e6a80b912ebd83246c0f7c	582	Pfam	PF01434	Peptidase family M41	351	560	6.2E-79	T	21-03-2019	IPR000642	Peptidase M41
MAG081_2_39	ff102ae936e6a80b912ebd83246c0f7c	582	Pfam	PF00004	ATPase family associated with various cellular activities (AAA)	158	290	5.3E-44	T	21-03-2019	IPR003959	ATPase, AAA-type, core
MAG081_2_39	ff102ae936e6a80b912ebd83246c0f7c	582	TIGRFAM	TIGR01241	FtsH_fam: ATP-dependent metallopeptidase HflB	73	561	8.0E-227	T	21-03-2019	IPR005936	Peptidase, FtsH
MAG081_29_9	d81b01957f3bbf21667c4967785e5cab	72	TIGRFAM	TIGR00810	secG: preprotein translocase, SecG subunit	3	71	1.3E-15	T	21-03-2019	IPR004692	Preprotein translocase SecG subunit
MAG081_29_9	d81b01957f3bbf21667c4967785e5cab	72	Pfam	PF03840	Preprotein translocase SecG subunit	4	70	7.5E-15	T	21-03-2019	IPR004692	Preprotein translocase SecG subunit
MAG081_134_1	77210d80ed028aa22f9bad8878641773	99	Pfam	PF08863	YolD-like protein	20	95	7.5E-9	T	21-03-2019	IPR014962	YolD-like protein
MAG081_13_10	03a8d3e1fc98b106d9791f34d07a9e9c	434	Pfam	PF00226	DnaJ domain	5	66	2.6E-18	T	21-03-2019	IPR001623	DnaJ domain
MAG081_4_9	58cc081ec8967aff6cb0e038923d9f9a	478	Pfam	PF00391	PEP-utilising enzyme, mobile domain	402	467	1.2E-15	T	21-03-2019	IPR008279	PEP-utilising enzyme, mobile domain
MAG081_4_9	58cc081ec8967aff6cb0e038923d9f9a	478	Pfam	PF01326	Pyruvate phosphate dikinase, PEP/pyruvate binding domain	1	49	1.4E-7	T	21-03-2019	IPR002192	Pyruvate phosphate dikinase, PEP/pyruvate-binding
MAG081_38_5	29bdef5eebd8cb84a90f0be10fbb5553	950	Pfam	PF00293	NUDIX domain	396	502	1.7E-10	T	21-03-2019	IPR000086	NUDIX hydrolase domain
MAG081_38_5	29bdef5eebd8cb84a90f0be10fbb5553	950	Pfam	PF08264	Anticodon-binding domain of tRNA	798	912	7.8E-14	T	21-03-2019	IPR013155	Methionyl/Valyl/Leucyl/Isoleucyl-tRNA synthetase, anticodon-binding
MAG081_38_5	29bdef5eebd8cb84a90f0be10fbb5553	950	Pfam	PF13603	Leucyl-tRNA synthetase, Domain 2	220	382	4.6E-53	T	21-03-2019	IPR025709	Leucyl-tRNA synthetase, editing domain
MAG081_38_5	29bdef5eebd8cb84a90f0be10fbb5553	950	Pfam	PF00133	tRNA synthetases class I (I, L, M and V)	11	167	7.3E-25	T	21-03-2019	IPR002300	Aminoacyl-tRNA synthetase, class Ia
MAG081_38_5	29bdef5eebd8cb84a90f0be10fbb5553	950	Pfam	PF00133	tRNA synthetases class I (I, L, M and V)	564	768	8.8E-19	T	21-03-2019	IPR002300	Aminoacyl-tRNA synthetase, class Ia
MAG081_12_1	847e69061a6f0b64a623afb5796b15f1	400	Pfam	PF13173	AAA domain	20	149	1.7E-34	T	21-03-2019
MAG081_12_1	847e69061a6f0b64a623afb5796b15f1	400	Pfam	PF13635	Domain of unknown function (DUF4143)	200	344	6.4E-9	T	21-03-2019	IPR025420	Domain of unknown function DUF4143
MAG081_2_15	3f277ca664de39ce8c972d63a0ea0b01	165	Pfam	PF00466	Ribosomal protein L10	9	101	7.4E-25	T	21-03-2019	IPR001790	Ribosomal protein L10P
MAG081_2_11	0079f047c79191ba3926fe9acf83a359	532	TIGRFAM	TIGR01135	glmS: glutamine-fructose-6-phosphate transaminase (isomerizing)	3	532	8.5E-195	T	21-03-2019	IPR005855	Glucosamine-fructose-6-phosphate aminotransferase, isomerising
MAG081_2_11	0079f047c79191ba3926fe9acf83a359	532	Pfam	PF13522	Glutamine amidotransferase domain	3	122	2.3E-17	T	21-03-2019
MAG081_2_11	0079f047c79191ba3926fe9acf83a359	532	Pfam	PF01380	SIS domain	222	346	8.9E-28	T	21-03-2019	IPR001347	Sugar isomerase (SIS)
MAG081_2_11	0079f047c79191ba3926fe9acf83a359	532	Pfam	PF01380	SIS domain	387	512	1.7E-18	T	21-03-2019	IPR001347	Sugar isomerase (SIS)
MAG081_28_5	bed0e80c4c73e1aa12501b3bdeb1c37d	243	Pfam	PF13419	Haloacid dehalogenase-like hydrolase	7	215	1.1E-17	T	21-03-2019
MAG081_28_5	bed0e80c4c73e1aa12501b3bdeb1c37d	243	TIGRFAM	TIGR01549	HAD-SF-IA-v1: HAD hydrolase, family IA, variant 1	117	210	3.9E-7	T	21-03-2019	IPR006439	HAD hydrolase, subfamily IA
MAG081_97_2	ec492e5a011ea3a4a966d7282fed0c45	243	Pfam	PF01476	LysM domain	198	238	2.3E-8	T	21-03-2019	IPR018392	LysM domain
MAG081_120_2	e6a04482e867cb384a8abf0256f48b93	96	Pfam	PF00226	DnaJ domain	2	58	3.3E-10	T	21-03-2019	IPR001623	DnaJ domain
MAG081_12_12	0387027d4c8ad30592eeba5d375e58a5	867	Pfam	PF01326	Pyruvate phosphate dikinase, PEP/pyruvate binding domain	16	291	3.9E-44	T	21-03-2019	IPR002192	Pyruvate phosphate dikinase, PEP/pyruvate-binding
MAG081_12_12	0387027d4c8ad30592eeba5d375e58a5	867	Pfam	PF00391	PEP-utilising enzyme, mobile domain	416	497	5.9E-23	T	21-03-2019	IPR008279	PEP-utilising enzyme, mobile domain
MAG081_12_12	0387027d4c8ad30592eeba5d375e58a5	867	Pfam	PF02896	PEP-utilising enzyme, TIM barrel domain	513	860	1.2E-82	T	21-03-2019	IPR000121	PEP-utilising enzyme, C-terminal
MAG081_12_12	0387027d4c8ad30592eeba5d375e58a5	867	TIGRFAM	TIGR01828	pyru_phos_dikin: pyruvate, phosphate dikinase	2	861	0.0	T	21-03-2019	IPR010121	Pyruvate, phosphate dikinase
MAG081_27_13	78d7b256c04242098b88e50a4bcbc384	112	Pfam	PF12836	Helix-hairpin-helix motif	50	111	5.7E-21	T	21-03-2019
MAG081_27_13	78d7b256c04242098b88e50a4bcbc384	112	TIGRFAM	TIGR00426	TIGR00426: competence protein ComEA helix-hairpin-helix repeat region	49	112	1.7E-22	T	21-03-2019	IPR004509	Competence protein ComEA, helix-hairpin-helix domain
MAG081_23_5	7db588df14919e9a354a865b5cef0f27	302	TIGRFAM	TIGR01212	TIGR01212: radical SAM protein, TIGR01212 family	6	299	3.4E-97	T	21-03-2019	IPR005911	Protein YhcC-like
MAG081_23_5	7db588df14919e9a354a865b5cef0f27	302	Pfam	PF16199	Radical_SAM C-terminal domain	207	287	2.0E-18	T	21-03-2019	IPR032432	Radical SAM, C-terminal extension
MAG081_23_5	7db588df14919e9a354a865b5cef0f27	302	Pfam	PF04055	Radical SAM superfamily	44	202	4.6E-14	T	21-03-2019	IPR007197	Radical SAM
MAG081_111_1	377f5b27bceade9850cf15c2cf098737	132	Pfam	PF01653	NAD-dependent DNA ligase adenylation domain	3	132	2.6E-44	T	21-03-2019	IPR013839	NAD-dependent DNA ligase, adenylation
MAG081_113_3	54dda231c1e2731fda7198ecbd46d7cf	104	Pfam	PF00239	Resolvase, N terminal domain	1	103	5.7E-25	T	21-03-2019	IPR006119	Resolvase, N-terminal catalytic domain
MAG081_21_12	fdba3aecd089f2dee61d77fdf57e2a77	191	Pfam	PF01018	GTP1/OBG	3	157	1.1E-54	T	21-03-2019	IPR006169	GTP1/OBG domain
MAG081_7_10	c7a04676328334e9a602e23996da796f	283	TIGRFAM	TIGR00431	TruB: tRNA pseudouridine(55) synthase	5	212	1.1E-69	T	21-03-2019	IPR014780	tRNA pseudouridine synthase II, TruB
MAG081_7_10	c7a04676328334e9a602e23996da796f	283	Pfam	PF16198	tRNA pseudouridylate synthase B C-terminal domain	175	215	4.1E-9	T	21-03-2019	IPR032819	tRNA pseudouridylate synthase B, C-terminal
MAG081_7_10	c7a04676328334e9a602e23996da796f	283	Pfam	PF01509	TruB family pseudouridylate synthase (N terminal domain)	28	174	2.4E-50	T	21-03-2019	IPR002501	Pseudouridine synthase II, N-terminal
MAG081_31_2	1f5a5dc79320dddb67365298e45f1260	409	Pfam	PF09586	Bacterial membrane protein YfhO	21	327	1.3E-16	T	21-03-2019	IPR018580	Uncharacterised protein family YfhO
MAG081_73_4	c87d290bbeabce99a41650fc85e70bc4	383	TIGRFAM	TIGR02543	List_Bact_rpt: repeat, TIGR02543 family	207	242	3.7E-5	T	21-03-2019	IPR013378	Listeria/Bacterioides repeat
MAG081_73_4	c87d290bbeabce99a41650fc85e70bc4	383	TIGRFAM	TIGR02543	List_Bact_rpt: repeat, TIGR02543 family	121	160	1.5E-5	T	21-03-2019	IPR013378	Listeria/Bacterioides repeat
MAG081_73_4	c87d290bbeabce99a41650fc85e70bc4	383	Pfam	PF07591	Pretoxin HINT domain	250	378	1.7E-22	T	21-03-2019
MAG081_73_4	c87d290bbeabce99a41650fc85e70bc4	383	TIGRFAM	TIGR01443	intein_Cterm: intein C-terminal splicing region	356	378	4.0E-4	T	21-03-2019	IPR030934	Intein C-terminal splicing region
MAG081_73_4	c87d290bbeabce99a41650fc85e70bc4	383	TIGRFAM	TIGR01445	intein_Nterm: intein N-terminal splicing region	244	315	2.1E-8	T	21-03-2019	IPR006141	Intein N-terminal splicing region
MAG081_73_4	c87d290bbeabce99a41650fc85e70bc4	383	Pfam	PF09479	Listeria-Bacteroides repeat domain (List_Bact_rpt)	165	239	2.7E-10	T	21-03-2019	IPR013378	Listeria/Bacterioides repeat
MAG081_73_4	c87d290bbeabce99a41650fc85e70bc4	383	Pfam	PF09479	Listeria-Bacteroides repeat domain (List_Bact_rpt)	91	158	3.4E-17	T	21-03-2019	IPR013378	Listeria/Bacterioides repeat
MAG081_73_4	c87d290bbeabce99a41650fc85e70bc4	383	Pfam	PF09479	Listeria-Bacteroides repeat domain (List_Bact_rpt)	20	84	1.1E-4	T	21-03-2019	IPR013378	Listeria/Bacterioides repeat
MAG081_76_6	3739a9e438ce85554f72a51daae6bc2f	199	Pfam	PF06028	Alpha/beta hydrolase of unknown function (DUF915)	85	168	1.8E-4	T	21-03-2019	IPR010315	Protein of unknown function DUF915, hydrolase-like
MAG081_47_9	2f7da49d55710e0296b93873742c1de4	480	Pfam	PF09479	Listeria-Bacteroides repeat domain (List_Bact_rpt)	103	170	2.9E-9	T	21-03-2019	IPR013378	Listeria/Bacterioides repeat
MAG081_47_9	2f7da49d55710e0296b93873742c1de4	480	Pfam	PF09479	Listeria-Bacteroides repeat domain (List_Bact_rpt)	250	316	3.9E-6	T	21-03-2019	IPR013378	Listeria/Bacterioides repeat
MAG081_47_9	2f7da49d55710e0296b93873742c1de4	480	Pfam	PF09479	Listeria-Bacteroides repeat domain (List_Bact_rpt)	177	244	1.5E-17	T	21-03-2019	IPR013378	Listeria/Bacterioides repeat
MAG081_47_9	2f7da49d55710e0296b93873742c1de4	480	Pfam	PF09479	Listeria-Bacteroides repeat domain (List_Bact_rpt)	30	97	4.7E-18	T	21-03-2019	IPR013378	Listeria/Bacterioides repeat
MAG081_47_9	2f7da49d55710e0296b93873742c1de4	480	Pfam	PF09479	Listeria-Bacteroides repeat domain (List_Bact_rpt)	330	395	0.0028	T	21-03-2019	IPR013378	Listeria/Bacterioides repeat
MAG081_47_9	2f7da49d55710e0296b93873742c1de4	480	TIGRFAM	TIGR02543	List_Bact_rpt: repeat, TIGR02543 family	60	101	4.2E-10	T	21-03-2019	IPR013378	Listeria/Bacterioides repeat
MAG081_47_9	2f7da49d55710e0296b93873742c1de4	480	TIGRFAM	TIGR02543	List_Bact_rpt: repeat, TIGR02543 family	136	176	2.8E-7	T	21-03-2019	IPR013378	Listeria/Bacterioides repeat
MAG081_47_9	2f7da49d55710e0296b93873742c1de4	480	TIGRFAM	TIGR02543	List_Bact_rpt: repeat, TIGR02543 family	207	249	1.3E-11	T	21-03-2019	IPR013378	Listeria/Bacterioides repeat
MAG081_28_1	30c6bd559dfe63145845664a24b8c4dc	200	Pfam	PF04542	Sigma-70 region 2	3	62	3.8E-11	T	21-03-2019	IPR007627	RNA polymerase sigma-70 region 2
MAG081_28_1	30c6bd559dfe63145845664a24b8c4dc	200	Pfam	PF04545	Sigma-70, region 4	148	196	3.6E-12	T	21-03-2019	IPR007630	RNA polymerase sigma-70 region 4
MAG081_28_1	30c6bd559dfe63145845664a24b8c4dc	200	TIGRFAM	TIGR02937	sigma70-ECF: RNA polymerase sigma factor, sigma-70 family	2	196	8.5E-25	T	21-03-2019	IPR014284	RNA polymerase sigma-70 like domain
MAG081_7_6	04eef7f6cc73301b775837277b0f357e	719	TIGRFAM	TIGR03591	polynuc_phos: polyribonucleotide nucleotidyltransferase	9	704	7.1E-290	T	21-03-2019	IPR012162	Polyribonucleotide nucleotidyltransferase
MAG081_7_6	04eef7f6cc73301b775837277b0f357e	719	Pfam	PF03725	3' exoribonuclease family, domain 2	144	208	1.1E-15	T	21-03-2019	IPR015847	Exoribonuclease, phosphorolytic domain 2
MAG081_7_6	04eef7f6cc73301b775837277b0f357e	719	Pfam	PF03725	3' exoribonuclease family, domain 2	462	532	1.8E-7	T	21-03-2019	IPR015847	Exoribonuclease, phosphorolytic domain 2
MAG081_7_6	04eef7f6cc73301b775837277b0f357e	719	Pfam	PF03726	Polyribonucleotide nucleotidyltransferase, RNA binding domain	239	322	1.4E-9	T	21-03-2019	IPR015848	Polyribonucleotide nucleotidyltransferase, RNA-binding domain
MAG081_7_6	04eef7f6cc73301b775837277b0f357e	719	Pfam	PF01138	3' exoribonuclease family, domain 1	12	141	3.6E-19	T	21-03-2019	IPR001247	Exoribonuclease, phosphorolytic domain 1
MAG081_7_6	04eef7f6cc73301b775837277b0f357e	719	Pfam	PF01138	3' exoribonuclease family, domain 1	326	459	2.0E-17	T	21-03-2019	IPR001247	Exoribonuclease, phosphorolytic domain 1
MAG081_7_6	04eef7f6cc73301b775837277b0f357e	719	Pfam	PF00575	S1 RNA binding domain	632	703	4.5E-19	T	21-03-2019	IPR003029	S1 domain
MAG081_9_12	6a5da1e1708fdf6481baf1ec2fa653c3	454	Pfam	PF17147	Pyruvate:ferredoxin oxidoreductase core domain II	266	368	1.6E-15	T	21-03-2019	IPR033412	Pyruvate:ferredoxin oxidoreductase, core domain II
MAG081_9_12	6a5da1e1708fdf6481baf1ec2fa653c3	454	Pfam	PF01855	Pyruvate flavodoxin/ferredoxin oxidoreductase, thiamine diP-bdg	15	244	1.9E-74	T	21-03-2019	IPR002880	Pyruvate flavodoxin/ferredoxin oxidoreductase, N-terminal
MAG081_35_6	d5afa128f61ff3cf0523e02d4185649f	117	Pfam	PF14198	Transposon-encoded protein TnpV	4	115	7.9E-35	T	21-03-2019	IPR026989	Transposon-encoded protein TnpV
MAG081_26_15	eaa18ab23a3d6c8fdc3e0b9e76e4dff3	138	Pfam	PF00380	Ribosomal protein S9/S16	10	138	1.8E-43	T	21-03-2019	IPR000754	Ribosomal protein S9
