MAG027_43_13	93b530b49b0643ca9d16d0bc24939899	850	Pfam	PF02574	Homocysteine S-methyltransferase	15	286	3.6E-56	T	21-03-2019	IPR003726	Homocysteine-binding domain
MAG027_5_41	a66916081e7eb92e7b5ed0c7e31b8114	384	Pfam	PF00512	His Kinase A (phospho-acceptor) domain	144	209	1.4E-15	T	21-03-2019	IPR003661	Signal transduction histidine kinase, dimerisation/phosphoacceptor domain
MAG027_5_41	a66916081e7eb92e7b5ed0c7e31b8114	384	Pfam	PF02518	Histidine kinase-, DNA gyrase B-, and HSP90-like ATPase	259	364	1.7E-22	T	21-03-2019	IPR003594	Histidine kinase/HSP90-like ATPase
MAG027_5_41	a66916081e7eb92e7b5ed0c7e31b8114	384	Pfam	PF00672	HAMP domain	89	132	1.2E-7	T	21-03-2019	IPR003660	HAMP domain
MAG027_222_2	f7475b5d77056ddc37a14f922d76fc3a	246	Pfam	PF12847	Methyltransferase domain	3	153	9.6E-54	T	21-03-2019
MAG027_74_10	1f17f7287460396632e43c6e2e71043c	622	Pfam	PF09709	CRISPR-associated protein (Cas_Csd1)	7	602	6.9E-97	T	21-03-2019	IPR010144	CRISPR-associated protein, Csd1-type
MAG027_74_10	1f17f7287460396632e43c6e2e71043c	622	TIGRFAM	TIGR01863	cas_Csd1: CRISPR-associated protein Cas8c/Csd1, subtype I-C/DVULG	10	609	6.8E-79	T	21-03-2019	IPR010144	CRISPR-associated protein, Csd1-type
MAG027_33_5	013900e62ab7ac482d66eccc7b076e5e	438	Pfam	PF01050	Mannose-6-phosphate isomerase	295	427	2.0E-16	T	21-03-2019	IPR001538	Mannose-6-phosphate isomerase, type II, C-terminal
MAG027_33_5	013900e62ab7ac482d66eccc7b076e5e	438	Pfam	PF00483	Nucleotidyl transferase	4	266	2.3E-31	T	21-03-2019	IPR005835	Nucleotidyl transferase domain
MAG027_51_24	dc81423fa8c085830ed1166feecfadfb	148	Pfam	PF00465	Iron-containing alcohol dehydrogenase	2	47	2.2E-14	T	21-03-2019	IPR001670	Alcohol dehydrogenase, iron-type/glycerol dehydrogenase GldA
MAG027_178_1	6a8f87337b53466ccdc1fabf1da1be0d	207	Pfam	PF02677	Uncharacterized BCR, COG1636	26	202	4.0E-71	T	21-03-2019	IPR003828	Epoxyqueuosine reductase QueH
MAG027_5_50	359ef395d6a0d7765570e0e26e60c6ad	236	Pfam	PF00483	Nucleotidyl transferase	3	230	1.8E-31	T	21-03-2019	IPR005835	Nucleotidyl transferase domain
MAG027_30_3	f3db0ed1a631fcbf253185fd1657209c	164	Pfam	PF00694	Aconitase C-terminal domain	52	107	2.0E-21	T	21-03-2019	IPR000573	Aconitase A/isopropylmalate dehydratase small subunit, swivel domain
MAG027_30_3	f3db0ed1a631fcbf253185fd1657209c	164	TIGRFAM	TIGR02087	LEUD_arch: 3-isopropylmalate dehydratase, small subunit	6	157	6.0E-52	T	21-03-2019	IPR011827	Hydrolyase LeuD/HacB/DmdB
MAG027_14_22	dbe10c39bc632703edb54e5a0043a40f	429	Pfam	PF00278	Pyridoxal-dependent decarboxylase, C-terminal sheet domain	281	369	3.4E-19	T	21-03-2019	IPR022643	Orn/DAP/Arg decarboxylase 2, C-terminal
MAG027_14_22	dbe10c39bc632703edb54e5a0043a40f	429	Pfam	PF02784	Pyridoxal-dependent decarboxylase, pyridoxal binding domain	31	279	1.1E-24	T	21-03-2019	IPR022644	Orn/DAP/Arg decarboxylase 2, N-terminal
MAG027_39_23	2306f37b848f821d19c0144968e3dd2b	92	Pfam	PF00203	Ribosomal protein S19	3	83	4.3E-36	T	21-03-2019	IPR002222	Ribosomal protein S19/S15
MAG027_39_23	2306f37b848f821d19c0144968e3dd2b	92	TIGRFAM	TIGR01050	rpsS_bact: ribosomal protein uS19	1	92	5.8E-46	T	21-03-2019	IPR005732	Ribosomal protein S19, bacterial-type
MAG027_168_9	62ab5a787ad24507954173146e3c429e	106	Pfam	PF01476	LysM domain	44	91	1.5E-6	T	21-03-2019	IPR018392	LysM domain
MAG027_133_6	95297fa579d0b278cf3352e8eef89eb3	372	Pfam	PF17479	Protein of unknown function (DUF3048) C-terminal domain	246	354	1.5E-29	T	21-03-2019	IPR035328	Protein of unknown function DUF3048, C-terminal domain
MAG027_133_6	95297fa579d0b278cf3352e8eef89eb3	372	Pfam	PF11258	Protein of unknown function (DUF3048) N-terminal domain	73	215	2.3E-51	T	21-03-2019	IPR021416	Protein of unknown function DUF3048, N-terminal
MAG027_1_68	77f14182e269ccd2e6c57b4e115bdf57	164	Pfam	PF01257	Thioredoxin-like [2Fe-2S] ferredoxin	21	164	4.2E-50	T	21-03-2019
MAG027_56_9	5c14e1202f036930d158831bb8a4b1d7	506	Pfam	PF00665	Integrase core domain	119	246	1.0E-11	T	21-03-2019	IPR001584	Integrase, catalytic core
MAG027_12_19	3bd305d2ecce16b0616dc85952c5b729	461	Pfam	PF13416	Bacterial extracellular solute-binding protein	87	403	4.1E-43	T	21-03-2019	IPR006059	Bacterial extracellular solute-binding protein
MAG027_128_10	de2280a7f2e64f07b9c4e497016a9aec	296	TIGRFAM	TIGR00147	TIGR00147: lipid kinase, YegS/Rv2252/BmrU family	1	295	3.2E-55	T	21-03-2019	IPR005218	Diacylglycerol/lipid kinase
MAG027_128_10	de2280a7f2e64f07b9c4e497016a9aec	296	Pfam	PF00781	Diacylglycerol kinase catalytic domain	3	125	4.7E-29	T	21-03-2019	IPR001206	Diacylglycerol kinase, catalytic domain
MAG027_167_7	969927632c50e1ab02f6b1f211a2d2aa	166	Pfam	PF04892	VanZ like family	16	142	1.1E-34	T	21-03-2019	IPR006976	VanZ-like
MAG027_280_2	308720e3799672575519bf2c96819070	160	Pfam	PF08279	HTH domain	5	61	2.2E-9	T	21-03-2019	IPR013196	Helix-turn-helix, type 11
MAG027_280_2	308720e3799672575519bf2c96819070	160	Pfam	PF05043	Mga helix-turn-helix domain	95	137	2.8E-5	T	21-03-2019	IPR007737	Mga helix-turn-helix domain
MAG027_6_62	fe416634eb10ad58dd197166e7d3ed66	454	Pfam	PF00176	SNF2 family N-terminal domain	13	274	1.1E-29	T	21-03-2019	IPR000330	SNF2-related, N-terminal domain
MAG027_6_62	fe416634eb10ad58dd197166e7d3ed66	454	Pfam	PF00271	Helicase conserved C-terminal domain	295	411	1.4E-13	T	21-03-2019	IPR001650	Helicase, C-terminal
MAG027_31_27	f985620c7207876c74aa01bc620f30b8	126	Pfam	PF00392	Bacterial regulatory proteins, gntR family	13	75	3.4E-13	T	21-03-2019	IPR000524	Transcription regulator HTH, GntR
MAG027_119_4	9d8a612ae779106144a09dc901ef361d	451	Pfam	PF02254	TrkA-N domain	3	105	7.0E-25	T	21-03-2019	IPR003148	Regulator of K+ conductance, N-terminal
MAG027_119_4	9d8a612ae779106144a09dc901ef361d	451	Pfam	PF02254	TrkA-N domain	231	347	4.8E-19	T	21-03-2019	IPR003148	Regulator of K+ conductance, N-terminal
MAG027_119_4	9d8a612ae779106144a09dc901ef361d	451	Pfam	PF02080	TrkA-C domain	153	219	2.8E-9	T	21-03-2019	IPR006037	Regulator of K+ conductance, C-terminal
MAG027_119_4	9d8a612ae779106144a09dc901ef361d	451	Pfam	PF02080	TrkA-C domain	385	450	1.2E-8	T	21-03-2019	IPR006037	Regulator of K+ conductance, C-terminal
MAG027_80_3	55f1883ff15d1588229a2f1c4ef137d8	367	Pfam	PF14031	Putative serine dehydratase domain	258	347	3.5E-18	T	21-03-2019	IPR026956	D-serine dehydratase-like domain
MAG027_80_3	55f1883ff15d1588229a2f1c4ef137d8	367	Pfam	PF01168	Alanine racemase, N-terminal domain	17	242	1.2E-23	T	21-03-2019	IPR001608	Alanine racemase, N-terminal
MAG027_139_3	213ec788550b5a25f1a63ebf29e9ca9f	270	Pfam	PF07486	Cell Wall Hydrolase	178	234	6.5E-11	T	21-03-2019	IPR011105	Cell wall hydrolase, SleB
MAG027_77_9	ea00bf1f252444055a22c50e18cc7c55	403	Pfam	PF00925	GTP cyclohydrolase II	213	374	1.4E-70	T	21-03-2019	IPR032677	GTP cyclohydrolase II
MAG027_77_9	ea00bf1f252444055a22c50e18cc7c55	403	TIGRFAM	TIGR00505	ribA: GTP cyclohydrolase II	213	397	3.3E-75	T	21-03-2019	IPR000926	GTP cyclohydrolase II, RibA
MAG027_77_9	ea00bf1f252444055a22c50e18cc7c55	403	Pfam	PF00926	3,4-dihydroxy-2-butanone 4-phosphate synthase	9	199	6.9E-86	T	21-03-2019	IPR000422	3,4-dihydroxy-2-butanone 4-phosphate synthase, RibB
MAG027_77_9	ea00bf1f252444055a22c50e18cc7c55	403	TIGRFAM	TIGR00506	ribB: 3,4-dihydroxy-2-butanone-4-phosphate synthase	6	199	9.3E-77	T	21-03-2019	IPR000422	3,4-dihydroxy-2-butanone 4-phosphate synthase, RibB
MAG027_38_23	f27f7d03adb43e9b28577c3af3a51e80	276	Pfam	PF13614	AAA domain	3	184	1.2E-41	T	21-03-2019	IPR025669	AAA domain
MAG027_30_6	b70eb0a54c6412ad66407c2203466c18	154	Pfam	PF04074	Domain of unknown function (DUF386)	1	152	3.0E-47	T	21-03-2019	IPR004375	YhcH/YjgK/YiaL family
MAG027_30_6	b70eb0a54c6412ad66407c2203466c18	154	TIGRFAM	TIGR00022	TIGR00022: YhcH/YjgK/YiaL family protein	1	152	1.8E-36	T	21-03-2019	IPR004375	YhcH/YjgK/YiaL family
MAG027_180_5	e3aa9c4618dc67d7e48fb2fc29f270a0	602	Pfam	PF00270	DEAD/DEAH box helicase	462	593	3.0E-6	T	21-03-2019	IPR011545	DEAD/DEAH box helicase domain
MAG027_154_3	4e7ae5a7579a5d8c1a520fe7b2cd8ba1	553	Pfam	PF00072	Response regulator receiver domain	282	393	9.3E-27	T	21-03-2019	IPR001789	Signal transduction response regulator, receiver domain
MAG027_154_3	4e7ae5a7579a5d8c1a520fe7b2cd8ba1	553	Pfam	PF02518	Histidine kinase-, DNA gyrase B-, and HSP90-like ATPase	128	246	3.7E-19	T	21-03-2019	IPR003594	Histidine kinase/HSP90-like ATPase
MAG027_88_4	e87b9f84bb6d45010b0ff67247f94266	278	Pfam	PF12833	Helix-turn-helix domain	195	273	1.3E-20	T	21-03-2019	IPR018060	DNA binding HTH domain, AraC-type
MAG027_88_4	e87b9f84bb6d45010b0ff67247f94266	278	Pfam	PF02311	AraC-like ligand binding domain	16	119	4.9E-19	T	21-03-2019	IPR003313	AraC-type arabinose-binding/dimerisation domain
MAG027_14_6	9e35218dee8ff9cc33ff3a5d923663a8	168	TIGRFAM	TIGR02937	sigma70-ECF: RNA polymerase sigma factor, sigma-70 family	15	162	8.6E-26	T	21-03-2019	IPR014284	RNA polymerase sigma-70 like domain
MAG027_14_6	9e35218dee8ff9cc33ff3a5d923663a8	168	Pfam	PF04542	Sigma-70 region 2	19	84	7.3E-8	T	21-03-2019	IPR007627	RNA polymerase sigma-70 region 2
MAG027_14_6	9e35218dee8ff9cc33ff3a5d923663a8	168	Pfam	PF04545	Sigma-70, region 4	112	160	4.3E-12	T	21-03-2019	IPR007630	RNA polymerase sigma-70 region 4
MAG027_75_3	f0de60b80451c5e480af08e04b1ffe38	517	Pfam	PF07508	Recombinase	191	310	2.2E-18	T	21-03-2019	IPR011109	DNA-binding recombinase domain
MAG027_75_3	f0de60b80451c5e480af08e04b1ffe38	517	Pfam	PF00239	Resolvase, N terminal domain	9	162	7.0E-17	T	21-03-2019	IPR006119	Resolvase, N-terminal catalytic domain
MAG027_98_11	183ab4794aae9eeab5e28df3e38d1cab	197	Pfam	PF00005	ABC transporter	22	177	1.8E-27	T	21-03-2019	IPR003439	ABC transporter-like
MAG027_149_4	7db7d79e38d9d4b49d157480b4fab1ca	776	Pfam	PF00330	Aconitase family (aconitate hydratase)	48	477	2.9E-80	T	21-03-2019	IPR001030	Aconitase/3-isopropylmalate dehydratase large subunit, alpha/beta/alpha domain
MAG027_25_28	b7f764f8fa36dde28935c5d3703f89e1	462	TIGRFAM	TIGR00797	matE: MATE efflux family protein	28	414	2.8E-61	T	21-03-2019	IPR002528	Multi antimicrobial extrusion protein
MAG027_25_28	b7f764f8fa36dde28935c5d3703f89e1	462	Pfam	PF01554	MatE	253	404	1.1E-15	T	21-03-2019	IPR002528	Multi antimicrobial extrusion protein
MAG027_25_28	b7f764f8fa36dde28935c5d3703f89e1	462	Pfam	PF01554	MatE	28	188	5.1E-34	T	21-03-2019	IPR002528	Multi antimicrobial extrusion protein
MAG027_48_17	d046766ffc5c3588b0060139433ba19f	136	Pfam	PF06949	Protein of unknown function (DUF1292)	51	116	2.5E-6	T	21-03-2019	IPR009711	Uncharacterised protein family UPF0473
MAG027_8_40	cdbf0789c53ffbf305593084864f0611	124	TIGRFAM	TIGR00855	L12: ribosomal protein bL12	1	124	2.5E-45	T	21-03-2019	IPR000206	Ribosomal protein L7/L12
MAG027_8_40	cdbf0789c53ffbf305593084864f0611	124	Pfam	PF00542	Ribosomal protein L7/L12 C-terminal domain	58	124	9.8E-29	T	21-03-2019	IPR013823	Ribosomal protein L7/L12, C-terminal
MAG027_8_40	cdbf0789c53ffbf305593084864f0611	124	Pfam	PF16320	Ribosomal protein L7/L12 dimerisation domain	5	49	1.5E-18	T	21-03-2019	IPR008932	Ribosomal protein L7/L12, oligomerisation
MAG027_79_11	bf055ac853d4d1da3b8167b61429d207	339	Pfam	PF00535	Glycosyl transferase family 2	5	109	6.5E-28	T	21-03-2019	IPR001173	Glycosyltransferase 2-like
MAG027_44_21	98d99089db19696c946f851f0e00b4bd	306	Pfam	PF13490	Putative zinc-finger	7	40	1.7E-8	T	21-03-2019	IPR027383	Putative zinc-finger
MAG027_48_18	59474934db907249f0665697bff127a5	91	Pfam	PF01740	STAS domain	7	87	4.7E-12	T	21-03-2019	IPR002645	STAS domain
MAG027_48_18	59474934db907249f0665697bff127a5	91	TIGRFAM	TIGR00377	ant_ant_sig: anti-anti-sigma factor	6	90	3.4E-18	T	21-03-2019	IPR003658	Anti-sigma factor antagonist
MAG027_63_7	18260aeb5ab47a82fea07746d5b09810	613	Pfam	PF00128	Alpha amylase, catalytic domain	84	324	2.4E-41	T	21-03-2019	IPR006047	Glycosyl hydrolase, family 13, catalytic domain
MAG027_129_1	d7642a79d4f9e8ede96c3230e3fdc2ab	339	Pfam	PF02655	ATP-grasp domain	111	289	3.2E-17	T	21-03-2019	IPR003806	ATP-grasp fold, DUF201-type
MAG027_62_1	ca139b2336e2bcdfee3b12a5fc8bc180	141	Pfam	PF00486	Transcriptional regulatory protein, C terminal	56	126	6.7E-15	T	21-03-2019	IPR001867	OmpR/PhoB-type DNA-binding domain
MAG027_18_35	5a6458d3462e116cd675d84c168979d7	942	TIGRFAM	TIGR00630	uvra: excinuclease ABC subunit A	6	925	0.0	T	21-03-2019	IPR004602	UvrABC system subunit A
MAG027_18_35	5a6458d3462e116cd675d84c168979d7	942	Pfam	PF00005	ABC transporter	624	860	4.7E-9	T	21-03-2019	IPR003439	ABC transporter-like
MAG027_14_30	4e94d9ffd6bffd4aff2dc79bfff088fc	284	TIGRFAM	TIGR01146	ATPsyn_F1gamma: ATP synthase F1, gamma subunit	1	283	7.7E-88	T	21-03-2019	IPR000131	ATP synthase, F1 complex, gamma subunit
MAG027_14_30	4e94d9ffd6bffd4aff2dc79bfff088fc	284	Pfam	PF00231	ATP synthase	3	282	1.8E-87	T	21-03-2019	IPR000131	ATP synthase, F1 complex, gamma subunit
MAG027_143_3	9f7581186dbe7931e4e4e2705eebd2e7	443	Pfam	PF14501	GHKL domain	346	434	9.0E-17	T	21-03-2019	IPR032834	Sensor histidine kinase NatK, C-terminal domain
MAG027_5_3	11c44dcdba5936d92b796ed2d674e8e7	157	Pfam	PF03682	Uncharacterised protein family (UPF0158)	10	147	4.3E-15	T	21-03-2019	IPR005361	Uncharacterised protein family UPF0158
MAG027_5_51	d15422099083dc394e0165a9710ad252	359	Pfam	PF08544	GHMP kinases C terminal	234	300	4.8E-10	T	21-03-2019	IPR013750	GHMP kinase, C-terminal domain
MAG027_5_51	d15422099083dc394e0165a9710ad252	359	Pfam	PF00288	GHMP kinases N terminal domain	95	162	1.6E-12	T	21-03-2019	IPR006204	GHMP kinase N-terminal domain
MAG027_202_5	6950cd7f3685650090710c0d0e75b95a	189	Pfam	PF06130	Phosphate propanoyltransferase	5	83	9.3E-31	T	21-03-2019	IPR008300	Phosphate propanoyltransferase
MAG027_202_5	6950cd7f3685650090710c0d0e75b95a	189	Pfam	PF06130	Phosphate propanoyltransferase	112	178	1.5E-18	T	21-03-2019	IPR008300	Phosphate propanoyltransferase
MAG027_2_25	59ab295cf46df3b5ef9c481f10c85f0c	122	Pfam	PF03965	Penicillinase repressor	7	122	2.3E-20	T	21-03-2019	IPR005650	BlaI transcriptional regulatory family
MAG027_77_7	3152d4dad83c96cb067bc81dc9bb75f9	770	Pfam	PF02518	Histidine kinase-, DNA gyrase B-, and HSP90-like ATPase	659	750	3.3E-9	T	21-03-2019	IPR003594	Histidine kinase/HSP90-like ATPase
MAG027_77_7	3152d4dad83c96cb067bc81dc9bb75f9	770	Pfam	PF00512	His Kinase A (phospho-acceptor) domain	547	612	2.5E-14	T	21-03-2019	IPR003661	Signal transduction histidine kinase, dimerisation/phosphoacceptor domain
MAG027_236_1	700cd7043e3b75e9290a9654a6d7d506	313	Pfam	PF00889	Elongation factor TS	72	293	1.2E-66	T	21-03-2019	IPR014039	Translation elongation factor EFTs/EF1B, dimerisation
MAG027_236_1	700cd7043e3b75e9290a9654a6d7d506	313	TIGRFAM	TIGR00116	tsf: translation elongation factor Ts	1	311	1.4E-91	T	21-03-2019	IPR001816	Translation elongation factor EFTs/EF1B
MAG027_269_3	ab88ec42ffe06094b886b00dce46a8fd	257	Pfam	PF00106	short chain dehydrogenase	2	186	2.4E-37	T	21-03-2019	IPR002347	Short-chain dehydrogenase/reductase SDR
MAG027_24_26	f4400676de3f5b6a4b414a7dd82ba7d0	136	Pfam	PF02618	YceG-like family	62	128	1.3E-6	T	21-03-2019	IPR003770	Endolytic murein transglycosylase
MAG027_50_13	0a911c05264d96ee533a5b590ca8c205	430	Pfam	PF13735	tRNA nucleotidyltransferase domain 2 putative	276	423	1.5E-16	T	21-03-2019	IPR032810	CCA-adding enzyme, C-terminal
MAG027_50_13	0a911c05264d96ee533a5b590ca8c205	430	Pfam	PF01743	Poly A polymerase head domain	51	171	3.0E-38	T	21-03-2019	IPR002646	Poly A polymerase, head domain
MAG027_50_13	0a911c05264d96ee533a5b590ca8c205	430	Pfam	PF12627	Probable RNA and SrmB- binding site of polymerase A	198	249	1.1E-15	T	21-03-2019	IPR032828	tRNA nucleotidyltransferase/poly(A) polymerase, RNA and SrmB- binding domain
MAG027_51_8	c90740ed7fe2098b998a14705d898991	242	Pfam	PF04397	LytTr DNA-binding domain	142	227	5.6E-16	T	21-03-2019	IPR007492	LytTR DNA-binding domain
MAG027_51_8	c90740ed7fe2098b998a14705d898991	242	Pfam	PF00072	Response regulator receiver domain	4	119	3.0E-13	T	21-03-2019	IPR001789	Signal transduction response regulator, receiver domain
MAG027_187_7	79346acd1e3c483cbfd2128ea28c6316	194	Pfam	PF00293	NUDIX domain	46	171	3.2E-10	T	21-03-2019	IPR000086	NUDIX hydrolase domain
MAG027_69_12	a73a3f3994426c714208c11fa062e9a9	276	Pfam	PF13411	MerR HTH family regulatory protein	9	76	3.8E-9	T	21-03-2019	IPR000551	MerR-type HTH domain
MAG027_238_1	dad5c5cea5783370713a822ff65eb009	198	Pfam	PF06580	Histidine kinase	109	187	8.5E-21	T	21-03-2019	IPR010559	Signal transduction histidine kinase, internal region
MAG027_39_27	3d91946cb6eab83bba6b12ffacd32f81	68	Pfam	PF00831	Ribosomal L29 protein	9	64	5.8E-26	T	21-03-2019	IPR001854	Ribosomal protein L29/L35
MAG027_39_27	3d91946cb6eab83bba6b12ffacd32f81	68	TIGRFAM	TIGR00012	L29: ribosomal protein uL29	9	64	7.6E-23	T	21-03-2019	IPR001854	Ribosomal protein L29/L35
MAG027_43_20	0293ad74be42f184f67346b611061d25	403	Pfam	PF00155	Aminotransferase class I and II	61	381	2.8E-48	T	21-03-2019	IPR004839	Aminotransferase, class I/classII
MAG027_1_44	445f28a02c536cf967bb07cf1729ac36	230	Pfam	PF00528	Binding-protein-dependent transport system inner membrane component	40	226	8.4E-19	T	21-03-2019	IPR000515	ABC transporter type 1, transmembrane domain MetI-like
MAG027_1_44	445f28a02c536cf967bb07cf1729ac36	230	TIGRFAM	TIGR01726	HEQRo_perm_3TM: amino ABC transporter, permease protein, 3-TM region, His/Glu/Gln/Arg/opine family	20	120	3.1E-20	T	21-03-2019	IPR010065	Amino acid ABC transporter, permease protein, 3-TM domain
MAG027_10_19	93be4f87abff3e6b95493488e41e6a49	100	Pfam	PF02302	PTS system, Lactose/Cellobiose specific IIB subunit	3	93	2.2E-21	T	21-03-2019	IPR003501	Phosphotransferase system, EIIB component, type 2/3
MAG027_11_18	d1e1a08db74f8daf0120a8a7ffcabd13	462	TIGRFAM	TIGR03974	rSAM_six_Cys: SCIFF radical SAM maturase	2	460	1.1E-243	T	21-03-2019	IPR024025	SCIFF radical SAM maturase
MAG027_11_18	d1e1a08db74f8daf0120a8a7ffcabd13	462	Pfam	PF13353	4Fe-4S single cluster domain	109	228	2.4E-13	T	21-03-2019
MAG027_11_18	d1e1a08db74f8daf0120a8a7ffcabd13	462	Pfam	PF04055	Radical SAM superfamily	113	234	1.1E-10	T	21-03-2019	IPR007197	Radical SAM
MAG027_11_18	d1e1a08db74f8daf0120a8a7ffcabd13	462	TIGRFAM	TIGR04085	rSAM_more_4Fe4S: radical SAM additional 4Fe4S-binding SPASM domain	356	439	1.6E-18	T	21-03-2019	IPR023885	4Fe4S-binding SPASM domain
MAG027_161_6	5d1aa8f03d26337aa7456bcf3b2ad9c2	92	Pfam	PF00356	Bacterial regulatory proteins, lacI family	4	48	9.6E-19	T	21-03-2019	IPR000843	LacI-type HTH domain
MAG027_217_1	bdda822aaffd3681b72d78f4b4e89841	70	Pfam	PF05239	PRC-barrel domain	1	69	9.8E-12	T	21-03-2019	IPR027275	PRC-barrel domain
MAG027_217_1	bdda822aaffd3681b72d78f4b4e89841	70	TIGRFAM	TIGR02888	spore_YlmC_YmxH: sporulation protein, YlmC/YmxH family	2	70	1.9E-18	T	21-03-2019	IPR014238	Sporulation protein YlmC/YmxH
MAG027_172_3	65291979650a2dd5d629fd8ac57f9c95	248	Pfam	PF01418	Helix-turn-helix domain, rpiR family	8	73	2.0E-13	T	21-03-2019	IPR000281	Helix-turn-helix protein RpiR
MAG027_172_3	65291979650a2dd5d629fd8ac57f9c95	248	Pfam	PF01380	SIS domain	111	215	3.1E-7	T	21-03-2019	IPR001347	Sugar isomerase (SIS)
MAG027_91_2	01d9e5b0f1ae7b66b8e60cce4c92e13a	1080	Pfam	PF08455	Bacterial SNF2 helicase associated	204	581	5.5E-72	T	21-03-2019	IPR013663	Helicase, SWF/SNF/SWI type, bacterial
MAG027_91_2	01d9e5b0f1ae7b66b8e60cce4c92e13a	1080	Pfam	PF00271	Helicase conserved C-terminal domain	914	1025	1.9E-18	T	21-03-2019	IPR001650	Helicase, C-terminal
MAG027_91_2	01d9e5b0f1ae7b66b8e60cce4c92e13a	1080	Pfam	PF00176	SNF2 family N-terminal domain	607	904	5.3E-58	T	21-03-2019	IPR000330	SNF2-related, N-terminal domain
MAG027_2_36	5523b7d3d70f3706702329a49f94fd7d	461	Pfam	PF01473	Putative cell wall binding repeat	95	103	0.49	T	21-03-2019	IPR018337	Cell wall/choline-binding repeat
MAG027_2_36	5523b7d3d70f3706702329a49f94fd7d	461	Pfam	PF01473	Putative cell wall binding repeat	34	50	0.0039	T	21-03-2019	IPR018337	Cell wall/choline-binding repeat
MAG027_79_7	e14422fb9a416ab14e1545e71ef1a84a	1059	Pfam	PF16353	Domain of unknown function(DUF4981)	667	749	5.8E-18	T	21-03-2019	IPR032312	Beta-galactosidase, domain 4
MAG027_79_7	e14422fb9a416ab14e1545e71ef1a84a	1059	Pfam	PF02929	Beta galactosidase small chain	785	1054	2.2E-65	T	21-03-2019	IPR004199	Beta galactosidase small chain/ domain 5
MAG027_79_7	e14422fb9a416ab14e1545e71ef1a84a	1059	Pfam	PF02836	Glycosyl hydrolases family 2, TIM barrel domain	355	647	6.3E-131	T	21-03-2019	IPR006103	Glycoside hydrolase family 2, catalytic domain
MAG027_79_7	e14422fb9a416ab14e1545e71ef1a84a	1059	Pfam	PF02837	Glycosyl hydrolases family 2, sugar binding domain	53	223	2.6E-29	T	21-03-2019	IPR006104	Glycosyl hydrolases family 2, sugar binding domain
MAG027_79_7	e14422fb9a416ab14e1545e71ef1a84a	1059	Pfam	PF00703	Glycosyl hydrolases family 2	264	353	8.4E-9	T	21-03-2019	IPR006102	Glycoside hydrolase, family 2, immunoglobulin-like beta-sandwich
MAG027_5_44	f1ee5e2950eace83fabf0f4e3e54857a	282	Pfam	PF12698	ABC-2 family transporter protein	54	265	2.1E-11	T	21-03-2019
MAG027_108_7	7d2c1c114fbb778eb66840385eaf2fa3	407	TIGRFAM	TIGR01127	ilvA_1Cterm: threonine ammonia-lyase	21	395	9.4E-134	T	21-03-2019	IPR005789	Threonine dehydratase, catabolic
MAG027_108_7	7d2c1c114fbb778eb66840385eaf2fa3	407	Pfam	PF00291	Pyridoxal-phosphate dependent enzyme	18	301	1.2E-78	T	21-03-2019	IPR001926	Pyridoxal-phosphate dependent enzyme
MAG027_223_4	e0763804b2d4cc6462ae038af24807d9	110	Pfam	PF16429	Domain of unknown function (DUF5026)	3	84	5.1E-38	T	21-03-2019	IPR032207	Protein of unknown function DUF5026
MAG027_47_6	072a02b22cfb76dd5378f7554b9262e3	372	Pfam	PF00145	C-5 cytosine-specific DNA methylase	11	358	2.6E-59	T	21-03-2019	IPR001525	C-5 cytosine methyltransferase
MAG027_47_6	072a02b22cfb76dd5378f7554b9262e3	372	TIGRFAM	TIGR00675	dcm: DNA (cytosine-5-)-methyltransferase	11	183	1.1E-39	T	21-03-2019	IPR001525	C-5 cytosine methyltransferase
MAG027_9_18	0be35a26f3a52479fe24f82ba0df5196	270	Pfam	PF03613	PTS system mannose/fructose/sorbose family IID component	3	264	1.5E-92	T	21-03-2019	IPR004704	Phosphotransferase system, mannose/fructose/sorbose family IID component
MAG027_22_25	ad10d8c5b4813c6d650dccace6ead64d	435	Pfam	PF01969	Protein of unknown function DUF111	7	424	2.8E-151	T	21-03-2019	IPR002822	Nickel insertion protein
MAG027_22_25	ad10d8c5b4813c6d650dccace6ead64d	435	TIGRFAM	TIGR00299	TIGR00299: TIGR00299 family protein	8	424	9.7E-95	T	21-03-2019	IPR002822	Nickel insertion protein
MAG027_64_13	5145ccbdc288c142057a0f7523182017	552	Pfam	PF07508	Recombinase	192	309	1.5E-23	T	21-03-2019	IPR011109	DNA-binding recombinase domain
MAG027_64_13	5145ccbdc288c142057a0f7523182017	552	Pfam	PF13408	Recombinase zinc beta ribbon domain	326	385	6.2E-13	T	21-03-2019	IPR025827	Recombinase zinc beta ribbon domain
MAG027_64_13	5145ccbdc288c142057a0f7523182017	552	Pfam	PF00239	Resolvase, N terminal domain	9	167	8.6E-22	T	21-03-2019	IPR006119	Resolvase, N-terminal catalytic domain
MAG027_159_1	4fcc014105f64d682674e73b8497e106	89	Pfam	PF09820	Predicted AAA-ATPase	1	48	4.6E-6	T	21-03-2019	IPR018631	AAA-ATPase-like domain
MAG027_294_1	7d01eb2a0d87f996b1f5098155e6e86f	565	Pfam	PF00204	DNA gyrase B	226	394	2.2E-48	T	21-03-2019	IPR013506	DNA topoisomerase, type IIA, subunit B, domain 2
MAG027_294_1	7d01eb2a0d87f996b1f5098155e6e86f	565	Pfam	PF01751	Toprim domain	422	536	1.1E-17	T	21-03-2019	IPR006171	TOPRIM  domain
MAG027_294_1	7d01eb2a0d87f996b1f5098155e6e86f	565	Pfam	PF02518	Histidine kinase-, DNA gyrase B-, and HSP90-like ATPase	34	162	9.9E-20	T	21-03-2019	IPR003594	Histidine kinase/HSP90-like ATPase
MAG027_51_3	a1aa018fd46b9559c2aac57ae12567a0	428	Pfam	PF05697	Bacterial trigger factor protein (TF)	1	144	6.4E-45	T	21-03-2019	IPR008881	Trigger factor, ribosome-binding, bacterial
MAG027_51_3	a1aa018fd46b9559c2aac57ae12567a0	428	Pfam	PF00254	FKBP-type peptidyl-prolyl cis-trans isomerase	159	239	7.8E-11	T	21-03-2019	IPR001179	FKBP-type peptidyl-prolyl cis-trans isomerase domain
MAG027_51_3	a1aa018fd46b9559c2aac57ae12567a0	428	Pfam	PF05698	Bacterial trigger factor protein (TF) C-terminus	263	422	1.2E-38	T	21-03-2019	IPR008880	Trigger factor, C-terminal
MAG027_51_3	a1aa018fd46b9559c2aac57ae12567a0	428	TIGRFAM	TIGR00115	tig: trigger factor	13	422	1.5E-135	T	21-03-2019	IPR005215	Trigger factor
MAG027_224_2	791a47e0768bb2cdea4c276d8d5fa4bb	355	TIGRFAM	TIGR00174	miaA: tRNA dimethylallyltransferase	5	289	7.6E-95	T	21-03-2019	IPR018022	IPP transferase
MAG027_224_2	791a47e0768bb2cdea4c276d8d5fa4bb	355	Pfam	PF01715	IPP transferase	38	284	4.0E-81	T	21-03-2019	IPR018022	IPP transferase
MAG027_240_2	746156e5776441859f93fb4a7dddd39f	255	Pfam	PF10418	Iron-sulfur cluster binding domain of dihydroorotate dehydrogenase B	210	253	9.9E-19	T	21-03-2019	IPR019480	Dihydroorotate dehydrogenase, electron transfer subunit, iron-sulphur cluster binding domain
MAG027_57_6	2fef06511473135a90fed6904d921459	490	Pfam	PF07685	CobB/CobQ-like glutamine amidotransferase domain	251	431	9.6E-48	T	21-03-2019	IPR011698	CobB/CobQ-like glutamine amidotransferase
MAG027_57_6	2fef06511473135a90fed6904d921459	490	TIGRFAM	TIGR00313	cobQ: cobyric acid synthase CobQ	5	479	2.3E-150	T	21-03-2019	IPR004459	Cobyric acid synthase CobQ
MAG027_57_6	2fef06511473135a90fed6904d921459	490	Pfam	PF01656	CobQ/CobB/MinD/ParA nucleotide binding domain	5	228	4.9E-22	T	21-03-2019	IPR002586	CobQ/CobB/MinD/ParA nucleotide binding domain
MAG027_44_20	bf5d5ce49697195e2be32e033b606e8d	306	Pfam	PF00294	pfkB family carbohydrate kinase	12	289	2.7E-43	T	21-03-2019	IPR011611	Carbohydrate kinase PfkB
MAG027_44_20	bf5d5ce49697195e2be32e033b606e8d	306	TIGRFAM	TIGR03828	pfkB: 1-phosphofructokinase	2	299	1.0E-97	T	21-03-2019	IPR022463	Fructose 1-phosphate kinase
MAG027_44_20	bf5d5ce49697195e2be32e033b606e8d	306	TIGRFAM	TIGR03168	1-PFK: hexose kinase, 1-phosphofructokinase family	2	300	1.0E-95	T	21-03-2019	IPR017583	Tagatose/fructose phosphokinase
MAG027_43_1	f3a6834b02c317c44a6fb5c389c7274f	801	Pfam	PF06733	DEAD_2	310	417	3.6E-8	T	21-03-2019	IPR010614	DEAD2
MAG027_43_1	f3a6834b02c317c44a6fb5c389c7274f	801	Pfam	PF13307	Helicase C-terminal domain	611	783	9.6E-42	T	21-03-2019	IPR006555	ATP-dependent helicase, C-terminal
