MAG104_7_65	fb27a8e4ac25b1e369ed2585f0f6f47f	211	Pfam	PF05076	Suppressor of fused protein (SUFU)	46	208	7.8E-29	T	21-03-2019	IPR020941	Suppressor of fused-like domain
MAG104_6_28	0f98436924f05ef4070b1136d0cc1f92	308	Pfam	PF01715	IPP transferase	33	279	1.2E-83	T	21-03-2019	IPR018022	IPP transferase
MAG104_6_28	0f98436924f05ef4070b1136d0cc1f92	308	TIGRFAM	TIGR00174	miaA: tRNA dimethylallyltransferase	2	285	2.8E-97	T	21-03-2019	IPR018022	IPP transferase
MAG104_63_9	8515122099fba18f2fe1c2a9d8cd0dd3	106	Pfam	PF13490	Putative zinc-finger	3	36	8.6E-7	T	21-03-2019	IPR027383	Putative zinc-finger
MAG104_73_4	e5cf53a1cb160fa8f511b196b7965861	259	Pfam	PF01026	TatD related DNase	3	253	2.9E-75	T	21-03-2019	IPR001130	TatD family
MAG104_73_4	e5cf53a1cb160fa8f511b196b7965861	259	TIGRFAM	TIGR00010	TIGR00010: hydrolase, TatD family	2	253	1.5E-81	T	21-03-2019	IPR015991	Uncharacterised hydrolase TatD-type
MAG104_48_3	d77e41631cb98f27ade22794bb71cb5a	374	Pfam	PF14897	EpsG family	25	338	2.0E-29	T	21-03-2019
MAG104_6_38	c4efc10a2656c97c7643be113210a60d	414	Pfam	PF03486	HI0933-like protein	4	410	1.9E-101	T	21-03-2019
MAG104_6_38	c4efc10a2656c97c7643be113210a60d	414	TIGRFAM	TIGR00275	TIGR00275: flavoprotein, HI0933 family	5	409	1.5E-110	T	21-03-2019	IPR004792	Conserved hypothetical protein CHP00275, flavoprotein HI0933-like
MAG104_87_1	99438aca0856820283b5806340772daa	229	Pfam	PF13280	WYL domain	59	220	5.4E-24	T	21-03-2019	IPR026881	WYL domain
MAG104_2_133	81ad3fe180deb1cb29cdbc1eab2c2d7d	1236	Pfam	PF00580	UvrD/REP helicase N-terminal domain	6	456	3.9E-67	T	21-03-2019	IPR034739	UvrD/AddA helicase, N-terminal
MAG104_2_133	81ad3fe180deb1cb29cdbc1eab2c2d7d	1236	Pfam	PF12705	PD-(D/E)XK nuclease superfamily	1062	1227	8.5E-9	T	21-03-2019	IPR038726	PD-(D/E)XK endonuclease-like domain, AddAB-type
MAG104_2_133	81ad3fe180deb1cb29cdbc1eab2c2d7d	1236	Pfam	PF13361	UvrD-like helicase C-terminal domain	466	873	1.7E-33	T	21-03-2019	IPR014017	UvrD-like DNA helicase, C-terminal
MAG104_2_133	81ad3fe180deb1cb29cdbc1eab2c2d7d	1236	TIGRFAM	TIGR02785	addA_Gpos: helicase-exonuclease AddAB, AddA subunit	5	1228	0.0	T	21-03-2019	IPR014152	DNA helicase subunit AddA
MAG104_6_77	90d8f146197678ba811e2de87a335709	224	Pfam	PF07729	FCD domain	88	210	4.5E-26	T	21-03-2019	IPR011711	GntR, C-terminal
MAG104_6_77	90d8f146197678ba811e2de87a335709	224	Pfam	PF00392	Bacterial regulatory proteins, gntR family	18	78	8.2E-18	T	21-03-2019	IPR000524	Transcription regulator HTH, GntR
MAG104_36_4	c5a9d9bac233102d415f69d48a650991	293	Pfam	PF13242	HAD-hyrolase-like	210	283	5.1E-18	T	21-03-2019
MAG104_36_4	c5a9d9bac233102d415f69d48a650991	293	TIGRFAM	TIGR01460	HAD-SF-IIA: HAD hydrolase, family IIA	32	259	1.0E-38	T	21-03-2019	IPR006357	HAD-superfamily hydrolase, subfamily IIA
MAG104_36_4	c5a9d9bac233102d415f69d48a650991	293	Pfam	PF13344	Haloacid dehalogenase-like hydrolase	32	131	3.5E-21	T	21-03-2019	IPR006357	HAD-superfamily hydrolase, subfamily IIA
MAG104_32_34	d092f32a84b975b4d55b9964fa35d18c	283	Pfam	PF01887	S-adenosyl-l-methionine hydroxide adenosyltransferase	8	276	9.5E-59	T	21-03-2019	IPR002747	SAM-dependent chlorinase/fluorinase
MAG104_39_26	df87919213dac2dc38bcd68857c47f79	350	TIGRFAM	TIGR00048	rRNA_mod_RlmN: 23S rRNA (adenine(2503)-C(2))-methyltransferase	2	344	1.9E-123	T	21-03-2019	IPR027492	Dual-specificity RNA methyltransferase RlmN
MAG104_39_26	df87919213dac2dc38bcd68857c47f79	350	Pfam	PF13394	4Fe-4S single cluster domain	112	202	2.1E-6	T	21-03-2019
MAG104_39_26	df87919213dac2dc38bcd68857c47f79	350	Pfam	PF04055	Radical SAM superfamily	108	269	1.0E-17	T	21-03-2019	IPR007197	Radical SAM
MAG104_7_84	5343ed722851731210efa3c9c93834f9	518	Pfam	PF01546	Peptidase family M20/M25/M40	70	516	3.7E-15	T	21-03-2019	IPR002933	Peptidase M20
MAG104_13_25	aec7f6b0edeab8c56f8201b437002613	119	Pfam	PF00072	Response regulator receiver domain	4	114	9.6E-32	T	21-03-2019	IPR001789	Signal transduction response regulator, receiver domain
MAG104_8_49	de4081eac90ae5255f6a34ed7325a907	792	TIGRFAM	TIGR02532	IV_pilin_GFxxxE: prepilin-type N-terminal cleavage/methylation domain	14	35	6.2E-6	T	21-03-2019	IPR012902	Prokaryotic N-terminal methylation site
MAG104_8_49	de4081eac90ae5255f6a34ed7325a907	792	Pfam	PF07963	Prokaryotic N-terminal methylation motif	12	36	1.0E-6	T	21-03-2019	IPR012902	Prokaryotic N-terminal methylation site
MAG104_1_75	e3b7c63496c6b2f7fcc0cda04f2f913a	142	Pfam	PF13279	Thioesterase-like superfamily	16	119	5.6E-17	T	21-03-2019
MAG104_1_75	e3b7c63496c6b2f7fcc0cda04f2f913a	142	TIGRFAM	TIGR00051	TIGR00051: acyl-CoA thioester hydrolase, YbgC/YbaW family	11	122	3.8E-24	T	21-03-2019	IPR006684	Acyl-CoA thioester hydrolase YbgC/YbaW family
MAG104_29_19	6c5b9dceb3023fc385df54a7774d79b1	379	Pfam	PF00512	His Kinase A (phospho-acceptor) domain	147	212	1.6E-14	T	21-03-2019	IPR003661	Signal transduction histidine kinase, dimerisation/phosphoacceptor domain
MAG104_29_19	6c5b9dceb3023fc385df54a7774d79b1	379	Pfam	PF00672	HAMP domain	88	134	1.2E-7	T	21-03-2019	IPR003660	HAMP domain
MAG104_29_19	6c5b9dceb3023fc385df54a7774d79b1	379	Pfam	PF02518	Histidine kinase-, DNA gyrase B-, and HSP90-like ATPase	261	370	6.2E-29	T	21-03-2019	IPR003594	Histidine kinase/HSP90-like ATPase
MAG104_7_40	4370cac5422f3d53e1df52cbf979e4fd	489	Pfam	PF03062	MBOAT, membrane-bound O-acyltransferase family	148	348	4.3E-31	T	21-03-2019	IPR004299	Membrane bound O-acyl transferase, MBOAT
MAG104_8_41	4706dac1cbebc5d295cfd7b5632ad72c	337	Pfam	PF14841	FliG middle domain	119	192	2.1E-32	T	21-03-2019	IPR032779	Flagellar motor switch protein FliG, middle domain
MAG104_8_41	4706dac1cbebc5d295cfd7b5632ad72c	337	TIGRFAM	TIGR00207	fliG: flagellar motor switch protein FliG	3	337	2.2E-138	T	21-03-2019	IPR000090	Flagellar motor switch protein FliG
MAG104_8_41	4706dac1cbebc5d295cfd7b5632ad72c	337	Pfam	PF14842	FliG N-terminal domain	8	110	1.6E-35	T	21-03-2019	IPR028263	Flagellar motor switch protein FliG, N-terminal domain
MAG104_8_41	4706dac1cbebc5d295cfd7b5632ad72c	337	Pfam	PF01706	FliG C-terminal domain	220	327	7.7E-43	T	21-03-2019	IPR023087	Flagellar motor switch protein FliG, C-terminal
MAG104_3_108	dcef13b64edc618d073a9962fa9f1224	741	Pfam	PF16875	Glycosyl hydrolase family 36 N-terminal domain	28	285	1.6E-89	T	21-03-2019	IPR031704	Glycosyl hydrolase family 36, N-terminal
MAG104_3_108	dcef13b64edc618d073a9962fa9f1224	741	Pfam	PF02065	Melibiase	289	635	1.2E-159	T	21-03-2019	IPR002252	Glycoside hydrolase family 36
MAG104_3_108	dcef13b64edc618d073a9962fa9f1224	741	Pfam	PF16874	Glycosyl hydrolase family 36 C-terminal domain	649	737	3.6E-16	T	21-03-2019	IPR031705	Glycosyl hydrolase family 36, C-terminal
MAG104_39_11	5f8516c3dbb1cc22360f663e3febd39b	128	TIGRFAM	TIGR04086	TIGR04086_membr: putative membrane protein, TIGR04086 family	22	128	4.9E-25	T	21-03-2019	IPR023804	Protein of unknown function DUF3792, transmembrane
MAG104_39_11	5f8516c3dbb1cc22360f663e3febd39b	128	Pfam	PF12670	Protein of unknown function (DUF3792)	22	128	5.3E-25	T	21-03-2019	IPR023804	Protein of unknown function DUF3792, transmembrane
MAG104_16_23	fec2e751a1680dc434344eff45f86111	356	Pfam	PF08666	SAF domain	299	356	1.4E-8	T	21-03-2019	IPR013974	SAF domain
MAG104_16_23	fec2e751a1680dc434344eff45f86111	356	Pfam	PF03102	NeuB family	42	280	5.9E-71	T	21-03-2019	IPR013132	N-acetylneuraminic acid synthase, N-terminal
MAG104_2_43	57b68bd07354075b604f1542f18701bd	193	Pfam	PF01965	DJ-1/PfpI family	1	175	8.5E-32	T	21-03-2019	IPR002818	DJ-1/PfpI
MAG104_13_24	8f2216584120307c575f7bfa49e84c49	295	Pfam	PF13690	Chemotaxis phosphatase CheX	185	262	3.4E-9	T	21-03-2019	IPR028051	Chemotaxis phosphatase CheX-like domain
MAG104_24_27	224a7b624f4108f8f3f43d64dc6e67da	490	Pfam	PF09547	Stage IV sporulation protein A (spore_IV_A)	1	490	1.3E-214	T	21-03-2019	IPR014201	Sporulation stage IV, protein A
MAG104_24_27	224a7b624f4108f8f3f43d64dc6e67da	490	TIGRFAM	TIGR02836	spore_IV_A: stage IV sporulation protein A	1	490	3.8E-182	T	21-03-2019	IPR014201	Sporulation stage IV, protein A
MAG104_73_3	7c5413d4254da56987c622f52a45f1a0	285	Pfam	PF00398	Ribosomal RNA adenine dimethylase	19	279	2.2E-65	T	21-03-2019	IPR001737	Ribosomal RNA adenine methyltransferase KsgA/Erm
MAG104_73_3	7c5413d4254da56987c622f52a45f1a0	285	TIGRFAM	TIGR00755	ksgA: ribosomal RNA small subunit methyltransferase A	19	283	8.8E-81	T	21-03-2019	IPR011530	Ribosomal RNA adenine dimethylase
MAG104_12_31	304e4989d99e3493bd8e1552d506bd2c	312	Pfam	PF13472	GDSL-like Lipase/Acylhydrolase family	145	288	3.2E-12	T	21-03-2019	IPR013830	SGNH hydrolase-type esterase domain
MAG104_54_12	56617e61fb672f24d843afd5fa94160d	549	Pfam	PF14283	Domain of unknown function (DUF4366)	372	511	5.7E-26	T	21-03-2019	IPR025376	Domain of unknown function DUF4366
MAG104_101_5	cdfee5b6ee43b9adced0eddca41d5cb4	306	TIGRFAM	TIGR01037	pyrD_sub1_fam: dihydroorotate dehydrogenase family protein	10	304	4.9E-113	T	21-03-2019	IPR005720	Dihydroorotate dehydrogenase domain
MAG104_101_5	cdfee5b6ee43b9adced0eddca41d5cb4	306	Pfam	PF01180	Dihydroorotate dehydrogenase	10	290	7.3E-77	T	21-03-2019	IPR005720	Dihydroorotate dehydrogenase domain
MAG104_21_30	3aa808f5184c79567bed2b965be99f3f	370	Pfam	PF02350	UDP-N-acetylglucosamine 2-epimerase	23	367	1.8E-115	T	21-03-2019	IPR003331	UDP-N-acetylglucosamine 2-epimerase domain
MAG104_21_30	3aa808f5184c79567bed2b965be99f3f	370	TIGRFAM	TIGR00236	wecB: UDP-N-acetylglucosamine 2-epimerase	4	368	5.5E-149	T	21-03-2019	IPR029767	UDP-N-acetylglucosamine 2-epimerase WecB-like
MAG104_6_52	a570dd709665b51002edc73988b8e815	165	TIGRFAM	TIGR00246	tRNA_RlmH_YbeA: rRNA large subunit m3Psi methyltransferase RlmH	8	165	4.9E-52	T	21-03-2019	IPR003742	RNA methyltransferase RlmH
MAG104_6_52	a570dd709665b51002edc73988b8e815	165	Pfam	PF02590	Predicted SPOUT methyltransferase	8	164	3.9E-56	T	21-03-2019	IPR003742	RNA methyltransferase RlmH
MAG104_39_30	987e3c802313e1535e3c9874f63503ad	221	TIGRFAM	TIGR01163	rpe: ribulose-phosphate 3-epimerase	4	209	2.5E-75	T	21-03-2019	IPR000056	Ribulose-phosphate 3-epimerase-like
MAG104_39_30	987e3c802313e1535e3c9874f63503ad	221	Pfam	PF00834	Ribulose-phosphate 3 epimerase family	4	200	7.5E-71	T	21-03-2019	IPR000056	Ribulose-phosphate 3-epimerase-like
MAG104_3_77	7da59756cb448e3c8347e7b18cb49b2f	436	TIGRFAM	TIGR00299	TIGR00299: TIGR00299 family protein	6	428	1.4E-98	T	21-03-2019	IPR002822	Nickel insertion protein
MAG104_3_77	7da59756cb448e3c8347e7b18cb49b2f	436	Pfam	PF01969	Protein of unknown function DUF111	5	428	4.4E-149	T	21-03-2019	IPR002822	Nickel insertion protein
MAG104_14_34	74aea72d6d1bea852e7d0c62151f5640	554	TIGRFAM	TIGR01484	HAD-SF-IIB: HAD hydrolase, family IIB	289	521	9.6E-27	T	21-03-2019	IPR006379	HAD-superfamily hydrolase, subfamily IIB
MAG104_14_34	74aea72d6d1bea852e7d0c62151f5640	554	Pfam	PF02811	PHP domain	5	141	3.3E-10	T	21-03-2019	IPR004013	PHP domain
MAG104_14_34	74aea72d6d1bea852e7d0c62151f5640	554	TIGRFAM	TIGR00099	Cof-subfamily: Cof-like hydrolase	289	548	2.2E-52	T	21-03-2019	IPR000150	Cof family
MAG104_14_34	74aea72d6d1bea852e7d0c62151f5640	554	Pfam	PF08282	haloacid dehalogenase-like hydrolase	290	546	7.6E-60	T	21-03-2019
MAG104_24_7	fe0194f277bd50cf22b435b3bab75399	115	Pfam	PF01245	Ribosomal protein L19	4	112	3.1E-48	T	21-03-2019	IPR001857	Ribosomal protein L19
MAG104_24_7	fe0194f277bd50cf22b435b3bab75399	115	TIGRFAM	TIGR01024	rplS_bact: ribosomal protein bL19	3	113	6.0E-47	T	21-03-2019	IPR001857	Ribosomal protein L19
MAG104_1_81	810cdbdb89e597f4e2dd55a35e44dfd3	377	Pfam	PF00575	S1 RNA binding domain	274	346	1.5E-21	T	21-03-2019	IPR003029	S1 domain
MAG104_1_81	810cdbdb89e597f4e2dd55a35e44dfd3	377	Pfam	PF00575	S1 RNA binding domain	18	89	4.0E-10	T	21-03-2019	IPR003029	S1 domain
MAG104_1_81	810cdbdb89e597f4e2dd55a35e44dfd3	377	Pfam	PF00575	S1 RNA binding domain	192	259	1.2E-20	T	21-03-2019	IPR003029	S1 domain
MAG104_1_81	810cdbdb89e597f4e2dd55a35e44dfd3	377	Pfam	PF00575	S1 RNA binding domain	105	169	4.9E-7	T	21-03-2019	IPR003029	S1 domain
MAG104_1_150	d6524f134b5e3487155873c496efa221	190	Pfam	PF00156	Phosphoribosyl transferase domain	42	177	1.0E-16	T	21-03-2019	IPR000836	Phosphoribosyltransferase domain
MAG104_1_150	d6524f134b5e3487155873c496efa221	190	TIGRFAM	TIGR01090	apt: adenine phosphoribosyltransferase	21	184	1.7E-67	T	21-03-2019	IPR005764	Adenine phosphoribosyl transferase
MAG104_8_37	e695897e4d26fdd7218136c859640f58	293	Pfam	PF03448	MgtE intracellular N domain	201	292	1.0E-6	T	21-03-2019	IPR006668	Magnesium transporter, MgtE intracellular domain
MAG104_28_12	55bac63b989c15749c699a71ca122de9	167	Pfam	PF08281	Sigma-70, region 4	104	155	7.9E-14	T	21-03-2019	IPR013249	RNA polymerase sigma factor 70, region 4 type 2
MAG104_28_12	55bac63b989c15749c699a71ca122de9	167	Pfam	PF04542	Sigma-70 region 2	10	76	1.7E-15	T	21-03-2019	IPR007627	RNA polymerase sigma-70 region 2
MAG104_28_12	55bac63b989c15749c699a71ca122de9	167	TIGRFAM	TIGR02937	sigma70-ECF: RNA polymerase sigma factor, sigma-70 family	7	159	4.1E-29	T	21-03-2019	IPR014284	RNA polymerase sigma-70 like domain
MAG104_87_4	a1346b5245b018414f6e2ee1c04e4343	684	Pfam	PF08447	PAS fold	52	140	4.9E-18	T	21-03-2019	IPR013655	PAS fold-3
MAG104_87_4	a1346b5245b018414f6e2ee1c04e4343	684	Pfam	PF00072	Response regulator receiver domain	562	677	5.1E-25	T	21-03-2019	IPR001789	Signal transduction response regulator, receiver domain
MAG104_87_4	a1346b5245b018414f6e2ee1c04e4343	684	Pfam	PF00072	Response regulator receiver domain	424	538	2.4E-16	T	21-03-2019	IPR001789	Signal transduction response regulator, receiver domain
MAG104_87_4	a1346b5245b018414f6e2ee1c04e4343	684	Pfam	PF00512	His Kinase A (phospho-acceptor) domain	174	240	7.8E-17	T	21-03-2019	IPR003661	Signal transduction histidine kinase, dimerisation/phosphoacceptor domain
MAG104_87_4	a1346b5245b018414f6e2ee1c04e4343	684	TIGRFAM	TIGR00229	sensory_box: PAS domain S-box protein	39	154	9.7E-6	T	21-03-2019	IPR000014	PAS domain
MAG104_87_4	a1346b5245b018414f6e2ee1c04e4343	684	Pfam	PF02518	Histidine kinase-, DNA gyrase B-, and HSP90-like ATPase	288	404	1.2E-27	T	21-03-2019	IPR003594	Histidine kinase/HSP90-like ATPase
MAG104_20_36	c742c1110fa24a5d1d2f6b233cba9d97	500	TIGRFAM	TIGR00499	lysS_bact: lysine--tRNA ligase	16	496	3.6E-200	T	21-03-2019	IPR002313	Lysine-tRNA ligase, class II
MAG104_20_36	c742c1110fa24a5d1d2f6b233cba9d97	500	Pfam	PF01336	OB-fold nucleic acid binding domain	64	141	1.8E-15	T	21-03-2019	IPR004365	OB-fold nucleic acid binding domain, AA-tRNA synthetase-type
MAG104_20_36	c742c1110fa24a5d1d2f6b233cba9d97	500	Pfam	PF00152	tRNA synthetases class II (D, K and N)	158	495	7.0E-83	T	21-03-2019	IPR004364	Aminoacyl-tRNA synthetase, class II (D/K/N)
MAG104_6_69	870a561ec0c9b4bc6dff1de5068385fa	395	TIGRFAM	TIGR00492	alr: alanine racemase	11	378	1.1E-114	T	21-03-2019	IPR000821	Alanine racemase
MAG104_6_69	870a561ec0c9b4bc6dff1de5068385fa	395	Pfam	PF00842	Alanine racemase, C-terminal domain	251	377	4.0E-46	T	21-03-2019	IPR011079	Alanine racemase, C-terminal
MAG104_6_69	870a561ec0c9b4bc6dff1de5068385fa	395	Pfam	PF01168	Alanine racemase, N-terminal domain	14	237	5.2E-58	T	21-03-2019	IPR001608	Alanine racemase, N-terminal
MAG104_50_7	1a8858024482edc1952e1a14b12f4335	307	Pfam	PF00005	ABC transporter	21	161	7.3E-29	T	21-03-2019	IPR003439	ABC transporter-like
MAG104_10_43	a4d73444bb5eb8dbf36d4fba5e32bab8	276	Pfam	PF07883	Cupin domain	28	81	3.0E-11	T	21-03-2019	IPR013096	Cupin 2, conserved barrel
MAG104_10_43	a4d73444bb5eb8dbf36d4fba5e32bab8	276	Pfam	PF12833	Helix-turn-helix domain	195	272	8.2E-18	T	21-03-2019	IPR018060	DNA binding HTH domain, AraC-type
MAG104_1_95	21c39a2874f6e362ca5332694f40136d	459	Pfam	PF02127	Aminopeptidase I zinc metalloprotease (M18)	28	455	1.6E-88	T	21-03-2019	IPR001948	Peptidase M18
MAG104_6_18	e3ac5c97c5a1fba91139a44d27037f45	71	Pfam	PF03776	Septum formation topological specificity factor MinE	12	65	1.9E-18	T	21-03-2019	IPR005527	Cell division topological specificity factor MinE
MAG104_6_18	e3ac5c97c5a1fba91139a44d27037f45	71	TIGRFAM	TIGR01215	minE: cell division topological specificity factor MinE	8	64	6.0E-18	T	21-03-2019	IPR005527	Cell division topological specificity factor MinE
MAG104_29_15	a71132327018f92295842ab7677ccb0d	296	Pfam	PF00126	Bacterial regulatory helix-turn-helix protein, lysR family	4	61	1.9E-20	T	21-03-2019	IPR000847	Transcription regulator HTH, LysR
MAG104_29_15	a71132327018f92295842ab7677ccb0d	296	Pfam	PF03466	LysR substrate binding domain	87	287	1.1E-27	T	21-03-2019	IPR005119	LysR, substrate-binding
MAG104_20_33	db4e4d3b189fdaf604fab3dbc004f150	342	Pfam	PF02518	Histidine kinase-, DNA gyrase B-, and HSP90-like ATPase	224	334	1.9E-8	T	21-03-2019	IPR003594	Histidine kinase/HSP90-like ATPase
MAG104_20_33	db4e4d3b189fdaf604fab3dbc004f150	342	Pfam	PF06580	Histidine kinase	122	201	6.4E-24	T	21-03-2019	IPR010559	Signal transduction histidine kinase, internal region
MAG104_124_4	999496104247617336a0e558bba15023	371	Pfam	PF00005	ABC transporter	136	283	1.9E-32	T	21-03-2019	IPR003439	ABC transporter-like
MAG104_124_4	999496104247617336a0e558bba15023	371	Pfam	PF01381	Helix-turn-helix	10	64	1.5E-12	T	21-03-2019	IPR001387	Cro/C1-type helix-turn-helix domain
MAG104_4_83	8ae38f93c7c539d5ea6ff472b86d7fd6	775	Pfam	PF01238	Phosphomannose isomerase type I	456	770	8.2E-16	T	21-03-2019	IPR001250	Mannose-6-phosphate isomerase, type I
MAG104_4_83	8ae38f93c7c539d5ea6ff472b86d7fd6	775	Pfam	PF01050	Mannose-6-phosphate isomerase	302	442	2.1E-32	T	21-03-2019	IPR001538	Mannose-6-phosphate isomerase, type II, C-terminal
MAG104_4_83	8ae38f93c7c539d5ea6ff472b86d7fd6	775	Pfam	PF00483	Nucleotidyl transferase	5	217	1.5E-21	T	21-03-2019	IPR005835	Nucleotidyl transferase domain
MAG104_11_44	9a962e8b5e7cf5727da93b5a5c311315	298	Pfam	PF06207	Protein of unknown function (DUF1002)	34	256	1.9E-70	T	21-03-2019	IPR009343	Protein of unknown function DUF1002
MAG104_37_18	4f28d65cbe1fd49c384e9e7d7ed620a1	200	Pfam	PF00574	Clp protease	12	192	6.3E-87	T	21-03-2019	IPR023562	Clp protease proteolytic subunit /Translocation-enhancing protein TepA
MAG104_37_18	4f28d65cbe1fd49c384e9e7d7ed620a1	200	TIGRFAM	TIGR00493	clpP: ATP-dependent Clp endopeptidase, proteolytic subunit ClpP	1	191	9.6E-102	T	21-03-2019	IPR001907	ATP-dependent Clp protease proteolytic subunit
MAG104_22_29	2f27018f64e141f13c3b5b8d6615436f	472	Pfam	PF00512	His Kinase A (phospho-acceptor) domain	248	306	3.0E-10	T	21-03-2019	IPR003661	Signal transduction histidine kinase, dimerisation/phosphoacceptor domain
MAG104_22_29	2f27018f64e141f13c3b5b8d6615436f	472	Pfam	PF00672	HAMP domain	187	235	2.8E-11	T	21-03-2019	IPR003660	HAMP domain
MAG104_22_29	2f27018f64e141f13c3b5b8d6615436f	472	Pfam	PF02518	Histidine kinase-, DNA gyrase B-, and HSP90-like ATPase	357	460	2.9E-19	T	21-03-2019	IPR003594	Histidine kinase/HSP90-like ATPase
MAG104_34_14	075a8e9ddb72039ba7ccb9fdc0e2ae6e	869	Pfam	PF05183	RNA dependent RNA polymerase	424	708	2.0E-10	T	21-03-2019	IPR007855	RNA-dependent RNA polymerase, eukaryotic-type
MAG104_34_14	075a8e9ddb72039ba7ccb9fdc0e2ae6e	869	Pfam	PF05183	RNA dependent RNA polymerase	73	247	6.0E-6	T	21-03-2019	IPR007855	RNA-dependent RNA polymerase, eukaryotic-type
MAG104_92_5	f6d0f099db8ecad563eb2cb710fd67eb	223	Pfam	PF09359	VTC domain	4	219	6.9E-24	T	21-03-2019	IPR018966	VTC domain
MAG104_20_29	b582802563d88f5eab6fab3bf7aa1392	344	Pfam	PF02653	Branched-chain amino acid transport system / permease component	48	333	2.9E-38	T	21-03-2019	IPR001851	ABC transporter, permease
MAG104_4_29	21a7f890501e7870e0625822433b3f87	257	Pfam	PF06429	Flagellar basal body rod FlgEFG protein C-terminal	184	252	1.0E-19	T	21-03-2019	IPR010930	Flagellar basal-body/hook protein, C-terminal domain
MAG104_4_29	21a7f890501e7870e0625822433b3f87	257	TIGRFAM	TIGR03506	FlgEFG_subfam: flagellar hook-basal body protein	4	139	6.5E-36	T	21-03-2019	IPR020013	Flagellar hook-basal body protein, FlgE/F/G
MAG104_4_29	21a7f890501e7870e0625822433b3f87	257	Pfam	PF00460	Flagella basal body rod protein	5	35	1.1E-10	T	21-03-2019	IPR001444	Flagellar basal body rod protein, N-terminal
MAG104_36_18	7311620d57e92e0781be44393c71474a	246	Pfam	PF04545	Sigma-70, region 4	185	239	1.3E-15	T	21-03-2019	IPR007630	RNA polymerase sigma-70 region 4
MAG104_36_18	7311620d57e92e0781be44393c71474a	246	TIGRFAM	TIGR02937	sigma70-ECF: RNA polymerase sigma factor, sigma-70 family	63	242	2.8E-34	T	21-03-2019	IPR014284	RNA polymerase sigma-70 like domain
MAG104_36_18	7311620d57e92e0781be44393c71474a	246	TIGRFAM	TIGR02835	spore_sigmaE: RNA polymerase sigma-E factor	20	244	5.6E-113	T	21-03-2019	IPR014200	RNA polymerase sigma-E type
MAG104_36_18	7311620d57e92e0781be44393c71474a	246	Pfam	PF04542	Sigma-70 region 2	67	136	5.5E-17	T	21-03-2019	IPR007627	RNA polymerase sigma-70 region 2
MAG104_35_3	36d131f693db0f80c2a8304954e64a77	198	Pfam	PF04542	Sigma-70 region 2	25	91	1.6E-14	T	21-03-2019	IPR007627	RNA polymerase sigma-70 region 2
MAG104_35_3	36d131f693db0f80c2a8304954e64a77	198	Pfam	PF04545	Sigma-70, region 4	144	193	2.0E-9	T	21-03-2019	IPR007630	RNA polymerase sigma-70 region 4
MAG104_35_3	36d131f693db0f80c2a8304954e64a77	198	TIGRFAM	TIGR02937	sigma70-ECF: RNA polymerase sigma factor, sigma-70 family	19	194	2.6E-27	T	21-03-2019	IPR014284	RNA polymerase sigma-70 like domain
MAG104_2_107	25c9d530e4137f205c74bf7384f52405	720	Pfam	PF01841	Transglutaminase-like superfamily	200	288	4.4E-6	T	21-03-2019	IPR002931	Transglutaminase-like
MAG104_2_107	25c9d530e4137f205c74bf7384f52405	720	Pfam	PF13946	Domain of unknown function (DUF4214)	521	584	7.1E-16	T	21-03-2019	IPR025282	Domain of unknown function DUF4214
MAG104_2_107	25c9d530e4137f205c74bf7384f52405	720	Pfam	PF13946	Domain of unknown function (DUF4214)	480	530	1.1E-9	T	21-03-2019	IPR025282	Domain of unknown function DUF4214
MAG104_2_107	25c9d530e4137f205c74bf7384f52405	720	Pfam	PF13946	Domain of unknown function (DUF4214)	649	714	9.0E-18	T	21-03-2019	IPR025282	Domain of unknown function DUF4214
MAG104_35_13	0f112dd603c26deebe2ce53a391824e5	357	Pfam	PF00155	Aminotransferase class I and II	22	351	6.2E-59	T	21-03-2019	IPR004839	Aminotransferase, class I/classII
MAG104_35_13	0f112dd603c26deebe2ce53a391824e5	357	TIGRFAM	TIGR01141	hisC: histidinol-phosphate transaminase	5	354	6.9E-91	T	21-03-2019	IPR005861	Histidinol-phosphate aminotransferase family
MAG104_12_46	1dff8e3272a39cc5a0fa6022bf77b552	436	Pfam	PF00877	NlpC/P60 family	337	425	1.4E-19	T	21-03-2019	IPR000064	Endopeptidase, NLPC/P60 domain
MAG104_12_46	1dff8e3272a39cc5a0fa6022bf77b552	436	Pfam	PF08239	Bacterial SH3 domain	149	198	1.7E-7	T	21-03-2019	IPR003646	SH3-like domain, bacterial-type
MAG104_12_46	1dff8e3272a39cc5a0fa6022bf77b552	436	Pfam	PF08239	Bacterial SH3 domain	222	273	9.5E-10	T	21-03-2019	IPR003646	SH3-like domain, bacterial-type
MAG104_4_76	de56eade9b68c8c3245f0565c231cc2d	391	Pfam	PF07221	N-acylglucosamine 2-epimerase (GlcNAc 2-epimerase)	28	375	1.2E-38	T	21-03-2019
MAG104_7_63	836eaf7657141b745fa6d30b4b1955c7	223	Pfam	PF00072	Response regulator receiver domain	3	113	8.1E-28	T	21-03-2019	IPR001789	Signal transduction response regulator, receiver domain
MAG104_7_63	836eaf7657141b745fa6d30b4b1955c7	223	Pfam	PF00486	Transcriptional regulatory protein, C terminal	149	221	1.3E-15	T	21-03-2019	IPR001867	OmpR/PhoB-type DNA-binding domain
MAG104_81_2	8c117309f76b3b75ce2cb9b00cde2d11	223	Pfam	PF06541	Putative ABC-transporter type IV	58	211	5.8E-39	T	21-03-2019	IPR010540	Putative ABC-transporter type IV CmpB/TMEM229
MAG104_3_66	9aafcbb9902dc81f5e148e943fa6d2a3	383	Pfam	PF02608	ABC transporter substrate-binding protein PnrA-like	74	333	1.7E-42	T	21-03-2019	IPR003760	ABC transporter substrate-binding protein PnrA-like
MAG104_22_9	e48de1491e78de602e8edf37e18f46a4	309	Pfam	PF01156	Inosine-uridine preferring nucleoside hydrolase	5	297	6.8E-71	T	21-03-2019	IPR001910	Inosine/uridine-preferring nucleoside hydrolase domain
MAG104_48_7	5945a7b4ef0954e3b556c14a919e0245	359	Pfam	PF04230	Polysaccharide pyruvyl transferase	13	296	5.1E-25	T	21-03-2019	IPR007345	Polysaccharide pyruvyl transferase
MAG104_19_7	5fffff06c6b61e7aca2adbee13905ed7	395	Pfam	PF12833	Helix-turn-helix domain	312	390	9.5E-18	T	21-03-2019	IPR018060	DNA binding HTH domain, AraC-type
MAG104_3_76	f1de86ae2639b98e2b06e040da17fed8	336	Pfam	PF13190	PDGLE domain	235	320	2.6E-29	T	21-03-2019	IPR025937	PDGLE domain
MAG104_3_76	f1de86ae2639b98e2b06e040da17fed8	336	Pfam	PF01891	Cobalt uptake substrate-specific transmembrane region	2	209	6.1E-57	T	21-03-2019	IPR002751	Metal transport protein CbiM/NikMN
MAG104_24_24	e83c107bac103b53d1edfcb152df6464	285	Pfam	PF02219	Methylenetetrahydrofolate reductase	2	282	2.0E-80	T	21-03-2019	IPR003171	Methylenetetrahydrofolate reductase
MAG104_24_24	e83c107bac103b53d1edfcb152df6464	285	TIGRFAM	TIGR00676	fadh2: methylenetetrahydrofolate reductase [NAD(P)H]	13	284	2.6E-95	T	21-03-2019	IPR004620	5,10-methylenetetrahydrofolate reductase
MAG104_92_2	5025be7da8acb2962a909011460cc68d	159	Pfam	PF01035	6-O-methylguanine DNA methyltransferase, DNA binding domain	50	133	3.7E-8	T	21-03-2019	IPR014048	Methylated-DNA-[protein]-cysteine S-methyltransferase, DNA binding
MAG104_23_45	0f7a499508ed83b9e57aaf81bac1ba05	93	TIGRFAM	TIGR01050	rpsS_bact: ribosomal protein uS19	1	91	4.9E-45	T	21-03-2019	IPR005732	Ribosomal protein S19, bacterial-type
MAG104_23_45	0f7a499508ed83b9e57aaf81bac1ba05	93	Pfam	PF00203	Ribosomal protein S19	3	83	5.5E-36	T	21-03-2019	IPR002222	Ribosomal protein S19/S15
MAG104_33_12	cc25046b1cb18051cc6238835b59eb4b	501	Pfam	PF12837	4Fe-4S binding domain	192	212	5.1E-6	T	21-03-2019	IPR017896	4Fe-4S ferredoxin-type, iron-sulphur binding domain
MAG104_33_12	cc25046b1cb18051cc6238835b59eb4b	501	Pfam	PF00037	4Fe-4S binding domain	146	167	4.1E-9	T	21-03-2019	IPR017896	4Fe-4S ferredoxin-type, iron-sulphur binding domain
MAG104_33_12	cc25046b1cb18051cc6238835b59eb4b	501	Pfam	PF02906	Iron only hydrogenase large subunit, C-terminal domain	230	465	4.8E-59	T	21-03-2019	IPR004108	Iron hydrogenase, large subunit, C-terminal
MAG104_33_12	cc25046b1cb18051cc6238835b59eb4b	501	TIGRFAM	TIGR04105	FeFe_hydrog_B1: [FeFe] hydrogenase, group B1/B3	5	468	4.1E-183	T	21-03-2019	IPR027631	[FeFe] hydrogenase, group B1/B3
