MAG141_68_11	6202110b54f25c94bced3fbeed72a505	303	Pfam	PF08340	Domain of unknown function (DUF1732)	219	303	6.1E-37	T	21-03-2019	IPR013551	Domain of unknown function DUF1732
MAG141_68_11	6202110b54f25c94bced3fbeed72a505	303	Pfam	PF03755	YicC-like family, N-terminal region	5	166	7.9E-39	T	21-03-2019	IPR013527	YicC-like, N-terminal
MAG141_128_2	5c7078b89654e1020fe46b33347940cf	259	Pfam	PF00005	ABC transporter	24	172	1.7E-26	T	21-03-2019	IPR003439	ABC transporter-like
MAG141_32_11	b5d630977721f5bcccec40d017555827	525	Pfam	PF01293	Phosphoenolpyruvate carboxykinase	18	479	9.0E-214	T	21-03-2019	IPR001272	Phosphoenolpyruvate carboxykinase, ATP-utilising
MAG141_32_11	b5d630977721f5bcccec40d017555827	525	TIGRFAM	TIGR00224	pckA: phosphoenolpyruvate carboxykinase (ATP)	5	523	5.5E-216	T	21-03-2019	IPR001272	Phosphoenolpyruvate carboxykinase, ATP-utilising
MAG141_47_13	9d3a7df476b23fb1e400dd3e3641e478	141	Pfam	PF03946	Ribosomal protein L11, N-terminal domain	9	66	4.2E-30	T	21-03-2019	IPR020784	Ribosomal protein L11, N-terminal
MAG141_47_13	9d3a7df476b23fb1e400dd3e3641e478	141	Pfam	PF00298	Ribosomal protein L11, RNA binding domain	71	139	1.0E-25	T	21-03-2019	IPR020783	Ribosomal protein L11, C-terminal
MAG141_47_13	9d3a7df476b23fb1e400dd3e3641e478	141	TIGRFAM	TIGR01632	L11_bact: ribosomal protein uL11	3	140	1.8E-64	T	21-03-2019	IPR006519	Ribosomal protein L11, bacterial-type
MAG141_60_15	6f5b318a6113758e9e94feed5063f185	192	Pfam	PF08502	LeuA allosteric (dimerisation) domain	55	183	1.7E-24	T	21-03-2019	IPR013709	2-isopropylmalate synthase LeuA, allosteric (dimerisation) domain
MAG141_6_6	0a50d99e274fefd3683702e34b115a5f	99	Pfam	PF01381	Helix-turn-helix	10	63	1.2E-9	T	21-03-2019	IPR001387	Cro/C1-type helix-turn-helix domain
MAG141_10_19	faa95a2fa80189e0907c251f76bb98c6	423	Pfam	PF00534	Glycosyl transferases group 1	198	362	1.7E-21	T	21-03-2019	IPR001296	Glycosyl transferase, family 1
MAG141_10_19	faa95a2fa80189e0907c251f76bb98c6	423	Pfam	PF13439	Glycosyltransferase Family 4	15	184	6.9E-27	T	21-03-2019	IPR028098	Glycosyltransferase subfamily 4-like, N-terminal domain
MAG141_108_3	7c3e69198dd62e41a326baa50aa7035f	78	Pfam	PF04023	FeoA domain	7	74	2.9E-11	T	21-03-2019	IPR007167	Ferrous iron transporter FeoA domain
MAG141_12_1	af5e7d97ca7f1180a9a83d13449da8a6	386	Pfam	PF12320	Type 5 capsule protein repressor C-terminal domain	270	359	5.0E-10	T	21-03-2019	IPR026843	Nuclease SbcCD subunit D, C-terminal domain
MAG141_12_1	af5e7d97ca7f1180a9a83d13449da8a6	386	TIGRFAM	TIGR00619	sbcd: exonuclease SbcCD, D subunit	1	247	4.7E-49	T	21-03-2019	IPR004593	Nuclease SbcCD subunit D
MAG141_12_1	af5e7d97ca7f1180a9a83d13449da8a6	386	Pfam	PF00149	Calcineurin-like phosphoesterase	1	220	1.0E-13	T	21-03-2019	IPR004843	Calcineurin-like phosphoesterase domain, ApaH type
MAG141_161_1	8109ea44c5ca4a5383d854554cf7b7d2	116	Pfam	PF00072	Response regulator receiver domain	2	108	6.9E-20	T	21-03-2019	IPR001789	Signal transduction response regulator, receiver domain
MAG141_19_4	d972a31b7dcb56780bed3ee1996a477b	223	TIGRFAM	TIGR02937	sigma70-ECF: RNA polymerase sigma factor, sigma-70 family	25	212	1.7E-26	T	21-03-2019	IPR014284	RNA polymerase sigma-70 like domain
MAG141_19_4	d972a31b7dcb56780bed3ee1996a477b	223	Pfam	PF04542	Sigma-70 region 2	28	101	6.5E-10	T	21-03-2019	IPR007627	RNA polymerase sigma-70 region 2
MAG141_2_37	b3cdb366ed18463fc64d23b51590fe6a	197	Pfam	PF01479	S4 domain	87	134	8.3E-16	T	21-03-2019	IPR002942	RNA-binding S4 domain
MAG141_2_37	b3cdb366ed18463fc64d23b51590fe6a	197	TIGRFAM	TIGR01017	rpsD_bact: ribosomal protein uS4	6	197	1.8E-65	T	21-03-2019	IPR005709	Ribosomal protein S4, bacterial-type
MAG141_2_37	b3cdb366ed18463fc64d23b51590fe6a	197	Pfam	PF00163	Ribosomal protein S4/S9 N-terminal domain	5	86	3.6E-19	T	21-03-2019	IPR001912	Ribosomal protein S4/S9, N-terminal
MAG141_63_2	37f9553f7fa5e27c3f316b2d8eed8a7d	57	Pfam	PF14070	Putative motility protein	7	47	2.0E-11	T	21-03-2019	IPR025906	Putative motility protein
MAG141_154_2	37f9553f7fa5e27c3f316b2d8eed8a7d	57	Pfam	PF14070	Putative motility protein	7	47	2.0E-11	T	21-03-2019	IPR025906	Putative motility protein
MAG141_56_5	ecba160a9f7a8d55c3e0883d05ba0474	179	Pfam	PF01476	LysM domain	107	151	1.5E-11	T	21-03-2019	IPR018392	LysM domain
MAG141_56_5	ecba160a9f7a8d55c3e0883d05ba0474	179	Pfam	PF01476	LysM domain	4	48	3.6E-9	T	21-03-2019	IPR018392	LysM domain
MAG141_27_19	086da991b539d0fc5e3df76eee887eeb	552	Pfam	PF07508	Recombinase	209	317	6.2E-21	T	21-03-2019	IPR011109	DNA-binding recombinase domain
MAG141_27_19	086da991b539d0fc5e3df76eee887eeb	552	Pfam	PF00239	Resolvase, N terminal domain	38	186	3.1E-34	T	21-03-2019	IPR006119	Resolvase, N-terminal catalytic domain
MAG141_27_19	086da991b539d0fc5e3df76eee887eeb	552	Pfam	PF13408	Recombinase zinc beta ribbon domain	341	401	3.1E-11	T	21-03-2019	IPR025827	Recombinase zinc beta ribbon domain
MAG141_8_20	0a0cf8e5bc2cc9c48f412352f1b19fec	253	Pfam	PF13561	Enoyl-(Acyl carrier protein) reductase	21	251	4.3E-70	T	21-03-2019
MAG141_8_20	0a0cf8e5bc2cc9c48f412352f1b19fec	253	TIGRFAM	TIGR01830	3oxo_ACP_reduc: 3-oxoacyl-[acyl-carrier-protein] reductase	14	252	1.7E-102	T	21-03-2019	IPR011284	3-oxoacyl-(acyl-carrier-protein) reductase
MAG141_9_16	c022f80d39c0947e8e1942cf2074236c	702	Pfam	PF01966	HD domain	175	300	1.2E-15	T	21-03-2019	IPR006674	HD domain
MAG141_9_16	c022f80d39c0947e8e1942cf2074236c	702	Pfam	PF00072	Response regulator receiver domain	7	112	1.4E-21	T	21-03-2019	IPR001789	Signal transduction response regulator, receiver domain
MAG141_9_16	c022f80d39c0947e8e1942cf2074236c	702	TIGRFAM	TIGR00254	GGDEF: diguanylate cyclase (GGDEF) domain	514	669	2.9E-35	T	21-03-2019	IPR000160	GGDEF domain
MAG141_9_16	c022f80d39c0947e8e1942cf2074236c	702	Pfam	PF00990	Diguanylate cyclase, GGDEF domain	518	665	2.2E-36	T	21-03-2019	IPR000160	GGDEF domain
MAG141_25_22	6f3de72fda89926c3a0b5c6e5305eb87	886	Pfam	PF00005	ABC transporter	318	449	2.1E-26	T	21-03-2019	IPR003439	ABC transporter-like
MAG141_25_22	6f3de72fda89926c3a0b5c6e5305eb87	886	Pfam	PF00005	ABC transporter	22	171	2.0E-25	T	21-03-2019	IPR003439	ABC transporter-like
MAG141_25_22	6f3de72fda89926c3a0b5c6e5305eb87	886	Pfam	PF07155	ECF-type riboflavin transporter, S component	713	844	3.3E-9	T	21-03-2019	IPR009825	ECF transporter, substrate-specific component-like
MAG141_15_18	2cbccd9cea487369d8925eb5696b6f15	484	Pfam	PF00534	Glycosyl transferases group 1	293	444	1.5E-15	T	21-03-2019	IPR001296	Glycosyl transferase, family 1
MAG141_15_18	2cbccd9cea487369d8925eb5696b6f15	484	Pfam	PF08323	Starch synthase catalytic domain	6	240	4.3E-78	T	21-03-2019	IPR013534	Starch synthase, catalytic domain
MAG141_15_18	2cbccd9cea487369d8925eb5696b6f15	484	TIGRFAM	TIGR02095	glgA: glycogen/starch synthase, ADP-glucose type	6	481	1.8E-165	T	21-03-2019	IPR011835	Bacterial/plant glycogen synthase
MAG141_22_11	6320b7cf6b88a075b051c6e919f578bf	652	Pfam	PF01434	Peptidase family M41	389	596	2.3E-80	T	21-03-2019	IPR000642	Peptidase M41
MAG141_22_11	6320b7cf6b88a075b051c6e919f578bf	652	TIGRFAM	TIGR01241	FtsH_fam: ATP-dependent metallopeptidase HflB	108	598	1.2E-235	T	21-03-2019	IPR005936	Peptidase, FtsH
MAG141_22_11	6320b7cf6b88a075b051c6e919f578bf	652	Pfam	PF00004	ATPase family associated with various cellular activities (AAA)	195	327	2.4E-43	T	21-03-2019	IPR003959	ATPase, AAA-type, core
MAG141_70_5	b7bda10490535a48649c60c309105357	241	Pfam	PF00005	ABC transporter	29	176	1.4E-33	T	21-03-2019	IPR003439	ABC transporter-like
MAG141_69_1	2ca1e6d4d5fd50fa4ff70ef86eb94bdb	149	Pfam	PF01149	Formamidopyrimidine-DNA glycosylase N-terminal domain	1	117	8.8E-31	T	21-03-2019	IPR012319	Formamidopyrimidine-DNA glycosylase, catalytic domain
MAG141_28_30	686763b9784e849884751dd1879490af	67	TIGRFAM	TIGR01764	excise: DNA binding domain, excisionase family	10	55	1.2E-9	T	21-03-2019	IPR010093	SinI-like, DNA-binding domain
MAG141_28_30	686763b9784e849884751dd1879490af	67	Pfam	PF12728	Helix-turn-helix domain	9	58	2.6E-9	T	21-03-2019
MAG141_23_32	6c3ceb454df996c7e6cf2334605f2552	88	Pfam	PF07875	Coat F domain	5	66	2.9E-19	T	21-03-2019	IPR012851	Spore coat protein CotF-like
MAG141_39_16	e72cdd1a09de5db7f7c8372344676bc1	853	Pfam	PF00395	S-layer homology domain	738	784	1.3E-4	T	21-03-2019	IPR001119	S-layer homology domain
MAG141_39_16	e72cdd1a09de5db7f7c8372344676bc1	853	Pfam	PF00395	S-layer homology domain	803	846	4.5E-13	T	21-03-2019	IPR001119	S-layer homology domain
MAG141_39_16	e72cdd1a09de5db7f7c8372344676bc1	853	Pfam	PF00395	S-layer homology domain	674	720	5.9E-11	T	21-03-2019	IPR001119	S-layer homology domain
MAG141_39_16	e72cdd1a09de5db7f7c8372344676bc1	853	Pfam	PF09992	Phosphodiester glycosidase	245	384	2.5E-22	T	21-03-2019	IPR018711	Phosphodiester glycosidase
MAG141_114_1	b15a22783504ee8dec887886929fcb6e	750	Pfam	PF02421	Ferrous iron transport protein B	4	156	3.7E-67	T	21-03-2019	IPR030389	FeoB-type guanine nucleotide-binding (G) domain
MAG141_114_1	b15a22783504ee8dec887886929fcb6e	750	Pfam	PF07670	Nucleoside recognition	389	483	5.4E-11	T	21-03-2019	IPR011642	Nucleoside transporter/FeoB GTPase, Gate domain
MAG141_114_1	b15a22783504ee8dec887886929fcb6e	750	Pfam	PF07670	Nucleoside recognition	550	680	3.1E-31	T	21-03-2019	IPR011642	Nucleoside transporter/FeoB GTPase, Gate domain
MAG141_114_1	b15a22783504ee8dec887886929fcb6e	750	Pfam	PF07664	Ferrous iron transport protein B C terminus	494	545	1.0E-20	T	21-03-2019	IPR011640	Ferrous iron transport protein B, C-terminal
MAG141_114_1	b15a22783504ee8dec887886929fcb6e	750	TIGRFAM	TIGR00437	feoB: ferrous iron transport protein B	362	677	7.9E-99	T	21-03-2019	IPR003373	Ferrous iron transport protein B
MAG141_11_9	06cff654abbc817e7244576796df4e21	452	Pfam	PF01551	Peptidase family M23	353	447	3.6E-30	T	21-03-2019	IPR016047	Peptidase M23
MAG141_11_9	06cff654abbc817e7244576796df4e21	452	Pfam	PF07501	G5 domain	245	315	9.4E-17	T	21-03-2019	IPR011098	G5 domain
MAG141_43_20	6379b525480e85139436b3e65e20db30	90	Pfam	PF06135	Bacterial protein of unknown function (DUF965)	7	84	3.7E-35	T	21-03-2019	IPR009309	Uncharacterised protein family UPF0297
MAG141_36_19	19efef0443778308848f41a632653c76	452	Pfam	PF01554	MatE	254	411	4.3E-17	T	21-03-2019	IPR002528	Multi antimicrobial extrusion protein
MAG141_36_19	19efef0443778308848f41a632653c76	452	Pfam	PF01554	MatE	30	190	2.1E-29	T	21-03-2019	IPR002528	Multi antimicrobial extrusion protein
MAG141_36_19	19efef0443778308848f41a632653c76	452	TIGRFAM	TIGR00797	matE: MATE efflux family protein	30	423	8.4E-50	T	21-03-2019	IPR002528	Multi antimicrobial extrusion protein
MAG141_12_8	3cdfc265b9a4d2a15a3c3128fd0c3378	686	Pfam	PF01751	Toprim domain	57	158	1.3E-6	T	21-03-2019	IPR006171	TOPRIM  domain
MAG141_12_8	3cdfc265b9a4d2a15a3c3128fd0c3378	686	TIGRFAM	TIGR01056	topB: DNA topoisomerase III	57	683	8.5E-173	T	21-03-2019	IPR005738	DNA topoisomerase III
MAG141_12_8	3cdfc265b9a4d2a15a3c3128fd0c3378	686	Pfam	PF01131	DNA topoisomerase	177	630	1.3E-118	T	21-03-2019	IPR013497	DNA topoisomerase, type IA, central
MAG141_125_3	54614f9baba976f1b8ee69aa45eff963	194	Pfam	PF00472	RF-1 domain	96	183	5.1E-20	T	21-03-2019	IPR000352	Peptide chain release factor class I/class II
MAG141_125_3	54614f9baba976f1b8ee69aa45eff963	194	TIGRFAM	TIGR03072	release_prfH: putative peptide chain release factor H	1	192	7.7E-52	T	21-03-2019	IPR017509	Putative peptide chain release factor H
MAG141_40_9	073e198300734ba18c95e5439e733093	341	Pfam	PF01409	tRNA synthetases class II core domain (F)	94	341	1.8E-103	T	21-03-2019	IPR002319	Phenylalanyl-tRNA synthetase
MAG141_40_9	073e198300734ba18c95e5439e733093	341	TIGRFAM	TIGR00468	pheS: phenylalanine--tRNA ligase, alpha subunit	41	341	1.1E-105	T	21-03-2019	IPR004529	Phenylalanyl-tRNA synthetase, class IIc, alpha subunit
MAG141_40_9	073e198300734ba18c95e5439e733093	341	Pfam	PF02912	Aminoacyl tRNA synthetase class II, N-terminal domain	22	89	7.4E-25	T	21-03-2019	IPR004188	Phenylalanine-tRNA ligase, class II, N-terminal
MAG141_12_2	57e694a7db04b16bd36db282fef24eb4	352	Pfam	PF13476	AAA domain	5	218	4.6E-28	T	21-03-2019	IPR038729	Rad50/SbcC-type AAA domain
MAG141_14_30	2f5ffced28ba1ab00addc096daa5b3fc	157	Pfam	PF00329	Respiratory-chain NADH dehydrogenase, 30 Kd subunit	35	146	4.7E-37	T	21-03-2019	IPR001268	NADH:ubiquinone oxidoreductase, 30kDa subunit
MAG141_14_30	2f5ffced28ba1ab00addc096daa5b3fc	157	TIGRFAM	TIGR01961	NuoC_fam: NADH (or F420H2) dehydrogenase, subunit C	35	144	7.9E-38	T	21-03-2019	IPR010218	NADH dehydrogenase, subunit C
MAG141_17_21	99540ba6bc62b836752bdedefd18bd9a	603	Pfam	PF12729	Four helix bundle sensory module for signal transduction	5	187	5.5E-21	T	21-03-2019	IPR024478	Chemotaxis methyl-accepting receptor HlyB-like, 4HB MCP domain
MAG141_17_21	99540ba6bc62b836752bdedefd18bd9a	603	Pfam	PF00015	Methyl-accepting chemotaxis protein (MCP) signalling domain	377	550	5.8E-37	T	21-03-2019	IPR004089	Methyl-accepting chemotaxis protein (MCP) signalling domain
MAG141_48_4	abd3386683348f0af5bc712ea50596a3	506	TIGRFAM	TIGR03458	YgfH_subfam: succinate CoA transferase	14	502	9.0E-221	T	21-03-2019	IPR017821	Succinate CoA transferase
MAG141_48_4	abd3386683348f0af5bc712ea50596a3	506	Pfam	PF02550	Acetyl-CoA hydrolase/transferase N-terminal domain	12	218	5.8E-28	T	21-03-2019	IPR003702	Acetyl-CoA hydrolase/transferase
MAG141_48_4	abd3386683348f0af5bc712ea50596a3	506	Pfam	PF13336	Acetyl-CoA hydrolase/transferase C-terminal domain	321	467	8.4E-45	T	21-03-2019	IPR026888	Acetyl-CoA hydrolase/transferase C-terminal domain
MAG141_107_5	bd9c16f7e3431568ff9989fbbf219e5a	323	Pfam	PF01430	Hsp33 protein	3	283	1.1E-73	T	21-03-2019	IPR000397	Heat shock protein Hsp33
MAG141_23_3	d88b163b3443141e1408c0ba5d920013	109	Pfam	PF05437	Branched-chain amino acid transport protein (AzlD)	10	100	3.5E-16	T	21-03-2019	IPR008407	Branched-chain amino acid transport, AzlD
MAG141_27_10	341ef36eb8dfb670dbf071201d1e0852	121	Pfam	PF03750	Csm2 Type III-A	5	118	5.7E-22	T	21-03-2019	IPR010149	CRISPR-associated protein, Csm2 Type III-A
MAG141_27_10	341ef36eb8dfb670dbf071201d1e0852	121	TIGRFAM	TIGR01870	cas_TM1810_Csm2: CRISPR type III-A/MTUBE-associated protein Csm2	30	117	3.1E-15	T	21-03-2019	IPR010149	CRISPR-associated protein, Csm2 Type III-A
MAG141_5_6	fd44e849d9a83e3cc03341d4d9281bee	411	Pfam	PF12965	Domain of unknown function (DUF3854)	298	391	1.5E-8	T	21-03-2019	IPR024385	Domain of unknown function DUF3854
MAG141_5_6	fd44e849d9a83e3cc03341d4d9281bee	411	Pfam	PF01807	CHC2 zinc finger	6	91	9.0E-24	T	21-03-2019	IPR002694	Zinc finger, CHC2-type
MAG141_149_4	2629118ef7977f1675ce2f1574d2dcfa	66	TIGRFAM	TIGR01031	rpmF_bact: ribosomal protein bL32	3	56	9.5E-20	T	21-03-2019	IPR002677	Ribosomal protein L32p
MAG141_149_4	2629118ef7977f1675ce2f1574d2dcfa	66	Pfam	PF01783	Ribosomal L32p protein family	3	56	1.2E-20	T	21-03-2019	IPR002677	Ribosomal protein L32p
MAG141_23_17	0cdc4ce2e6ee38a37aacf6ec804dd137	438	Pfam	PF04984	Phage tail sheath protein subtilisin-like domain	186	330	1.5E-19	T	21-03-2019	IPR035089	Tail sheath protein, subtilisin-like domain
MAG141_23_17	0cdc4ce2e6ee38a37aacf6ec804dd137	438	Pfam	PF17482	Phage tail sheath C-terminal domain	341	437	5.2E-18	T	21-03-2019	IPR020287	Tail sheath protein, C-terminal domain
MAG141_107_3	2f07d91a2585f0b309f806bad5003a43	184	Pfam	PF09285	Elongation factor P, C-terminal	128	183	2.4E-24	T	21-03-2019	IPR015365	Elongation factor P, C-terminal
MAG141_107_3	2f07d91a2585f0b309f806bad5003a43	184	Pfam	PF01132	Elongation factor P (EF-P) OB domain	68	119	1.4E-20	T	21-03-2019	IPR001059	Translation elongation factor P/YeiP, central
MAG141_107_3	2f07d91a2585f0b309f806bad5003a43	184	Pfam	PF08207	Elongation factor P (EF-P) KOW-like domain	3	60	4.2E-26	T	21-03-2019	IPR013185	Translation elongation factor, KOW-like
MAG141_107_3	2f07d91a2585f0b309f806bad5003a43	184	TIGRFAM	TIGR00038	efp: translation elongation factor P	2	184	6.1E-76	T	21-03-2019	IPR011768	Translation elongation factor P
MAG141_44_11	92074ba38527e5d1f41e46b63e7e454e	398	Pfam	PF00589	Phage integrase family	203	367	1.2E-20	T	21-03-2019	IPR002104	Integrase, catalytic domain
MAG141_44_11	92074ba38527e5d1f41e46b63e7e454e	398	Pfam	PF14659	Phage integrase, N-terminal SAM-like domain	71	123	9.4E-11	T	21-03-2019	IPR004107	Integrase, SAM-like, N-terminal
MAG141_4_28	31acd6bb26a229c5c5b729a9ab4756f8	166	TIGRFAM	TIGR01575	rimI: ribosomal-protein-alanine acetyltransferase	16	148	5.4E-31	T	21-03-2019	IPR006464	N-acetyltransferase RimI/Ard1
MAG141_4_28	31acd6bb26a229c5c5b729a9ab4756f8	166	Pfam	PF00583	Acetyltransferase (GNAT) family	17	128	4.4E-17	T	21-03-2019	IPR000182	GNAT domain
MAG141_154_1	e495c71ce65588684b2f8a1b9e555710	456	Pfam	PF00669	Bacterial flagellin N-terminal helical region	3	36	4.7E-7	T	21-03-2019	IPR001029	Flagellin, D0/D1 domain
MAG141_154_1	e495c71ce65588684b2f8a1b9e555710	456	Pfam	PF00700	Bacterial flagellin C-terminal helical region	371	455	5.9E-25	T	21-03-2019	IPR001029	Flagellin, D0/D1 domain
MAG141_86_5	ba6710f4f70f6f4cd45f9891754e7ec1	577	Pfam	PF00890	FAD binding domain	6	392	8.3E-86	T	21-03-2019	IPR003953	FAD-dependent oxidoreductase 2, FAD binding domain
MAG141_86_5	ba6710f4f70f6f4cd45f9891754e7ec1	577	Pfam	PF02910	Fumarate reductase flavoprotein C-term	452	577	6.8E-39	T	21-03-2019	IPR015939	Fumarate reductase/succinate dehydrogenase flavoprotein-like, C-terminal
MAG141_86_5	ba6710f4f70f6f4cd45f9891754e7ec1	577	TIGRFAM	TIGR01811	sdhA_Bsu: succinate dehydrogenase or fumarate reductase, flavoprotein subunit	7	577	3.1E-228	T	21-03-2019	IPR011280	Succinate dehydrogenase/fumarate reductase flavoprotein subunit, low-GC Gram-positive bacteria
MAG141_10_30	788d3b9a4922a16e6c260e434c6b63fe	655	TIGRFAM	TIGR00499	lysS_bact: lysine--tRNA ligase	24	503	3.8E-206	T	21-03-2019	IPR002313	Lysine-tRNA ligase, class II
MAG141_10_30	788d3b9a4922a16e6c260e434c6b63fe	655	Pfam	PF01588	Putative tRNA binding domain	557	652	1.0E-21	T	21-03-2019	IPR002547	tRNA-binding domain
MAG141_10_30	788d3b9a4922a16e6c260e434c6b63fe	655	Pfam	PF00152	tRNA synthetases class II (D, K and N)	164	501	3.9E-79	T	21-03-2019	IPR004364	Aminoacyl-tRNA synthetase, class II (D/K/N)
MAG141_10_30	788d3b9a4922a16e6c260e434c6b63fe	655	Pfam	PF01336	OB-fold nucleic acid binding domain	70	147	3.0E-16	T	21-03-2019	IPR004365	OB-fold nucleic acid binding domain, AA-tRNA synthetase-type
MAG141_7_14	2569e3d10f9059d29ee74c01a1879dc2	585	Pfam	PF01268	Formate--tetrahydrofolate ligase	9	585	1.8E-208	T	21-03-2019	IPR000559	Formate-tetrahydrofolate ligase, FTHFS
MAG141_15_10	96204aababf7fdfa31f117f066ecc822	153	Pfam	PF01668	SmpB protein	6	148	1.0E-60	T	21-03-2019	IPR000037	SsrA-binding protein
MAG141_15_10	96204aababf7fdfa31f117f066ecc822	153	TIGRFAM	TIGR00086	smpB: SsrA-binding protein	6	147	1.1E-57	T	21-03-2019	IPR000037	SsrA-binding protein
MAG141_129_1	4d73c4f1937b2783a4b65b79f470d254	836	Pfam	PF13306	Leucine rich repeats (6 copies)	259	334	7.2E-20	T	21-03-2019	IPR026906	Leucine rich repeat 5
MAG141_129_1	4d73c4f1937b2783a4b65b79f470d254	836	Pfam	PF13306	Leucine rich repeats (6 copies)	70	188	2.6E-32	T	21-03-2019	IPR026906	Leucine rich repeat 5
MAG141_129_1	4d73c4f1937b2783a4b65b79f470d254	836	Pfam	PF09479	Listeria-Bacteroides repeat domain (List_Bact_rpt)	539	605	3.6E-10	T	21-03-2019	IPR013378	Listeria/Bacterioides repeat
MAG141_129_1	4d73c4f1937b2783a4b65b79f470d254	836	Pfam	PF02368	Bacterial Ig-like domain (group 2)	367	443	1.5E-15	T	21-03-2019	IPR003343	Bacterial Ig-like, group 2
MAG141_129_1	4d73c4f1937b2783a4b65b79f470d254	836	Pfam	PF02368	Bacterial Ig-like domain (group 2)	449	521	1.1E-15	T	21-03-2019	IPR003343	Bacterial Ig-like, group 2
MAG141_129_1	4d73c4f1937b2783a4b65b79f470d254	836	Pfam	PF00395	S-layer homology domain	659	697	9.1E-7	T	21-03-2019	IPR001119	S-layer homology domain
MAG141_129_1	4d73c4f1937b2783a4b65b79f470d254	836	Pfam	PF00395	S-layer homology domain	717	759	1.8E-13	T	21-03-2019	IPR001119	S-layer homology domain
MAG141_129_1	4d73c4f1937b2783a4b65b79f470d254	836	Pfam	PF00395	S-layer homology domain	782	825	3.5E-9	T	21-03-2019	IPR001119	S-layer homology domain
MAG141_94_5	8a86c37c741719c0575f23e8ff4b018a	387	Pfam	PF00188	Cysteine-rich secretory protein family	181	295	5.9E-11	T	21-03-2019	IPR014044	CAP domain
MAG141_94_5	8a86c37c741719c0575f23e8ff4b018a	387	Pfam	PF07833	Copper amine oxidase N-terminal domain	58	149	7.5E-26	T	21-03-2019	IPR012854	Copper amine oxidase-like, N-terminal
MAG141_103_4	c9831b401c67602be4e3e43492424384	211	Pfam	PF00899	ThiF family	18	174	5.2E-33	T	21-03-2019	IPR000594	THIF-type NAD/FAD binding fold
MAG141_103_4	c9831b401c67602be4e3e43492424384	211	TIGRFAM	TIGR02354	thiF_fam2: thiamine biosynthesis protein ThiF	8	206	4.2E-76	T	21-03-2019	IPR012729	Thiamine biosynthesis protein ThiF
MAG141_92_3	b3033e2af47564e2a1b52c8e07ad09d4	252	Pfam	PF12399	Branched-chain amino acid ATP-binding cassette transporter	229	251	7.5E-8	T	21-03-2019	IPR032823	Branched-chain amino acid ATP-binding cassette transporter, C-terminal
MAG141_92_3	b3033e2af47564e2a1b52c8e07ad09d4	252	Pfam	PF00005	ABC transporter	20	179	2.0E-31	T	21-03-2019	IPR003439	ABC transporter-like
MAG141_3_4	64e75a63a657d3fbc6b44b4db63a2cd6	320	Pfam	PF13527	Acetyltransferase (GNAT) domain	8	134	9.5E-18	T	21-03-2019
MAG141_13_35	2de9f0a4a305a26fcd402c5f4f3c5cbc	157	Pfam	PF13151	Protein of unknown function (DUF3990)	1	151	3.4E-46	T	21-03-2019	IPR025051	Protein of unknown function DUF3990
MAG141_33_23	15c7acbccaeaf85831faff437f42b777	211	TIGRFAM	TIGR01855	IMP_synth_hisH: imidazole glycerol phosphate synthase, glutamine amidotransferase subunit	3	210	4.2E-64	T	21-03-2019	IPR010139	Imidazole glycerol phosphate synthase, subunit H
MAG141_33_23	15c7acbccaeaf85831faff437f42b777	211	Pfam	PF00117	Glutamine amidotransferase class-I	5	199	5.7E-19	T	21-03-2019	IPR017926	Glutamine amidotransferase
MAG141_7_34	5e0429aedfac78c212c9c33e6f1d80be	301	Pfam	PF00126	Bacterial regulatory helix-turn-helix protein, lysR family	3	62	5.6E-19	T	21-03-2019	IPR000847	Transcription regulator HTH, LysR
MAG141_7_34	5e0429aedfac78c212c9c33e6f1d80be	301	Pfam	PF03466	LysR substrate binding domain	89	297	1.1E-36	T	21-03-2019	IPR005119	LysR, substrate-binding
MAG141_109_5	57b5c3e6a3c019fa87a727a52f83906d	248	Pfam	PF00005	ABC transporter	25	173	2.0E-35	T	21-03-2019	IPR003439	ABC transporter-like
MAG141_17_11	b2347731bdc8672c42be60d4726613f1	220	Pfam	PF00813	FliP family	20	215	1.5E-74	T	21-03-2019	IPR005838	Type III secretion system inner membrane P protein
MAG141_17_11	b2347731bdc8672c42be60d4726613f1	220	TIGRFAM	TIGR01103	fliP: flagellar biosynthetic protein FliP	20	219	7.4E-73	T	21-03-2019	IPR005837	Flagellar transport protein FliP
MAG141_37_2	fe415fcb5ef41c5ad94b136d7e5b68a6	492	Pfam	PF01656	CobQ/CobB/MinD/ParA nucleotide binding domain	1	227	4.0E-17	T	21-03-2019	IPR002586	CobQ/CobB/MinD/ParA nucleotide binding domain
MAG141_37_2	fe415fcb5ef41c5ad94b136d7e5b68a6	492	Pfam	PF07685	CobB/CobQ-like glutamine amidotransferase domain	252	438	4.2E-42	T	21-03-2019	IPR011698	CobB/CobQ-like glutamine amidotransferase
MAG141_37_2	fe415fcb5ef41c5ad94b136d7e5b68a6	492	TIGRFAM	TIGR00313	cobQ: cobyric acid synthase CobQ	1	483	8.3E-149	T	21-03-2019	IPR004459	Cobyric acid synthase CobQ
MAG141_29_26	143c8d97ed83c59de0c7b50fce1e49ea	350	Pfam	PF03418	Germination protease	28	286	2.1E-57	T	21-03-2019	IPR005080	Peptidase A25, germination protease
MAG141_141_2	5346bb21527b675937bf39378b87a015	443	Pfam	PF00408	Phosphoglucomutase/phosphomannomutase, C-terminal domain	376	442	2.7E-18	T	21-03-2019	IPR005843	Alpha-D-phosphohexomutase, C-terminal
MAG141_141_2	5346bb21527b675937bf39378b87a015	443	Pfam	PF02878	Phosphoglucomutase/phosphomannomutase, alpha/beta/alpha domain I	3	134	6.6E-35	T	21-03-2019	IPR005844	Alpha-D-phosphohexomutase, alpha/beta/alpha domain I
MAG141_141_2	5346bb21527b675937bf39378b87a015	443	Pfam	PF02879	Phosphoglucomutase/phosphomannomutase, alpha/beta/alpha domain II	171	253	6.5E-17	T	21-03-2019	IPR005845	Alpha-D-phosphohexomutase, alpha/beta/alpha domain II
MAG141_141_2	5346bb21527b675937bf39378b87a015	443	TIGRFAM	TIGR01455	glmM: phosphoglucosamine mutase	5	443	2.5E-161	T	21-03-2019	IPR006352	Phosphoglucosamine mutase, bacterial type
MAG141_141_2	5346bb21527b675937bf39378b87a015	443	Pfam	PF02880	Phosphoglucomutase/phosphomannomutase, alpha/beta/alpha domain III	258	369	9.0E-31	T	21-03-2019	IPR005846	Alpha-D-phosphohexomutase, alpha/beta/alpha domain III
MAG141_80_2	3b7e6c6203f81a62cb1ddbcb1d0be6c5	135	Pfam	PF13669	Glyoxalase/Bleomycin resistance protein/Dioxygenase superfamily	8	118	6.2E-22	T	21-03-2019
MAG141_80_2	3b7e6c6203f81a62cb1ddbcb1d0be6c5	135	TIGRFAM	TIGR03081	metmalonyl_epim: methylmalonyl-CoA epimerase	6	133	2.3E-43	T	21-03-2019	IPR017515	Methylmalonyl-CoA epimerase
MAG141_22_23	174fd3bdde9c3ea41413e56b5016ecfa	412	Pfam	PF00579	tRNA synthetases class I (W and Y)	29	321	7.3E-80	T	21-03-2019	IPR002305	Aminoacyl-tRNA synthetase, class Ic
MAG141_22_23	174fd3bdde9c3ea41413e56b5016ecfa	412	TIGRFAM	TIGR00234	tyrS: tyrosine--tRNA ligase	1	411	4.6E-120	T	21-03-2019	IPR002307	Tyrosine-tRNA ligase
MAG141_82_4	6842ac24affb028bc192da1ebbc9f38f	432	TIGRFAM	TIGR00928	purB: adenylosuccinate lyase	1	428	3.8E-139	T	21-03-2019	IPR004769	Adenylosuccinate lyase
MAG141_82_4	6842ac24affb028bc192da1ebbc9f38f	432	Pfam	PF00206	Lyase	8	283	2.2E-48	T	21-03-2019	IPR022761	Fumarate lyase, N-terminal
MAG141_82_4	6842ac24affb028bc192da1ebbc9f38f	432	Pfam	PF10397	Adenylosuccinate lyase C-terminus	351	429	5.0E-22	T	21-03-2019	IPR019468	Adenylosuccinate lyase C-terminal
MAG141_37_5	89b2716d6ca7e089be0065a6bf752596	388	TIGRFAM	TIGR00312	cbiD: cobalamin biosynthesis protein CbiD	27	370	1.7E-92	T	21-03-2019	IPR002748	Cobalt-precorrin-5B C(1)-methyltransferase CbiD
MAG141_37_5	89b2716d6ca7e089be0065a6bf752596	388	Pfam	PF01888	CbiD	20	279	4.2E-92	T	21-03-2019	IPR002748	Cobalt-precorrin-5B C(1)-methyltransferase CbiD
MAG141_10_28	ea2ab89a6f8457bc4db03fe4a9f34d43	515	Pfam	PF03069	Acetamidase/Formamidase family	241	396	1.8E-21	T	21-03-2019	IPR004304	Acetamidase/Formamidase
MAG141_10_28	ea2ab89a6f8457bc4db03fe4a9f34d43	515	Pfam	PF03069	Acetamidase/Formamidase family	115	238	4.3E-8	T	21-03-2019	IPR004304	Acetamidase/Formamidase
