MAG142_32_25	7cec450e179c1b9c1d7ba54a1093e9fa	242	Pfam	PF00717	Peptidase S24-like	153	223	3.2E-8	T	21-03-2019	IPR015927	Peptidase S24/S26A/S26B/S26C
MAG142_62_3	b38bc2127dc09b3ed3d04ea1ccbae54d	404	Pfam	PF02441	Flavoprotein	7	177	2.0E-39	T	21-03-2019	IPR003382	Flavoprotein
MAG142_62_3	b38bc2127dc09b3ed3d04ea1ccbae54d	404	TIGRFAM	TIGR00521	coaBC_dfp: phosphopantothenoylcysteine decarboxylase / phosphopantothenate--cysteine ligase	4	397	2.4E-133	T	21-03-2019	IPR005252	Coenzyme A biosynthesis bifunctional protein CoaBC
MAG142_62_3	b38bc2127dc09b3ed3d04ea1ccbae54d	404	Pfam	PF04127	DNA / pantothenate metabolism flavoprotein	187	372	6.9E-73	T	21-03-2019	IPR007085	DNA/pantothenate metabolism flavoprotein, C-terminal
MAG142_2_43	659199a1da9756f52b410d5acbb52367	472	Pfam	PF07980	SusD family	330	466	2.1E-16	T	21-03-2019	IPR012944	RagB/SusD domain
MAG142_2_43	659199a1da9756f52b410d5acbb52367	472	Pfam	PF14322	Starch-binding associating with outer membrane	21	228	1.1E-28	T	21-03-2019	IPR033985	SusD-like, N-terminal
MAG142_15_20	7109a9404f6c6656d5c935b539ba10f9	466	Pfam	PF04087	Domain of unknown function (DUF389)	68	203	3.1E-40	T	21-03-2019	IPR005240	Protein of unknown function DUF389
MAG142_15_20	7109a9404f6c6656d5c935b539ba10f9	466	TIGRFAM	TIGR00341	TIGR00341: TIGR00341 family protein	36	222	3.0E-28	T	21-03-2019
MAG142_49_13	77b06e79735cf28150befe3a1ea25ce8	171	Pfam	PF03938	Outer membrane protein (OmpH-like)	9	167	7.6E-36	T	21-03-2019	IPR005632	Chaperone protein Skp
MAG142_1_20	44f429b51f532d54e9b08e841cedcb0e	498	Pfam	PF14052	Capsule assembly protein Wzi	52	482	2.5E-45	T	21-03-2019	IPR026950	Capsule assembly protein Wzi
MAG142_48_6	bd7927684c6430ed367c16706b515432	647	Pfam	PF00204	DNA gyrase B	232	401	1.1E-60	T	21-03-2019	IPR013506	DNA topoisomerase, type IIA, subunit B, domain 2
MAG142_48_6	bd7927684c6430ed367c16706b515432	647	TIGRFAM	TIGR01059	gyrB: DNA gyrase, B subunit	12	643	1.6E-280	T	21-03-2019	IPR011557	DNA gyrase, subunit B
MAG142_48_6	bd7927684c6430ed367c16706b515432	647	Pfam	PF02518	Histidine kinase-, DNA gyrase B-, and HSP90-like ATPase	40	179	1.5E-22	T	21-03-2019	IPR003594	Histidine kinase/HSP90-like ATPase
MAG142_48_6	bd7927684c6430ed367c16706b515432	647	Pfam	PF00986	DNA gyrase B subunit, carboxyl terminus	576	637	2.3E-27	T	21-03-2019	IPR002288	DNA gyrase B subunit, C-terminal
MAG142_48_6	bd7927684c6430ed367c16706b515432	647	Pfam	PF01751	Toprim domain	430	530	1.4E-17	T	21-03-2019	IPR006171	TOPRIM  domain
MAG142_1_42	3dd17870a9cc55a0557b394eee5bffd0	229	Pfam	PF00132	Bacterial transferase hexapeptide (six repeats)	130	164	8.9E-11	T	21-03-2019	IPR001451	Hexapeptide repeat
MAG142_1_42	3dd17870a9cc55a0557b394eee5bffd0	229	Pfam	PF00132	Bacterial transferase hexapeptide (six repeats)	47	80	5.5E-4	T	21-03-2019	IPR001451	Hexapeptide repeat
MAG142_8_50	fbbfb2c19bd7f593742904fb8c14d5b2	460	Pfam	PF00639	PPIC-type PPIASE domain	186	274	7.5E-20	T	21-03-2019	IPR000297	Peptidyl-prolyl cis-trans isomerase, PpiC-type
MAG142_8_50	fbbfb2c19bd7f593742904fb8c14d5b2	460	Pfam	PF00639	PPIC-type PPIASE domain	285	378	4.3E-11	T	21-03-2019	IPR000297	Peptidyl-prolyl cis-trans isomerase, PpiC-type
MAG142_1_78	f2e3ed0268b456a93434d3e638609ef6	254	Pfam	PF13614	AAA domain	2	178	1.8E-66	T	21-03-2019	IPR025669	AAA domain
MAG142_32_21	f5e1612d7fb9e790fd386549422e53cc	165	Pfam	PF13905	Thioredoxin-like	46	142	3.3E-8	T	21-03-2019	IPR012336	Thioredoxin-like fold
MAG142_27_13	39b44b328cea7136a6b33a5ed3abaa43	163	Pfam	PF13353	4Fe-4S single cluster domain	12	143	1.0E-38	T	21-03-2019
MAG142_27_13	39b44b328cea7136a6b33a5ed3abaa43	163	Pfam	PF04055	Radical SAM superfamily	23	92	2.1E-11	T	21-03-2019	IPR007197	Radical SAM
MAG142_27_13	39b44b328cea7136a6b33a5ed3abaa43	163	TIGRFAM	TIGR02491	NrdG: anaerobic ribonucleoside-triphosphate reductase activating protein	3	145	4.3E-43	T	21-03-2019	IPR012837	Ribonucleoside-triphosphate reductase activating, anaerobic
MAG142_24_3	d0640a33b0d357b09a2fb532fcdc1da6	370	Pfam	PF03372	Endonuclease/Exonuclease/phosphatase family	99	353	9.3E-15	T	21-03-2019	IPR005135	Endonuclease/exonuclease/phosphatase
MAG142_38_9	14a9be29296a05c97634bc5c84a27ef9	636	Pfam	PF00364	Biotin-requiring enzyme	570	633	5.8E-15	T	21-03-2019	IPR000089	Biotin/lipoyl attachment
MAG142_38_9	14a9be29296a05c97634bc5c84a27ef9	636	Pfam	PF02436	Conserved carboxylase domain	381	544	1.4E-30	T	21-03-2019	IPR003379	Carboxylase, conserved domain
MAG142_38_9	14a9be29296a05c97634bc5c84a27ef9	636	Pfam	PF00682	HMGL-like	10	305	1.2E-24	T	21-03-2019	IPR000891	Pyruvate carboxyltransferase
MAG142_14_10	ada0297748b0a29ddb3affd0e14463ba	113	Pfam	PF00436	Single-strand binding protein family	3	107	1.7E-31	T	21-03-2019	IPR000424	Primosome PriB/single-strand DNA-binding
MAG142_14_10	ada0297748b0a29ddb3affd0e14463ba	113	TIGRFAM	TIGR00621	ssb: single-stranded DNA-binding protein	2	108	7.8E-34	T	21-03-2019	IPR011344	Single-stranded DNA-binding protein
MAG142_4_72	da8e7502e8ab4113d4e63fbe0650519b	411	Pfam	PF08239	Bacterial SH3 domain	28	85	3.7E-9	T	21-03-2019	IPR003646	SH3-like domain, bacterial-type
MAG142_1_89	1fe34ec83d4d7d575a9ec2a674a387f9	399	Pfam	PF14289	Domain of unknown function (DUF4369)	40	141	2.9E-17	T	21-03-2019	IPR025380	Domain of unknown function DUF4369
MAG142_1_89	1fe34ec83d4d7d575a9ec2a674a387f9	399	Pfam	PF00578	AhpC/TSA family	249	380	1.7E-17	T	21-03-2019	IPR000866	Alkyl hydroperoxide reductase subunit C/ Thiol specific antioxidant
MAG142_8_7	4732b8e87e393ac6315a6ebeec640f0e	544	Pfam	PF00884	Sulfatase	220	505	4.1E-35	T	21-03-2019	IPR000917	Sulfatase, N-terminal
MAG142_8_7	4732b8e87e393ac6315a6ebeec640f0e	544	Pfam	PF08019	Domain of unknown function (DUF1705)	44	165	4.8E-13	T	21-03-2019	IPR012549	Phosphoethanolamine transferase, N-terminal
MAG142_4_41	b7a32e0b4a525cff0b5cd496af4ec529	239	TIGRFAM	TIGR00046	TIGR00046: RNA methyltransferase, RsmE family	12	230	4.4E-39	T	21-03-2019	IPR006700	Ribosomal RNA small subunit methyltransferase E
MAG142_4_41	b7a32e0b4a525cff0b5cd496af4ec529	239	Pfam	PF04452	RNA methyltransferase	14	228	1.4E-56	T	21-03-2019	IPR006700	Ribosomal RNA small subunit methyltransferase E
MAG142_37_9	7e0b9e30d4475e9519e77194eebf5fee	1271	Pfam	PF04561	RNA polymerase Rpb2, domain 2	306	416	8.7E-22	T	21-03-2019	IPR007642	RNA polymerase Rpb2, domain 2
MAG142_37_9	7e0b9e30d4475e9519e77194eebf5fee	1271	Pfam	PF04561	RNA polymerase Rpb2, domain 2	150	220	9.4E-8	T	21-03-2019	IPR007642	RNA polymerase Rpb2, domain 2
MAG142_37_9	7e0b9e30d4475e9519e77194eebf5fee	1271	Pfam	PF04563	RNA polymerase beta subunit	26	462	2.3E-25	T	21-03-2019	IPR007644	RNA polymerase, beta subunit, protrusion
MAG142_37_9	7e0b9e30d4475e9519e77194eebf5fee	1271	Pfam	PF00562	RNA polymerase Rpb2, domain 6	682	1194	9.7E-149	T	21-03-2019	IPR007120	DNA-directed RNA polymerase, subunit 2, hybrid-binding domain
MAG142_37_9	7e0b9e30d4475e9519e77194eebf5fee	1271	Pfam	PF04560	RNA polymerase Rpb2, domain 7	1196	1270	1.8E-23	T	21-03-2019	IPR007641	RNA polymerase Rpb2, domain 7
MAG142_37_9	7e0b9e30d4475e9519e77194eebf5fee	1271	TIGRFAM	TIGR02013	rpoB: DNA-directed RNA polymerase, beta subunit	9	1269	0.0	T	21-03-2019	IPR010243	DNA-directed RNA polymerase beta subunit, bacterial-type
MAG142_37_9	7e0b9e30d4475e9519e77194eebf5fee	1271	Pfam	PF04565	RNA polymerase Rpb2, domain 3	475	543	2.0E-30	T	21-03-2019	IPR007645	RNA polymerase Rpb2, domain 3
MAG142_37_9	7e0b9e30d4475e9519e77194eebf5fee	1271	Pfam	PF10385	RNA polymerase beta subunit external 1 domain	553	621	1.1E-23	T	21-03-2019	IPR019462	DNA-directed RNA polymerase, beta subunit, external 1 domain
MAG142_31_6	11e25395939211d811cc61a94af3410a	360	Pfam	PF01855	Pyruvate flavodoxin/ferredoxin oxidoreductase, thiamine diP-bdg	16	192	1.3E-46	T	21-03-2019	IPR002880	Pyruvate flavodoxin/ferredoxin oxidoreductase, N-terminal
MAG142_31_6	11e25395939211d811cc61a94af3410a	360	Pfam	PF17147	Pyruvate:ferredoxin oxidoreductase core domain II	256	350	1.6E-26	T	21-03-2019	IPR033412	Pyruvate:ferredoxin oxidoreductase, core domain II
MAG142_9_7	e8a59aa5c4a8adc9d642c31293d82133	130	Pfam	PF01230	HIT domain	11	98	1.3E-17	T	21-03-2019	IPR001310	Histidine triad (HIT) protein
MAG142_59_10	cc1463c5941ad603638a6a747982b250	251	Pfam	PF08713	DNA alkylation repair enzyme	7	240	3.4E-61	T	21-03-2019	IPR014825	DNA alkylation repair enzyme
MAG142_18_39	dec2eef2c6c12423bcde0443bdd559ec	375	Pfam	PF01041	DegT/DnrJ/EryC1/StrS aminotransferase family	4	369	3.2E-88	T	21-03-2019	IPR000653	DegT/DnrJ/EryC1/StrS aminotransferase
MAG142_66_6	24663c00131034363e83a52612044ab5	430	Pfam	PF07075	Protein of unknown function (DUF1343)	62	429	4.4E-127	T	21-03-2019	IPR008302	Uncharacterised conserved protein UCP016719
MAG142_46_3	dc93d8656051b489ddb3473081933656	474	Pfam	PF03349	Outer membrane protein transport protein (OMPP1/FadL/TodX)	13	412	3.6E-66	T	21-03-2019	IPR005017	Outer membrane protein transport protein (OMPP1/FadL/TodX)
MAG142_1_75	2dda82e5e7ff9e67b1273238bd625e47	446	Pfam	PF13286	Phosphohydrolase-associated domain	352	436	1.3E-6	T	21-03-2019	IPR026875	Phosphohydrolase-associated domain
MAG142_1_75	2dda82e5e7ff9e67b1273238bd625e47	446	TIGRFAM	TIGR01353	dGTP_triPase: putative dGTPase	25	439	4.7E-106	T	21-03-2019	IPR006261	dNTP triphosphohydrolase
MAG142_1_75	2dda82e5e7ff9e67b1273238bd625e47	446	Pfam	PF01966	HD domain	62	172	1.0E-7	T	21-03-2019	IPR006674	HD domain
MAG142_5_75	dbcdcf8a93e60f64d8aebcd4c9e67430	839	Pfam	PF14900	Domain of unknown function (DUF4493)	33	230	6.2E-18	T	21-03-2019	IPR027840	Protein of unknown function DUF4493
MAG142_34_18	28e2fce9a2843bffdcb23f60062e0ee5	358	TIGRFAM	TIGR00005	rluA_subfam: pseudouridine synthase, RluA family	44	351	1.8E-90	T	21-03-2019	IPR006225	Pseudouridine synthase, RluC/RluD
MAG142_34_18	28e2fce9a2843bffdcb23f60062e0ee5	358	Pfam	PF00849	RNA pseudouridylate synthase	119	276	2.0E-33	T	21-03-2019	IPR006145	Pseudouridine synthase, RsuA/RluB/C/D/E/F
MAG142_34_18	28e2fce9a2843bffdcb23f60062e0ee5	358	Pfam	PF01479	S4 domain	45	90	7.1E-10	T	21-03-2019	IPR002942	RNA-binding S4 domain
MAG142_7_53	da87d1d749b9fa9cece8ac109731fbaf	398	Pfam	PF16653	Saccharopine dehydrogenase C-terminal domain	138	386	8.3E-34	T	21-03-2019	IPR032095	Saccharopine dehydrogenase, C-terminal
MAG142_7_53	da87d1d749b9fa9cece8ac109731fbaf	398	Pfam	PF03435	Saccharopine dehydrogenase NADP binding domain	4	134	3.8E-36	T	21-03-2019	IPR005097	Saccharopine dehydrogenase, NADP binding domain
MAG142_40_12	64fdef8d861f4f06d06c5aed75fddd51	515	TIGRFAM	TIGR00797	matE: MATE efflux family protein	89	488	5.5E-55	T	21-03-2019	IPR002528	Multi antimicrobial extrusion protein
MAG142_40_12	64fdef8d861f4f06d06c5aed75fddd51	515	Pfam	PF01554	MatE	89	248	7.6E-21	T	21-03-2019	IPR002528	Multi antimicrobial extrusion protein
MAG142_40_12	64fdef8d861f4f06d06c5aed75fddd51	515	Pfam	PF01554	MatE	315	476	5.9E-21	T	21-03-2019	IPR002528	Multi antimicrobial extrusion protein
MAG142_22_26	fb39b8b5a47eb229f89c46807629b279	206	Pfam	PF00254	FKBP-type peptidyl-prolyl cis-trans isomerase	115	203	8.3E-30	T	21-03-2019	IPR001179	FKBP-type peptidyl-prolyl cis-trans isomerase domain
MAG142_22_26	fb39b8b5a47eb229f89c46807629b279	206	Pfam	PF01346	Domain amino terminal to FKBP-type peptidyl-prolyl isomerase	4	108	8.7E-28	T	21-03-2019	IPR000774	Peptidyl-prolyl cis-trans isomerase, FKBP-type, N-terminal
MAG142_24_10	bbf076fa4fa62e2c431288df695cda7e	341	Pfam	PF00766	Electron transfer flavoprotein FAD-binding domain	217	299	7.5E-36	T	21-03-2019	IPR014731	Electron transfer flavoprotein, alpha subunit, C-terminal
MAG142_24_10	bbf076fa4fa62e2c431288df695cda7e	341	Pfam	PF01012	Electron transfer flavoprotein domain	8	194	9.6E-41	T	21-03-2019	IPR014730	Electron transfer flavoprotein, alpha/beta-subunit, N-terminal
MAG142_4_66	575a822404b48174f692c237efe2318c	419	Pfam	PF13184	NusA-like KH domain	238	305	1.8E-26	T	21-03-2019	IPR025249	KH domain, NusA-like
MAG142_4_66	575a822404b48174f692c237efe2318c	419	TIGRFAM	TIGR01953	NusA: transcription termination factor NusA	10	349	4.1E-118	T	21-03-2019	IPR010213	Transcription termination factor NusA
MAG142_4_66	575a822404b48174f692c237efe2318c	419	Pfam	PF08529	NusA N-terminal domain	10	132	4.0E-25	T	21-03-2019	IPR013735	Transcription factor NusA, N-terminal
MAG142_1_107	030e76b4020de74eec84746ed8534e79	281	Pfam	PF00800	Prephenate dehydratase	4	181	1.7E-49	T	21-03-2019	IPR001086	Prephenate dehydratase
MAG142_5_26	d0b365b393392a2316d2d7cd19d9c4c0	677	Pfam	PF02779	Transketolase, pyrimidine binding domain	352	533	6.4E-34	T	21-03-2019	IPR005475	Transketolase-like, pyrimidine-binding domain
MAG142_5_26	d0b365b393392a2316d2d7cd19d9c4c0	677	Pfam	PF02780	Transketolase, C-terminal domain	554	667	1.2E-9	T	21-03-2019	IPR033248	Transketolase, C-terminal domain
MAG142_5_26	d0b365b393392a2316d2d7cd19d9c4c0	677	Pfam	PF00456	Transketolase, thiamine diphosphate binding domain	8	339	2.6E-94	T	21-03-2019	IPR005474	Transketolase, N-terminal
MAG142_41_11	d8cede8553123fcf4fc59077f5022f5b	573	Pfam	PF00205	Thiamine pyrophosphate enzyme, central domain	198	331	2.8E-40	T	21-03-2019	IPR012000	Thiamine pyrophosphate enzyme, central domain
MAG142_41_11	d8cede8553123fcf4fc59077f5022f5b	573	Pfam	PF02776	Thiamine pyrophosphate enzyme, N-terminal TPP binding domain	6	175	1.5E-55	T	21-03-2019	IPR012001	Thiamine pyrophosphate enzyme, N-terminal TPP-binding domain
MAG142_41_11	d8cede8553123fcf4fc59077f5022f5b	573	TIGRFAM	TIGR00118	acolac_lg: acetolactate synthase, large subunit, biosynthetic type	6	565	7.7E-205	T	21-03-2019	IPR012846	Acetolactate synthase, large subunit, biosynthetic
MAG142_41_11	d8cede8553123fcf4fc59077f5022f5b	573	Pfam	PF02775	Thiamine pyrophosphate enzyme, C-terminal TPP binding domain	395	542	5.8E-44	T	21-03-2019	IPR011766	Thiamine pyrophosphate enzyme, C-terminal TPP-binding
MAG142_33_7	7c509e6a24418d3eaca1d3fd7ab92987	455	Pfam	PF03129	Anticodon binding domain	381	453	2.8E-16	T	21-03-2019	IPR004154	Anticodon-binding
MAG142_33_7	7c509e6a24418d3eaca1d3fd7ab92987	455	TIGRFAM	TIGR00442	hisS: histidine--tRNA ligase	7	444	4.2E-119	T	21-03-2019	IPR015807	Histidine-tRNA ligase
MAG142_33_7	7c509e6a24418d3eaca1d3fd7ab92987	455	Pfam	PF13393	Histidyl-tRNA synthetase	97	345	1.1E-25	T	21-03-2019
MAG142_33_7	7c509e6a24418d3eaca1d3fd7ab92987	455	Pfam	PF13393	Histidyl-tRNA synthetase	10	69	5.5E-6	T	21-03-2019
MAG142_22_14	f95368143c67c94b6755d8ff8382b62e	226	Pfam	PF13174	Tetratricopeptide repeat	176	205	0.19	T	21-03-2019	IPR019734	Tetratricopeptide repeat
MAG142_22_14	f95368143c67c94b6755d8ff8382b62e	226	Pfam	PF09976	Tetratricopeptide repeat-like domain	68	167	5.8E-6	T	21-03-2019	IPR018704	Tetratricopeptide repeat-like domain
MAG142_11_38	5428e42e8c1b5b71cbd8617150736e1c	444	Pfam	PF07992	Pyridine nucleotide-disulphide oxidoreductase	3	320	1.2E-64	T	21-03-2019	IPR023753	FAD/NAD(P)-binding domain
MAG142_11_38	5428e42e8c1b5b71cbd8617150736e1c	444	Pfam	PF02852	Pyridine nucleotide-disulphide oxidoreductase, dimerisation domain	333	441	7.4E-35	T	21-03-2019	IPR004099	Pyridine nucleotide-disulphide oxidoreductase, dimerisation domain
MAG142_11_38	5428e42e8c1b5b71cbd8617150736e1c	444	TIGRFAM	TIGR01350	lipoamide_DH: dihydrolipoyl dehydrogenase	3	442	6.7E-139	T	21-03-2019	IPR006258	Dihydrolipoamide dehydrogenase
MAG142_7_18	45b06fbf2fff3ecc1d329cfafbfad253	566	TIGRFAM	TIGR00815	sulP: sulfate permease	16	548	1.1E-117	T	21-03-2019	IPR001902	SLC26A/SulP transporter
MAG142_7_18	45b06fbf2fff3ecc1d329cfafbfad253	566	Pfam	PF00916	Sulfate permease family	25	389	8.2E-82	T	21-03-2019	IPR011547	SLC26A/SulP transporter domain
MAG142_7_18	45b06fbf2fff3ecc1d329cfafbfad253	566	Pfam	PF01740	STAS domain	444	548	3.2E-18	T	21-03-2019	IPR002645	STAS domain
MAG142_24_21	a5005fae3b0d01c3d3eb2b6ce0c4d6ed	222	TIGRFAM	TIGR01704	MTA/SAH-Nsdase: MTA/SAH nucleosidase	3	220	3.5E-45	T	21-03-2019	IPR010049	MTA/SAH nucleosidase
MAG142_24_21	a5005fae3b0d01c3d3eb2b6ce0c4d6ed	222	Pfam	PF01048	Phosphorylase superfamily	2	207	3.0E-32	T	21-03-2019	IPR000845	Nucleoside phosphorylase domain
MAG142_34_4	7a2b21c018f45f6d6f96e4cd37c7d970	722	Pfam	PF13432	Tetratricopeptide repeat	338	387	1.3E-5	T	21-03-2019
MAG142_34_4	7a2b21c018f45f6d6f96e4cd37c7d970	722	Pfam	PF13174	Tetratricopeptide repeat	166	195	0.029	T	21-03-2019	IPR019734	Tetratricopeptide repeat
MAG142_34_4	7a2b21c018f45f6d6f96e4cd37c7d970	722	Pfam	PF13414	TPR repeat	657	692	2.0E-8	T	21-03-2019
MAG142_34_4	7a2b21c018f45f6d6f96e4cd37c7d970	722	Pfam	PF13181	Tetratricopeptide repeat	563	585	0.017	T	21-03-2019	IPR019734	Tetratricopeptide repeat
MAG142_34_4	7a2b21c018f45f6d6f96e4cd37c7d970	722	Pfam	PF13181	Tetratricopeptide repeat	130	161	0.097	T	21-03-2019	IPR019734	Tetratricopeptide repeat
MAG142_17_15	3ae2d4b62cbc3e9bd0375aa966e52516	493	Pfam	PF00587	tRNA synthetase class II core domain (G, H, P, S and T)	116	285	6.0E-21	T	21-03-2019	IPR002314	Aminoacyl-tRNA synthetase, class II (G/ P/ S/T)
MAG142_17_15	3ae2d4b62cbc3e9bd0375aa966e52516	493	TIGRFAM	TIGR00408	proS_fam_I: proline--tRNA ligase	9	493	4.7E-167	T	21-03-2019	IPR004499	Proline-tRNA ligase, class IIa, archaeal-type
MAG142_17_15	3ae2d4b62cbc3e9bd0375aa966e52516	493	Pfam	PF03129	Anticodon binding domain	304	400	8.5E-20	T	21-03-2019	IPR004154	Anticodon-binding
MAG142_17_15	3ae2d4b62cbc3e9bd0375aa966e52516	493	Pfam	PF09180	Prolyl-tRNA synthetase, C-terminal	427	493	3.7E-25	T	21-03-2019	IPR016061	Proline-tRNA ligase, class II, C-terminal
MAG142_9_18	d2cff5257ff58c3ba5622e05d7d2afa1	389	Pfam	PF00155	Aminotransferase class I and II	22	374	3.7E-50	T	21-03-2019	IPR004839	Aminotransferase, class I/classII
MAG142_4_30	2e57dfa0606a3a82360cb38dd82fd075	155	Pfam	PF01037	Lrp/AsnC ligand binding domain	70	140	9.8E-19	T	21-03-2019	IPR019887	Transcription regulator AsnC/Lrp, ligand binding domain
MAG142_4_30	2e57dfa0606a3a82360cb38dd82fd075	155	Pfam	PF13412	Winged helix-turn-helix DNA-binding	5	51	2.8E-13	T	21-03-2019
MAG142_3_2	79ddb7a810de12f675bd783bd1096ccc	500	Pfam	PF16383	Domain of unknown function	3	179	1.9E-56	T	21-03-2019	IPR032155	Domain of unknown function DUF4992
MAG142_3_2	79ddb7a810de12f675bd783bd1096ccc	500	Pfam	PF16318	Domain of unknown function (DUF4957)	180	339	1.9E-30	T	21-03-2019	IPR032530	Domain of unknown function DUF4957
MAG142_23_17	71b44897945339f2ec7351135fa19870	110	Pfam	PF01192	RNA polymerase Rpb6	23	99	8.5E-9	T	21-03-2019	IPR006110	RNA polymerase, subunit omega/K/RPB6
MAG142_7_28	e1d9b8dbad17cffb492a04d89ccdc533	380	TIGRFAM	TIGR00131	gal_kin: galactokinase	5	377	8.5E-91	T	21-03-2019	IPR000705	Galactokinase
MAG142_7_28	e1d9b8dbad17cffb492a04d89ccdc533	380	Pfam	PF10509	Galactokinase galactose-binding signature	10	56	4.9E-18	T	21-03-2019	IPR019539	Galactokinase galactose-binding domain
MAG142_7_28	e1d9b8dbad17cffb492a04d89ccdc533	380	Pfam	PF08544	GHMP kinases C terminal	278	345	2.5E-8	T	21-03-2019	IPR013750	GHMP kinase, C-terminal domain
MAG142_7_28	e1d9b8dbad17cffb492a04d89ccdc533	380	Pfam	PF00288	GHMP kinases N terminal domain	112	179	8.5E-16	T	21-03-2019	IPR006204	GHMP kinase N-terminal domain
MAG142_22_25	130069c051058f75e1981d09700f9009	366	Pfam	PF02463	RecF/RecN/SMC N terminal domain	3	341	2.1E-12	T	21-03-2019	IPR003395	RecF/RecN/SMC, N-terminal
MAG142_22_25	130069c051058f75e1981d09700f9009	366	TIGRFAM	TIGR00611	recf: DNA replication and repair protein RecF	1	345	3.3E-73	T	21-03-2019	IPR001238	DNA-binding, RecF
MAG142_44_11	cf293804971db30af65bca28037c2649	577	Pfam	PF00205	Thiamine pyrophosphate enzyme, central domain	210	337	6.5E-30	T	21-03-2019	IPR012000	Thiamine pyrophosphate enzyme, central domain
MAG142_44_11	cf293804971db30af65bca28037c2649	577	Pfam	PF02775	Thiamine pyrophosphate enzyme, C-terminal TPP binding domain	417	551	5.5E-24	T	21-03-2019	IPR011766	Thiamine pyrophosphate enzyme, C-terminal TPP-binding
MAG142_44_11	cf293804971db30af65bca28037c2649	577	TIGRFAM	TIGR03254	oxalate_oxc: oxalyl-CoA decarboxylase	16	569	2.0E-229	T	21-03-2019	IPR017660	Oxalyl-CoA decarboxylase
MAG142_44_11	cf293804971db30af65bca28037c2649	577	Pfam	PF02776	Thiamine pyrophosphate enzyme, N-terminal TPP binding domain	18	176	4.0E-34	T	21-03-2019	IPR012001	Thiamine pyrophosphate enzyme, N-terminal TPP-binding domain
MAG142_4_50	bd8793b3d7ba130081b1f174852b8156	338	Pfam	PF05496	Holliday junction DNA helicase ruvB N-terminus	10	236	3.6E-111	T	21-03-2019	IPR008824	Holliday junction DNA helicase ruvB, N-terminal
MAG142_4_50	bd8793b3d7ba130081b1f174852b8156	338	TIGRFAM	TIGR00635	ruvB: Holliday junction DNA helicase RuvB	26	327	4.5E-138	T	21-03-2019	IPR004605	DNA helicase, Holliday junction RuvB type
MAG142_4_50	bd8793b3d7ba130081b1f174852b8156	338	Pfam	PF05491	Holliday junction DNA helicase ruvB C-terminus	254	327	1.4E-33	T	21-03-2019	IPR008823	DNA helicase, Holliday junction RuvB type, C-terminal
MAG142_103_2	1f8c447210fbc54b8a8505167a024679	647	Pfam	PF07973	Threonyl and Alanyl tRNA synthetase second additional domain	171	220	5.7E-12	T	21-03-2019	IPR012947	Threonyl/alanyl tRNA synthetase, SAD
MAG142_103_2	1f8c447210fbc54b8a8505167a024679	647	Pfam	PF00587	tRNA synthetase class II core domain (G, H, P, S and T)	327	537	2.5E-41	T	21-03-2019	IPR002314	Aminoacyl-tRNA synthetase, class II (G/ P/ S/T)
MAG142_103_2	1f8c447210fbc54b8a8505167a024679	647	Pfam	PF02824	TGS domain	4	63	1.7E-12	T	21-03-2019	IPR004095	TGS
MAG142_103_2	1f8c447210fbc54b8a8505167a024679	647	Pfam	PF03129	Anticodon binding domain	550	638	5.1E-24	T	21-03-2019	IPR004154	Anticodon-binding
MAG142_103_2	1f8c447210fbc54b8a8505167a024679	647	TIGRFAM	TIGR00418	thrS: threonine--tRNA ligase	74	640	4.5E-219	T	21-03-2019	IPR002320	Threonine-tRNA ligase, class IIa
MAG142_15_33	1e18d26be31048558b9a968a0b2954b9	325	Pfam	PF12849	PBP superfamily domain	36	284	7.4E-25	T	21-03-2019	IPR024370	PBP domain
MAG142_5_45	b3dc3dd3284f8017a439ec2e51d17b83	1291	Pfam	PF07733	Bacterial DNA polymerase III alpha subunit	417	861	1.5E-156	T	21-03-2019	IPR011708	Bacterial DNA polymerase III, alpha subunit
MAG142_5_45	b3dc3dd3284f8017a439ec2e51d17b83	1291	Pfam	PF02811	PHP domain	27	239	2.9E-48	T	21-03-2019	IPR004013	PHP domain
MAG142_5_45	b3dc3dd3284f8017a439ec2e51d17b83	1291	TIGRFAM	TIGR00594	polc: DNA polymerase III, alpha subunit	411	1165	2.0E-253	T	21-03-2019	IPR004805	DNA polymerase III, alpha subunit
MAG142_5_45	b3dc3dd3284f8017a439ec2e51d17b83	1291	Pfam	PF14579	Helix-hairpin-helix motif	935	1022	1.9E-26	T	21-03-2019	IPR029460	DNA polymerase, helix-hairpin-helix motif
MAG142_53_4	9157d1c758ebf16b8c6f4f3e25c7ee37	666	Pfam	PF03571	Peptidase family M49	221	455	2.6E-40	T	21-03-2019	IPR039461	Peptidase family M49
MAG142_1_108	c1fbd7edb2e577b186e5d17786e11757	195	Pfam	PF00881	Nitroreductase family	109	157	1.3E-7	T	21-03-2019	IPR029479	Nitroreductase
MAG142_1_108	c1fbd7edb2e577b186e5d17786e11757	195	Pfam	PF00881	Nitroreductase family	17	72	9.9E-7	T	21-03-2019	IPR029479	Nitroreductase
MAG142_10_44	22fbd41520b45a78bd74f2aa5ceff578	446	Pfam	PF13375	RnfC Barrel sandwich hybrid domain	8	103	9.5E-32	T	21-03-2019	IPR026902	RnfC Barrel sandwich hybrid domain
MAG142_10_44	22fbd41520b45a78bd74f2aa5ceff578	446	Pfam	PF13237	4Fe-4S dicluster domain	363	417	3.2E-8	T	21-03-2019	IPR017896	4Fe-4S ferredoxin-type, iron-sulphur binding domain
MAG142_10_44	22fbd41520b45a78bd74f2aa5ceff578	446	TIGRFAM	TIGR01945	rnfC: electron transport complex, RnfABCDGE type, C subunit	3	435	3.0E-151	T	21-03-2019	IPR010208	Ion-translocating oxidoreductase complex, subunit RnfC/RsxC
MAG142_10_44	22fbd41520b45a78bd74f2aa5ceff578	446	Pfam	PF01512	Respiratory-chain NADH dehydrogenase 51 Kd subunit	137	283	1.3E-50	T	21-03-2019	IPR011538	NADH-ubiquinone oxidoreductase 51kDa subunit, FMN-binding domain
MAG142_5_67	c2ebed96b82c15c53597ced900aa64df	294	TIGRFAM	TIGR01146	ATPsyn_F1gamma: ATP synthase F1, gamma subunit	1	290	4.3E-74	T	21-03-2019	IPR000131	ATP synthase, F1 complex, gamma subunit
MAG142_5_67	c2ebed96b82c15c53597ced900aa64df	294	Pfam	PF00231	ATP synthase	3	290	5.5E-74	T	21-03-2019	IPR000131	ATP synthase, F1 complex, gamma subunit
MAG142_1_67	9228d962a6824994a49d7086e32b9cc2	251	Pfam	PF00121	Triosephosphate isomerase	5	248	5.5E-93	T	21-03-2019	IPR000652	Triosephosphate isomerase
MAG142_1_67	9228d962a6824994a49d7086e32b9cc2	251	TIGRFAM	TIGR00419	tim: triose-phosphate isomerase	5	242	1.2E-56	T	21-03-2019	IPR000652	Triosephosphate isomerase
MAG142_64_1	0529eacea1d14efd5aa44600b3dbb018	257	Pfam	PF09674	Protein of unknown function (DUF2400)	26	255	2.8E-70	T	21-03-2019	IPR014127	Conserved hypothetical protein CHP02757
MAG142_64_1	0529eacea1d14efd5aa44600b3dbb018	257	TIGRFAM	TIGR02757	TIGR02757: TIGR02757 family protein	22	255	8.0E-53	T	21-03-2019	IPR014127	Conserved hypothetical protein CHP02757
MAG142_63_7	63c8808badbecf0c28c498f1a32e921b	261	Pfam	PF01182	Glucosamine-6-phosphate isomerases/6-phosphogluconolactonase	9	219	3.3E-22	T	21-03-2019	IPR006148	Glucosamine/galactosamine-6-phosphate isomerase
MAG142_63_7	63c8808badbecf0c28c498f1a32e921b	261	TIGRFAM	TIGR00502	nagB: glucosamine-6-phosphate deaminase	1	259	1.3E-119	T	21-03-2019	IPR004547	Glucosamine-6-phosphate isomerase
MAG142_2_64	7e2698a5b187477f109b91b8f7f932fb	929	Pfam	PF01367	5'-3' exonuclease, C-terminal SAM fold	177	269	1.2E-30	T	21-03-2019	IPR020045	DNA polymerase I-like, H3TH domain
MAG142_2_64	7e2698a5b187477f109b91b8f7f932fb	929	Pfam	PF00476	DNA polymerase family A	552	926	1.0E-147	T	21-03-2019	IPR001098	DNA-directed DNA polymerase, family A, palm domain
MAG142_2_64	7e2698a5b187477f109b91b8f7f932fb	929	Pfam	PF01612	3'-5' exonuclease	341	510	1.6E-8	T	21-03-2019	IPR002562	3'-5' exonuclease domain
MAG142_2_64	7e2698a5b187477f109b91b8f7f932fb	929	Pfam	PF02739	5'-3' exonuclease, N-terminal resolvase-like domain	5	174	4.0E-49	T	21-03-2019	IPR020046	5'-3' exonuclease, alpha-helical arch, N-terminal
MAG142_2_64	7e2698a5b187477f109b91b8f7f932fb	929	TIGRFAM	TIGR00593	pola: DNA polymerase I	5	929	4.1E-280	T	21-03-2019	IPR018320	DNA polymerase 1
MAG142_49_15	395d6c551bea064e0fb265adb7607095	640	Pfam	PF03739	Predicted permease YjgP/YjgQ family	11	463	2.4E-104	T	21-03-2019	IPR005495	Permease LptG/LptF-related
MAG142_5_70	27f4e53a8cafccf4d0dea1e53c95c449	103	Pfam	PF00420	NADH-ubiquinone/plastoquinone oxidoreductase chain 4L	8	97	1.7E-20	T	21-03-2019	IPR039428	NADH-ubiquinone oxidoreductase chain 4L/Mnh complex subunit C1-like
