MAG141_123_4	22196e1fa603836467378eff650aa873	452	TIGRFAM	TIGR00563	rsmB: 16S rRNA (cytosine(967)-C(5))-methyltransferase	11	450	1.8E-116	T	21-03-2019	IPR004573	rRNA small subunit methyltransferase B
MAG141_123_4	22196e1fa603836467378eff650aa873	452	Pfam	PF01189	16S rRNA methyltransferase RsmB/F	256	449	1.2E-52	T	21-03-2019	IPR001678	SAM-dependent methyltransferase RsmB/NOP2-type
MAG141_123_4	22196e1fa603836467378eff650aa873	452	Pfam	PF17125	N-terminal domain of 16S rRNA methyltransferase RsmF	174	252	1.9E-8	T	21-03-2019	IPR031341	Ribosomal RNA small subunit methyltransferase F, N-terminal
MAG141_123_4	22196e1fa603836467378eff650aa873	452	Pfam	PF01029	NusB family	9	134	2.6E-30	T	21-03-2019	IPR006027	NusB/RsmB/TIM44
MAG141_43_21	cf0beb96bd7fee2ac8838d70944c3f6d	903	Pfam	PF07973	Threonyl and Alanyl tRNA synthetase second additional domain	679	721	4.7E-17	T	21-03-2019	IPR012947	Threonyl/alanyl tRNA synthetase, SAD
MAG141_43_21	cf0beb96bd7fee2ac8838d70944c3f6d	903	Pfam	PF02272	DHHA1 domain	758	898	4.7E-25	T	21-03-2019	IPR003156	DHHA1 domain
MAG141_43_21	cf0beb96bd7fee2ac8838d70944c3f6d	903	TIGRFAM	TIGR00344	alaS: alanine--tRNA ligase	22	881	8.9E-299	T	21-03-2019	IPR002318	Alanine-tRNA ligase, class IIc
MAG141_43_21	cf0beb96bd7fee2ac8838d70944c3f6d	903	Pfam	PF01411	tRNA synthetases class II (A)	22	579	1.2E-216	T	21-03-2019	IPR018164	Alanyl-tRNA synthetase, class IIc, N-terminal
MAG141_15_22	29ecc763ea71bd3e9f78debb9c6c5231	643	Pfam	PF02806	Alpha amylase, C-terminal all-beta domain	538	640	3.7E-17	T	21-03-2019	IPR006048	Alpha-amylase/branching enzyme, C-terminal all beta
MAG141_15_22	29ecc763ea71bd3e9f78debb9c6c5231	643	Pfam	PF00128	Alpha amylase, catalytic domain	186	260	2.7E-10	T	21-03-2019	IPR006047	Glycosyl hydrolase, family 13, catalytic domain
MAG141_15_22	29ecc763ea71bd3e9f78debb9c6c5231	643	TIGRFAM	TIGR01515	branching_enzym: 1,4-alpha-glucan branching enzyme	20	639	2.6E-229	T	21-03-2019	IPR006407	1,4-alpha-glucan-branching enzyme, GlgB
MAG141_15_22	29ecc763ea71bd3e9f78debb9c6c5231	643	Pfam	PF02922	Carbohydrate-binding module 48 (Isoamylase N-terminal domain)	35	116	6.3E-15	T	21-03-2019	IPR004193	Glycoside hydrolase, family 13, N-terminal
MAG141_5_14	236ed04696ab657a434069059fe5512c	505	TIGRFAM	TIGR02487	NrdD: anaerobic ribonucleoside-triphosphate reductase	17	498	5.8E-98	T	21-03-2019	IPR012833	Ribonucleoside-triphosphate reductase, anaerobic
MAG141_5_14	236ed04696ab657a434069059fe5512c	505	Pfam	PF13597	Anaerobic ribonucleoside-triphosphate reductase	1	498	1.1E-130	T	21-03-2019	IPR012833	Ribonucleoside-triphosphate reductase, anaerobic
MAG141_10_16	75785abd8b8c0276723f97a3fbcaefb1	451	Pfam	PF16325	Peptidase family U32 C-terminal domain	352	434	1.4E-20	T	21-03-2019	IPR032525	Peptidase family U32, C-terminal
MAG141_10_16	75785abd8b8c0276723f97a3fbcaefb1	451	Pfam	PF01136	Peptidase family U32	77	325	2.0E-87	T	21-03-2019	IPR001539	Peptidase U32
MAG141_6_37	41d550e3174b39fe7b884c35661a9cde	86	TIGRFAM	TIGR02116	toxin_Txe_YoeB: addiction module toxin, Txe/YoeB family	6	85	6.2E-33	T	21-03-2019	IPR009614	Toxin YoeB
MAG141_6_37	41d550e3174b39fe7b884c35661a9cde	86	Pfam	PF06769	YoeB-like toxin of bacterial type II toxin-antitoxin system	6	85	2.6E-38	T	21-03-2019	IPR009614	Toxin YoeB
MAG141_130_1	a5414c94c5c6d8315f552130e3510a2a	280	Pfam	PF14080	Domain of unknown function (DUF4261)	190	263	7.6E-23	T	21-03-2019	IPR025357	Domain of unknown function DUF4261
MAG141_88_5	223b8e9bf38a6b82fb0eedb878286de6	172	TIGRFAM	TIGR00449	tgt_general: tRNA-guanine family transglycosylase	4	153	4.1E-66	T	21-03-2019	IPR002616	tRNA-guanine(15) transglycosylase-like
MAG141_32_10	fe9f80dffac4bb2a4cf66aab98eb72ea	132	Pfam	PF00334	Nucleoside diphosphate kinase	2	131	1.0E-49	T	21-03-2019	IPR034907	Nucleoside diphosphate kinase-like domain
MAG141_1_7	0bac86c76af8e8b27a893443b8efd61b	197	Pfam	PF03167	Uracil DNA glycosylase superfamily	65	140	8.0E-8	T	21-03-2019	IPR005122	Uracil-DNA glycosylase-like
MAG141_22_19	a9fdc1f855041d515fab3a0763609110	316	Pfam	PF01544	CorA-like Mg2+ transporter protein	29	311	6.7E-56	T	21-03-2019	IPR002523	Mg2+ transporter protein, CorA-like/Zinc transport protein ZntB
MAG141_42_20	451bfb5f696b3d614d52d03d956a6051	85	Pfam	PF05866	Endodeoxyribonuclease RusA	2	81	1.1E-22	T	21-03-2019	IPR008822	Holliday junction resolvase RusA-like
MAG141_14_13	abe04d9ec52eebda2da1c6c91bde5abc	407	Pfam	PF02342	TerD domain	235	402	3.6E-33	T	21-03-2019	IPR003325	TerD domain
MAG141_48_3	e06b6a2e18d234646fb77d6880d91bfb	497	Pfam	PF01979	Amidohydrolase family	86	471	4.4E-29	T	21-03-2019	IPR006680	Amidohydrolase-related
MAG141_48_3	e06b6a2e18d234646fb77d6880d91bfb	497	TIGRFAM	TIGR00857	pyrC_multi: dihydroorotase, multifunctional complex type	53	474	4.5E-85	T	21-03-2019
MAG141_4_29	6a93c87b6312466638abbcb9e5f239b5	334	Pfam	PF00814	Glycoprotease family	25	305	6.9E-96	T	21-03-2019	IPR000905	Gcp-like domain
MAG141_4_29	6a93c87b6312466638abbcb9e5f239b5	334	TIGRFAM	TIGR03723	T6A_TsaD_YgjD: tRNA threonylcarbamoyl adenosine modification protein TsaD	4	312	6.4E-124	T	21-03-2019	IPR022450	tRNA N6-adenosine threonylcarbamoyltransferase, TsaD
MAG141_4_29	6a93c87b6312466638abbcb9e5f239b5	334	TIGRFAM	TIGR00329	gcp_kae1: metallohydrolase, glycoprotease/Kae1 family	5	305	1.1E-98	T	21-03-2019	IPR017861	Kae1/TsaD family
MAG141_86_9	2eb702ffc3c0e2ac0b894ddd0eb2e8e4	72	Pfam	PF01381	Helix-turn-helix	6	59	2.7E-18	T	21-03-2019	IPR001387	Cro/C1-type helix-turn-helix domain
MAG141_29_17	1ed08b27fa49a5424a0fd0a8b878c040	106	Pfam	PF05016	ParE toxin of type II toxin-antitoxin system, parDE	8	99	4.4E-14	T	21-03-2019	IPR007712	Toxin-antitoxin system, RelE/ParE toxin family
MAG141_9_34	f80bc32e50fced4cef086a9ff44920df	172	TIGRFAM	TIGR02937	sigma70-ECF: RNA polymerase sigma factor, sigma-70 family	17	169	4.4E-23	T	21-03-2019	IPR014284	RNA polymerase sigma-70 like domain
MAG141_9_34	f80bc32e50fced4cef086a9ff44920df	172	Pfam	PF04542	Sigma-70 region 2	21	83	2.0E-9	T	21-03-2019	IPR007627	RNA polymerase sigma-70 region 2
MAG141_9_34	f80bc32e50fced4cef086a9ff44920df	172	Pfam	PF08281	Sigma-70, region 4	118	165	9.7E-12	T	21-03-2019	IPR013249	RNA polymerase sigma factor 70, region 4 type 2
MAG141_62_11	fe5cc483929d7e586d2d262f25409a02	65	Pfam	PF02381	MraZ protein, putative antitoxin-like	1	54	2.1E-13	T	21-03-2019	IPR020603	MraZ domain
MAG141_2_48	fed37fbaf8e846eac27504c24ac9a59c	168	TIGRFAM	TIGR01021	rpsE_bact: ribosomal protein uS5	12	165	1.2E-68	T	21-03-2019	IPR005712	Ribosomal protein S5, bacterial-type
MAG141_2_48	fed37fbaf8e846eac27504c24ac9a59c	168	Pfam	PF03719	Ribosomal protein S5, C-terminal domain	89	159	1.2E-32	T	21-03-2019	IPR005324	Ribosomal protein S5, C-terminal
MAG141_2_48	fed37fbaf8e846eac27504c24ac9a59c	168	Pfam	PF00333	Ribosomal protein S5, N-terminal domain	15	77	2.5E-28	T	21-03-2019	IPR013810	Ribosomal protein S5, N-terminal
MAG141_38_18	f2b0509c933dee168dc3070816040ac3	571	Pfam	PF02776	Thiamine pyrophosphate enzyme, N-terminal TPP binding domain	16	178	7.7E-51	T	21-03-2019	IPR012001	Thiamine pyrophosphate enzyme, N-terminal TPP-binding domain
MAG141_38_18	f2b0509c933dee168dc3070816040ac3	571	TIGRFAM	TIGR00118	acolac_lg: acetolactate synthase, large subunit, biosynthetic type	15	569	3.1E-220	T	21-03-2019	IPR012846	Acetolactate synthase, large subunit, biosynthetic
MAG141_38_18	f2b0509c933dee168dc3070816040ac3	571	Pfam	PF00205	Thiamine pyrophosphate enzyme, central domain	202	335	5.4E-45	T	21-03-2019	IPR012000	Thiamine pyrophosphate enzyme, central domain
MAG141_38_18	f2b0509c933dee168dc3070816040ac3	571	Pfam	PF02775	Thiamine pyrophosphate enzyme, C-terminal TPP binding domain	398	546	8.8E-46	T	21-03-2019	IPR011766	Thiamine pyrophosphate enzyme, C-terminal TPP-binding
MAG141_91_9	bbd877a59ee595f38be7817717b80abb	270	TIGRFAM	TIGR00478	tly: TlyA family rRNA methyltransferase/putative hemolysin	5	236	4.4E-78	T	21-03-2019	IPR004538	Haemolysin A /rRNA methyltransferase TlyA
MAG141_91_9	bbd877a59ee595f38be7817717b80abb	270	Pfam	PF01479	S4 domain	4	48	1.1E-13	T	21-03-2019	IPR002942	RNA-binding S4 domain
MAG141_91_9	bbd877a59ee595f38be7817717b80abb	270	Pfam	PF01728	FtsJ-like methyltransferase	60	242	2.2E-18	T	21-03-2019	IPR002877	Ribosomal RNA methyltransferase FtsJ domain
MAG141_64_10	25341542de80dca8a0f6c0fee67b3892	319	Pfam	PF01715	IPP transferase	41	291	2.4E-78	T	21-03-2019	IPR018022	IPP transferase
MAG141_64_10	25341542de80dca8a0f6c0fee67b3892	319	TIGRFAM	TIGR00174	miaA: tRNA dimethylallyltransferase	8	297	1.8E-90	T	21-03-2019	IPR018022	IPP transferase
MAG141_5_16	a0a8d170caf4ac81cf8d9efd1f3bd44f	227	Pfam	PF03477	ATP cone domain	1	91	2.8E-20	T	21-03-2019	IPR005144	ATP-cone domain
MAG141_5_16	a0a8d170caf4ac81cf8d9efd1f3bd44f	227	Pfam	PF13597	Anaerobic ribonucleoside-triphosphate reductase	117	221	2.1E-29	T	21-03-2019	IPR012833	Ribonucleoside-triphosphate reductase, anaerobic
MAG141_54_4	0c8d45d5d3642a8dcbb7b38aeca8df41	672	Pfam	PF00122	E1-E2 ATPase	164	348	1.1E-46	T	21-03-2019
MAG141_54_4	0c8d45d5d3642a8dcbb7b38aeca8df41	672	TIGRFAM	TIGR01525	ATPase-IB_hvy: heavy metal translocating P-type ATPase	109	665	2.2E-166	T	21-03-2019	IPR027256	P-type ATPase, subfamily IB
MAG141_54_4	0c8d45d5d3642a8dcbb7b38aeca8df41	672	Pfam	PF00702	haloacid dehalogenase-like hydrolase	367	577	2.7E-35	T	21-03-2019
MAG141_54_4	0c8d45d5d3642a8dcbb7b38aeca8df41	672	TIGRFAM	TIGR01494	ATPase_P-type: HAD ATPase, P-type, family IC	135	651	5.5E-70	T	21-03-2019	IPR001757	P-type ATPase
MAG141_54_4	0c8d45d5d3642a8dcbb7b38aeca8df41	672	TIGRFAM	TIGR01512	ATPase-IB2_Cd: cadmium-translocating P-type ATPase	109	667	3.2E-145	T	21-03-2019
MAG141_58_14	6a080c2bb737c376c5dfac8947763c3c	129	TIGRFAM	TIGR04076	TIGR04076: TIGR04076 family protein	2	128	1.3E-31	T	21-03-2019	IPR023811	Conserved hypothetical protein CHP04076
MAG141_88_9	2d02ee493a48015ad3c73ceec48dc801	450	Pfam	PF01957	NfeD-like C-terminal, partner-binding	289	439	2.9E-16	T	21-03-2019	IPR002810	NfeD-like, C-terminal domain
MAG141_88_9	2d02ee493a48015ad3c73ceec48dc801	450	Pfam	PF01972	Serine dehydrogenase proteinase	70	139	2.1E-5	T	21-03-2019	IPR002825	Peptidase S49, serine-peptidase prokaryotes
MAG141_74_12	ec8e44ccabe1fb5c0c2f7615bc9d176f	388	Pfam	PF01556	DnaJ C terminal domain	123	339	7.2E-43	T	21-03-2019	IPR002939	Chaperone DnaJ, C-terminal
MAG141_74_12	ec8e44ccabe1fb5c0c2f7615bc9d176f	388	TIGRFAM	TIGR02349	DnaJ_bact: chaperone protein DnaJ	5	356	1.7E-136	T	21-03-2019	IPR012724	Chaperone DnaJ
MAG141_74_12	ec8e44ccabe1fb5c0c2f7615bc9d176f	388	Pfam	PF00684	DnaJ central domain	149	213	4.1E-12	T	21-03-2019	IPR001305	Heat shock protein DnaJ, cysteine-rich domain
MAG141_74_12	ec8e44ccabe1fb5c0c2f7615bc9d176f	388	Pfam	PF00226	DnaJ domain	5	67	4.5E-24	T	21-03-2019	IPR001623	DnaJ domain
MAG141_88_2	47151c40c08d43c4ed3ad174a8c1dad5	414	TIGRFAM	TIGR00916	2A0604s01: protein-export membrane protein, SecD/SecF family	151	381	4.9E-67	T	21-03-2019	IPR022645	Protein-export membrane protein SecD/SecF, bacterial
MAG141_88_2	47151c40c08d43c4ed3ad174a8c1dad5	414	Pfam	PF02355	Protein export membrane protein	220	392	1.3E-19	T	21-03-2019	IPR022813	Protein-export membrane protein SecD/SecF, archaeal and bacterial
MAG141_88_2	47151c40c08d43c4ed3ad174a8c1dad5	414	TIGRFAM	TIGR01129	secD: protein-export membrane protein SecD	119	388	1.9E-89	T	21-03-2019	IPR005791	Protein translocase subunit SecD
MAG141_88_2	47151c40c08d43c4ed3ad174a8c1dad5	414	Pfam	PF07549	SecD/SecF GG Motif	30	46	5.6E-4	T	21-03-2019	IPR022646	Protein-export membrane protein SecD/SecF/SecDF, conserved site
MAG141_68_6	70ce9311f23c46e70bd6e6d670c10ae7	410	TIGRFAM	TIGR00521	coaBC_dfp: phosphopantothenoylcysteine decarboxylase / phosphopantothenate--cysteine ligase	5	404	4.9E-134	T	21-03-2019	IPR005252	Coenzyme A biosynthesis bifunctional protein CoaBC
MAG141_68_6	70ce9311f23c46e70bd6e6d670c10ae7	410	Pfam	PF04127	DNA / pantothenate metabolism flavoprotein	196	379	1.1E-75	T	21-03-2019	IPR007085	DNA/pantothenate metabolism flavoprotein, C-terminal
MAG141_68_6	70ce9311f23c46e70bd6e6d670c10ae7	410	Pfam	PF02441	Flavoprotein	7	179	9.7E-43	T	21-03-2019	IPR003382	Flavoprotein
MAG141_13_29	c776a7e74e9a1c90600cd076242a3c8f	898	Pfam	PF13306	Leucine rich repeats (6 copies)	374	482	6.8E-25	T	21-03-2019	IPR026906	Leucine rich repeat 5
MAG141_13_29	c776a7e74e9a1c90600cd076242a3c8f	898	Pfam	PF13306	Leucine rich repeats (6 copies)	109	171	2.8E-8	T	21-03-2019	IPR026906	Leucine rich repeat 5
MAG141_13_29	c776a7e74e9a1c90600cd076242a3c8f	898	Pfam	PF13306	Leucine rich repeats (6 copies)	681	727	2.7E-4	T	21-03-2019	IPR026906	Leucine rich repeat 5
MAG141_13_29	c776a7e74e9a1c90600cd076242a3c8f	898	Pfam	PF13306	Leucine rich repeats (6 copies)	551	626	1.1E-18	T	21-03-2019	IPR026906	Leucine rich repeat 5
MAG141_13_29	c776a7e74e9a1c90600cd076242a3c8f	898	Pfam	PF13306	Leucine rich repeats (6 copies)	223	325	6.5E-21	T	21-03-2019	IPR026906	Leucine rich repeat 5
MAG141_82_2	60fb5446c0f27f819ee30110b801d57b	731	TIGRFAM	TIGR00091	TIGR00091: tRNA (guanine-N(7)-)-methyltransferase	41	214	1.5E-42	T	21-03-2019	IPR003358	tRNA (guanine-N-7) methyltransferase, Trmb type
MAG141_82_2	60fb5446c0f27f819ee30110b801d57b	731	TIGRFAM	TIGR00260	thrC: threonine synthase	309	675	1.3E-73	T	21-03-2019	IPR004450	Threonine synthase-like
MAG141_82_2	60fb5446c0f27f819ee30110b801d57b	731	Pfam	PF00291	Pyridoxal-phosphate dependent enzyme	338	657	9.8E-12	T	21-03-2019	IPR001926	Pyridoxal-phosphate dependent enzyme
MAG141_82_2	60fb5446c0f27f819ee30110b801d57b	731	Pfam	PF02390	Putative methyltransferase	43	211	1.5E-39	T	21-03-2019
MAG141_82_2	60fb5446c0f27f819ee30110b801d57b	731	Pfam	PF14821	Threonine synthase N terminus	236	313	4.2E-19	T	21-03-2019	IPR029144	Threonine synthase, N-terminal
MAG141_45_8	f115ac2a0ea0dedcb64b682384b1eff9	52	Pfam	PF00301	Rubredoxin	3	49	4.6E-25	T	21-03-2019	IPR024935	Rubredoxin domain
MAG141_4_14	157c02958a48d6181d399bd60fb9cdbb	432	TIGRFAM	TIGR00133	gatB: aspartyl/glutamyl-tRNA(Asn/Gln) amidotransferase, B subunit	1	431	3.4E-154	T	21-03-2019	IPR004413	Aspartyl/glutamyl-tRNA(Asn/Gln) amidotransferase, B subunit
MAG141_4_14	157c02958a48d6181d399bd60fb9cdbb	432	Pfam	PF02637	GatB domain	285	431	4.8E-46	T	21-03-2019	IPR018027	Asn/Gln amidotransferase
MAG141_4_14	157c02958a48d6181d399bd60fb9cdbb	432	Pfam	PF02934	GatB/GatE catalytic domain	1	245	7.1E-94	T	21-03-2019	IPR006075	Aspartyl/Glutamyl-tRNA(Gln) amidotransferase, subunit B/E, catalytic
MAG141_34_10	4aecec8b288a61de5fdad5228cedd2ca	412	Pfam	PF00395	S-layer homology domain	231	271	2.0E-4	T	21-03-2019	IPR001119	S-layer homology domain
MAG141_34_10	4aecec8b288a61de5fdad5228cedd2ca	412	Pfam	PF00395	S-layer homology domain	292	334	8.2E-8	T	21-03-2019	IPR001119	S-layer homology domain
MAG141_34_10	4aecec8b288a61de5fdad5228cedd2ca	412	Pfam	PF00395	S-layer homology domain	357	400	2.7E-5	T	21-03-2019	IPR001119	S-layer homology domain
MAG141_10_11	eded90c20579d2afc60e4330c4276759	260	Pfam	PF03309	Type III pantothenate kinase	2	208	1.3E-64	T	21-03-2019	IPR004619	Type III pantothenate kinase
MAG141_10_11	eded90c20579d2afc60e4330c4276759	260	TIGRFAM	TIGR00671	baf: pantothenate kinase, type III	2	251	7.4E-66	T	21-03-2019	IPR004619	Type III pantothenate kinase
MAG141_143_1	7526a67bfcdddff5b83dd7c094fffdce	360	Pfam	PF00702	haloacid dehalogenase-like hydrolase	8	162	5.9E-30	T	21-03-2019
MAG141_143_1	7526a67bfcdddff5b83dd7c094fffdce	360	TIGRFAM	TIGR01494	ATPase_P-type: HAD ATPase, P-type, family IC	44	229	5.6E-47	T	21-03-2019	IPR001757	P-type ATPase
MAG141_143_1	7526a67bfcdddff5b83dd7c094fffdce	360	Pfam	PF00403	Heavy-metal-associated domain	296	355	2.1E-16	T	21-03-2019	IPR006121	Heavy metal-associated domain, HMA
MAG141_26_15	943a2d71011268e65df656d3b4bbf866	101	TIGRFAM	TIGR02384	RelB_DinJ: addiction module antitoxin, RelB/DinJ family	1	77	3.6E-15	T	21-03-2019	IPR007337	RelB antitoxin/Antitoxin DinJ
MAG141_26_15	943a2d71011268e65df656d3b4bbf866	101	Pfam	PF04221	RelB antitoxin	5	69	5.9E-14	T	21-03-2019	IPR007337	RelB antitoxin/Antitoxin DinJ
MAG141_133_1	899da5171f9fd1b91eeb449d95f5dc30	653	Pfam	PF11987	Translation-initiation factor 2	439	543	4.3E-39	T	21-03-2019	IPR023115	Translation initiation factor IF- 2, domain 3
MAG141_133_1	899da5171f9fd1b91eeb449d95f5dc30	653	Pfam	PF00009	Elongation factor Tu GTP binding domain	158	314	8.4E-35	T	21-03-2019	IPR000795	Transcription factor, GTP-binding domain
MAG141_133_1	899da5171f9fd1b91eeb449d95f5dc30	653	TIGRFAM	TIGR00231	small_GTP: small GTP-binding protein domain	155	312	2.0E-35	T	21-03-2019	IPR005225	Small GTP-binding protein domain
MAG141_133_1	899da5171f9fd1b91eeb449d95f5dc30	653	Pfam	PF04760	Translation initiation factor IF-2, N-terminal region	83	129	2.1E-14	T	21-03-2019	IPR006847	Translation initiation factor IF-2, N-terminal
MAG141_133_1	899da5171f9fd1b91eeb449d95f5dc30	653	TIGRFAM	TIGR00487	IF-2: translation initiation factor IF-2	72	651	2.5E-261	T	21-03-2019	IPR000178	Translation initiation factor aIF-2, bacterial-like
MAG141_18_3	aaeb6fbbcb4b93ecb0db82ec6c42b6f5	344	Pfam	PF00348	Polyprenyl synthetase	44	283	2.3E-58	T	21-03-2019	IPR000092	Polyprenyl synthetase
MAG141_45_5	a77effb5ac62e11181af3a874973dac4	217	TIGRFAM	TIGR00126	deoC: deoxyribose-phosphate aldolase	6	213	2.3E-70	T	21-03-2019	IPR011343	Deoxyribose-phosphate aldolase
MAG141_45_5	a77effb5ac62e11181af3a874973dac4	217	Pfam	PF01791	DeoC/LacD family aldolase	19	197	1.0E-22	T	21-03-2019	IPR002915	DeoC/FbaB/ lacD aldolase
MAG141_97_2	c7cab02b69d7bc11a3ab55076423a1ad	163	Pfam	PF13306	Leucine rich repeats (6 copies)	93	159	9.2E-18	T	21-03-2019	IPR026906	Leucine rich repeat 5
MAG141_7_10	bcf5f4b74c4c664b28a79a054939e57d	284	Pfam	PF00005	ABC transporter	23	205	3.3E-29	T	21-03-2019	IPR003439	ABC transporter-like
MAG141_7_10	bcf5f4b74c4c664b28a79a054939e57d	284	Pfam	PF12399	Branched-chain amino acid ATP-binding cassette transporter	256	277	7.5E-11	T	21-03-2019	IPR032823	Branched-chain amino acid ATP-binding cassette transporter, C-terminal
MAG141_35_19	e2805c1352800bbc706fdab6104d9332	309	TIGRFAM	TIGR01136	cysKM: cysteine synthase	8	307	5.6E-132	T	21-03-2019	IPR005856	Cysteine synthase
MAG141_35_19	e2805c1352800bbc706fdab6104d9332	309	TIGRFAM	TIGR01139	cysK: cysteine synthase A	8	307	7.9E-135	T	21-03-2019	IPR005859	Cysteine synthase CysK
MAG141_35_19	e2805c1352800bbc706fdab6104d9332	309	Pfam	PF00291	Pyridoxal-phosphate dependent enzyme	8	295	2.3E-68	T	21-03-2019	IPR001926	Pyridoxal-phosphate dependent enzyme
MAG141_2_47	e188c0068351a98666f2b6528c2d50ad	59	Pfam	PF00327	Ribosomal protein L30p/L7e	4	54	2.4E-16	T	21-03-2019	IPR016082	Ribosomal protein L30, ferredoxin-like fold domain
MAG141_2_47	e188c0068351a98666f2b6528c2d50ad	59	TIGRFAM	TIGR01308	rpmD_bact: ribosomal protein uL30	4	57	2.4E-23	T	21-03-2019	IPR005996	Ribosomal protein L30, bacterial-type
MAG141_19_1	8654bf6d2ffd238d229f1ff6b2590447	312	Pfam	PF11348	Protein of unknown function (DUF3150)	35	182	2.9E-6	T	21-03-2019	IPR021496	Protein of unknown function DUF3150
MAG141_17_15	de3834fc0a57591519c84475d3cc07ff	337	TIGRFAM	TIGR01397	fliM_switch: flagellar motor switch protein FliM	3	323	8.1E-67	T	21-03-2019	IPR001689	Flagellar motor switch protein FliM
MAG141_17_15	de3834fc0a57591519c84475d3cc07ff	337	Pfam	PF01052	Type III flagellar switch regulator (C-ring) FliN C-term	253	323	1.5E-19	T	21-03-2019	IPR001543	Surface presentation of antigen (SpoA)
MAG141_17_15	de3834fc0a57591519c84475d3cc07ff	337	Pfam	PF02154	Flagellar motor switch protein FliM	36	232	6.4E-36	T	21-03-2019	IPR001689	Flagellar motor switch protein FliM
MAG141_13_11	aa114b7981f9a3aae8fed815b22a66fe	226	Pfam	PF02511	Thymidylate synthase complementing protein	5	194	1.7E-72	T	21-03-2019	IPR003669	Thymidylate synthase ThyX
MAG141_13_11	aa114b7981f9a3aae8fed815b22a66fe	226	TIGRFAM	TIGR02170	thyX: thymidylate synthase, flavin-dependent	3	198	2.5E-61	T	21-03-2019	IPR003669	Thymidylate synthase ThyX
MAG141_29_6	29982552a171fb02c8f1610191d19728	234	Pfam	PF00072	Response regulator receiver domain	10	117	4.9E-27	T	21-03-2019	IPR001789	Signal transduction response regulator, receiver domain
MAG141_29_6	29982552a171fb02c8f1610191d19728	234	Pfam	PF00486	Transcriptional regulatory protein, C terminal	153	231	4.4E-24	T	21-03-2019	IPR001867	OmpR/PhoB-type DNA-binding domain
MAG141_17_19	91c7ca636342d4c75514b9c147e2d46e	549	Pfam	PF13682	Chemoreceptor zinc-binding domain	58	123	8.9E-11	T	21-03-2019	IPR025991	Chemoreceptor zinc-binding domain
MAG141_17_19	91c7ca636342d4c75514b9c147e2d46e	549	Pfam	PF00015	Methyl-accepting chemotaxis protein (MCP) signalling domain	359	527	6.2E-38	T	21-03-2019	IPR004089	Methyl-accepting chemotaxis protein (MCP) signalling domain
MAG141_31_11	9e878286aa0b25346a800dbec97768de	783	Pfam	PF07833	Copper amine oxidase N-terminal domain	127	167	1.9E-5	T	21-03-2019	IPR012854	Copper amine oxidase-like, N-terminal
MAG141_31_11	9e878286aa0b25346a800dbec97768de	783	Pfam	PF07833	Copper amine oxidase N-terminal domain	169	245	8.4E-12	T	21-03-2019	IPR012854	Copper amine oxidase-like, N-terminal
MAG141_4_12	704259fe8725972db4358ef83f86044d	95	Pfam	PF02686	Glu-tRNAGln amidotransferase C subunit	19	90	1.9E-19	T	21-03-2019	IPR003837	Glu-tRNAGln amidotransferase C subunit
MAG141_4_12	704259fe8725972db4358ef83f86044d	95	TIGRFAM	TIGR00135	gatC: aspartyl/glutamyl-tRNA(Asn/Gln) amidotransferase, C subunit	3	95	8.5E-25	T	21-03-2019	IPR003837	Glu-tRNAGln amidotransferase C subunit
MAG141_57_6	374752a7b874f956a60119300a257181	373	Pfam	PF00460	Flagella basal body rod protein	5	35	1.9E-8	T	21-03-2019	IPR001444	Flagellar basal body rod protein, N-terminal
MAG141_57_6	374752a7b874f956a60119300a257181	373	TIGRFAM	TIGR03506	FlgEFG_subfam: flagellar hook-basal body protein	3	288	4.9E-33	T	21-03-2019	IPR020013	Flagellar hook-basal body protein, FlgE/F/G
MAG141_57_6	374752a7b874f956a60119300a257181	373	Pfam	PF06429	Flagellar basal body rod FlgEFG protein C-terminal	325	371	1.6E-11	T	21-03-2019	IPR010930	Flagellar basal-body/hook protein, C-terminal domain
MAG141_1_45	231c1383526712ef0718366d2be20abe	1267	Pfam	PF13361	UvrD-like helicase C-terminal domain	778	882	1.5E-13	T	21-03-2019	IPR014017	UvrD-like DNA helicase, C-terminal
MAG141_1_45	231c1383526712ef0718366d2be20abe	1267	Pfam	PF00580	UvrD/REP helicase N-terminal domain	3	437	2.2E-68	T	21-03-2019	IPR034739	UvrD/AddA helicase, N-terminal
MAG141_1_45	231c1383526712ef0718366d2be20abe	1267	TIGRFAM	TIGR02785	addA_Gpos: helicase-exonuclease AddAB, AddA subunit	3	1262	9.6E-231	T	21-03-2019	IPR014152	DNA helicase subunit AddA
MAG141_1_45	231c1383526712ef0718366d2be20abe	1267	Pfam	PF12705	PD-(D/E)XK nuclease superfamily	1058	1255	1.6E-12	T	21-03-2019	IPR038726	PD-(D/E)XK endonuclease-like domain, AddAB-type
MAG141_3_19	28d30495a988b77433e46b955de8106a	344	Pfam	PF02518	Histidine kinase-, DNA gyrase B-, and HSP90-like ATPase	212	336	8.4E-13	T	21-03-2019	IPR003594	Histidine kinase/HSP90-like ATPase
MAG141_2_39	668cbf24ece0550b50200f992a35c256	123	Pfam	PF00416	Ribosomal protein S13/S18	3	109	9.2E-32	T	21-03-2019	IPR001892	Ribosomal protein S13
MAG141_2_39	668cbf24ece0550b50200f992a35c256	123	TIGRFAM	TIGR03631	uS13_bact: ribosomal protein uS13	3	115	2.1E-53	T	21-03-2019	IPR019980	Ribosomal protein S13, bacterial-type
MAG141_114_4	48345585280bc3e80184261b88c3847a	355	Pfam	PF07501	G5 domain	182	253	5.9E-18	T	21-03-2019	IPR011098	G5 domain
MAG141_114_4	48345585280bc3e80184261b88c3847a	355	Pfam	PF06725	3D domain	295	355	1.2E-19	T	21-03-2019	IPR010611	3D domain
MAG141_114_4	48345585280bc3e80184261b88c3847a	355	Pfam	PF03990	Domain of unknown function (DUF348)	124	164	4.5E-6	T	21-03-2019	IPR007137	Resuscitation-promoting factor, domain of unknown function DUF348
MAG141_114_4	48345585280bc3e80184261b88c3847a	355	Pfam	PF03990	Domain of unknown function (DUF348)	67	105	3.0E-9	T	21-03-2019	IPR007137	Resuscitation-promoting factor, domain of unknown function DUF348
MAG141_49_11	153e79506f4b5498b7591e6a295dd56a	415	TIGRFAM	TIGR01072	murA: UDP-N-acetylglucosamine 1-carboxyvinyltransferase	1	413	1.8E-169	T	21-03-2019	IPR005750	UDP-N-acetylglucosamine 1-carboxyvinyltransferase
MAG141_49_11	153e79506f4b5498b7591e6a295dd56a	415	Pfam	PF00275	EPSP synthase (3-phosphoshikimate 1-carboxyvinyltransferase)	7	405	5.8E-101	T	21-03-2019	IPR001986	Enolpyruvate transferase domain
MAG141_56_16	a37dd69863b62085f9a681fdaa2ecefa	190	Pfam	PF01966	HD domain	24	89	5.4E-5	T	21-03-2019	IPR006674	HD domain
MAG141_56_16	a37dd69863b62085f9a681fdaa2ecefa	190	TIGRFAM	TIGR00277	HDIG: HDIG domain	20	89	1.5E-7	T	21-03-2019	IPR006675	HDIG domain
MAG141_77_5	8948dd9baaa84bc319c9fdfd8af3b65d	155	Pfam	PF02576	RimP N-terminal domain	12	84	3.8E-23	T	21-03-2019	IPR028989	Ribosome maturation factor RimP, N-terminal
MAG141_77_5	8948dd9baaa84bc319c9fdfd8af3b65d	155	Pfam	PF17384	RimP C-terminal SH3 domain	87	155	1.6E-10	T	21-03-2019	IPR028998	Ribosome maturation factor RimP, C-terminal
MAG141_1_18	b9fb86f7ce1aeac1081e441f72a270c1	445	Pfam	PF00120	Glutamine synthetase, catalytic domain	113	433	5.3E-88	T	21-03-2019	IPR008146	Glutamine synthetase, catalytic domain
MAG141_1_18	b9fb86f7ce1aeac1081e441f72a270c1	445	Pfam	PF03951	Glutamine synthetase, beta-Grasp domain	18	105	2.0E-17	T	21-03-2019	IPR008147	Glutamine synthetase, beta-Grasp domain
MAG141_10_15	85c79a94e05ce05d5faab317d8717da9	85	Pfam	PF16256	Domain of unknown function (DUF4911)	22	75	1.0E-17	T	21-03-2019	IPR032587	Protein of unknown function DUF4911
MAG141_40_14	493d1f4a8116f8b46453702e822532ef	172	TIGRFAM	TIGR00168	infC: translation initiation factor IF-3	10	172	3.2E-63	T	21-03-2019	IPR001288	Translation initiation factor 3
MAG141_40_14	493d1f4a8116f8b46453702e822532ef	172	Pfam	PF05198	Translation initiation factor IF-3, N-terminal domain	10	80	7.8E-31	T	21-03-2019	IPR019814	Translation initiation factor 3, N-terminal
MAG141_40_14	493d1f4a8116f8b46453702e822532ef	172	Pfam	PF00707	Translation initiation factor IF-3, C-terminal domain	87	172	7.2E-37	T	21-03-2019	IPR019815	Translation initiation factor 3, C-terminal
MAG141_40_19	d3ba788394dc2006548d91e06b394d20	159	TIGRFAM	TIGR00090	rsfS_iojap_ybeB: ribosome silencing factor	59	147	2.1E-33	T	21-03-2019	IPR004394	Protein Iojap/ribosomal silencing factor RsfS
