MAG142_5_50	9a1bc84176511202abd9ce73db0268fc	465	Pfam	PF02843	Phosphoribosylglycinamide synthetase, C domain	367	455	1.4E-22	T	21-03-2019	IPR020560	Phosphoribosylglycinamide synthetase, C-domain
MAG142_5_50	9a1bc84176511202abd9ce73db0268fc	465	Pfam	PF02844	Phosphoribosylglycinamide synthetase, N domain	36	137	1.8E-28	T	21-03-2019	IPR020562	Phosphoribosylglycinamide synthetase, N-terminal
MAG142_5_50	9a1bc84176511202abd9ce73db0268fc	465	Pfam	PF01071	Phosphoribosylglycinamide synthetase, ATP-grasp (A) domain	138	332	9.6E-63	T	21-03-2019	IPR020561	Phosphoribosylglycinamide synthetase, ATP-grasp (A) domain
MAG142_12_15	0063d1fe234a5003e55078e4bf0509c0	384	TIGRFAM	TIGR00695	uxuA: mannonate dehydratase	1	382	1.0E-122	T	21-03-2019	IPR004628	Mannonate dehydratase
MAG142_12_15	0063d1fe234a5003e55078e4bf0509c0	384	Pfam	PF03786	D-mannonate dehydratase (UxuA)	1	383	7.2E-116	T	21-03-2019	IPR004628	Mannonate dehydratase
MAG142_7_55	2fe933e9689cc34e919708f7a2f854d2	595	Pfam	PF05746	DALR anticodon binding domain	478	595	2.1E-32	T	21-03-2019	IPR008909	DALR anticodon binding
MAG142_7_55	2fe933e9689cc34e919708f7a2f854d2	595	Pfam	PF00750	tRNA synthetases class I (R)	111	460	2.1E-47	T	21-03-2019	IPR035684	Arginyl-tRNA synthetase, catalytic core domain
MAG142_7_55	2fe933e9689cc34e919708f7a2f854d2	595	Pfam	PF03485	Arginyl tRNA synthetase N terminal domain	7	88	1.7E-6	T	21-03-2019	IPR005148	Arginyl tRNA synthetase N-terminal domain
MAG142_7_55	2fe933e9689cc34e919708f7a2f854d2	595	TIGRFAM	TIGR00456	argS: arginine--tRNA ligase	4	595	6.5E-136	T	21-03-2019	IPR001278	Arginine-tRNA ligase
MAG142_20_29	f978a3f016963a0636bd019905d27990	144	Pfam	PF14126	Domain of unknown function (DUF4293)	3	143	3.5E-23	T	21-03-2019	IPR025635	Protein of unknown function DUF4293
MAG142_77_7	7ac28a0f6765b654362d18f505159393	209	Pfam	PF01510	N-acetylmuramoyl-L-alanine amidase	66	195	4.0E-19	T	21-03-2019	IPR002502	N-acetylmuramoyl-L-alanine amidase domain
MAG142_77_7	7ac28a0f6765b654362d18f505159393	209	Pfam	PF01471	Putative peptidoglycan binding domain	9	59	2.5E-16	T	21-03-2019	IPR002477	Peptidoglycan binding-like
MAG142_15_28	4eb2b5b375239dae00ddd83a1a0f5f4f	290	Pfam	PF01048	Phosphorylase superfamily	30	272	1.9E-36	T	21-03-2019	IPR000845	Nucleoside phosphorylase domain
MAG142_49_4	354eabbdf35ace3bbfa49551cb6140a0	326	Pfam	PF00889	Elongation factor TS	66	325	1.3E-54	T	21-03-2019	IPR014039	Translation elongation factor EFTs/EF1B, dimerisation
MAG142_49_4	354eabbdf35ace3bbfa49551cb6140a0	326	TIGRFAM	TIGR00116	tsf: translation elongation factor Ts	3	325	1.6E-65	T	21-03-2019	IPR001816	Translation elongation factor EFTs/EF1B
MAG142_38_1	80814857d245e89b7fce27f509719616	765	Pfam	PF00689	Cation transporting ATPase, C-terminus	567	763	4.6E-31	T	21-03-2019	IPR006068	Cation-transporting P-type ATPase, C-terminal
MAG142_38_1	80814857d245e89b7fce27f509719616	765	Pfam	PF00122	E1-E2 ATPase	4	81	3.0E-9	T	21-03-2019
MAG142_38_1	80814857d245e89b7fce27f509719616	765	Pfam	PF00122	E1-E2 ATPase	115	185	2.1E-6	T	21-03-2019
MAG142_38_1	80814857d245e89b7fce27f509719616	765	TIGRFAM	TIGR01494	ATPase_P-type: HAD ATPase, P-type, family IC	454	565	3.8E-31	T	21-03-2019	IPR001757	P-type ATPase
MAG142_38_1	80814857d245e89b7fce27f509719616	765	TIGRFAM	TIGR01494	ATPase_P-type: HAD ATPase, P-type, family IC	142	231	2.2E-20	T	21-03-2019	IPR001757	P-type ATPase
MAG142_38_1	80814857d245e89b7fce27f509719616	765	Pfam	PF08282	haloacid dehalogenase-like hydrolase	467	527	7.5E-6	T	21-03-2019
MAG142_38_1	80814857d245e89b7fce27f509719616	765	Pfam	PF13246	Cation transport ATPase (P-type)	241	325	2.2E-20	T	21-03-2019
MAG142_18_37	05542c5db0beb6b83ed6e196ec6d356a	333	Pfam	PF00535	Glycosyl transferase family 2	40	147	7.1E-20	T	21-03-2019	IPR001173	Glycosyltransferase 2-like
MAG142_88_2	77f429941e3e4913cc64876df9148543	358	Pfam	PF08522	Domain of unknown function (DUF1735)	33	158	9.6E-19	T	21-03-2019	IPR013728	Domain of unknown function DUF1735
MAG142_26_20	2c70d293927524cc5abf7fbf6711f724	457	Pfam	PF02113	D-Ala-D-Ala carboxypeptidase 3 (S13) family	32	436	1.1E-65	T	21-03-2019	IPR000667	Peptidase S13, D-Ala-D-Ala carboxypeptidase C
MAG142_26_20	2c70d293927524cc5abf7fbf6711f724	457	TIGRFAM	TIGR00666	PBP4: D-alanyl-D-alanine carboxypeptidase/D-alanyl-D-alanine-endopeptidase	48	423	9.2E-58	T	21-03-2019	IPR000667	Peptidase S13, D-Ala-D-Ala carboxypeptidase C
MAG142_13_23	878f063a4bc41624534ba7b0a53e8fde	459	Pfam	PF08245	Mur ligase middle domain	118	294	2.2E-23	T	21-03-2019	IPR013221	Mur ligase, central
MAG142_13_23	878f063a4bc41624534ba7b0a53e8fde	459	Pfam	PF02875	Mur ligase family, glutamate ligase domain	316	404	4.2E-19	T	21-03-2019	IPR004101	Mur ligase, C-terminal
MAG142_13_23	878f063a4bc41624534ba7b0a53e8fde	459	Pfam	PF01225	Mur ligase family, catalytic domain	8	111	1.4E-12	T	21-03-2019	IPR000713	Mur ligase, N-terminal catalytic domain
MAG142_39_4	7254f96e5cc4b333af2f5e3a7a20869a	352	TIGRFAM	TIGR01128	holA: DNA polymerase III, delta subunit	28	340	1.8E-51	T	21-03-2019	IPR005790	DNA polymerase III, delta subunit
MAG142_39_4	7254f96e5cc4b333af2f5e3a7a20869a	352	Pfam	PF06144	DNA polymerase III, delta subunit	32	197	5.1E-26	T	21-03-2019	IPR010372	DNA polymerase III delta, N-terminal
MAG142_11_44	173e0f6b7e0e11750c25d8527cba5671	123	TIGRFAM	TIGR00494	crcB: protein CrcB	8	122	8.6E-24	T	21-03-2019	IPR003691	Putative fluoride ion transporter CrcB
MAG142_11_44	173e0f6b7e0e11750c25d8527cba5671	123	Pfam	PF02537	CrcB-like protein, Camphor Resistance (CrcB)	7	118	3.9E-24	T	21-03-2019	IPR003691	Putative fluoride ion transporter CrcB
MAG142_6_44	02fd2b40a5309355a87f4c37b458ffbe	465	Pfam	PF06968	Biotin and Thiamin Synthesis associated domain	269	373	6.5E-22	T	21-03-2019	IPR010722	Biotin and thiamin synthesis-associated domain
MAG142_6_44	02fd2b40a5309355a87f4c37b458ffbe	465	Pfam	PF04055	Radical SAM superfamily	87	234	1.2E-8	T	21-03-2019	IPR007197	Radical SAM
MAG142_6_44	02fd2b40a5309355a87f4c37b458ffbe	465	TIGRFAM	TIGR03955	rSAM_HydG: [FeFe] hydrogenase H-cluster radical SAM maturase HydG	2	465	1.8E-257	T	21-03-2019	IPR024007	[FeFe]-hydrogenase maturation HydG, radical SAM
MAG142_10_7	5ec8b0b2af308965baf1ff58b8065e22	273	Pfam	PF00288	GHMP kinases N terminal domain	84	140	2.6E-9	T	21-03-2019	IPR006204	GHMP kinase N-terminal domain
MAG142_10_7	5ec8b0b2af308965baf1ff58b8065e22	273	TIGRFAM	TIGR00154	ispE: 4-(cytidine 5'-diphospho)-2-C-methyl-D-erythritol kinase	6	251	2.0E-53	T	21-03-2019	IPR004424	4-diphosphocytidyl-2C-methyl-D-erythritol kinase
MAG142_3_37	3ad543963f7e6dd7cb3f8d1bb6c306a1	521	Pfam	PF01408	Oxidoreductase family, NAD-binding Rossmann fold	70	195	2.8E-13	T	21-03-2019	IPR000683	Oxidoreductase, N-terminal
MAG142_49_5	a695ffb95d6a2b4b75b1fb5f48702358	498	TIGRFAM	TIGR00973	leuA_bact: 2-isopropylmalate synthase	4	494	6.6E-195	T	21-03-2019	IPR005671	2-isopropylmalate synthase, bacterial-type
MAG142_49_5	a695ffb95d6a2b4b75b1fb5f48702358	498	Pfam	PF00682	HMGL-like	5	272	1.8E-89	T	21-03-2019	IPR000891	Pyruvate carboxyltransferase
MAG142_49_5	a695ffb95d6a2b4b75b1fb5f48702358	498	Pfam	PF08502	LeuA allosteric (dimerisation) domain	369	496	1.6E-27	T	21-03-2019	IPR013709	2-isopropylmalate synthase LeuA, allosteric (dimerisation) domain
MAG142_54_13	a517d0f7ed9b91f99baa455a23807f22	427	Pfam	PF12704	MacB-like periplasmic core domain	37	253	1.9E-8	T	21-03-2019	IPR025857	MacB-like periplasmic core domain
MAG142_54_13	a517d0f7ed9b91f99baa455a23807f22	427	Pfam	PF02687	FtsX-like permease family	322	420	3.8E-7	T	21-03-2019	IPR003838	ABC transporter permease protein domain
MAG142_11_4	9500e07e1fdf973fd9ad33c7d57117e5	752	Pfam	PF00999	Sodium/hydrogen exchanger family	29	393	6.1E-51	T	21-03-2019	IPR006153	Cation/H+ exchanger
MAG142_11_4	9500e07e1fdf973fd9ad33c7d57117e5	752	Pfam	PF02080	TrkA-C domain	688	751	4.5E-11	T	21-03-2019	IPR006037	Regulator of K+ conductance, C-terminal
MAG142_11_4	9500e07e1fdf973fd9ad33c7d57117e5	752	Pfam	PF02080	TrkA-C domain	601	666	6.4E-12	T	21-03-2019	IPR006037	Regulator of K+ conductance, C-terminal
MAG142_123_2	692549c69a787ef62755351dd35ce3e3	254	Pfam	PF11459	Transcriptional regulator, AbiEi antitoxin, Type IV TA system	100	247	3.1E-44	T	21-03-2019	IPR021561	Transcriptional regulator, AbiEi 3 antitoxin, Type IV TA system
MAG142_123_2	692549c69a787ef62755351dd35ce3e3	254	Pfam	PF17194	Transcriptional regulator, AbiEi antitoxin N-terminal domain	7	97	2.7E-28	T	21-03-2019	IPR033455	Transcriptional regulator AbiEi antitoxin, N-terminal domain
MAG142_1_11	33788501d4a5a9c2c579c90c2a1e0af8	439	Pfam	PF03553	Na+/H+ antiporter family	39	221	2.4E-16	T	21-03-2019	IPR018461	Na+/H+ antiporter, NhaC-like, C-terminal
MAG142_1_11	33788501d4a5a9c2c579c90c2a1e0af8	439	Pfam	PF03553	Na+/H+ antiporter family	244	430	7.7E-17	T	21-03-2019	IPR018461	Na+/H+ antiporter, NhaC-like, C-terminal
MAG142_27_26	42be2c9988409fe903ac34350ea9e386	263	Pfam	PF06738	Putative threonine/serine exporter	19	257	1.1E-50	T	21-03-2019	IPR010619	Putative threonine/serine exporter
MAG142_7_22	3751243d8f9bf27c798972c9eb5e418a	284	Pfam	PF04085	rod shape-determining protein MreC	116	263	3.6E-36	T	21-03-2019	IPR007221	Rod shape-determining protein MreC
MAG142_6_20	4e4208ebda095f4dbba15908e3420936	405	Pfam	PF06321	Major fimbrial subunit protein (FimA)	20	222	3.2E-10	T	21-03-2019	IPR029141	Major fimbrial subunit protein, N-terminal
MAG142_55_1	f52bb10cc81ac100b279d12cf87c9981	597	Pfam	PF14322	Starch-binding associating with outer membrane	104	224	4.3E-17	T	21-03-2019	IPR033985	SusD-like, N-terminal
MAG142_55_1	f52bb10cc81ac100b279d12cf87c9981	597	Pfam	PF07980	SusD family	277	596	7.2E-38	T	21-03-2019	IPR012944	RagB/SusD domain
MAG142_16_16	48d085369e3c618072bfc8e187c7f03f	1197	TIGRFAM	TIGR04056	OMP_RagA_SusC: TonB-linked outer membrane protein, SusC/RagA family	110	1197	5.4E-171	T	21-03-2019	IPR023996	TonB-dependent outer membrane protein, SusC/RagA
MAG142_16_16	48d085369e3c618072bfc8e187c7f03f	1197	Pfam	PF00593	TonB dependent receptor	620	1164	4.0E-19	T	21-03-2019	IPR000531	TonB-dependent receptor-like, beta-barrel
MAG142_16_16	48d085369e3c618072bfc8e187c7f03f	1197	Pfam	PF13715	CarboxypepD_reg-like domain	111	196	1.7E-19	T	21-03-2019
MAG142_16_16	48d085369e3c618072bfc8e187c7f03f	1197	Pfam	PF07715	TonB-dependent Receptor Plug Domain	204	324	9.2E-18	T	21-03-2019	IPR012910	TonB-dependent receptor, plug domain
MAG142_16_16	48d085369e3c618072bfc8e187c7f03f	1197	TIGRFAM	TIGR04057	SusC_RagA_signa: TonB-dependent outer membrane receptor, SusC/RagA subfamily, signature region	300	330	4.9E-16	T	21-03-2019	IPR023997	TonB-dependent outer membrane protein SusC/RagA, conserved site
MAG142_4_56	94e5a3ffb25745334f3b8a9660326538	397	Pfam	PF07690	Major Facilitator Superfamily	13	325	5.5E-31	T	21-03-2019	IPR011701	Major facilitator superfamily
MAG142_75_11	9aa2170b8a8d5799d76725dec94c5163	78	TIGRFAM	TIGR00517	acyl_carrier: acyl carrier protein	1	77	3.6E-32	T	21-03-2019	IPR003231	Acyl carrier protein (ACP)
MAG142_75_11	9aa2170b8a8d5799d76725dec94c5163	78	Pfam	PF00550	Phosphopantetheine attachment site	7	73	4.7E-16	T	21-03-2019	IPR009081	Phosphopantetheine binding ACP domain
MAG142_90_2	b1901d14ef054141ab4ca039e103cbb8	675	Pfam	PF00890	FAD binding domain	65	477	7.8E-61	T	21-03-2019	IPR003953	FAD-dependent oxidoreductase 2, FAD binding domain
MAG142_90_2	b1901d14ef054141ab4ca039e103cbb8	675	Pfam	PF02910	Fumarate reductase flavoprotein C-term	539	673	1.1E-34	T	21-03-2019	IPR015939	Fumarate reductase/succinate dehydrogenase flavoprotein-like, C-terminal
MAG142_90_2	b1901d14ef054141ab4ca039e103cbb8	675	TIGRFAM	TIGR01811	sdhA_Bsu: succinate dehydrogenase or fumarate reductase, flavoprotein subunit	66	673	1.0E-280	T	21-03-2019	IPR011280	Succinate dehydrogenase/fumarate reductase flavoprotein subunit, low-GC Gram-positive bacteria
MAG142_69_5	6dec86218ad017f6a439d9303e2db695	569	TIGRFAM	TIGR03802	Asp_Ala_antiprt: aspartate-alanine antiporter	5	567	1.9E-194	T	21-03-2019	IPR022457	Aspartate-alanine antiporter
MAG142_69_5	6dec86218ad017f6a439d9303e2db695	569	TIGRFAM	TIGR01625	YidE_YbjL_dupl: AspT/YidE/YbjL antiporter duplication domain	401	551	3.3E-29	T	21-03-2019	IPR006512	YidE/YbjL duplication
MAG142_69_5	6dec86218ad017f6a439d9303e2db695	569	Pfam	PF02080	TrkA-C domain	322	382	2.1E-6	T	21-03-2019	IPR006037	Regulator of K+ conductance, C-terminal
MAG142_69_5	6dec86218ad017f6a439d9303e2db695	569	Pfam	PF06826	Predicted Permease Membrane Region	19	179	2.5E-38	T	21-03-2019	IPR006512	YidE/YbjL duplication
MAG142_69_5	6dec86218ad017f6a439d9303e2db695	569	Pfam	PF06826	Predicted Permease Membrane Region	398	565	1.4E-43	T	21-03-2019	IPR006512	YidE/YbjL duplication
MAG142_49_2	6c200e0a7a12d6c591dbcdb8e3a3d683	128	Pfam	PF00380	Ribosomal protein S9/S16	8	128	2.3E-45	T	21-03-2019	IPR000754	Ribosomal protein S9
MAG142_40_10	73dfa3f27bc04effbf20b91594be1c50	305	Pfam	PF11777	Protein of unknown function (DUF3316)	5	163	1.1E-18	T	21-03-2019	IPR016879	Uncharacterised conserved protein UCP028299
MAG142_94_1	260d52b05f4bb5b70ad060480fe7f6f5	230	Pfam	PF13545	Crp-like helix-turn-helix domain	156	222	1.2E-7	T	21-03-2019	IPR012318	Crp-type HTH domain
MAG142_94_1	260d52b05f4bb5b70ad060480fe7f6f5	230	Pfam	PF00027	Cyclic nucleotide-binding domain	37	124	7.5E-10	T	21-03-2019	IPR000595	Cyclic nucleotide-binding domain
MAG142_1_92	638b9331945b224a6701d1a80cf1660e	390	Pfam	PF04773	FecR protein	182	271	7.2E-17	T	21-03-2019	IPR006860	FecR protein
MAG142_1_92	638b9331945b224a6701d1a80cf1660e	390	Pfam	PF16344	Domain of unknown function (DUF4974)	285	384	5.0E-19	T	21-03-2019	IPR032508	Protein FecR, C-terminal
MAG142_49_7	dd0a7c79dde034cd55b1bb0f59de5f00	197	TIGRFAM	TIGR00171	leuD: 3-isopropylmalate dehydratase, small subunit	3	184	1.3E-56	T	21-03-2019	IPR004431	3-isopropylmalate dehydratase, small subunit
MAG142_49_7	dd0a7c79dde034cd55b1bb0f59de5f00	197	Pfam	PF00694	Aconitase C-terminal domain	3	122	4.6E-28	T	21-03-2019	IPR000573	Aconitase A/isopropylmalate dehydratase small subunit, swivel domain
MAG142_8_30	670ba71c447394f5cb062109c06bb809	434	Pfam	PF13742	OB-fold nucleic acid binding domain	9	115	8.0E-15	T	21-03-2019	IPR025824	OB-fold nucleic acid binding domain
MAG142_8_30	670ba71c447394f5cb062109c06bb809	434	TIGRFAM	TIGR00237	xseA: exodeoxyribonuclease VII, large subunit	10	433	3.3E-92	T	21-03-2019	IPR003753	Exonuclease VII, large subunit
MAG142_8_30	670ba71c447394f5cb062109c06bb809	434	Pfam	PF02601	Exonuclease VII, large subunit	141	431	5.8E-70	T	21-03-2019	IPR020579	Exonuclease VII, large subunit, C-terminal
MAG142_26_10	a6b83f147288cdcfee63601c57c7d08b	920	Pfam	PF13715	CarboxypepD_reg-like domain	29	107	4.6E-12	T	21-03-2019
MAG142_26_10	a6b83f147288cdcfee63601c57c7d08b	920	Pfam	PF07715	TonB-dependent Receptor Plug Domain	115	223	7.5E-15	T	21-03-2019	IPR012910	TonB-dependent receptor, plug domain
MAG142_42_8	8dd25fc20d20cf3a3f2233eb40f34228	340	TIGRFAM	TIGR04440	glyco_TIGR04440: glycosyltransferase domain	7	214	1.2E-57	T	21-03-2019	IPR031042	Glycosyltransferase domain
MAG142_17_11	3d9798a1e263850af5baa3797bed4f6e	196	Pfam	PF14123	Domain of unknown function (DUF4290)	2	174	2.6E-72	T	21-03-2019	IPR025632	Protein of unknown function DUF4290
MAG142_71_4	5288fcd80ca1b9f856430f954d0cae16	1117	TIGRFAM	TIGR00580	mfd: transcription-repair coupling factor	238	1042	4.9E-269	T	21-03-2019	IPR004576	Transcription-repair coupling factor
MAG142_71_4	5288fcd80ca1b9f856430f954d0cae16	1117	Pfam	PF00271	Helicase conserved C-terminal domain	761	861	1.0E-17	T	21-03-2019	IPR001650	Helicase, C-terminal
MAG142_71_4	5288fcd80ca1b9f856430f954d0cae16	1117	Pfam	PF02559	CarD-like/TRCF domain	433	527	5.5E-24	T	21-03-2019	IPR003711	CarD-like/TRCF domain
MAG142_71_4	5288fcd80ca1b9f856430f954d0cae16	1117	Pfam	PF03461	TRCF domain	971	1062	1.7E-23	T	21-03-2019	IPR005118	Transcription-repair-coupling factor, C-terminal domain
MAG142_71_4	5288fcd80ca1b9f856430f954d0cae16	1117	Pfam	PF00270	DEAD/DEAH box helicase	577	717	3.4E-15	T	21-03-2019	IPR011545	DEAD/DEAH box helicase domain
MAG142_19_17	36809142501009c8aa62a848f5f670f0	441	Pfam	PF00919	Uncharacterized protein family UPF0004	5	115	1.2E-18	T	21-03-2019	IPR013848	Methylthiotransferase, N-terminal
MAG142_19_17	36809142501009c8aa62a848f5f670f0	441	Pfam	PF04055	Radical SAM superfamily	151	321	5.1E-23	T	21-03-2019	IPR007197	Radical SAM
MAG142_19_17	36809142501009c8aa62a848f5f670f0	441	TIGRFAM	TIGR00089	TIGR00089: radical SAM methylthiotransferase, MiaB/RimO family	5	437	1.6E-106	T	21-03-2019	IPR005839	Methylthiotransferase
MAG142_19_17	36809142501009c8aa62a848f5f670f0	441	TIGRFAM	TIGR01125	TIGR01125: ribosomal protein S12 methylthiotransferase RimO	5	437	3.0E-129	T	21-03-2019	IPR005840	Ribosomal protein S12 methylthiotransferase RimO
MAG142_20_21	7d4393bb08cbc26f52d4f101d8ac8320	517	Pfam	PF12708	Pectate lyase superfamily protein	50	169	6.7E-8	T	21-03-2019	IPR024535	Pectate lyase superfamily protein
MAG142_20_21	7d4393bb08cbc26f52d4f101d8ac8320	517	Pfam	PF00295	Glycosyl hydrolases family 28	228	456	2.6E-32	T	21-03-2019	IPR000743	Glycoside hydrolase, family 28
MAG142_14_25	9e3f68ebc498a53c0dc26356b937081a	940	Pfam	PF07715	TonB-dependent Receptor Plug Domain	41	129	9.8E-6	T	21-03-2019	IPR012910	TonB-dependent receptor, plug domain
MAG142_14_25	9e3f68ebc498a53c0dc26356b937081a	940	TIGRFAM	TIGR04057	SusC_RagA_signa: TonB-dependent outer membrane receptor, SusC/RagA subfamily, signature region	105	135	1.5E-16	T	21-03-2019	IPR023997	TonB-dependent outer membrane protein SusC/RagA, conserved site
MAG142_14_25	9e3f68ebc498a53c0dc26356b937081a	940	TIGRFAM	TIGR04056	OMP_RagA_SusC: TonB-linked outer membrane protein, SusC/RagA family	28	940	9.8E-149	T	21-03-2019	IPR023996	TonB-dependent outer membrane protein, SusC/RagA
MAG142_10_49	bec7885b4d46958a97d012bb3d00e670	440	Pfam	PF02773	S-adenosylmethionine synthetase, C-terminal domain	265	400	1.4E-60	T	21-03-2019	IPR022630	S-adenosylmethionine synthetase, C-terminal
MAG142_10_49	bec7885b4d46958a97d012bb3d00e670	440	TIGRFAM	TIGR01034	metK: methionine adenosyltransferase	5	400	4.4E-148	T	21-03-2019	IPR002133	S-adenosylmethionine synthetase
MAG142_10_49	bec7885b4d46958a97d012bb3d00e670	440	Pfam	PF02772	S-adenosylmethionine synthetase, central domain	115	263	7.5E-41	T	21-03-2019	IPR022629	S-adenosylmethionine synthetase, central domain
MAG142_10_49	bec7885b4d46958a97d012bb3d00e670	440	Pfam	PF00438	S-adenosylmethionine synthetase, N-terminal domain	4	101	5.0E-42	T	21-03-2019	IPR022628	S-adenosylmethionine synthetase, N-terminal
MAG142_8_40	bbe561d71b2454342ea266f2b9191f86	164	TIGRFAM	TIGR02937	sigma70-ECF: RNA polymerase sigma factor, sigma-70 family	12	160	1.3E-18	T	21-03-2019	IPR014284	RNA polymerase sigma-70 like domain
MAG142_8_40	bbe561d71b2454342ea266f2b9191f86	164	Pfam	PF04542	Sigma-70 region 2	16	71	6.0E-9	T	21-03-2019	IPR007627	RNA polymerase sigma-70 region 2
MAG142_8_40	bbe561d71b2454342ea266f2b9191f86	164	Pfam	PF08281	Sigma-70, region 4	106	156	6.6E-10	T	21-03-2019	IPR013249	RNA polymerase sigma factor 70, region 4 type 2
MAG142_32_16	371203a75b6106184440af2cebb08cc0	478	Pfam	PF03781	Sulfatase-modifying factor enzyme 1	48	467	1.4E-51	T	21-03-2019	IPR005532	Sulfatase-modifying factor enzyme
MAG142_9_57	428890db89ef21117ed877fb771712cb	356	TIGRFAM	TIGR01368	CPSaseIIsmall: carbamoyl-phosphate synthase, small subunit	7	355	1.5E-136	T	21-03-2019	IPR006274	Carbamoyl-phosphate synthase, small subunit
MAG142_9_57	428890db89ef21117ed877fb771712cb	356	Pfam	PF00117	Glutamine amidotransferase class-I	180	354	1.0E-48	T	21-03-2019	IPR017926	Glutamine amidotransferase
MAG142_9_57	428890db89ef21117ed877fb771712cb	356	Pfam	PF00988	Carbamoyl-phosphate synthase small chain, CPSase domain	7	142	6.0E-52	T	21-03-2019	IPR002474	Carbamoyl-phosphate synthase small subunit, N-terminal domain
MAG142_90_8	d6d6274c4a0eebd3af9512f08c1b5a2b	190	TIGRFAM	TIGR03263	guanyl_kin: guanylate kinase	4	185	1.7E-64	T	21-03-2019	IPR017665	Guanylate kinase
MAG142_90_8	d6d6274c4a0eebd3af9512f08c1b5a2b	190	Pfam	PF00625	Guanylate kinase	4	186	3.0E-46	T	21-03-2019	IPR008145	Guanylate kinase/L-type calcium channel beta subunit
MAG142_47_4	74461ef0d00c5e89333b22911a3d846d	264	Pfam	PF00303	Thymidylate synthase	3	264	1.6E-127	T	21-03-2019	IPR023451	Thymidylate synthase/dCMP hydroxymethylase domain
MAG142_47_4	74461ef0d00c5e89333b22911a3d846d	264	TIGRFAM	TIGR03284	thym_sym: thymidylate synthase	2	84	1.7E-41	T	21-03-2019	IPR000398	Thymidylate synthase
MAG142_47_4	74461ef0d00c5e89333b22911a3d846d	264	TIGRFAM	TIGR03284	thym_sym: thymidylate synthase	85	264	4.0E-93	T	21-03-2019	IPR000398	Thymidylate synthase
MAG142_54_11	5ad3b635b5d5c9972f231ebe18336f5d	442	Pfam	PF11734	TilS substrate C-terminal domain	369	435	1.3E-8	T	21-03-2019	IPR012796	Lysidine-tRNA(Ile) synthetase, C-terminal
MAG142_54_11	5ad3b635b5d5c9972f231ebe18336f5d	442	TIGRFAM	TIGR02432	lysidine_TilS_N: tRNA(Ile)-lysidine synthetase	18	198	3.2E-52	T	21-03-2019	IPR012795	tRNA(Ile)-lysidine synthase, N-terminal
MAG142_54_11	5ad3b635b5d5c9972f231ebe18336f5d	442	Pfam	PF01171	PP-loop family	19	194	2.4E-48	T	21-03-2019	IPR011063	tRNA(Ile)-lysidine/2-thiocytidine synthase, N-terminal
MAG142_54_11	5ad3b635b5d5c9972f231ebe18336f5d	442	TIGRFAM	TIGR02433	lysidine_TilS_C: tRNA(Ile)-lysidine synthetase, C-terminal domain	367	413	4.4E-10	T	21-03-2019	IPR012796	Lysidine-tRNA(Ile) synthetase, C-terminal
MAG142_12_42	60c94a2fd2a7caddff05f1ea30fcaef7	419	Pfam	PF16272	Domain of unknown function (DUF4925)	95	247	1.0E-12	T	21-03-2019	IPR032573	Protein of unknown function DUF4925
MAG142_81_4	e09ded57448bddfa8214ff6d2bd0ca14	335	Pfam	PF04231	Endonuclease I	88	244	3.1E-15	T	21-03-2019	IPR007346	Endonuclease I
MAG142_2_57	eee2db0fdabd1c0f82f5bd238b3c7964	239	Pfam	PF06971	Putative DNA-binding protein N-terminus	37	84	1.6E-18	T	21-03-2019	IPR009718	Rex DNA-binding, C-terminal domain
MAG142_2_57	eee2db0fdabd1c0f82f5bd238b3c7964	239	Pfam	PF02629	CoA binding domain	115	209	6.7E-18	T	21-03-2019	IPR003781	CoA-binding
MAG142_5_47	2ca1b6def26b1345f54ca04b60abc79f	132	Pfam	PF01510	N-acetylmuramoyl-L-alanine amidase	2	125	1.5E-18	T	21-03-2019	IPR002502	N-acetylmuramoyl-L-alanine amidase domain
MAG142_54_12	676671ca8e1e86bfd5262b68e55e9e94	184	Pfam	PF12833	Helix-turn-helix domain	101	173	1.5E-15	T	21-03-2019	IPR018060	DNA binding HTH domain, AraC-type
MAG142_26_15	fb8eab505e08a1705ef9c95b40d70fd4	993	Pfam	PF01326	Pyruvate phosphate dikinase, PEP/pyruvate binding domain	433	812	2.5E-42	T	21-03-2019	IPR002192	Pyruvate phosphate dikinase, PEP/pyruvate-binding
MAG142_124_3	393ceaa9ea79058ee1276675a66db41f	386	Pfam	PF17293	Arm DNA-binding domain	10	96	3.8E-12	T	21-03-2019	IPR035386	Arm, DNA-binding domain
MAG142_124_3	393ceaa9ea79058ee1276675a66db41f	386	Pfam	PF00589	Phage integrase family	224	353	4.0E-6	T	21-03-2019	IPR002104	Integrase, catalytic domain
MAG142_124_3	393ceaa9ea79058ee1276675a66db41f	386	Pfam	PF13102	Phage integrase SAM-like domain	109	215	5.3E-18	T	21-03-2019	IPR025269	Phage integrase SAM-like domain
MAG142_107_1	7ad7451341be0db2ee5062daac024707	400	Pfam	PF13102	Phage integrase SAM-like domain	108	199	4.0E-20	T	21-03-2019	IPR025269	Phage integrase SAM-like domain
MAG142_107_1	7ad7451341be0db2ee5062daac024707	400	Pfam	PF17293	Arm DNA-binding domain	12	95	2.2E-6	T	21-03-2019	IPR035386	Arm, DNA-binding domain
MAG142_107_1	7ad7451341be0db2ee5062daac024707	400	Pfam	PF00589	Phage integrase family	250	384	5.3E-9	T	21-03-2019	IPR002104	Integrase, catalytic domain
MAG142_25_11	9fabad58cb42b9f4d46c5e5b1b419a8d	353	TIGRFAM	TIGR00233	trpS: tryptophan--tRNA ligase	4	348	1.8E-86	T	21-03-2019	IPR002306	Tryptophan-tRNA ligase
MAG142_25_11	9fabad58cb42b9f4d46c5e5b1b419a8d	353	Pfam	PF00579	tRNA synthetases class I (W and Y)	5	299	8.0E-63	T	21-03-2019	IPR002305	Aminoacyl-tRNA synthetase, class Ic
MAG142_19_24	b030a30a93bf2c921deab057801af589	204	Pfam	PF01926	50S ribosome-binding GTPase	26	143	6.9E-21	T	21-03-2019	IPR006073	GTP binding domain
MAG142_19_24	b030a30a93bf2c921deab057801af589	204	TIGRFAM	TIGR00231	small_GTP: small GTP-binding protein domain	28	192	1.0E-11	T	21-03-2019	IPR005225	Small GTP-binding protein domain
MAG142_19_24	b030a30a93bf2c921deab057801af589	204	TIGRFAM	TIGR03598	GTPase_YsxC: ribosome biogenesis GTP-binding protein YsxC	6	191	3.3E-60	T	21-03-2019	IPR019987	GTP-binding protein, ribosome biogenesis, YsxC
MAG142_28_4	56a8683d1d2558455c31899947832a59	110	Pfam	PF09919	Uncharacterized conserved protein (DUF2149)	19	110	2.4E-29	T	21-03-2019	IPR018676	Protein of unknown function DUF2149
MAG142_9_51	80f36768a5c14ba38b4a4e7c5e395427	238	Pfam	PF04002	RadC-like JAB domain	117	236	3.6E-37	T	21-03-2019	IPR025657	RadC-like JAB domain
MAG142_9_51	80f36768a5c14ba38b4a4e7c5e395427	238	TIGRFAM	TIGR00608	radc: DNA repair protein RadC	22	238	3.2E-51	T	21-03-2019	IPR001405	Uncharacterised protein family UPF0758
MAG142_32_11	9d08a71a7d4bb5ba1bd3db7a670f2f9a	1012	Pfam	PF13149	Fimbrillin-like	93	378	2.1E-25	T	21-03-2019	IPR025049	Fimbrillin-like 1
MAG142_18_1	e1c63899c861433026e29130a791610f	139	TIGRFAM	TIGR00250	RNAse_H_YqgF: putative transcription antitermination factor YqgF	5	133	1.4E-20	T	21-03-2019	IPR005227	Putative pre-16S rRNA nuclease
MAG142_18_1	e1c63899c861433026e29130a791610f	139	Pfam	PF03652	Holliday junction resolvase	3	134	1.9E-35	T	21-03-2019	IPR005227	Putative pre-16S rRNA nuclease
MAG142_6_59	d5decb2502fbd6eca774e6c973cb9d5c	687	TIGRFAM	TIGR00277	HDIG: HDIG domain	469	565	2.8E-23	T	21-03-2019	IPR006675	HDIG domain
MAG142_6_59	d5decb2502fbd6eca774e6c973cb9d5c	687	Pfam	PF07697	7TM-HD extracellular	49	242	1.7E-10	T	21-03-2019	IPR011624	Metal-dependent phosphohydrolase, 7TM extracellular domain
MAG142_6_59	d5decb2502fbd6eca774e6c973cb9d5c	687	Pfam	PF07698	7TM receptor with intracellular HD hydrolase	259	446	8.4E-28	T	21-03-2019	IPR011621	Metal-dependent phosphohydrolase, 7TM intracellular domain
MAG142_6_59	d5decb2502fbd6eca774e6c973cb9d5c	687	Pfam	PF01966	HD domain	471	613	1.0E-15	T	21-03-2019	IPR006674	HD domain
MAG142_38_15	056da17a819655baa1544cb0c2edb32b	190	TIGRFAM	TIGR01221	rmlC: dTDP-4-dehydrorhamnose 3,5-epimerase	2	177	3.3E-74	T	21-03-2019	IPR000888	dTDP-4-dehydrorhamnose 3,5-epimerase-related
